id,parent_project_id,project_id,rfd_ref_no,transaction_type,transaction_date,value,currency,value_date,description,provider_org,receiver_org,disbursement_channel,sector,recipient_country,recipient_region,narrative,aid_type,tied_status,transaction_code,disbursement_channel_code,flow_type,finance_type
1000000005__12-05-1994-00:00:00_Commitment,1100000365,1000000005,,Commitment,1994-12-05T00:00:00.000Z,100957653.71,BEF,1994-12-05T00:00:00.000Z,1000000005 G-B-B-13-,IFAD,OFFICE OF MACRO-POLICY & INTERNATIONAL ECONOMIC COOPERATION,Money is disbursed through central Ministry of Finance or Treasury,,ER,ESA,1000000005 GRANTS,C01, ,2,1,20,110
1000000005_0019529100051013_10-18-1995-00:00:00_Disbursement,1100000365,1000000005,0019529100051013,Disbursement,1995-10-18T00:00:00.000Z,6585557.73,BEF,1995-10-18T00:00:00.000Z,1000000005 G-B-B-13-,IFAD,OFFICE OF MACRO-POLICY & INTERNATIONAL ECONOMIC COOPERATION,Money is disbursed through central Ministry of Finance or Treasury,,ER,ESA,1000000005 0019529100051013 Direct Payment/Reimbursement,C01, ,3,1,20,110
1000000005_0010429600051027_10-22-2004-00:00:00_Disbursement,1100000365,1000000005,0010429600051027,Disbursement,2004-10-22T00:00:00.000Z,3771741.52,BEF,2004-10-22T00:00:00.000Z,1000000005 G-B-B-13-,IFAD,OFFICE OF MACRO-POLICY & INTERNATIONAL ECONOMIC COOPERATION,Money is disbursed through central Ministry of Finance or Treasury,,ER,ESA,1000000005 0010429600051027 Direct Payment/Reimbursement,C01, ,3,1,20,110
1000000005_0010510400051028_04-14-2005-00:00:00_Disbursement,1100000365,1000000005,0010510400051028,Disbursement,2005-04-14T00:00:00.000Z,663232.51,BEF,2005-04-14T00:00:00.000Z,1000000005 G-B-B-13-,IFAD,OFFICE OF MACRO-POLICY & INTERNATIONAL ECONOMIC COOPERATION,Money is disbursed through central Ministry of Finance or Treasury,,ER,ESA,1000000005 0010510400051028 Direct Payment/Reimbursement,C01, ,3,1,20,110
1000000005_0010615900051034_06-08-2006-00:00:00_Disbursement,1100000365,1000000005,0010615900051034,Disbursement,2006-06-08T00:00:00.000Z,3364722.96,BEF,2006-06-08T00:00:00.000Z,1000000005 G-B-B-13-,IFAD,OFFICE OF MACRO-POLICY & INTERNATIONAL ECONOMIC COOPERATION,Money is disbursed through central Ministry of Finance or Treasury,,ER,ESA,1000000005 0010615900051034 Direct Payment/Reimbursement,C01, ,3,1,20,110
1000000005_0010004900051010_02-18-2000-00:00:00_Disbursement,1100000365,1000000005,0010004900051010,Disbursement,2000-02-18T00:00:00.000Z,445635.4,BEF,2000-02-18T00:00:00.000Z,1000000005 G-B-B-13-,IFAD,OFFICE OF MACRO-POLICY & INTERNATIONAL ECONOMIC COOPERATION,Money is disbursed through central Ministry of Finance or Treasury,,ER,ESA,1000000005 0010004900051010 Direct Payment/Reimbursement,C01, ,3,1,20,110
1000000005_0010021700051004_08-04-2000-00:00:00_Disbursement,1100000365,1000000005,0010021700051004,Disbursement,2000-08-04T00:00:00.000Z,106071.0,BEF,2000-08-04T00:00:00.000Z,1000000005 G-B-B-13-,IFAD,OFFICE OF MACRO-POLICY & INTERNATIONAL ECONOMIC COOPERATION,Money is disbursed through central Ministry of Finance or Treasury,,ER,ESA,1000000005 0010021700051004 Direct Payment/Reimbursement,C01, ,3,1,20,110
1000000005_0010106100051006_03-02-2001-00:00:00_Disbursement,1100000365,1000000005,0010106100051006,Disbursement,2001-03-02T00:00:00.000Z,206837.61,BEF,2001-03-02T00:00:00.000Z,1000000005 G-B-B-13-,IFAD,OFFICE OF MACRO-POLICY & INTERNATIONAL ECONOMIC COOPERATION,Money is disbursed through central Ministry of Finance or Treasury,,ER,ESA,1000000005 0010106100051006 Direct Payment/Reimbursement,C01, ,3,1,20,110
1000000005_0010515800051029_06-07-2005-00:00:00_Disbursement,1100000365,1000000005,0010515800051029,Disbursement,2005-06-07T00:00:00.000Z,1069932.85,BEF,2005-06-07T00:00:00.000Z,1000000005 G-B-B-13-,IFAD,OFFICE OF MACRO-POLICY & INTERNATIONAL ECONOMIC COOPERATION,Money is disbursed through central Ministry of Finance or Treasury,,ER,ESA,1000000005 0010515800051029 Direct Payment/Reimbursement,C01, ,3,1,20,110
1000000005_0010611100051033_04-21-2006-00:00:00_Disbursement,1100000365,1000000005,0010611100051033,Disbursement,2006-04-21T00:00:00.000Z,1143378.23,BEF,2006-04-21T00:00:00.000Z,1000000005 G-B-B-13-,IFAD,OFFICE OF MACRO-POLICY & INTERNATIONAL ECONOMIC COOPERATION,Money is disbursed through central Ministry of Finance or Treasury,,ER,ESA,1000000005 0010611100051033 Direct Payment/Reimbursement,C01, ,3,1,20,110
1000000005_0019525400051001_09-11-1995-00:00:00_Disbursement,1100000365,1000000005,0019525400051001,Disbursement,1995-09-11T00:00:00.000Z,6902900.13,BEF,1995-09-11T00:00:00.000Z,1000000005 G-B-B-13-,IFAD,OFFICE OF MACRO-POLICY & INTERNATIONAL ECONOMIC COOPERATION,Money is disbursed through central Ministry of Finance or Treasury,,ER,ESA,1000000005 0019525400051001 Direct Payment/Reimbursement,C01, ,3,1,20,110
1000000005_0010318200051021_07-01-2003-00:00:00_Disbursement,1100000365,1000000005,0010318200051021,Disbursement,2003-07-01T00:00:00.000Z,2902594.45,BEF,2003-07-01T00:00:00.000Z,1000000005 G-B-B-13-,IFAD,OFFICE OF MACRO-POLICY & INTERNATIONAL ECONOMIC COOPERATION,Money is disbursed through central Ministry of Finance or Treasury,,ER,ESA,1000000005 0010318200051021 Direct Payment/Reimbursement,C01, ,3,1,20,110
1000000005_0010112000051009_04-30-2001-00:00:00_Disbursement,1100000365,1000000005,0010112000051009,Disbursement,2001-04-30T00:00:00.000Z,8309713.03,BEF,2001-04-30T00:00:00.000Z,1000000005 G-B-B-13-,IFAD,OFFICE OF MACRO-POLICY & INTERNATIONAL ECONOMIC COOPERATION,Money is disbursed through central Ministry of Finance or Treasury,,ER,ESA,1000000005 0010112000051009 Direct Payment/Reimbursement,C01, ,3,1,20,110
1000000005_0010106700051008_03-08-2001-00:00:00_Disbursement,1100000365,1000000005,0010106700051008,Disbursement,2001-03-08T00:00:00.000Z,9499.73,BEF,2001-03-08T00:00:00.000Z,1000000005 G-B-B-13-,IFAD,OFFICE OF MACRO-POLICY & INTERNATIONAL ECONOMIC COOPERATION,Money is disbursed through central Ministry of Finance or Treasury,,ER,ESA,1000000005 0010106700051008 Direct Payment/Reimbursement,C01, ,3,1,20,110
1000000005_0010212300051017_05-03-2002-00:00:00_Disbursement,1100000365,1000000005,0010212300051017,Disbursement,2002-05-03T00:00:00.000Z,21910026.91,BEF,2002-05-03T00:00:00.000Z,1000000005 G-B-B-13-,IFAD,OFFICE OF MACRO-POLICY & INTERNATIONAL ECONOMIC COOPERATION,Money is disbursed through central Ministry of Finance or Treasury,,ER,ESA,1000000005 0010212300051017 Direct Payment/Reimbursement,C01, ,3,1,20,110
1000000005_0010004900051012_02-18-2000-00:00:00_Disbursement,1100000365,1000000005,0010004900051012,Disbursement,2000-02-18T00:00:00.000Z,755850.98,BEF,2000-02-18T00:00:00.000Z,1000000005 G-B-B-13-,IFAD,OFFICE OF MACRO-POLICY & INTERNATIONAL ECONOMIC COOPERATION,Money is disbursed through central Ministry of Finance or Treasury,,ER,ESA,1000000005 0010004900051012 Direct Payment/Reimbursement,C01, ,3,1,20,110
1000000005_0010424000051026_08-27-2004-00:00:00_Disbursement,1100000365,1000000005,0010424000051026,Disbursement,2004-08-27T00:00:00.000Z,2312017.23,BEF,2004-08-27T00:00:00.000Z,1000000005 G-B-B-13-,IFAD,OFFICE OF MACRO-POLICY & INTERNATIONAL ECONOMIC COOPERATION,Money is disbursed through central Ministry of Finance or Treasury,,ER,ESA,1000000005 0010424000051026 Direct Payment/Reimbursement,C01, ,3,1,20,110
1000000005_0010407500051024_03-15-2004-00:00:00_Disbursement,1100000365,1000000005,0010407500051024,Disbursement,2004-03-15T00:00:00.000Z,1064236.75,BEF,2004-03-15T00:00:00.000Z,1000000005 G-B-B-13-,IFAD,OFFICE OF MACRO-POLICY & INTERNATIONAL ECONOMIC COOPERATION,Money is disbursed through central Ministry of Finance or Treasury,,ER,ESA,1000000005 0010407500051024 Direct Payment/Reimbursement,C01, ,3,1,20,110
1000000005_0010102900051005_01-29-2001-00:00:00_Disbursement,1100000365,1000000005,0010102900051005,Disbursement,2001-01-29T00:00:00.000Z,2621333.89,BEF,2001-01-29T00:00:00.000Z,1000000005 G-B-B-13-,IFAD,OFFICE OF MACRO-POLICY & INTERNATIONAL ECONOMIC COOPERATION,Money is disbursed through central Ministry of Finance or Treasury,,ER,ESA,1000000005 0010102900051005 Direct Payment/Reimbursement,C01, ,3,1,20,110
1000000005_0010004900051011_02-18-2000-00:00:00_Disbursement,1100000365,1000000005,0010004900051011,Disbursement,2000-02-18T00:00:00.000Z,1244122.45,BEF,2000-02-18T00:00:00.000Z,1000000005 G-B-B-13-,IFAD,OFFICE OF MACRO-POLICY & INTERNATIONAL ECONOMIC COOPERATION,Money is disbursed through central Ministry of Finance or Treasury,,ER,ESA,1000000005 0010004900051011 Direct Payment/Reimbursement,C01, ,3,1,20,110
1000000005_0010210000051016_04-10-2002-00:00:00_Disbursement,1100000365,1000000005,0010210000051016,Disbursement,2002-04-10T00:00:00.000Z,1710754.59,BEF,2002-04-10T00:00:00.000Z,1000000005 G-B-B-13-,IFAD,OFFICE OF MACRO-POLICY & INTERNATIONAL ECONOMIC COOPERATION,Money is disbursed through central Ministry of Finance or Treasury,,ER,ESA,1000000005 0010210000051016 Direct Payment/Reimbursement,C01, ,3,1,20,110
1000000005_0010324600051022_09-03-2003-00:00:00_Disbursement,1100000365,1000000005,0010324600051022,Disbursement,2003-09-03T00:00:00.000Z,1116060.39,BEF,2003-09-03T00:00:00.000Z,1000000005 G-B-B-13-,IFAD,OFFICE OF MACRO-POLICY & INTERNATIONAL ECONOMIC COOPERATION,Money is disbursed through central Ministry of Finance or Treasury,,ER,ESA,1000000005 0010324600051022 Direct Payment/Reimbursement,C01, ,3,1,20,110
1000000005_0010401200051023_01-12-2004-00:00:00_Disbursement,1100000365,1000000005,0010401200051023,Disbursement,2004-01-12T00:00:00.000Z,5854367.52,BEF,2004-01-12T00:00:00.000Z,1000000005 G-B-B-13-,IFAD,OFFICE OF MACRO-POLICY & INTERNATIONAL ECONOMIC COOPERATION,Money is disbursed through central Ministry of Finance or Treasury,,ER,ESA,1000000005 0010401200051023 Direct Payment/Reimbursement,C01, ,3,1,20,110
1000000005_0010011100051003_04-20-2000-00:00:00_Disbursement,1100000365,1000000005,0010011100051003,Disbursement,2000-04-20T00:00:00.000Z,2091857.0,BEF,2000-04-20T00:00:00.000Z,1000000005 G-B-B-13-,IFAD,OFFICE OF MACRO-POLICY & INTERNATIONAL ECONOMIC COOPERATION,Money is disbursed through central Ministry of Finance or Treasury,,ER,ESA,1000000005 0010011100051003 Direct Payment/Reimbursement,C01, ,3,1,20,110
1000000005_0010227400051019_10-01-2002-00:00:00_Disbursement,1100000365,1000000005,0010227400051019,Disbursement,2002-10-01T00:00:00.000Z,1333837.74,BEF,2002-10-01T00:00:00.000Z,1000000005 G-B-B-13-,IFAD,OFFICE OF MACRO-POLICY & INTERNATIONAL ECONOMIC COOPERATION,Money is disbursed through central Ministry of Finance or Treasury,,ER,ESA,1000000005 0010227400051019 Direct Payment/Reimbursement,C01, ,3,1,20,110
1000000005_0019700900051014_01-09-1997-00:00:00_Disbursement,1100000365,1000000005,0019700900051014,Disbursement,1997-01-09T00:00:00.000Z,1524921.3,BEF,1997-01-09T00:00:00.000Z,1000000005 G-B-B-13-,IFAD,OFFICE OF MACRO-POLICY & INTERNATIONAL ECONOMIC COOPERATION,Money is disbursed through central Ministry of Finance or Treasury,,ER,ESA,1000000005 0019700900051014 Direct Payment/Reimbursement,C01, ,3,1,20,110
1000000005_0019734900051015_12-15-1997-00:00:00_Disbursement,1100000365,1000000005,0019734900051015,Disbursement,1997-12-15T00:00:00.000Z,2228470.43,BEF,1997-12-15T00:00:00.000Z,1000000005 G-B-B-13-,IFAD,OFFICE OF MACRO-POLICY & INTERNATIONAL ECONOMIC COOPERATION,Money is disbursed through central Ministry of Finance or Treasury,,ER,ESA,1000000005 0019734900051015 Direct Payment/Reimbursement,C01, ,3,1,20,110
1000000005_0010420900051025_07-27-2004-00:00:00_Disbursement,1100000365,1000000005,0010420900051025,Disbursement,2004-07-27T00:00:00.000Z,3922028.22,BEF,2004-07-27T00:00:00.000Z,1000000005 G-B-B-13-,IFAD,OFFICE OF MACRO-POLICY & INTERNATIONAL ECONOMIC COOPERATION,Money is disbursed through central Ministry of Finance or Treasury,,ER,ESA,1000000005 0010420900051025 Direct Payment/Reimbursement,C01, ,3,1,20,110
1000000005_0010217900051018_06-28-2002-00:00:00_Disbursement,1100000365,1000000005,0010217900051018,Disbursement,2002-06-28T00:00:00.000Z,524267.6,BEF,2002-06-28T00:00:00.000Z,1000000005 G-B-B-13-,IFAD,OFFICE OF MACRO-POLICY & INTERNATIONAL ECONOMIC COOPERATION,Money is disbursed through central Ministry of Finance or Treasury,,ER,ESA,1000000005 0010217900051018 Direct Payment/Reimbursement,C01, ,3,1,20,110
1000000005_0019832000051002_11-16-1998-00:00:00_Disbursement,1100000365,1000000005,0019832000051002,Disbursement,1998-11-16T00:00:00.000Z,5476234.0,BEF,1998-11-16T00:00:00.000Z,1000000005 G-B-B-13-,IFAD,OFFICE OF MACRO-POLICY & INTERNATIONAL ECONOMIC COOPERATION,Money is disbursed through central Ministry of Finance or Treasury,,ER,ESA,1000000005 0019832000051002 Direct Payment/Reimbursement,C01, ,3,1,20,110
1000000005_0010519500051030_07-14-2005-00:00:00_Disbursement,1100000365,1000000005,0010519500051030,Disbursement,2005-07-14T00:00:00.000Z,2701641.1,BEF,2005-07-14T00:00:00.000Z,1000000005 G-B-B-13-,IFAD,OFFICE OF MACRO-POLICY & INTERNATIONAL ECONOMIC COOPERATION,Money is disbursed through central Ministry of Finance or Treasury,,ER,ESA,1000000005 0010519500051030 Direct Payment/Reimbursement,C01, ,3,1,20,110
1000000005_0010532200051031_11-18-2005-00:00:00_Disbursement,1100000365,1000000005,0010532200051031,Disbursement,2005-11-18T00:00:00.000Z,2391252.36,BEF,2005-11-18T00:00:00.000Z,1000000005 G-B-B-13-,IFAD,OFFICE OF MACRO-POLICY & INTERNATIONAL ECONOMIC COOPERATION,Money is disbursed through central Ministry of Finance or Treasury,,ER,ESA,1000000005 0010532200051031 Direct Payment/Reimbursement,C01, ,3,1,20,110
1000000005_0010611100051032_04-21-2006-00:00:00_Disbursement,1100000365,1000000005,0010611100051032,Disbursement,2006-04-21T00:00:00.000Z,2365727.21,BEF,2006-04-21T00:00:00.000Z,1000000005 G-B-B-13-,IFAD,OFFICE OF MACRO-POLICY & INTERNATIONAL ECONOMIC COOPERATION,Money is disbursed through central Ministry of Finance or Treasury,,ER,ESA,1000000005 0010611100051032 Direct Payment/Reimbursement,C01, ,3,1,20,110
1000000005_0010305200051020_02-21-2003-00:00:00_Disbursement,1100000365,1000000005,0010305200051020,Disbursement,2003-02-21T00:00:00.000Z,2326828.89,BEF,2003-02-21T00:00:00.000Z,1000000005 G-B-B-13-,IFAD,OFFICE OF MACRO-POLICY & INTERNATIONAL ECONOMIC COOPERATION,Money is disbursed through central Ministry of Finance or Treasury,,ER,ESA,1000000005 0010305200051020 Direct Payment/Reimbursement,C01, ,3,1,20,110
1000000006___Commitment,1000000006,1000000006,,Commitment,,39058593.0,BEF,,1000000006 G-B-B-14-,IFAD,UNITED NATIONS CHILDREN'S FUND,Money is disbursed through central Ministry of Finance or Treasury,,CH,ESA,1000000006 GRANTS,C01, ,2,1,20,110
1000000006_0019817000061002_06-19-1998-00:00:00_Disbursement,1000000006,1000000006,0019817000061002,Disbursement,1998-06-19T00:00:00.000Z,6246520.0,BEF,1998-06-19T00:00:00.000Z,1000000006 G-B-B-14-,IFAD,UNITED NATIONS CHILDREN'S FUND,Money is disbursed through central Ministry of Finance or Treasury,,CH,ESA,1000000006 0019817000061002 Direct Payment/Reimbursement,C01, ,3,1,20,110
1000000006_0019932200061003_11-18-1999-00:00:00_Disbursement,1000000006,1000000006,0019932200061003,Disbursement,1999-11-18T00:00:00.000Z,4122988.0,BEF,1999-11-18T00:00:00.000Z,1000000006 G-B-B-14-,IFAD,UNITED NATIONS CHILDREN'S FUND,Money is disbursed through central Ministry of Finance or Treasury,,CH,ESA,1000000006 0019932200061003 Direct Payment/Reimbursement,C01, ,3,1,20,110
1000000006_0019934200061004_12-08-1999-00:00:00_Disbursement,1000000006,1000000006,0019934200061004,Disbursement,1999-12-08T00:00:00.000Z,23338228.0,BEF,1999-12-08T00:00:00.000Z,1000000006 G-B-B-14-,IFAD,UNITED NATIONS CHILDREN'S FUND,Money is disbursed through central Ministry of Finance or Treasury,,CH,ESA,1000000006 0019934200061004 Direct Payment/Reimbursement,C01, ,3,1,20,110
1000000006_0019726200061001_09-19-1997-00:00:00_Disbursement,1000000006,1000000006,0019726200061001,Disbursement,1997-09-19T00:00:00.000Z,5350857.0,BEF,1997-09-19T00:00:00.000Z,1000000006 G-B-B-14-,IFAD,UNITED NATIONS CHILDREN'S FUND,Money is disbursed through central Ministry of Finance or Treasury,,CH,ESA,1000000006 0019726200061001 Direct Payment/Reimbursement,C01, ,3,1,20,110
1000000007___Commitment,1000000007,1000000007,,Commitment,,150000000.0,BEF,,1000000007 G-B-B-15-,IFAD,"MINISTRY OF FINANCE, PLANNING AND ECONOMIC DEVELOPMENT",Money is disbursed through central Ministry of Finance or Treasury,,UG,ESA,1000000007 GRANTS,C01, ,2,1,20,110
1000000007_0019726200071018_09-19-1997-00:00:00_Disbursement,1000000007,1000000007,0019726200071018,Disbursement,1997-09-19T00:00:00.000Z,3972261.0,BEF,1997-09-19T00:00:00.000Z,1000000007 G-B-B-15-,IFAD,"MINISTRY OF FINANCE, PLANNING AND ECONOMIC DEVELOPMENT",Money is disbursed through central Ministry of Finance or Treasury,,UG,ESA,1000000007 0019726200071018 Direct Payment/Reimbursement,C01, ,3,1,20,110
1000000007_0019725900071015_09-16-1997-00:00:00_Disbursement,1000000007,1000000007,0019725900071015,Disbursement,1997-09-16T00:00:00.000Z,4625214.0,BEF,1997-09-16T00:00:00.000Z,1000000007 G-B-B-15-,IFAD,"MINISTRY OF FINANCE, PLANNING AND ECONOMIC DEVELOPMENT",Money is disbursed through central Ministry of Finance or Treasury,,UG,ESA,1000000007 0019725900071015 Direct Payment/Reimbursement,C01, ,3,1,20,110
1000000007_0019828100071040_10-08-1998-00:00:00_Disbursement,1000000007,1000000007,0019828100071040,Disbursement,1998-10-08T00:00:00.000Z,2378571.0,BEF,1998-10-08T00:00:00.000Z,1000000007 G-B-B-15-,IFAD,"MINISTRY OF FINANCE, PLANNING AND ECONOMIC DEVELOPMENT",Money is disbursed through central Ministry of Finance or Treasury,,UG,ESA,1000000007 0019828100071040 Direct Payment/Reimbursement,C01, ,3,1,20,110
1000000007_0019809200071031_04-02-1998-00:00:00_Disbursement,1000000007,1000000007,0019809200071031,Disbursement,1998-04-02T00:00:00.000Z,846068.0,BEF,1998-04-02T00:00:00.000Z,1000000007 G-B-B-15-,IFAD,"MINISTRY OF FINANCE, PLANNING AND ECONOMIC DEVELOPMENT",Money is disbursed through central Ministry of Finance or Treasury,,UG,ESA,1000000007 0019809200071031 Direct Payment/Reimbursement,C01, ,3,1,20,110
1000000007_0019835100071041_12-17-1998-00:00:00_Disbursement,1000000007,1000000007,0019835100071041,Disbursement,1998-12-17T00:00:00.000Z,1597001.0,BEF,1998-12-17T00:00:00.000Z,1000000007 G-B-B-15-,IFAD,"MINISTRY OF FINANCE, PLANNING AND ECONOMIC DEVELOPMENT",Money is disbursed through central Ministry of Finance or Treasury,,UG,ESA,1000000007 0019835100071041 Direct Payment/Reimbursement,C01, ,3,1,20,110
1000000007_0019702100071026_01-21-1997-00:00:00_Disbursement,1000000007,1000000007,0019702100071026,Disbursement,1997-01-21T00:00:00.000Z,8024951.0,BEF,1997-01-21T00:00:00.000Z,1000000007 G-B-B-15-,IFAD,"MINISTRY OF FINANCE, PLANNING AND ECONOMIC DEVELOPMENT",Money is disbursed through central Ministry of Finance or Treasury,,UG,ESA,1000000007 0019702100071026 Direct Payment/Reimbursement,C01, ,3,1,20,110
1000000007_0019723100071016_08-19-1997-00:00:00_Disbursement,1000000007,1000000007,0019723100071016,Disbursement,1997-08-19T00:00:00.000Z,502674.0,BEF,1997-08-19T00:00:00.000Z,1000000007 G-B-B-15-,IFAD,"MINISTRY OF FINANCE, PLANNING AND ECONOMIC DEVELOPMENT",Money is disbursed through central Ministry of Finance or Treasury,,UG,ESA,1000000007 0019723100071016 Direct Payment/Reimbursement,C01, ,3,1,20,110
1000000007_0019809200071032_04-02-1998-00:00:00_Disbursement,1000000007,1000000007,0019809200071032,Disbursement,1998-04-02T00:00:00.000Z,1139605.0,BEF,1998-04-02T00:00:00.000Z,1000000007 G-B-B-15-,IFAD,"MINISTRY OF FINANCE, PLANNING AND ECONOMIC DEVELOPMENT",Money is disbursed through central Ministry of Finance or Treasury,,UG,ESA,1000000007 0019809200071032 Direct Payment/Reimbursement,C01, ,3,1,20,110
1000000007_0019717700071010_06-26-1997-00:00:00_Disbursement,1000000007,1000000007,0019717700071010,Disbursement,1997-06-26T00:00:00.000Z,7727509.0,BEF,1997-06-26T00:00:00.000Z,1000000007 G-B-B-15-,IFAD,"MINISTRY OF FINANCE, PLANNING AND ECONOMIC DEVELOPMENT",Money is disbursed through central Ministry of Finance or Treasury,,UG,ESA,1000000007 0019717700071010 Direct Payment/Reimbursement,C01, ,3,1,20,110
1000000007_0019713200071008_05-12-1997-00:00:00_Disbursement,1000000007,1000000007,0019713200071008,Disbursement,1997-05-12T00:00:00.000Z,471914.0,BEF,1997-05-12T00:00:00.000Z,1000000007 G-B-B-15-,IFAD,"MINISTRY OF FINANCE, PLANNING AND ECONOMIC DEVELOPMENT",Money is disbursed through central Ministry of Finance or Treasury,,UG,ESA,1000000007 0019713200071008 Direct Payment/Reimbursement,C01, ,3,1,20,110
1000000007_0019725900071017_09-16-1997-00:00:00_Disbursement,1000000007,1000000007,0019725900071017,Disbursement,1997-09-16T00:00:00.000Z,488121.0,BEF,1997-09-16T00:00:00.000Z,1000000007 G-B-B-15-,IFAD,"MINISTRY OF FINANCE, PLANNING AND ECONOMIC DEVELOPMENT",Money is disbursed through central Ministry of Finance or Treasury,,UG,ESA,1000000007 0019725900071017 Direct Payment/Reimbursement,C01, ,3,1,20,110
1000000007_0019903400071043_02-03-1999-00:00:00_Disbursement,1000000007,1000000007,0019903400071043,Disbursement,1999-02-03T00:00:00.000Z,7114365.0,BEF,1999-02-03T00:00:00.000Z,1000000007 G-B-B-15-,IFAD,"MINISTRY OF FINANCE, PLANNING AND ECONOMIC DEVELOPMENT",Money is disbursed through central Ministry of Finance or Treasury,,UG,ESA,1000000007 0019903400071043 Direct Payment/Reimbursement,C01, ,3,1,20,110
1000000007_0019918900071045_07-08-1999-00:00:00_Disbursement,1000000007,1000000007,0019918900071045,Disbursement,1999-07-08T00:00:00.000Z,10595208.0,BEF,1999-07-08T00:00:00.000Z,1000000007 G-B-B-15-,IFAD,"MINISTRY OF FINANCE, PLANNING AND ECONOMIC DEVELOPMENT",Money is disbursed through central Ministry of Finance or Treasury,,UG,ESA,1000000007 0019918900071045 Direct Payment/Reimbursement,C01, ,3,1,20,110
1000000007_0019629000071001_10-16-1996-00:00:00_Disbursement,1000000007,1000000007,0019629000071001,Disbursement,1996-10-16T00:00:00.000Z,15814500.0,BEF,1996-10-16T00:00:00.000Z,1000000007 G-B-B-15-,IFAD,"MINISTRY OF FINANCE, PLANNING AND ECONOMIC DEVELOPMENT",Money is disbursed through central Ministry of Finance or Treasury,,UG,ESA,1000000007 0019629000071001 Direct Payment/Reimbursement,C01, ,3,1,20,110
1000000007_0019902700071042_01-27-1999-00:00:00_Disbursement,1000000007,1000000007,0019902700071042,Disbursement,1999-01-27T00:00:00.000Z,1716960.0,BEF,1999-01-27T00:00:00.000Z,1000000007 G-B-B-15-,IFAD,"MINISTRY OF FINANCE, PLANNING AND ECONOMIC DEVELOPMENT",Money is disbursed through central Ministry of Finance or Treasury,,UG,ESA,1000000007 0019902700071042 Direct Payment/Reimbursement,C01, ,3,1,20,110
1000000007_0019804800071029_02-17-1998-00:00:00_Disbursement,1000000007,1000000007,0019804800071029,Disbursement,1998-02-17T00:00:00.000Z,6067113.0,BEF,1998-02-17T00:00:00.000Z,1000000007 G-B-B-15-,IFAD,"MINISTRY OF FINANCE, PLANNING AND ECONOMIC DEVELOPMENT",Money is disbursed through central Ministry of Finance or Treasury,,UG,ESA,1000000007 0019804800071029 Direct Payment/Reimbursement,C01, ,3,1,20,110
1000000007_0019728300071020_10-10-1997-00:00:00_Disbursement,1000000007,1000000007,0019728300071020,Disbursement,1997-10-10T00:00:00.000Z,481089.0,BEF,1997-10-10T00:00:00.000Z,1000000007 G-B-B-15-,IFAD,"MINISTRY OF FINANCE, PLANNING AND ECONOMIC DEVELOPMENT",Money is disbursed through central Ministry of Finance or Treasury,,UG,ESA,1000000007 0019728300071020 Direct Payment/Reimbursement,C01, ,3,1,20,110
1000000007_0019804700071028_02-16-1998-00:00:00_Disbursement,1000000007,1000000007,0019804700071028,Disbursement,1998-02-16T00:00:00.000Z,4462871.0,BEF,1998-02-16T00:00:00.000Z,1000000007 G-B-B-15-,IFAD,"MINISTRY OF FINANCE, PLANNING AND ECONOMIC DEVELOPMENT",Money is disbursed through central Ministry of Finance or Treasury,,UG,ESA,1000000007 0019804700071028 Direct Payment/Reimbursement,C01, ,3,1,20,110
1000000007_0019818400071037_07-03-1998-00:00:00_Disbursement,1000000007,1000000007,0019818400071037,Disbursement,1998-07-03T00:00:00.000Z,3219329.0,BEF,1998-07-03T00:00:00.000Z,1000000007 G-B-B-15-,IFAD,"MINISTRY OF FINANCE, PLANNING AND ECONOMIC DEVELOPMENT",Money is disbursed through central Ministry of Finance or Treasury,,UG,ESA,1000000007 0019818400071037 Direct Payment/Reimbursement,C01, ,3,1,20,110
1000000007_0019710600071006_04-16-1997-00:00:00_Disbursement,1000000007,1000000007,0019710600071006,Disbursement,1997-04-16T00:00:00.000Z,942743.0,BEF,1997-04-16T00:00:00.000Z,1000000007 G-B-B-15-,IFAD,"MINISTRY OF FINANCE, PLANNING AND ECONOMIC DEVELOPMENT",Money is disbursed through central Ministry of Finance or Treasury,,UG,ESA,1000000007 0019710600071006 Direct Payment/Reimbursement,C01, ,3,1,20,110
1000000007_0019719800071012_07-17-1997-00:00:00_Disbursement,1000000007,1000000007,0019719800071012,Disbursement,1997-07-17T00:00:00.000Z,2349515.0,BEF,1997-07-17T00:00:00.000Z,1000000007 G-B-B-15-,IFAD,"MINISTRY OF FINANCE, PLANNING AND ECONOMIC DEVELOPMENT",Money is disbursed through central Ministry of Finance or Treasury,,UG,ESA,1000000007 0019719800071012 Direct Payment/Reimbursement,C01, ,3,1,20,110
1000000007_0019701600071004_01-16-1997-00:00:00_Disbursement,1000000007,1000000007,0019701600071004,Disbursement,1997-01-16T00:00:00.000Z,437042.0,BEF,1997-01-16T00:00:00.000Z,1000000007 G-B-B-15-,IFAD,"MINISTRY OF FINANCE, PLANNING AND ECONOMIC DEVELOPMENT",Money is disbursed through central Ministry of Finance or Treasury,,UG,ESA,1000000007 0019701600071004 Direct Payment/Reimbursement,C01, ,3,1,20,110
1000000007_0019636500071003_12-30-1996-00:00:00_Disbursement,1000000007,1000000007,0019636500071003,Disbursement,1996-12-30T00:00:00.000Z,427996.0,BEF,1996-12-30T00:00:00.000Z,1000000007 G-B-B-15-,IFAD,"MINISTRY OF FINANCE, PLANNING AND ECONOMIC DEVELOPMENT",Money is disbursed through central Ministry of Finance or Treasury,,UG,ESA,1000000007 0019636500071003 Direct Payment/Reimbursement,C01, ,3,1,20,110
1000000007_0019720600071014_07-25-1997-00:00:00_Disbursement,1000000007,1000000007,0019720600071014,Disbursement,1997-07-25T00:00:00.000Z,2521043.0,BEF,1997-07-25T00:00:00.000Z,1000000007 G-B-B-15-,IFAD,"MINISTRY OF FINANCE, PLANNING AND ECONOMIC DEVELOPMENT",Money is disbursed through central Ministry of Finance or Treasury,,UG,ESA,1000000007 0019720600071014 Direct Payment/Reimbursement,C01, ,3,1,20,110
1000000007_0019803700071027_02-06-1998-00:00:00_Disbursement,1000000007,1000000007,0019803700071027,Disbursement,1998-02-06T00:00:00.000Z,496839.0,BEF,1998-02-06T00:00:00.000Z,1000000007 G-B-B-15-,IFAD,"MINISTRY OF FINANCE, PLANNING AND ECONOMIC DEVELOPMENT",Money is disbursed through central Ministry of Finance or Treasury,,UG,ESA,1000000007 0019803700071027 Direct Payment/Reimbursement,C01, ,3,1,20,110
1000000007_0019736400071024_12-30-1997-00:00:00_Disbursement,1000000007,1000000007,0019736400071024,Disbursement,1997-12-30T00:00:00.000Z,486335.0,BEF,1997-12-30T00:00:00.000Z,1000000007 G-B-B-15-,IFAD,"MINISTRY OF FINANCE, PLANNING AND ECONOMIC DEVELOPMENT",Money is disbursed through central Ministry of Finance or Treasury,,UG,ESA,1000000007 0019736400071024 Direct Payment/Reimbursement,C01, ,3,1,20,110
1000000007_0019706400071005_03-05-1997-00:00:00_Disbursement,1000000007,1000000007,0019706400071005,Disbursement,1997-03-05T00:00:00.000Z,466157.0,BEF,1997-03-05T00:00:00.000Z,1000000007 G-B-B-15-,IFAD,"MINISTRY OF FINANCE, PLANNING AND ECONOMIC DEVELOPMENT",Money is disbursed through central Ministry of Finance or Treasury,,UG,ESA,1000000007 0019706400071005 Direct Payment/Reimbursement,C01, ,3,1,20,110
1000000007_0019809200071030_04-02-1998-00:00:00_Disbursement,1000000007,1000000007,0019809200071030,Disbursement,1998-04-02T00:00:00.000Z,6508100.0,BEF,1998-04-02T00:00:00.000Z,1000000007 G-B-B-15-,IFAD,"MINISTRY OF FINANCE, PLANNING AND ECONOMIC DEVELOPMENT",Money is disbursed through central Ministry of Finance or Treasury,,UG,ESA,1000000007 0019809200071030 Direct Payment/Reimbursement,C01, ,3,1,20,110
1000000007_0019815500071035_06-04-1998-00:00:00_Disbursement,1000000007,1000000007,0019815500071035,Disbursement,1998-06-04T00:00:00.000Z,549060.0,BEF,1998-06-04T00:00:00.000Z,1000000007 G-B-B-15-,IFAD,"MINISTRY OF FINANCE, PLANNING AND ECONOMIC DEVELOPMENT",Money is disbursed through central Ministry of Finance or Treasury,,UG,ESA,1000000007 0019815500071035 Direct Payment/Reimbursement,C01, ,3,1,20,110
1000000007_0019821100071038_07-30-1998-00:00:00_Disbursement,1000000007,1000000007,0019821100071038,Disbursement,1998-07-30T00:00:00.000Z,670268.0,BEF,1998-07-30T00:00:00.000Z,1000000007 G-B-B-15-,IFAD,"MINISTRY OF FINANCE, PLANNING AND ECONOMIC DEVELOPMENT",Money is disbursed through central Ministry of Finance or Treasury,,UG,ESA,1000000007 0019821100071038 Direct Payment/Reimbursement,C01, ,3,1,20,110
1000000007_0019732300071021_11-19-1997-00:00:00_Disbursement,1000000007,1000000007,0019732300071021,Disbursement,1997-11-19T00:00:00.000Z,475810.0,BEF,1997-11-19T00:00:00.000Z,1000000007 G-B-B-15-,IFAD,"MINISTRY OF FINANCE, PLANNING AND ECONOMIC DEVELOPMENT",Money is disbursed through central Ministry of Finance or Treasury,,UG,ESA,1000000007 0019732300071021 Direct Payment/Reimbursement,C01, ,3,1,20,110
1000000007_0019904000071044_02-09-1999-00:00:00_Disbursement,1000000007,1000000007,0019904000071044,Disbursement,1999-02-09T00:00:00.000Z,972922.0,BEF,1999-02-09T00:00:00.000Z,1000000007 G-B-B-15-,IFAD,"MINISTRY OF FINANCE, PLANNING AND ECONOMIC DEVELOPMENT",Money is disbursed through central Ministry of Finance or Treasury,,UG,ESA,1000000007 0019904000071044 Direct Payment/Reimbursement,C01, ,3,1,20,110
1000000007_0019727200071019_09-29-1997-00:00:00_Disbursement,1000000007,1000000007,0019727200071019,Disbursement,1997-09-29T00:00:00.000Z,3795874.0,BEF,1997-09-29T00:00:00.000Z,1000000007 G-B-B-15-,IFAD,"MINISTRY OF FINANCE, PLANNING AND ECONOMIC DEVELOPMENT",Money is disbursed through central Ministry of Finance or Treasury,,UG,ESA,1000000007 0019727200071019 Direct Payment/Reimbursement,C01, ,3,1,20,110
1000000007_0019933600071046_12-02-1999-00:00:00_Disbursement,1000000007,1000000007,0019933600071046,Disbursement,1999-12-02T00:00:00.000Z,908719.0,BEF,1999-12-02T00:00:00.000Z,1000000007 G-B-B-15-,IFAD,"MINISTRY OF FINANCE, PLANNING AND ECONOMIC DEVELOPMENT",Money is disbursed through central Ministry of Finance or Treasury,,UG,ESA,1000000007 0019933600071046 Direct Payment/Reimbursement,C01, ,3,1,20,110
1000000007_0019720600071013_07-25-1997-00:00:00_Disbursement,1000000007,1000000007,0019720600071013,Disbursement,1997-07-25T00:00:00.000Z,6416886.0,BEF,1997-07-25T00:00:00.000Z,1000000007 G-B-B-15-,IFAD,"MINISTRY OF FINANCE, PLANNING AND ECONOMIC DEVELOPMENT",Money is disbursed through central Ministry of Finance or Treasury,,UG,ESA,1000000007 0019720600071013 Direct Payment/Reimbursement,C01, ,3,1,20,110
1000000007_0019823900071039_08-27-1998-00:00:00_Disbursement,1000000007,1000000007,0019823900071039,Disbursement,1998-08-27T00:00:00.000Z,11632330.0,BEF,1998-08-27T00:00:00.000Z,1000000007 G-B-B-15-,IFAD,"MINISTRY OF FINANCE, PLANNING AND ECONOMIC DEVELOPMENT",Money is disbursed through central Ministry of Finance or Treasury,,UG,ESA,1000000007 0019823900071039 Direct Payment/Reimbursement,C01, ,3,1,20,110
1000000007_0019811800071033_04-28-1998-00:00:00_Disbursement,1000000007,1000000007,0019811800071033,Disbursement,1998-04-28T00:00:00.000Z,7903767.0,BEF,1998-04-28T00:00:00.000Z,1000000007 G-B-B-15-,IFAD,"MINISTRY OF FINANCE, PLANNING AND ECONOMIC DEVELOPMENT",Money is disbursed through central Ministry of Finance or Treasury,,UG,ESA,1000000007 0019811800071033 Direct Payment/Reimbursement,C01, ,3,1,20,110
1000000007_0019634800071002_12-13-1996-00:00:00_Disbursement,1000000007,1000000007,0019634800071002,Disbursement,1996-12-13T00:00:00.000Z,428036.0,BEF,1996-12-13T00:00:00.000Z,1000000007 G-B-B-15-,IFAD,"MINISTRY OF FINANCE, PLANNING AND ECONOMIC DEVELOPMENT",Money is disbursed through central Ministry of Finance or Treasury,,UG,ESA,1000000007 0019634800071002 Direct Payment/Reimbursement,C01, ,3,1,20,110
1000000007_0019713200071007_05-12-1997-00:00:00_Disbursement,1000000007,1000000007,0019713200071007,Disbursement,1997-05-12T00:00:00.000Z,8045618.0,BEF,1997-05-12T00:00:00.000Z,1000000007 G-B-B-15-,IFAD,"MINISTRY OF FINANCE, PLANNING AND ECONOMIC DEVELOPMENT",Money is disbursed through central Ministry of Finance or Treasury,,UG,ESA,1000000007 0019713200071007 Direct Payment/Reimbursement,C01, ,3,1,20,110
1000000007_0019714800071009_05-28-1997-00:00:00_Disbursement,1000000007,1000000007,0019714800071009,Disbursement,1997-05-28T00:00:00.000Z,462666.0,BEF,1997-05-28T00:00:00.000Z,1000000007 G-B-B-15-,IFAD,"MINISTRY OF FINANCE, PLANNING AND ECONOMIC DEVELOPMENT",Money is disbursed through central Ministry of Finance or Treasury,,UG,ESA,1000000007 0019714800071009 Direct Payment/Reimbursement,C01, ,3,1,20,110
1000000007_0019734900071023_12-15-1997-00:00:00_Disbursement,1000000007,1000000007,0019734900071023,Disbursement,1997-12-15T00:00:00.000Z,485739.0,BEF,1997-12-15T00:00:00.000Z,1000000007 G-B-B-15-,IFAD,"MINISTRY OF FINANCE, PLANNING AND ECONOMIC DEVELOPMENT",Money is disbursed through central Ministry of Finance or Treasury,,UG,ESA,1000000007 0019734900071023 Direct Payment/Reimbursement,C01, ,3,1,20,110
1000000007_0019817400071036_06-23-1998-00:00:00_Disbursement,1000000007,1000000007,0019817400071036,Disbursement,1998-06-23T00:00:00.000Z,711754.0,BEF,1998-06-23T00:00:00.000Z,1000000007 G-B-B-15-,IFAD,"MINISTRY OF FINANCE, PLANNING AND ECONOMIC DEVELOPMENT",Money is disbursed through central Ministry of Finance or Treasury,,UG,ESA,1000000007 0019817400071036 Direct Payment/Reimbursement,C01, ,3,1,20,110
1000000007_0019732300071022_11-19-1997-00:00:00_Disbursement,1000000007,1000000007,0019732300071022,Disbursement,1997-11-19T00:00:00.000Z,2718808.0,BEF,1997-11-19T00:00:00.000Z,1000000007 G-B-B-15-,IFAD,"MINISTRY OF FINANCE, PLANNING AND ECONOMIC DEVELOPMENT",Money is disbursed through central Ministry of Finance or Treasury,,UG,ESA,1000000007 0019732300071022 Direct Payment/Reimbursement,C01, ,3,1,20,110
1000000007_0019814900071034_05-29-1998-00:00:00_Disbursement,1000000007,1000000007,0019814900071034,Disbursement,1998-05-29T00:00:00.000Z,544169.0,BEF,1998-05-29T00:00:00.000Z,1000000007 G-B-B-15-,IFAD,"MINISTRY OF FINANCE, PLANNING AND ECONOMIC DEVELOPMENT",Money is disbursed through central Ministry of Finance or Treasury,,UG,ESA,1000000007 0019814900071034 Direct Payment/Reimbursement,C01, ,3,1,20,110
1000000007_0019736400071025_12-30-1997-00:00:00_Disbursement,1000000007,1000000007,0019736400071025,Disbursement,1997-12-30T00:00:00.000Z,6904985.0,BEF,1997-12-30T00:00:00.000Z,1000000007 G-B-B-15-,IFAD,"MINISTRY OF FINANCE, PLANNING AND ECONOMIC DEVELOPMENT",Money is disbursed through central Ministry of Finance or Treasury,,UG,ESA,1000000007 0019736400071025 Direct Payment/Reimbursement,C01, ,3,1,20,110
1000000007_0019719800071011_07-17-1997-00:00:00_Disbursement,1000000007,1000000007,0019719800071011,Disbursement,1997-07-17T00:00:00.000Z,491495.0,BEF,1997-07-17T00:00:00.000Z,1000000007 G-B-B-15-,IFAD,"MINISTRY OF FINANCE, PLANNING AND ECONOMIC DEVELOPMENT",Money is disbursed through central Ministry of Finance or Treasury,,UG,ESA,1000000007 0019719800071011 Direct Payment/Reimbursement,C01, ,3,1,20,110
1000000009__12-06-1995-00:00:00_Commitment,1100000489,1000000009,,Commitment,1995-12-06T00:00:00.000Z,60951314.94,BEF,1995-12-06T00:00:00.000Z,1000000009 G-B-B-17-,IFAD,"MINISTRY OF FINANCE, PERMANENT SECRETARY",Money is disbursed through central Ministry of Finance or Treasury,,TZ,ESA,1000000009 GRANTS,C01, ,2,1,20,110
1000000009_0010309200091035_04-02-2003-00:00:00_Disbursement,1100000489,1000000009,0010309200091035,Disbursement,2003-04-02T00:00:00.000Z,555012.02,BEF,2003-04-02T00:00:00.000Z,1000000009 G-B-B-17-,IFAD,"MINISTRY OF FINANCE, PERMANENT SECRETARY",Money is disbursed through central Ministry of Finance or Treasury,,TZ,ESA,1000000009 0010309200091035 Direct Payment/Reimbursement,C01, ,3,1,20,110
1000000009_0010317400091036_06-23-2003-00:00:00_Disbursement,1100000489,1000000009,0010317400091036,Disbursement,2003-06-23T00:00:00.000Z,45309.77,BEF,2003-06-23T00:00:00.000Z,1000000009 G-B-B-17-,IFAD,"MINISTRY OF FINANCE, PERMANENT SECRETARY",Money is disbursed through central Ministry of Finance or Treasury,,TZ,ESA,1000000009 0010317400091036 Direct Payment/Reimbursement,C01, ,3,1,20,110
1000000009_0019828900091011_10-16-1998-00:00:00_Disbursement,1100000489,1000000009,0019828900091011,Disbursement,1998-10-16T00:00:00.000Z,1523363.0,BEF,1998-10-16T00:00:00.000Z,1000000009 G-B-B-17-,IFAD,"MINISTRY OF FINANCE, PERMANENT SECRETARY",Money is disbursed through central Ministry of Finance or Treasury,,TZ,ESA,1000000009 0019828900091011 Direct Payment/Reimbursement,C01, ,3,1,20,110
1000000009_0010004200091017_02-11-2000-00:00:00_Disbursement,1100000489,1000000009,0010004200091017,Disbursement,2000-02-11T00:00:00.000Z,3844768.0,BEF,2000-02-11T00:00:00.000Z,1000000009 G-B-B-17-,IFAD,"MINISTRY OF FINANCE, PERMANENT SECRETARY",Money is disbursed through central Ministry of Finance or Treasury,,TZ,ESA,1000000009 0010004200091017 Direct Payment/Reimbursement,C01, ,3,1,20,110
1000000009_0010103100091025_01-31-2001-00:00:00_Disbursement,1100000489,1000000009,0010103100091025,Disbursement,2001-01-31T00:00:00.000Z,125080.22,BEF,2001-01-31T00:00:00.000Z,1000000009 G-B-B-17-,IFAD,"MINISTRY OF FINANCE, PERMANENT SECRETARY",Money is disbursed through central Ministry of Finance or Treasury,,TZ,ESA,1000000009 0010103100091025 Direct Payment/Reimbursement,C01, ,3,1,20,110
1000000009_0019901500091013_01-15-1999-00:00:00_Disbursement,1100000489,1000000009,0019901500091013,Disbursement,1999-01-15T00:00:00.000Z,3412778.0,BEF,1999-01-15T00:00:00.000Z,1000000009 G-B-B-17-,IFAD,"MINISTRY OF FINANCE, PERMANENT SECRETARY",Money is disbursed through central Ministry of Finance or Treasury,,TZ,ESA,1000000009 0019901500091013 Direct Payment/Reimbursement,C01, ,3,1,20,110
1000000009_0019714800091002_05-28-1997-00:00:00_Disbursement,1100000489,1000000009,0019714800091002,Disbursement,1997-05-28T00:00:00.000Z,912527.0,BEF,1997-05-28T00:00:00.000Z,1000000009 G-B-B-17-,IFAD,"MINISTRY OF FINANCE, PERMANENT SECRETARY",Money is disbursed through central Ministry of Finance or Treasury,,TZ,ESA,1000000009 0019714800091002 Direct Payment/Reimbursement,C01, ,3,1,20,110
1000000009_0010008700091018_03-27-2000-00:00:00_Disbursement,1100000489,1000000009,0010008700091018,Disbursement,2000-03-27T00:00:00.000Z,767621.0,BEF,2000-03-27T00:00:00.000Z,1000000009 G-B-B-17-,IFAD,"MINISTRY OF FINANCE, PERMANENT SECRETARY",Money is disbursed through central Ministry of Finance or Treasury,,TZ,ESA,1000000009 0010008700091018 Direct Payment/Reimbursement,C01, ,3,1,20,110
1000000009_0010228100091034_10-08-2002-00:00:00_Disbursement,1100000489,1000000009,0010228100091034,Disbursement,2002-10-08T00:00:00.000Z,156112.2,BEF,2002-10-08T00:00:00.000Z,1000000009 G-B-B-17-,IFAD,"MINISTRY OF FINANCE, PERMANENT SECRETARY",Money is disbursed through central Ministry of Finance or Treasury,,TZ,ESA,1000000009 0010228100091034 Direct Payment/Reimbursement,C01, ,3,1,20,110
1000000009_0010032200091024_11-17-2000-00:00:00_Disbursement,1100000489,1000000009,0010032200091024,Disbursement,2000-11-17T00:00:00.000Z,1042382.0,BEF,2000-11-17T00:00:00.000Z,1000000009 G-B-B-17-,IFAD,"MINISTRY OF FINANCE, PERMANENT SECRETARY",Money is disbursed through central Ministry of Finance or Treasury,,TZ,ESA,1000000009 0010032200091024 Direct Payment/Reimbursement,C01, ,3,1,20,110
1000000009_0010225900091033_09-16-2002-00:00:00_Disbursement,1100000489,1000000009,0010225900091033,Disbursement,2002-09-16T00:00:00.000Z,559489.92,BEF,2002-09-16T00:00:00.000Z,1000000009 G-B-B-17-,IFAD,"MINISTRY OF FINANCE, PERMANENT SECRETARY",Money is disbursed through central Ministry of Finance or Treasury,,TZ,ESA,1000000009 0010225900091033 Direct Payment/Reimbursement,C01, ,3,1,20,110
1000000009_0010134600091031_12-12-2001-00:00:00_Disbursement,1100000489,1000000009,0010134600091031,Disbursement,2001-12-12T00:00:00.000Z,2333936.29,BEF,2001-12-12T00:00:00.000Z,1000000009 G-B-B-17-,IFAD,"MINISTRY OF FINANCE, PERMANENT SECRETARY",Money is disbursed through central Ministry of Finance or Treasury,,TZ,ESA,1000000009 0010134600091031 Direct Payment/Reimbursement,C01, ,3,1,20,110
1000000009_0019806500091006_03-06-1998-00:00:00_Disbursement,1100000489,1000000009,0019806500091006,Disbursement,1998-03-06T00:00:00.000Z,2026666.0,BEF,1998-03-06T00:00:00.000Z,1000000009 G-B-B-17-,IFAD,"MINISTRY OF FINANCE, PERMANENT SECRETARY",Money is disbursed through central Ministry of Finance or Treasury,,TZ,ESA,1000000009 0019806500091006 Direct Payment/Reimbursement,C01, ,3,1,20,110
1000000009_0019901500091014_01-15-1999-00:00:00_Disbursement,1100000489,1000000009,0019901500091014,Disbursement,1999-01-15T00:00:00.000Z,1301342.0,BEF,1999-01-15T00:00:00.000Z,1000000009 G-B-B-17-,IFAD,"MINISTRY OF FINANCE, PERMANENT SECRETARY",Money is disbursed through central Ministry of Finance or Treasury,,TZ,ESA,1000000009 0019901500091014 Direct Payment/Reimbursement,C01, ,3,1,20,110
1000000009_0010111500091027_04-25-2001-00:00:00_Disbursement,1100000489,1000000009,0010111500091027,Disbursement,2001-04-25T00:00:00.000Z,994441.75,BEF,2001-04-25T00:00:00.000Z,1000000009 G-B-B-17-,IFAD,"MINISTRY OF FINANCE, PERMANENT SECRETARY",Money is disbursed through central Ministry of Finance or Treasury,,TZ,ESA,1000000009 0010111500091027 Direct Payment/Reimbursement,C01, ,3,1,20,110
1000000009_0019723100091003_08-19-1997-00:00:00_Disbursement,1100000489,1000000009,0019723100091003,Disbursement,1997-08-19T00:00:00.000Z,150206.0,BEF,1997-08-19T00:00:00.000Z,1000000009 G-B-B-17-,IFAD,"MINISTRY OF FINANCE, PERMANENT SECRETARY",Money is disbursed through central Ministry of Finance or Treasury,,TZ,ESA,1000000009 0019723100091003 Direct Payment/Reimbursement,C01, ,3,1,20,110
1000000009_0019933300091016_11-29-1999-00:00:00_Disbursement,1100000489,1000000009,0019933300091016,Disbursement,1999-11-29T00:00:00.000Z,880425.0,BEF,1999-11-29T00:00:00.000Z,1000000009 G-B-B-17-,IFAD,"MINISTRY OF FINANCE, PERMANENT SECRETARY",Money is disbursed through central Ministry of Finance or Treasury,,TZ,ESA,1000000009 0019933300091016 Direct Payment/Reimbursement,C01, ,3,1,20,110
1000000009_0010322400091038_08-12-2003-00:00:00_Disbursement,1100000489,1000000009,0010322400091038,Disbursement,2003-08-12T00:00:00.000Z,368121.53,BEF,2003-08-12T00:00:00.000Z,1000000009 G-B-B-17-,IFAD,"MINISTRY OF FINANCE, PERMANENT SECRETARY",Money is disbursed through central Ministry of Finance or Treasury,,TZ,ESA,1000000009 0010322400091038 Direct Payment/Reimbursement,C01, ,3,1,20,110
1000000009_0019826000091010_09-17-1998-00:00:00_Disbursement,1100000489,1000000009,0019826000091010,Disbursement,1998-09-17T00:00:00.000Z,3329484.0,BEF,1998-09-17T00:00:00.000Z,1000000009 G-B-B-17-,IFAD,"MINISTRY OF FINANCE, PERMANENT SECRETARY",Money is disbursed through central Ministry of Finance or Treasury,,TZ,ESA,1000000009 0019826000091010 Direct Payment/Reimbursement,C01, ,3,1,20,110
1000000009_0010011900091020_04-28-2000-00:00:00_Disbursement,1100000489,1000000009,0010011900091020,Disbursement,2000-04-28T00:00:00.000Z,1378659.0,BEF,2000-04-28T00:00:00.000Z,1000000009 G-B-B-17-,IFAD,"MINISTRY OF FINANCE, PERMANENT SECRETARY",Money is disbursed through central Ministry of Finance or Treasury,,TZ,ESA,1000000009 0010011900091020 Direct Payment/Reimbursement,C01, ,3,1,20,110
1000000009_0010013900091021_05-18-2000-00:00:00_Disbursement,1100000489,1000000009,0010013900091021,Disbursement,2000-05-18T00:00:00.000Z,2906430.0,BEF,2000-05-18T00:00:00.000Z,1000000009 G-B-B-17-,IFAD,"MINISTRY OF FINANCE, PERMANENT SECRETARY",Money is disbursed through central Ministry of Finance or Treasury,,TZ,ESA,1000000009 0010013900091021 Direct Payment/Reimbursement,C01, ,3,1,20,110
1000000009_0019914000091015_05-20-1999-00:00:00_Disbursement,1100000489,1000000009,0019914000091015,Disbursement,1999-05-20T00:00:00.000Z,3948373.0,BEF,1999-05-20T00:00:00.000Z,1000000009 G-B-B-17-,IFAD,"MINISTRY OF FINANCE, PERMANENT SECRETARY",Money is disbursed through central Ministry of Finance or Treasury,,TZ,ESA,1000000009 0019914000091015 Direct Payment/Reimbursement,C01, ,3,1,20,110
1000000009_0019625300091001_09-09-1996-00:00:00_Disbursement,1100000489,1000000009,0019625300091001,Disbursement,1996-09-09T00:00:00.000Z,4602000.0,BEF,1996-09-09T00:00:00.000Z,1000000009 G-B-B-17-,IFAD,"MINISTRY OF FINANCE, PERMANENT SECRETARY",Money is disbursed through central Ministry of Finance or Treasury,,TZ,ESA,1000000009 0019625300091001 Direct Payment/Reimbursement,C01, ,3,1,20,110
1000000009_0010129800091029_10-25-2001-00:00:00_Disbursement,1100000489,1000000009,0010129800091029,Disbursement,2001-10-25T00:00:00.000Z,1213286.71,BEF,2001-10-25T00:00:00.000Z,1000000009 G-B-B-17-,IFAD,"MINISTRY OF FINANCE, PERMANENT SECRETARY",Money is disbursed through central Ministry of Finance or Treasury,,TZ,ESA,1000000009 0010129800091029 Direct Payment/Reimbursement,C01, ,3,1,20,110
1000000009_0010125500091028_09-12-2001-00:00:00_Disbursement,1100000489,1000000009,0010125500091028,Disbursement,2001-09-12T00:00:00.000Z,1766869.77,BEF,2001-09-12T00:00:00.000Z,1000000009 G-B-B-17-,IFAD,"MINISTRY OF FINANCE, PERMANENT SECRETARY",Money is disbursed through central Ministry of Finance or Treasury,,TZ,ESA,1000000009 0010125500091028 Direct Payment/Reimbursement,C01, ,3,1,20,110
1000000009_0010018000091022_06-28-2000-00:00:00_Disbursement,1100000489,1000000009,0010018000091022,Disbursement,2000-06-28T00:00:00.000Z,1242914.0,BEF,2000-06-28T00:00:00.000Z,1000000009 G-B-B-17-,IFAD,"MINISTRY OF FINANCE, PERMANENT SECRETARY",Money is disbursed through central Ministry of Finance or Treasury,,TZ,ESA,1000000009 0010018000091022 Direct Payment/Reimbursement,C01, ,3,1,20,110
1000000009_0010317400091037_06-23-2003-00:00:00_Disbursement,1100000489,1000000009,0010317400091037,Disbursement,2003-06-23T00:00:00.000Z,121619.72,BEF,2003-06-23T00:00:00.000Z,1000000009 G-B-B-17-,IFAD,"MINISTRY OF FINANCE, PERMANENT SECRETARY",Money is disbursed through central Ministry of Finance or Treasury,,TZ,ESA,1000000009 0010317400091037 Direct Payment/Reimbursement,C01, ,3,1,20,110
1000000009_0010103100091026_01-31-2001-00:00:00_Disbursement,1100000489,1000000009,0010103100091026,Disbursement,2001-01-31T00:00:00.000Z,304950.57,BEF,2001-01-31T00:00:00.000Z,1000000009 G-B-B-17-,IFAD,"MINISTRY OF FINANCE, PERMANENT SECRETARY",Money is disbursed through central Ministry of Finance or Treasury,,TZ,ESA,1000000009 0010103100091026 Direct Payment/Reimbursement,C01, ,3,1,20,110
1000000009_0010322500091039_08-13-2003-00:00:00_Disbursement,1100000489,1000000009,0010322500091039,Disbursement,2003-08-13T00:00:00.000Z,1010402.24,BEF,2003-08-13T00:00:00.000Z,1000000009 G-B-B-17-,IFAD,"MINISTRY OF FINANCE, PERMANENT SECRETARY",Money is disbursed through central Ministry of Finance or Treasury,,TZ,ESA,1000000009 0010322500091039 Direct Payment/Reimbursement,C01, ,3,1,20,110
1000000009_0019819500091008_07-14-1998-00:00:00_Disbursement,1100000489,1000000009,0019819500091008,Disbursement,1998-07-14T00:00:00.000Z,2693965.0,BEF,1998-07-14T00:00:00.000Z,1000000009 G-B-B-17-,IFAD,"MINISTRY OF FINANCE, PERMANENT SECRETARY",Money is disbursed through central Ministry of Finance or Treasury,,TZ,ESA,1000000009 0019819500091008 Direct Payment/Reimbursement,C01, ,3,1,20,110
1000000009_0010011900091019_04-28-2000-00:00:00_Disbursement,1100000489,1000000009,0010011900091019,Disbursement,2000-04-28T00:00:00.000Z,3690056.0,BEF,2000-04-28T00:00:00.000Z,1000000009 G-B-B-17-,IFAD,"MINISTRY OF FINANCE, PERMANENT SECRETARY",Money is disbursed through central Ministry of Finance or Treasury,,TZ,ESA,1000000009 0010011900091019 Direct Payment/Reimbursement,C01, ,3,1,20,110
1000000009_0010216200091032_06-11-2002-00:00:00_Disbursement,1100000489,1000000009,0010216200091032,Disbursement,2002-06-11T00:00:00.000Z,1678251.47,BEF,2002-06-11T00:00:00.000Z,1000000009 G-B-B-17-,IFAD,"MINISTRY OF FINANCE, PERMANENT SECRETARY",Money is disbursed through central Ministry of Finance or Treasury,,TZ,ESA,1000000009 0010216200091032 Direct Payment/Reimbursement,C01, ,3,1,20,110
1000000009_0019814900091007_05-29-1998-00:00:00_Disbursement,1100000489,1000000009,0019814900091007,Disbursement,1998-05-29T00:00:00.000Z,277559.0,BEF,1998-05-29T00:00:00.000Z,1000000009 G-B-B-17-,IFAD,"MINISTRY OF FINANCE, PERMANENT SECRETARY",Money is disbursed through central Ministry of Finance or Treasury,,TZ,ESA,1000000009 0019814900091007 Direct Payment/Reimbursement,C01, ,3,1,20,110
1000000009_0019820500091009_07-24-1998-00:00:00_Disbursement,1100000489,1000000009,0019820500091009,Disbursement,1998-07-24T00:00:00.000Z,4504882.0,BEF,1998-07-24T00:00:00.000Z,1000000009 G-B-B-17-,IFAD,"MINISTRY OF FINANCE, PERMANENT SECRETARY",Money is disbursed through central Ministry of Finance or Treasury,,TZ,ESA,1000000009 0019820500091009 Direct Payment/Reimbursement,C01, ,3,1,20,110
1000000009_0019728300091004_10-10-1997-00:00:00_Disbursement,1100000489,1000000009,0019728300091004,Disbursement,1997-10-10T00:00:00.000Z,1713892.0,BEF,1997-10-10T00:00:00.000Z,1000000009 G-B-B-17-,IFAD,"MINISTRY OF FINANCE, PERMANENT SECRETARY",Money is disbursed through central Ministry of Finance or Treasury,,TZ,ESA,1000000009 0019728300091004 Direct Payment/Reimbursement,C01, ,3,1,20,110
1000000009_0019831400091012_11-10-1998-00:00:00_Disbursement,1100000489,1000000009,0019831400091012,Disbursement,1998-11-10T00:00:00.000Z,255969.0,BEF,1998-11-10T00:00:00.000Z,1000000009 G-B-B-17-,IFAD,"MINISTRY OF FINANCE, PERMANENT SECRETARY",Money is disbursed through central Ministry of Finance or Treasury,,TZ,ESA,1000000009 0019831400091012 Direct Payment/Reimbursement,C01, ,3,1,20,110
1000000009_0019803700091005_02-06-1998-00:00:00_Disbursement,1100000489,1000000009,0019803700091005,Disbursement,1998-02-06T00:00:00.000Z,1244331.0,BEF,1998-02-06T00:00:00.000Z,1000000009 G-B-B-17-,IFAD,"MINISTRY OF FINANCE, PERMANENT SECRETARY",Money is disbursed through central Ministry of Finance or Treasury,,TZ,ESA,1000000009 0019803700091005 Direct Payment/Reimbursement,C01, ,3,1,20,110
1000000009_0010131200091030_11-08-2001-00:00:00_Disbursement,1100000489,1000000009,0010131200091030,Disbursement,2001-11-08T00:00:00.000Z,885625.76,BEF,2001-11-08T00:00:00.000Z,1000000009 G-B-B-17-,IFAD,"MINISTRY OF FINANCE, PERMANENT SECRETARY",Money is disbursed through central Ministry of Finance or Treasury,,TZ,ESA,1000000009 0010131200091030 Direct Payment/Reimbursement,C01, ,3,1,20,110
1000000009_0010019600091023_07-14-2000-00:00:00_Disbursement,1100000489,1000000009,0010019600091023,Disbursement,2000-07-14T00:00:00.000Z,1182213.0,BEF,2000-07-14T00:00:00.000Z,1000000009 G-B-B-17-,IFAD,"MINISTRY OF FINANCE, PERMANENT SECRETARY",Money is disbursed through central Ministry of Finance or Treasury,,TZ,ESA,1000000009 0010019600091023 Direct Payment/Reimbursement,C01, ,3,1,20,110
1000000012__04-02-1985-00:00:00_Commitment,1100000168,1000000012,,Commitment,1985-04-02T00:00:00.000Z,316416066.0,BEF,1985-04-02T00:00:00.000Z,1000000012 G-B-B-2-,IFAD,MINISTRY OF FINANCE AND ECONOMIC DEVELOPMENT,Money is disbursed through central Ministry of Finance or Treasury,,ET,ESA,1000000012 GRANTS,C01, ,2,1,20,110
1000000012_0019530000121041_10-27-1995-00:00:00_Disbursement,1100000168,1000000012,0019530000121041,Disbursement,1995-10-27T00:00:00.000Z,4194234.0,BEF,1995-10-27T00:00:00.000Z,1000000012 G-B-B-2-,IFAD,MINISTRY OF FINANCE AND ECONOMIC DEVELOPMENT,Money is disbursed through central Ministry of Finance or Treasury,,ET,ESA,1000000012 0019530000121041 Direct Payment/Reimbursement,C01, ,3,1,20,110
1000000012_0018908800121009_03-29-1989-00:00:00_Disbursement,1100000168,1000000012,0018908800121009,Disbursement,1989-03-29T00:00:00.000Z,5162797.0,BEF,1989-03-29T00:00:00.000Z,1000000012 G-B-B-2-,IFAD,MINISTRY OF FINANCE AND ECONOMIC DEVELOPMENT,Money is disbursed through central Ministry of Finance or Treasury,,ET,ESA,1000000012 0018908800121009 Direct Payment/Reimbursement,C01, ,3,1,20,110
1000000012_0019235000121023_12-15-1992-00:00:00_Disbursement,1100000168,1000000012,0019235000121023,Disbursement,1992-12-15T00:00:00.000Z,1906073.0,BEF,1992-12-15T00:00:00.000Z,1000000012 G-B-B-2-,IFAD,MINISTRY OF FINANCE AND ECONOMIC DEVELOPMENT,Money is disbursed through central Ministry of Finance or Treasury,,ET,ESA,1000000012 0019235000121023 Direct Payment/Reimbursement,C01, ,3,1,20,110
1000000012_0019532100121044_11-17-1995-00:00:00_Disbursement,1100000168,1000000012,0019532100121044,Disbursement,1995-11-17T00:00:00.000Z,800447.0,BEF,1995-11-17T00:00:00.000Z,1000000012 G-B-B-2-,IFAD,MINISTRY OF FINANCE AND ECONOMIC DEVELOPMENT,Money is disbursed through central Ministry of Finance or Treasury,,ET,ESA,1000000012 0019532100121044 Direct Payment/Reimbursement,C01, ,3,1,20,110
1000000012_0019123800121017_08-26-1991-00:00:00_Disbursement,1100000168,1000000012,0019123800121017,Disbursement,1991-08-26T00:00:00.000Z,51676871.0,BEF,1991-08-26T00:00:00.000Z,1000000012 G-B-B-2-,IFAD,MINISTRY OF FINANCE AND ECONOMIC DEVELOPMENT,Money is disbursed through central Ministry of Finance or Treasury,,ET,ESA,1000000012 0019123800121017 Direct Payment/Reimbursement,C01, ,3,1,20,110
1000000012_0018816900121006_06-17-1988-00:00:00_Disbursement,1100000168,1000000012,0018816900121006,Disbursement,1988-06-17T00:00:00.000Z,956800.0,BEF,1988-06-17T00:00:00.000Z,1000000012 G-B-B-2-,IFAD,MINISTRY OF FINANCE AND ECONOMIC DEVELOPMENT,Money is disbursed through central Ministry of Finance or Treasury,,ET,ESA,1000000012 0018816900121006 Direct Payment/Reimbursement,C01, ,3,1,20,110
1000000012_0019513800121036_05-18-1995-00:00:00_Disbursement,1100000168,1000000012,0019513800121036,Disbursement,1995-05-18T00:00:00.000Z,155684.0,BEF,1995-05-18T00:00:00.000Z,1000000012 G-B-B-2-,IFAD,MINISTRY OF FINANCE AND ECONOMIC DEVELOPMENT,Money is disbursed through central Ministry of Finance or Treasury,,ET,ESA,1000000012 0019513800121036 Direct Payment/Reimbursement,C01, ,3,1,20,110
1000000012_0019323700121026_08-25-1993-00:00:00_Disbursement,1100000168,1000000012,0019323700121026,Disbursement,1993-08-25T00:00:00.000Z,417892.0,BEF,1993-08-25T00:00:00.000Z,1000000012 G-B-B-2-,IFAD,MINISTRY OF FINANCE AND ECONOMIC DEVELOPMENT,Money is disbursed through central Ministry of Finance or Treasury,,ET,ESA,1000000012 0019323700121026 Direct Payment/Reimbursement,C01, ,3,1,20,110
1000000012_0019519900121037_07-18-1995-00:00:00_Disbursement,1100000168,1000000012,0019519900121037,Disbursement,1995-07-18T00:00:00.000Z,1482827.0,BEF,1995-07-18T00:00:00.000Z,1000000012 G-B-B-2-,IFAD,MINISTRY OF FINANCE AND ECONOMIC DEVELOPMENT,Money is disbursed through central Ministry of Finance or Treasury,,ET,ESA,1000000012 0019519900121037 Direct Payment/Reimbursement,C01, ,3,1,20,110
1000000012_0019427300121034_09-30-1994-00:00:00_Disbursement,1100000168,1000000012,0019427300121034,Disbursement,1994-09-30T00:00:00.000Z,2551200.0,BEF,1994-09-30T00:00:00.000Z,1000000012 G-B-B-2-,IFAD,MINISTRY OF FINANCE AND ECONOMIC DEVELOPMENT,Money is disbursed through central Ministry of Finance or Treasury,,ET,ESA,1000000012 0019427300121034 Direct Payment/Reimbursement,C01, ,3,1,20,110
1000000012_0018615300121002_06-02-1986-00:00:00_Disbursement,1100000168,1000000012,0018615300121002,Disbursement,1986-06-02T00:00:00.000Z,51898000.0,BEF,1986-06-02T00:00:00.000Z,1000000012 G-B-B-2-,IFAD,MINISTRY OF FINANCE AND ECONOMIC DEVELOPMENT,Money is disbursed through central Ministry of Finance or Treasury,,ET,ESA,1000000012 0018615300121002 Direct Payment/Reimbursement,C01, ,3,1,20,110
1000000012_0018735000121004_12-16-1987-00:00:00_Disbursement,1100000168,1000000012,0018735000121004,Disbursement,1987-12-16T00:00:00.000Z,16146158.0,BEF,1987-12-16T00:00:00.000Z,1000000012 G-B-B-2-,IFAD,MINISTRY OF FINANCE AND ECONOMIC DEVELOPMENT,Money is disbursed through central Ministry of Finance or Treasury,,ET,ESA,1000000012 0018735000121004 Direct Payment/Reimbursement,C01, ,3,1,20,110
1000000012_0019532100121043_11-17-1995-00:00:00_Disbursement,1100000168,1000000012,0019532100121043,Disbursement,1995-11-17T00:00:00.000Z,2588407.0,BEF,1995-11-17T00:00:00.000Z,1000000012 G-B-B-2-,IFAD,MINISTRY OF FINANCE AND ECONOMIC DEVELOPMENT,Money is disbursed through central Ministry of Finance or Treasury,,ET,ESA,1000000012 0019532100121043 Direct Payment/Reimbursement,C01, ,3,1,20,110
1000000012_0018929100121010_10-18-1989-00:00:00_Disbursement,1100000168,1000000012,0018929100121010,Disbursement,1989-10-18T00:00:00.000Z,12678390.0,BEF,1989-10-18T00:00:00.000Z,1000000012 G-B-B-2-,IFAD,MINISTRY OF FINANCE AND ECONOMIC DEVELOPMENT,Money is disbursed through central Ministry of Finance or Treasury,,ET,ESA,1000000012 0018929100121010 Direct Payment/Reimbursement,C01, ,3,1,20,110
1000000012_0019005400121011_02-23-1990-00:00:00_Disbursement,1100000168,1000000012,0019005400121011,Disbursement,1990-02-23T00:00:00.000Z,11580711.0,BEF,1990-02-23T00:00:00.000Z,1000000012 G-B-B-2-,IFAD,MINISTRY OF FINANCE AND ECONOMIC DEVELOPMENT,Money is disbursed through central Ministry of Finance or Treasury,,ET,ESA,1000000012 0019005400121011 Direct Payment/Reimbursement,C01, ,3,1,20,110
1000000012_0019401900121032_01-19-1994-00:00:00_Disbursement,1100000168,1000000012,0019401900121032,Disbursement,1994-01-19T00:00:00.000Z,65880.0,BEF,1994-01-19T00:00:00.000Z,1000000012 G-B-B-2-,IFAD,MINISTRY OF FINANCE AND ECONOMIC DEVELOPMENT,Money is disbursed through central Ministry of Finance or Treasury,,ET,ESA,1000000012 0019401900121032 Direct Payment/Reimbursement,C01, ,3,1,20,110
1000000012_0019336300121029_12-29-1993-00:00:00_Disbursement,1100000168,1000000012,0019336300121029,Disbursement,1993-12-29T00:00:00.000Z,459463.0,BEF,1993-12-29T00:00:00.000Z,1000000012 G-B-B-2-,IFAD,MINISTRY OF FINANCE AND ECONOMIC DEVELOPMENT,Money is disbursed through central Ministry of Finance or Treasury,,ET,ESA,1000000012 0019336300121029 Direct Payment/Reimbursement,C01, ,3,1,20,110
1000000012_0019526100121040_09-18-1995-00:00:00_Disbursement,1100000168,1000000012,0019526100121040,Disbursement,1995-09-18T00:00:00.000Z,2852645.0,BEF,1995-09-18T00:00:00.000Z,1000000012 G-B-B-2-,IFAD,MINISTRY OF FINANCE AND ECONOMIC DEVELOPMENT,Money is disbursed through central Ministry of Finance or Treasury,,ET,ESA,1000000012 0019526100121040 Direct Payment/Reimbursement,C01, ,3,1,20,110
1000000012_0018827400121046_09-30-1988-00:00:00_Disbursement,1100000168,1000000012,0018827400121046,Disbursement,1988-09-30T00:00:00.000Z,2600.0,BEF,1988-09-30T00:00:00.000Z,1000000012 G-B-B-2-,IFAD,MINISTRY OF FINANCE AND ECONOMIC DEVELOPMENT,Money is disbursed through central Ministry of Finance or Treasury,,ET,ESA,1000000012 0018827400121046 Direct Payment/Reimbursement,C01, ,3,1,20,110
1000000012_0019323600121025_08-24-1993-00:00:00_Disbursement,1100000168,1000000012,0019323600121025,Disbursement,1993-08-24T00:00:00.000Z,145960.0,BEF,1993-08-24T00:00:00.000Z,1000000012 G-B-B-2-,IFAD,MINISTRY OF FINANCE AND ECONOMIC DEVELOPMENT,Money is disbursed through central Ministry of Finance or Treasury,,ET,ESA,1000000012 0019323600121025 Direct Payment/Reimbursement,C01, ,3,1,20,110
1000000012_0019225400121021_09-10-1992-00:00:00_Disbursement,1100000168,1000000012,0019225400121021,Disbursement,1992-09-10T00:00:00.000Z,436500.0,BEF,1992-09-10T00:00:00.000Z,1000000012 G-B-B-2-,IFAD,MINISTRY OF FINANCE AND ECONOMIC DEVELOPMENT,Money is disbursed through central Ministry of Finance or Treasury,,ET,ESA,1000000012 0019225400121021 Direct Payment/Reimbursement,C01, ,3,1,20,110
1000000012_0018619000121001_07-09-1986-00:00:00_Disbursement,1100000168,1000000012,0018619000121001,Disbursement,1986-07-09T00:00:00.000Z,32000000.0,BEF,1986-07-09T00:00:00.000Z,1000000012 G-B-B-2-,IFAD,MINISTRY OF FINANCE AND ECONOMIC DEVELOPMENT,Money is disbursed through central Ministry of Finance or Treasury,,ET,ESA,1000000012 0018619000121001 Direct Payment/Reimbursement,C01, ,3,1,20,110
1000000012_0019526100121039_09-18-1995-00:00:00_Disbursement,1100000168,1000000012,0019526100121039,Disbursement,1995-09-18T00:00:00.000Z,1900072.0,BEF,1995-09-18T00:00:00.000Z,1000000012 G-B-B-2-,IFAD,MINISTRY OF FINANCE AND ECONOMIC DEVELOPMENT,Money is disbursed through central Ministry of Finance or Treasury,,ET,ESA,1000000012 0019526100121039 Direct Payment/Reimbursement,C01, ,3,1,20,110
1000000012_0019505500121035_02-24-1995-00:00:00_Disbursement,1100000168,1000000012,0019505500121035,Disbursement,1995-02-24T00:00:00.000Z,611570.0,BEF,1995-02-24T00:00:00.000Z,1000000012 G-B-B-2-,IFAD,MINISTRY OF FINANCE AND ECONOMIC DEVELOPMENT,Money is disbursed through central Ministry of Finance or Treasury,,ET,ESA,1000000012 0019505500121035 Direct Payment/Reimbursement,C01, ,3,1,20,110
1000000012_0019036500121015_12-31-1990-00:00:00_Disbursement,1100000168,1000000012,0019036500121015,Disbursement,1990-12-31T00:00:00.000Z,10779011.0,BEF,1990-12-31T00:00:00.000Z,1000000012 G-B-B-2-,IFAD,MINISTRY OF FINANCE AND ECONOMIC DEVELOPMENT,Money is disbursed through central Ministry of Finance or Treasury,,ET,ESA,1000000012 0019036500121015 Direct Payment/Reimbursement,C01, ,3,1,20,110
1000000012_0019519900121038_07-18-1995-00:00:00_Disbursement,1100000168,1000000012,0019519900121038,Disbursement,1995-07-18T00:00:00.000Z,1482827.0,BEF,1995-07-18T00:00:00.000Z,1000000012 G-B-B-2-,IFAD,MINISTRY OF FINANCE AND ECONOMIC DEVELOPMENT,Money is disbursed through central Ministry of Finance or Treasury,,ET,ESA,1000000012 0019519900121038 Direct Payment/Reimbursement,C01, ,3,1,20,110
1000000012_0019402600121033_01-26-1994-00:00:00_Disbursement,1100000168,1000000012,0019402600121033,Disbursement,1994-01-26T00:00:00.000Z,263321.0,BEF,1994-01-26T00:00:00.000Z,1000000012 G-B-B-2-,IFAD,MINISTRY OF FINANCE AND ECONOMIC DEVELOPMENT,Money is disbursed through central Ministry of Finance or Treasury,,ET,ESA,1000000012 0019402600121033 Direct Payment/Reimbursement,C01, ,3,1,20,110
1000000012_0019400400121031_01-04-1994-00:00:00_Disbursement,1100000168,1000000012,0019400400121031,Disbursement,1994-01-04T00:00:00.000Z,3796976.0,BEF,1994-01-04T00:00:00.000Z,1000000012 G-B-B-2-,IFAD,MINISTRY OF FINANCE AND ECONOMIC DEVELOPMENT,Money is disbursed through central Ministry of Finance or Treasury,,ET,ESA,1000000012 0019400400121031 Direct Payment/Reimbursement,C01, ,3,1,20,110
1000000012_0018803100121005_01-31-1988-00:00:00_Disbursement,1100000168,1000000012,0018803100121005,Disbursement,1988-01-31T00:00:00.000Z,15944.0,BEF,1988-01-31T00:00:00.000Z,1000000012 G-B-B-2-,IFAD,MINISTRY OF FINANCE AND ECONOMIC DEVELOPMENT,Money is disbursed through central Ministry of Finance or Treasury,,ET,ESA,1000000012 0018803100121005 Direct Payment/Reimbursement,C01, ,3,1,20,110
1000000012_0019336300121030_12-29-1993-00:00:00_Disbursement,1100000168,1000000012,0019336300121030,Disbursement,1993-12-29T00:00:00.000Z,391961.0,BEF,1993-12-29T00:00:00.000Z,1000000012 G-B-B-2-,IFAD,MINISTRY OF FINANCE AND ECONOMIC DEVELOPMENT,Money is disbursed through central Ministry of Finance or Treasury,,ET,ESA,1000000012 0019336300121030 Direct Payment/Reimbursement,C01, ,3,1,20,110
1000000012_0018836200121007_12-27-1988-00:00:00_Disbursement,1100000168,1000000012,0018836200121007,Disbursement,1988-12-27T00:00:00.000Z,11699002.0,BEF,1988-12-27T00:00:00.000Z,1000000012 G-B-B-2-,IFAD,MINISTRY OF FINANCE AND ECONOMIC DEVELOPMENT,Money is disbursed through central Ministry of Finance or Treasury,,ET,ESA,1000000012 0018836200121007 Direct Payment/Reimbursement,C01, ,3,1,20,110
1000000012_0018836300121008_12-28-1988-00:00:00_Disbursement,1100000168,1000000012,0018836300121008,Disbursement,1988-12-28T00:00:00.000Z,7500000.0,BEF,1988-12-28T00:00:00.000Z,1000000012 G-B-B-2-,IFAD,MINISTRY OF FINANCE AND ECONOMIC DEVELOPMENT,Money is disbursed through central Ministry of Finance or Treasury,,ET,ESA,1000000012 0018836300121008 Direct Payment/Reimbursement,C01, ,3,1,20,110
1000000012_0019120500121016_07-24-1991-00:00:00_Disbursement,1100000168,1000000012,0019120500121016,Disbursement,1991-07-24T00:00:00.000Z,4176000.0,BEF,1991-07-24T00:00:00.000Z,1000000012 G-B-B-2-,IFAD,MINISTRY OF FINANCE AND ECONOMIC DEVELOPMENT,Money is disbursed through central Ministry of Finance or Treasury,,ET,ESA,1000000012 0019120500121016 Direct Payment/Reimbursement,C01, ,3,1,20,110
1000000012_0019532100121042_11-17-1995-00:00:00_Disbursement,1100000168,1000000012,0019532100121042,Disbursement,1995-11-17T00:00:00.000Z,12997095.0,BEF,1995-11-17T00:00:00.000Z,1000000012 G-B-B-2-,IFAD,MINISTRY OF FINANCE AND ECONOMIC DEVELOPMENT,Money is disbursed through central Ministry of Finance or Treasury,,ET,ESA,1000000012 0019532100121042 Direct Payment/Reimbursement,C01, ,3,1,20,110
1000000012_0019335500121028_12-21-1993-00:00:00_Disbursement,1100000168,1000000012,0019335500121028,Disbursement,1993-12-21T00:00:00.000Z,6200158.0,BEF,1993-12-21T00:00:00.000Z,1000000012 G-B-B-2-,IFAD,MINISTRY OF FINANCE AND ECONOMIC DEVELOPMENT,Money is disbursed through central Ministry of Finance or Treasury,,ET,ESA,1000000012 0019335500121028 Direct Payment/Reimbursement,C01, ,3,1,20,110
1000000012_0019323600121027_08-24-1993-00:00:00_Disbursement,1100000168,1000000012,0019323600121027,Disbursement,1993-08-24T00:00:00.000Z,356000.0,BEF,1993-08-24T00:00:00.000Z,1000000012 G-B-B-2-,IFAD,MINISTRY OF FINANCE AND ECONOMIC DEVELOPMENT,Money is disbursed through central Ministry of Finance or Treasury,,ET,ESA,1000000012 0019323600121027 Direct Payment/Reimbursement,C01, ,3,1,20,110
1000000012_0019219800121020_07-16-1992-00:00:00_Disbursement,1100000168,1000000012,0019219800121020,Disbursement,1992-07-16T00:00:00.000Z,71858.0,BEF,1992-07-16T00:00:00.000Z,1000000012 G-B-B-2-,IFAD,MINISTRY OF FINANCE AND ECONOMIC DEVELOPMENT,Money is disbursed through central Ministry of Finance or Treasury,,ET,ESA,1000000012 0019219800121020 Direct Payment/Reimbursement,C01, ,3,1,20,110
1000000012_0019011700121012_04-27-1990-00:00:00_Disbursement,1100000168,1000000012,0019011700121012,Disbursement,1990-04-27T00:00:00.000Z,1123200.0,BEF,1990-04-27T00:00:00.000Z,1000000012 G-B-B-2-,IFAD,MINISTRY OF FINANCE AND ECONOMIC DEVELOPMENT,Money is disbursed through central Ministry of Finance or Treasury,,ET,ESA,1000000012 0019011700121012 Direct Payment/Reimbursement,C01, ,3,1,20,110
1000000012_0019231500121022_11-10-1992-00:00:00_Disbursement,1100000168,1000000012,0019231500121022,Disbursement,1992-11-10T00:00:00.000Z,759530.0,BEF,1992-11-10T00:00:00.000Z,1000000012 G-B-B-2-,IFAD,MINISTRY OF FINANCE AND ECONOMIC DEVELOPMENT,Money is disbursed through central Ministry of Finance or Treasury,,ET,ESA,1000000012 0019231500121022 Direct Payment/Reimbursement,C01, ,3,1,20,110
1000000012_0019321100121024_07-30-1993-00:00:00_Disbursement,1100000168,1000000012,0019321100121024,Disbursement,1993-07-30T00:00:00.000Z,4942527.0,BEF,1993-07-30T00:00:00.000Z,1000000012 G-B-B-2-,IFAD,MINISTRY OF FINANCE AND ECONOMIC DEVELOPMENT,Money is disbursed through central Ministry of Finance or Treasury,,ET,ESA,1000000012 0019321100121024 Direct Payment/Reimbursement,C01, ,3,1,20,110
1000000012_0018702900121003_01-29-1987-00:00:00_Disbursement,1100000168,1000000012,0018702900121003,Disbursement,1987-01-29T00:00:00.000Z,11481093.0,BEF,1987-01-29T00:00:00.000Z,1000000012 G-B-B-2-,IFAD,MINISTRY OF FINANCE AND ECONOMIC DEVELOPMENT,Money is disbursed through central Ministry of Finance or Treasury,,ET,ESA,1000000012 0018702900121003 Direct Payment/Reimbursement,C01, ,3,1,20,110
1000000012_0019136100121018_12-27-1991-00:00:00_Disbursement,1100000168,1000000012,0019136100121018,Disbursement,1991-12-27T00:00:00.000Z,15725905.0,BEF,1991-12-27T00:00:00.000Z,1000000012 G-B-B-2-,IFAD,MINISTRY OF FINANCE AND ECONOMIC DEVELOPMENT,Money is disbursed through central Ministry of Finance or Treasury,,ET,ESA,1000000012 0019136100121018 Direct Payment/Reimbursement,C01, ,3,1,20,110
1000000012_0019536300121045_12-29-1995-00:00:00_Disbursement,1100000168,1000000012,0019536300121045,Disbursement,1995-12-29T00:00:00.000Z,550775.0,BEF,1995-12-29T00:00:00.000Z,1000000012 G-B-B-2-,IFAD,MINISTRY OF FINANCE AND ECONOMIC DEVELOPMENT,Money is disbursed through central Ministry of Finance or Treasury,,ET,ESA,1000000012 0019536300121045 Direct Payment/Reimbursement,C01, ,3,1,20,110
1000000012_0019213400121019_05-13-1992-00:00:00_Disbursement,1100000168,1000000012,0019213400121019,Disbursement,1992-05-13T00:00:00.000Z,3234043.0,BEF,1992-05-13T00:00:00.000Z,1000000012 G-B-B-2-,IFAD,MINISTRY OF FINANCE AND ECONOMIC DEVELOPMENT,Money is disbursed through central Ministry of Finance or Treasury,,ET,ESA,1000000012 0019213400121019 Direct Payment/Reimbursement,C01, ,3,1,20,110
1000000012_0019012700121013_05-07-1990-00:00:00_Disbursement,1100000168,1000000012,0019012700121013,Disbursement,1990-05-07T00:00:00.000Z,8038602.0,BEF,1990-05-07T00:00:00.000Z,1000000012 G-B-B-2-,IFAD,MINISTRY OF FINANCE AND ECONOMIC DEVELOPMENT,Money is disbursed through central Ministry of Finance or Treasury,,ET,ESA,1000000012 0019012700121013 Direct Payment/Reimbursement,C01, ,3,1,20,110
1000000012_0019023900121014_08-27-1990-00:00:00_Disbursement,1100000168,1000000012,0019023900121014,Disbursement,1990-08-27T00:00:00.000Z,8159057.0,BEF,1990-08-27T00:00:00.000Z,1000000012 G-B-B-2-,IFAD,MINISTRY OF FINANCE AND ECONOMIC DEVELOPMENT,Money is disbursed through central Ministry of Finance or Treasury,,ET,ESA,1000000012 0019023900121014 Direct Payment/Reimbursement,C01, ,3,1,20,110
1000000016__04-17-1996-00:00:00_Commitment,1100000497,1000000016,,Commitment,1996-04-17T00:00:00.000Z,79959140.9,BEF,1996-04-17T00:00:00.000Z,1000000016 G-B-B-23-,IFAD,MINISTERE DES FINANCES,Money is disbursed through central Ministry of Finance or Treasury,,ML,WCA,1000000016 GRANTS,C01, ,2,1,20,110
1000000016_0010426000161019_09-16-2004-00:00:00_Disbursement,1100000497,1000000016,0010426000161019,Disbursement,2004-09-16T00:00:00.000Z,794090.12,BEF,2004-09-16T00:00:00.000Z,1000000016 G-B-B-23-,IFAD,MINISTERE DES FINANCES,Money is disbursed through central Ministry of Finance or Treasury,,ML,WCA,1000000016 0010426000161019 Direct Payment/Reimbursement,C01, ,3,1,20,110
1000000016_0010001700161004_01-17-2000-00:00:00_Disbursement,1100000497,1000000016,0010001700161004,Disbursement,2000-01-17T00:00:00.000Z,2589732.03,BEF,2000-01-17T00:00:00.000Z,1000000016 G-B-B-23-,IFAD,MINISTERE DES FINANCES,Money is disbursed through central Ministry of Finance or Treasury,,ML,WCA,1000000016 0010001700161004 Direct Payment/Reimbursement,C01, ,3,1,20,110
1000000016_0010105300161009_02-22-2001-00:00:00_Disbursement,1100000497,1000000016,0010105300161009,Disbursement,2001-02-22T00:00:00.000Z,3168326.0,BEF,2001-02-22T00:00:00.000Z,1000000016 G-B-B-23-,IFAD,MINISTERE DES FINANCES,Money is disbursed through central Ministry of Finance or Treasury,,ML,WCA,1000000016 0010105300161009 Direct Payment/Reimbursement,C01, ,3,1,20,110
1000000016_0010017800161007_06-26-2000-00:00:00_Disbursement,1100000497,1000000016,0010017800161007,Disbursement,2000-06-26T00:00:00.000Z,2146020.56,BEF,2000-06-26T00:00:00.000Z,1000000016 G-B-B-23-,IFAD,MINISTERE DES FINANCES,Money is disbursed through central Ministry of Finance or Treasury,,ML,WCA,1000000016 0010017800161007 Direct Payment/Reimbursement,C01, ,3,1,20,110
1000000016_0010212000161012_04-30-2002-00:00:00_Disbursement,1100000497,1000000016,0010212000161012,Disbursement,2002-04-30T00:00:00.000Z,5020094.42,BEF,2002-04-30T00:00:00.000Z,1000000016 G-B-B-23-,IFAD,MINISTERE DES FINANCES,Money is disbursed through central Ministry of Finance or Treasury,,ML,WCA,1000000016 0010212000161012 Direct Payment/Reimbursement,C01, ,3,1,20,110
1000000016_0010534300161030_12-09-2005-00:00:00_Disbursement,1100000497,1000000016,0010534300161030,Disbursement,2005-12-09T00:00:00.000Z,3896361.15,BEF,2005-12-09T00:00:00.000Z,1000000016 G-B-B-23-,IFAD,MINISTERE DES FINANCES,Money is disbursed through central Ministry of Finance or Treasury,,ML,WCA,1000000016 0010534300161030 Direct Payment/Reimbursement,C01, ,3,1,20,110
1000000016_0010432400161021_11-19-2004-00:00:00_Disbursement,1100000497,1000000016,0010432400161021,Disbursement,2004-11-19T00:00:00.000Z,4611250.34,BEF,2004-11-19T00:00:00.000Z,1000000016 G-B-B-23-,IFAD,MINISTERE DES FINANCES,Money is disbursed through central Ministry of Finance or Treasury,,ML,WCA,1000000016 0010432400161021 Direct Payment/Reimbursement,C01, ,3,1,20,110
1000000016_0010523800161028_08-26-2005-00:00:00_Disbursement,1100000497,1000000016,0010523800161028,Disbursement,2005-08-26T00:00:00.000Z,4274524.72,BEF,2005-08-26T00:00:00.000Z,1000000016 G-B-B-23-,IFAD,MINISTERE DES FINANCES,Money is disbursed through central Ministry of Finance or Treasury,,ML,WCA,1000000016 0010523800161028 Direct Payment/Reimbursement,C01, ,3,1,20,110
1000000016_0010314300161015_05-23-2003-00:00:00_Disbursement,1100000497,1000000016,0010314300161015,Disbursement,2003-05-23T00:00:00.000Z,2593993.13,BEF,2003-05-23T00:00:00.000Z,1000000016 G-B-B-23-,IFAD,MINISTERE DES FINANCES,Money is disbursed through central Ministry of Finance or Treasury,,ML,WCA,1000000016 0010314300161015 Direct Payment/Reimbursement,C01, ,3,1,20,110
1000000016_0010219900161013_07-18-2002-00:00:00_Disbursement,1100000497,1000000016,0010219900161013,Disbursement,2002-07-18T00:00:00.000Z,1543622.86,BEF,2002-07-18T00:00:00.000Z,1000000016 G-B-B-23-,IFAD,MINISTERE DES FINANCES,Money is disbursed through central Ministry of Finance or Treasury,,ML,WCA,1000000016 0010219900161013 Direct Payment/Reimbursement,C01, ,3,1,20,110
1000000016_0010432400161022_11-19-2004-00:00:00_Disbursement,1100000497,1000000016,0010432400161022,Disbursement,2004-11-19T00:00:00.000Z,1106175.32,BEF,2004-11-19T00:00:00.000Z,1000000016 G-B-B-23-,IFAD,MINISTERE DES FINANCES,Money is disbursed through central Ministry of Finance or Treasury,,ML,WCA,1000000016 0010432400161022 Direct Payment/Reimbursement,C01, ,3,1,20,110
1000000016_0010607400161032_03-15-2006-00:00:00_Disbursement,1100000497,1000000016,0010607400161032,Disbursement,2006-03-15T00:00:00.000Z,672060.31,BEF,2006-03-15T00:00:00.000Z,1000000016 G-B-B-23-,IFAD,MINISTERE DES FINANCES,Money is disbursed through central Ministry of Finance or Treasury,,ML,WCA,1000000016 0010607400161032 Direct Payment/Reimbursement,C01, ,3,1,20,110
1000000016_0010325500161016_09-12-2003-00:00:00_Disbursement,1100000497,1000000016,0010325500161016,Disbursement,2003-09-12T00:00:00.000Z,2706553.96,BEF,2003-09-12T00:00:00.000Z,1000000016 G-B-B-23-,IFAD,MINISTERE DES FINANCES,Money is disbursed through central Ministry of Finance or Treasury,,ML,WCA,1000000016 0010325500161016 Direct Payment/Reimbursement,C01, ,3,1,20,110
1000000016_0010006000161005_02-29-2000-00:00:00_Disbursement,1100000497,1000000016,0010006000161005,Disbursement,2000-02-29T00:00:00.000Z,2238519.23,BEF,2000-02-29T00:00:00.000Z,1000000016 G-B-B-23-,IFAD,MINISTERE DES FINANCES,Money is disbursed through central Ministry of Finance or Treasury,,ML,WCA,1000000016 0010006000161005 Direct Payment/Reimbursement,C01, ,3,1,20,110
1000000016_0010515300161025_06-02-2005-00:00:00_Disbursement,1100000497,1000000016,0010515300161025,Disbursement,2005-06-02T00:00:00.000Z,835346.55,BEF,2005-06-02T00:00:00.000Z,1000000016 G-B-B-23-,IFAD,MINISTERE DES FINANCES,Money is disbursed through central Ministry of Finance or Treasury,,ML,WCA,1000000016 0010515300161025 Direct Payment/Reimbursement,C01, ,3,1,20,110
1000000016_0010506100161023_03-02-2005-00:00:00_Disbursement,1100000497,1000000016,0010506100161023,Disbursement,2005-03-02T00:00:00.000Z,476454.16,BEF,2005-03-02T00:00:00.000Z,1000000016 G-B-B-23-,IFAD,MINISTERE DES FINANCES,Money is disbursed through central Ministry of Finance or Treasury,,ML,WCA,1000000016 0010506100161023 Direct Payment/Reimbursement,C01, ,3,1,20,110
1000000016_0010108100161010_03-22-2001-00:00:00_Disbursement,1100000497,1000000016,0010108100161010,Disbursement,2001-03-22T00:00:00.000Z,2386710.59,BEF,2001-03-22T00:00:00.000Z,1000000016 G-B-B-23-,IFAD,MINISTERE DES FINANCES,Money is disbursed through central Ministry of Finance or Treasury,,ML,WCA,1000000016 0010108100161010 Direct Payment/Reimbursement,C01, ,3,1,20,110
1000000016_0010516000161027_06-09-2005-00:00:00_Disbursement,1100000497,1000000016,0010516000161027,Disbursement,2005-06-09T00:00:00.000Z,11752068.97,BEF,2005-06-09T00:00:00.000Z,1000000016 G-B-B-23-,IFAD,MINISTERE DES FINANCES,Money is disbursed through central Ministry of Finance or Treasury,,ML,WCA,1000000016 0010516000161027 Direct Payment/Reimbursement,C01, ,3,1,20,110
1000000016_0010536400161031_12-30-2005-00:00:00_Disbursement,1100000497,1000000016,0010536400161031,Disbursement,2005-12-30T00:00:00.000Z,574405.48,BEF,2005-12-30T00:00:00.000Z,1000000016 G-B-B-23-,IFAD,MINISTERE DES FINANCES,Money is disbursed through central Ministry of Finance or Treasury,,ML,WCA,1000000016 0010536400161031 Direct Payment/Reimbursement,C01, ,3,1,20,110
1000000016_0010036400161008_12-29-2000-00:00:00_Disbursement,1100000497,1000000016,0010036400161008,Disbursement,2000-12-29T00:00:00.000Z,4292041.11,BEF,2000-12-29T00:00:00.000Z,1000000016 G-B-B-23-,IFAD,MINISTERE DES FINANCES,Money is disbursed through central Ministry of Finance or Treasury,,ML,WCA,1000000016 0010036400161008 Direct Payment/Reimbursement,C01, ,3,1,20,110
1000000016_0010432400161020_11-19-2004-00:00:00_Disbursement,1100000497,1000000016,0010432400161020,Disbursement,2004-11-19T00:00:00.000Z,941693.82,BEF,2004-11-19T00:00:00.000Z,1000000016 G-B-B-23-,IFAD,MINISTERE DES FINANCES,Money is disbursed through central Ministry of Finance or Treasury,,ML,WCA,1000000016 0010432400161020 Direct Payment/Reimbursement,C01, ,3,1,20,110
1000000016_0010523800161029_08-26-2005-00:00:00_Disbursement,1100000497,1000000016,0010523800161029,Disbursement,2005-08-26T00:00:00.000Z,317635.97,BEF,2005-08-26T00:00:00.000Z,1000000016 G-B-B-23-,IFAD,MINISTERE DES FINANCES,Money is disbursed through central Ministry of Finance or Treasury,,ML,WCA,1000000016 0010523800161029 Direct Payment/Reimbursement,C01, ,3,1,20,110
1000000016_0010414200161018_05-21-2004-00:00:00_Disbursement,1100000497,1000000016,0010414200161018,Disbursement,2004-05-21T00:00:00.000Z,1376320.34,BEF,2004-05-21T00:00:00.000Z,1000000016 G-B-B-23-,IFAD,MINISTERE DES FINANCES,Money is disbursed through central Ministry of Finance or Treasury,,ML,WCA,1000000016 0010414200161018 Direct Payment/Reimbursement,C01, ,3,1,20,110
1000000016_0019924600161002_09-03-1999-00:00:00_Disbursement,1100000497,1000000016,0019924600161002,Disbursement,1999-09-03T00:00:00.000Z,1387268.59,BEF,1999-09-03T00:00:00.000Z,1000000016 G-B-B-23-,IFAD,MINISTERE DES FINANCES,Money is disbursed through central Ministry of Finance or Treasury,,ML,WCA,1000000016 0019924600161002 Direct Payment/Reimbursement,C01, ,3,1,20,110
1000000016_0010231900161014_11-15-2002-00:00:00_Disbursement,1100000497,1000000016,0010231900161014,Disbursement,2002-11-15T00:00:00.000Z,1603638.1,BEF,2002-11-15T00:00:00.000Z,1000000016 G-B-B-23-,IFAD,MINISTERE DES FINANCES,Money is disbursed through central Ministry of Finance or Treasury,,ML,WCA,1000000016 0010231900161014 Direct Payment/Reimbursement,C01, ,3,1,20,110
1000000016_0019927300161003_09-30-1999-00:00:00_Disbursement,1100000497,1000000016,0019927300161003,Disbursement,1999-09-30T00:00:00.000Z,1374099.63,BEF,1999-09-30T00:00:00.000Z,1000000016 G-B-B-23-,IFAD,MINISTERE DES FINANCES,Money is disbursed through central Ministry of Finance or Treasury,,ML,WCA,1000000016 0019927300161003 Direct Payment/Reimbursement,C01, ,3,1,20,110
1000000016_0019736400161001_12-30-1997-00:00:00_Disbursement,1100000497,1000000016,0019736400161001,Disbursement,1997-12-30T00:00:00.000Z,7413600.0,BEF,1997-12-30T00:00:00.000Z,1000000016 G-B-B-23-,IFAD,MINISTERE DES FINANCES,Money is disbursed through central Ministry of Finance or Treasury,,ML,WCA,1000000016 0019736400161001 Direct Payment/Reimbursement,C01, ,3,1,20,110
1000000016_0010013000161006_05-09-2000-00:00:00_Disbursement,1100000497,1000000016,0010013000161006,Disbursement,2000-05-09T00:00:00.000Z,1496180.67,BEF,2000-05-09T00:00:00.000Z,1000000016 G-B-B-23-,IFAD,MINISTERE DES FINANCES,Money is disbursed through central Ministry of Finance or Treasury,,ML,WCA,1000000016 0010013000161006 Direct Payment/Reimbursement,C01, ,3,1,20,110
1000000016_0010510800161024_04-18-2005-00:00:00_Disbursement,1100000497,1000000016,0010510800161024,Disbursement,2005-04-18T00:00:00.000Z,3354849.23,BEF,2005-04-18T00:00:00.000Z,1000000016 G-B-B-23-,IFAD,MINISTERE DES FINANCES,Money is disbursed through central Ministry of Finance or Treasury,,ML,WCA,1000000016 0010510800161024 Direct Payment/Reimbursement,C01, ,3,1,20,110
1000000016_0010515800161026_06-07-2005-00:00:00_Disbursement,1100000497,1000000016,0010515800161026,Disbursement,2005-06-07T00:00:00.000Z,1886603.13,BEF,2005-06-07T00:00:00.000Z,1000000016 G-B-B-23-,IFAD,MINISTERE DES FINANCES,Money is disbursed through central Ministry of Finance or Treasury,,ML,WCA,1000000016 0010515800161026 Direct Payment/Reimbursement,C01, ,3,1,20,110
1000000016_0010609600161033_04-06-2006-00:00:00_Disbursement,1100000497,1000000016,0010609600161033,Disbursement,2006-04-06T00:00:00.000Z,413560.22,BEF,2006-04-06T00:00:00.000Z,1000000016 G-B-B-23-,IFAD,MINISTERE DES FINANCES,Money is disbursed through central Ministry of Finance or Treasury,,ML,WCA,1000000016 0010609600161033 Direct Payment/Reimbursement,C01, ,3,1,20,110
1000000016_0010414000161017_05-19-2004-00:00:00_Disbursement,1100000497,1000000016,0010414000161017,Disbursement,2004-05-19T00:00:00.000Z,715340.19,BEF,2004-05-19T00:00:00.000Z,1000000016 G-B-B-23-,IFAD,MINISTERE DES FINANCES,Money is disbursed through central Ministry of Finance or Treasury,,ML,WCA,1000000016 0010414000161017 Direct Payment/Reimbursement,C01, ,3,1,20,110
1000000017__12-07-1995-00:00:00_Commitment,1100000492,1000000017,,Commitment,1995-12-07T00:00:00.000Z,86185594.56,BEF,1995-12-07T00:00:00.000Z,1000000017 G-B-B-24-,IFAD,MINISTERE DES FINANCES,Money is disbursed through central Ministry of Finance or Treasury,,AO,ESA,1000000017 GRANTS,C01, ,2,1,20,110
1000000017_0010334600171016_12-12-2003-00:00:00_Disbursement,1100000492,1000000017,0010334600171016,Disbursement,2003-12-12T00:00:00.000Z,4700508.61,BEF,2003-12-12T00:00:00.000Z,1000000017 G-B-B-24-,IFAD,MINISTERE DES FINANCES,Money is disbursed through central Ministry of Finance or Treasury,,AO,ESA,1000000017 0010334600171016 Direct Payment/Reimbursement,C01, ,3,1,20,110
1000000017_0010619300171021_07-12-2006-00:00:00_Disbursement,1100000492,1000000017,0010619300171021,Disbursement,2006-07-12T00:00:00.000Z,1588239.87,BEF,2006-07-12T00:00:00.000Z,1000000017 G-B-B-24-,IFAD,MINISTERE DES FINANCES,Money is disbursed through central Ministry of Finance or Treasury,,AO,ESA,1000000017 0010619300171021 Direct Payment/Reimbursement,C01, ,3,1,20,110
1000000017_0010624300171029_08-31-2006-00:00:00_Disbursement,1100000492,1000000017,0010624300171029,Disbursement,2006-08-31T00:00:00.000Z,298209.22,BEF,2006-08-31T00:00:00.000Z,1000000017 G-B-B-24-,IFAD,MINISTERE DES FINANCES,Money is disbursed through central Ministry of Finance or Treasury,,AO,ESA,1000000017 0010624300171029 Direct Payment/Reimbursement,C01, ,3,1,20,110
1000000017_0019928000171005_10-07-1999-00:00:00_Disbursement,1100000492,1000000017,0019928000171005,Disbursement,1999-10-07T00:00:00.000Z,2599040.0,BEF,1999-10-07T00:00:00.000Z,1000000017 G-B-B-24-,IFAD,MINISTERE DES FINANCES,Money is disbursed through central Ministry of Finance or Treasury,,AO,ESA,1000000017 0019928000171005 Direct Payment/Reimbursement,C01, ,3,1,20,110
1000000017_0010116500171009_06-14-2001-00:00:00_Disbursement,1100000492,1000000017,0010116500171009,Disbursement,2001-06-14T00:00:00.000Z,5038311.48,BEF,2001-06-14T00:00:00.000Z,1000000017 G-B-B-24-,IFAD,MINISTERE DES FINANCES,Money is disbursed through central Ministry of Finance or Treasury,,AO,ESA,1000000017 0010116500171009 Direct Payment/Reimbursement,C01, ,3,1,20,110
1000000017_0019734900171001_12-15-1997-00:00:00_Disbursement,1100000492,1000000017,0019734900171001,Disbursement,1997-12-15T00:00:00.000Z,11014500.0,BEF,1997-12-15T00:00:00.000Z,1000000017 G-B-B-24-,IFAD,MINISTERE DES FINANCES,Money is disbursed through central Ministry of Finance or Treasury,,AO,ESA,1000000017 0019734900171001 Direct Payment/Reimbursement,C01, ,3,1,20,110
1000000017_0019902900171004_01-29-1999-00:00:00_Disbursement,1100000492,1000000017,0019902900171004,Disbursement,1999-01-29T00:00:00.000Z,2414391.0,BEF,1999-01-29T00:00:00.000Z,1000000017 G-B-B-24-,IFAD,MINISTERE DES FINANCES,Money is disbursed through central Ministry of Finance or Treasury,,AO,ESA,1000000017 0019902900171004 Direct Payment/Reimbursement,C01, ,3,1,20,110
1000000017_0010021500171007_08-02-2000-00:00:00_Disbursement,1100000492,1000000017,0010021500171007,Disbursement,2000-08-02T00:00:00.000Z,8678462.0,BEF,2000-08-02T00:00:00.000Z,1000000017 G-B-B-24-,IFAD,MINISTERE DES FINANCES,Money is disbursed through central Ministry of Finance or Treasury,,AO,ESA,1000000017 0010021500171007 Direct Payment/Reimbursement,C01, ,3,1,20,110
1000000017_0010301600171014_01-16-2003-00:00:00_Disbursement,1100000492,1000000017,0010301600171014,Disbursement,2003-01-16T00:00:00.000Z,2203899.57,BEF,2003-01-16T00:00:00.000Z,1000000017 G-B-B-24-,IFAD,MINISTERE DES FINANCES,Money is disbursed through central Ministry of Finance or Treasury,,AO,ESA,1000000017 0010301600171014 Direct Payment/Reimbursement,C01, ,3,1,20,110
1000000017_0010619300171025_07-12-2006-00:00:00_Disbursement,1100000492,1000000017,0010619300171025,Disbursement,2006-07-12T00:00:00.000Z,554901.78,BEF,2006-07-12T00:00:00.000Z,1000000017 G-B-B-24-,IFAD,MINISTERE DES FINANCES,Money is disbursed through central Ministry of Finance or Treasury,,AO,ESA,1000000017 0010619300171025 Direct Payment/Reimbursement,C01, ,3,1,20,110
1000000017_0010619300171022_07-12-2006-00:00:00_Disbursement,1100000492,1000000017,0010619300171022,Disbursement,2006-07-12T00:00:00.000Z,1488199.01,BEF,2006-07-12T00:00:00.000Z,1000000017 G-B-B-24-,IFAD,MINISTERE DES FINANCES,Money is disbursed through central Ministry of Finance or Treasury,,AO,ESA,1000000017 0010619300171022 Direct Payment/Reimbursement,C01, ,3,1,20,110
1000000017_0010407800171017_03-18-2004-00:00:00_Disbursement,1100000492,1000000017,0010407800171017,Disbursement,2004-03-18T00:00:00.000Z,1041044.54,BEF,2004-03-18T00:00:00.000Z,1000000017 G-B-B-24-,IFAD,MINISTERE DES FINANCES,Money is disbursed through central Ministry of Finance or Treasury,,AO,ESA,1000000017 0010407800171017 Direct Payment/Reimbursement,C01, ,3,1,20,110
1000000017_0010130300171012_10-30-2001-00:00:00_Disbursement,1100000492,1000000017,0010130300171012,Disbursement,2001-10-30T00:00:00.000Z,1407816.48,BEF,2001-10-30T00:00:00.000Z,1000000017 G-B-B-24-,IFAD,MINISTERE DES FINANCES,Money is disbursed through central Ministry of Finance or Treasury,,AO,ESA,1000000017 0010130300171012 Direct Payment/Reimbursement,C01, ,3,1,20,110
1000000017_0010619300171026_07-12-2006-00:00:00_Disbursement,1100000492,1000000017,0010619300171026,Disbursement,2006-07-12T00:00:00.000Z,367424.25,BEF,2006-07-12T00:00:00.000Z,1000000017 G-B-B-24-,IFAD,MINISTERE DES FINANCES,Money is disbursed through central Ministry of Finance or Treasury,,AO,ESA,1000000017 0010619300171026 Direct Payment/Reimbursement,C01, ,3,1,20,110
1000000017_0019802800171002_01-28-1998-00:00:00_Disbursement,1100000492,1000000017,0019802800171002,Disbursement,1998-01-28T00:00:00.000Z,2529347.0,BEF,1998-01-28T00:00:00.000Z,1000000017 G-B-B-24-,IFAD,MINISTERE DES FINANCES,Money is disbursed through central Ministry of Finance or Treasury,,AO,ESA,1000000017 0019802800171002 Direct Payment/Reimbursement,C01, ,3,1,20,110
1000000017_0010122800171011_08-16-2001-00:00:00_Disbursement,1100000492,1000000017,0010122800171011,Disbursement,2001-08-16T00:00:00.000Z,5723670.33,BEF,2001-08-16T00:00:00.000Z,1000000017 G-B-B-24-,IFAD,MINISTERE DES FINANCES,Money is disbursed through central Ministry of Finance or Treasury,,AO,ESA,1000000017 0010122800171011 Direct Payment/Reimbursement,C01, ,3,1,20,110
1000000017_0019930200171006_10-29-1999-00:00:00_Disbursement,1100000492,1000000017,0019930200171006,Disbursement,1999-10-29T00:00:00.000Z,3518963.0,BEF,1999-10-29T00:00:00.000Z,1000000017 G-B-B-24-,IFAD,MINISTERE DES FINANCES,Money is disbursed through central Ministry of Finance or Treasury,,AO,ESA,1000000017 0019930200171006 Direct Payment/Reimbursement,C01, ,3,1,20,110
1000000017_0010619300171023_07-12-2006-00:00:00_Disbursement,1100000492,1000000017,0010619300171023,Disbursement,2006-07-12T00:00:00.000Z,397515.78,BEF,2006-07-12T00:00:00.000Z,1000000017 G-B-B-24-,IFAD,MINISTERE DES FINANCES,Money is disbursed through central Ministry of Finance or Treasury,,AO,ESA,1000000017 0010619300171023 Direct Payment/Reimbursement,C01, ,3,1,20,110
1000000017_0010624300171028_08-31-2006-00:00:00_Disbursement,1100000492,1000000017,0010624300171028,Disbursement,2006-08-31T00:00:00.000Z,753370.66,BEF,2006-08-31T00:00:00.000Z,1000000017 G-B-B-24-,IFAD,MINISTERE DES FINANCES,Money is disbursed through central Ministry of Finance or Treasury,,AO,ESA,1000000017 0010624300171028 Direct Payment/Reimbursement,C01, ,3,1,20,110
1000000017_0019818400171003_07-03-1998-00:00:00_Disbursement,1100000492,1000000017,0019818400171003,Disbursement,1998-07-03T00:00:00.000Z,2579156.0,BEF,1998-07-03T00:00:00.000Z,1000000017 G-B-B-24-,IFAD,MINISTERE DES FINANCES,Money is disbursed through central Ministry of Finance or Treasury,,AO,ESA,1000000017 0019818400171003 Direct Payment/Reimbursement,C01, ,3,1,20,110
1000000017_0010513200171019_05-12-2005-00:00:00_Disbursement,1100000492,1000000017,0010513200171019,Disbursement,2005-05-12T00:00:00.000Z,588468.0,BEF,2005-05-12T00:00:00.000Z,1000000017 G-B-B-24-,IFAD,MINISTERE DES FINANCES,Money is disbursed through central Ministry of Finance or Treasury,,AO,ESA,1000000017 0010513200171019 Direct Payment/Reimbursement,C01, ,3,1,20,110
1000000017_0010226600171013_09-23-2002-00:00:00_Disbursement,1100000492,1000000017,0010226600171013,Disbursement,2002-09-23T00:00:00.000Z,12126001.41,BEF,2002-09-23T00:00:00.000Z,1000000017 G-B-B-24-,IFAD,MINISTERE DES FINANCES,Money is disbursed through central Ministry of Finance or Treasury,,AO,ESA,1000000017 0010226600171013 Direct Payment/Reimbursement,C01, ,3,1,20,110
1000000017_0010419600171018_07-14-2004-00:00:00_Disbursement,1100000492,1000000017,0010419600171018,Disbursement,2004-07-14T00:00:00.000Z,2101024.22,BEF,2004-07-14T00:00:00.000Z,1000000017 G-B-B-24-,IFAD,MINISTERE DES FINANCES,Money is disbursed through central Ministry of Finance or Treasury,,AO,ESA,1000000017 0010419600171018 Direct Payment/Reimbursement,C01, ,3,1,20,110
1000000017_0010317100171015_06-20-2003-00:00:00_Disbursement,1100000492,1000000017,0010317100171015,Disbursement,2003-06-20T00:00:00.000Z,1299789.95,BEF,2003-06-20T00:00:00.000Z,1000000017 G-B-B-24-,IFAD,MINISTERE DES FINANCES,Money is disbursed through central Ministry of Finance or Treasury,,AO,ESA,1000000017 0010317100171015 Direct Payment/Reimbursement,C01, ,3,1,20,110
1000000017_0010030500171008_10-31-2000-00:00:00_Disbursement,1100000492,1000000017,0010030500171008,Disbursement,2000-10-31T00:00:00.000Z,10824545.0,BEF,2000-10-31T00:00:00.000Z,1000000017 G-B-B-24-,IFAD,MINISTERE DES FINANCES,Money is disbursed through central Ministry of Finance or Treasury,,AO,ESA,1000000017 0010030500171008 Direct Payment/Reimbursement,C01, ,3,1,20,110
1000000017_0010619300171027_07-12-2006-00:00:00_Disbursement,1100000492,1000000017,0010619300171027,Disbursement,2006-07-12T00:00:00.000Z,348795.4,BEF,2006-07-12T00:00:00.000Z,1000000017 G-B-B-24-,IFAD,MINISTERE DES FINANCES,Money is disbursed through central Ministry of Finance or Treasury,,AO,ESA,1000000017 0010619300171027 Direct Payment/Reimbursement,C01, ,3,1,20,110
1000000018__09-11-1996-00:00:00_Commitment,1100000512,1000000018,,Commitment,1996-09-11T00:00:00.000Z,79647578.31,BEF,1996-09-11T00:00:00.000Z,1000000018 G-B-B-25-,IFAD,MINISTERE DE L'ECONOMIE ET DES FINANCES,Money is disbursed through central Ministry of Finance or Treasury,,BF,WCA,1000000018 GRANTS,C01, ,2,1,20,110
1000000018_0010133100181002_11-27-2001-00:00:00_Disbursement,1100000512,1000000018,0010133100181002,Disbursement,2001-11-27T00:00:00.000Z,1489819.07,BEF,2001-11-27T00:00:00.000Z,1000000018 G-B-B-25-,IFAD,MINISTERE DE L'ECONOMIE ET DES FINANCES,Money is disbursed through central Ministry of Finance or Treasury,,BF,WCA,1000000018 0010133100181002 Direct Payment/Reimbursement,C01, ,3,1,20,110
1000000018_0010433800181007_12-03-2004-00:00:00_Disbursement,1100000512,1000000018,0010433800181007,Disbursement,2004-12-03T00:00:00.000Z,6233109.97,BEF,2004-12-03T00:00:00.000Z,1000000018 G-B-B-25-,IFAD,MINISTERE DE L'ECONOMIE ET DES FINANCES,Money is disbursed through central Ministry of Finance or Treasury,,BF,WCA,1000000018 0010433800181007 Direct Payment/Reimbursement,C01, ,3,1,20,110
1000000018_0010636300181033_12-29-2006-00:00:00_Disbursement,1100000512,1000000018,0010636300181033,Disbursement,2006-12-29T00:00:00.000Z,1573707.91,BEF,2006-12-29T00:00:00.000Z,1000000018 G-B-B-25-,IFAD,MINISTERE DE L'ECONOMIE ET DES FINANCES,Money is disbursed through central Ministry of Finance or Treasury,,BF,WCA,1000000018 0010636300181033 Direct Payment/Reimbursement,C01, ,3,1,20,110
1000000018_0010036400181001_12-29-2000-00:00:00_Disbursement,1100000512,1000000018,0010036400181001,Disbursement,2000-12-29T00:00:00.000Z,6149778.22,BEF,2000-12-29T00:00:00.000Z,1000000018 G-B-B-25-,IFAD,MINISTERE DE L'ECONOMIE ET DES FINANCES,Money is disbursed through central Ministry of Finance or Treasury,,BF,WCA,1000000018 0010036400181001 Direct Payment/Reimbursement,C01, ,3,1,20,110
1000000018_0010718300181043_07-02-2007-00:00:00_Disbursement,1100000512,1000000018,0010718300181043,Disbursement,2007-07-02T00:00:00.000Z,111833.9,BEF,2007-07-02T00:00:00.000Z,1000000018 G-B-B-25-,IFAD,MINISTERE DE L'ECONOMIE ET DES FINANCES,Money is disbursed through central Ministry of Finance or Treasury,,BF,WCA,1000000018 0010718300181043 Direct Payment/Reimbursement,C01, ,3,1,20,110
1000000018_0010716300181041_06-12-2007-00:00:00_Disbursement,1100000512,1000000018,0010716300181041,Disbursement,2007-06-12T00:00:00.000Z,2236551.36,BEF,2007-06-12T00:00:00.000Z,1000000018 G-B-B-25-,IFAD,MINISTERE DE L'ECONOMIE ET DES FINANCES,Money is disbursed through central Ministry of Finance or Treasury,,BF,WCA,1000000018 0010716300181041 Direct Payment/Reimbursement,C01, ,3,1,20,110
1000000018_0010720700181049_07-26-2007-00:00:00_Disbursement,1100000512,1000000018,0010720700181049,Disbursement,2007-07-26T00:00:00.000Z,182340.79,BEF,2007-07-26T00:00:00.000Z,1000000018 G-B-B-25-,IFAD,MINISTERE DE L'ECONOMIE ET DES FINANCES,Money is disbursed through central Ministry of Finance or Treasury,,BF,WCA,1000000018 0010720700181049 Direct Payment/Reimbursement,C01, ,3,1,20,110
1000000018_0010606900181025_03-10-2006-00:00:00_Disbursement,1100000512,1000000018,0010606900181025,Disbursement,2006-03-10T00:00:00.000Z,322863.21,BEF,2006-03-10T00:00:00.000Z,1000000018 G-B-B-25-,IFAD,MINISTERE DE L'ECONOMIE ET DES FINANCES,Money is disbursed through central Ministry of Finance or Treasury,,BF,WCA,1000000018 0010606900181025 Direct Payment/Reimbursement,C01, ,3,1,20,110
1000000018_0010506800181011_03-09-2005-00:00:00_Disbursement,1100000512,1000000018,0010506800181011,Disbursement,2005-03-09T00:00:00.000Z,3257558.67,BEF,2005-03-09T00:00:00.000Z,1000000018 G-B-B-25-,IFAD,MINISTERE DE L'ECONOMIE ET DES FINANCES,Money is disbursed through central Ministry of Finance or Treasury,,BF,WCA,1000000018 0010506800181011 Direct Payment/Reimbursement,C01, ,3,1,20,110
1000000018_0010519600181015_07-15-2005-00:00:00_Disbursement,1100000512,1000000018,0010519600181015,Disbursement,2005-07-15T00:00:00.000Z,1485031.53,BEF,2005-07-15T00:00:00.000Z,1000000018 G-B-B-25-,IFAD,MINISTERE DE L'ECONOMIE ET DES FINANCES,Money is disbursed through central Ministry of Finance or Treasury,,BF,WCA,1000000018 0010519600181015 Direct Payment/Reimbursement,C01, ,3,1,20,110
1000000018_0010601300181020_01-13-2006-00:00:00_Disbursement,1100000512,1000000018,0010601300181020,Disbursement,2006-01-13T00:00:00.000Z,3273207.72,BEF,2006-01-13T00:00:00.000Z,1000000018 G-B-B-25-,IFAD,MINISTERE DE L'ECONOMIE ET DES FINANCES,Money is disbursed through central Ministry of Finance or Treasury,,BF,WCA,1000000018 0010601300181020 Direct Payment/Reimbursement,C01, ,3,1,20,110
1000000018_0010703600181037_02-05-2007-00:00:00_Disbursement,1100000512,1000000018,0010703600181037,Disbursement,2007-02-05T00:00:00.000Z,1322673.92,BEF,2007-02-05T00:00:00.000Z,1000000018 G-B-B-25-,IFAD,MINISTERE DE L'ECONOMIE ET DES FINANCES,Money is disbursed through central Ministry of Finance or Treasury,,BF,WCA,1000000018 0010703600181037 Direct Payment/Reimbursement,C01, ,3,1,20,110
1000000018_0010727500181052_10-02-2007-00:00:00_Disbursement,1100000512,1000000018,0010727500181052,Disbursement,2007-10-02T00:00:00.000Z,1297357.0,BEF,2007-10-02T00:00:00.000Z,1000000018 G-B-B-25-,IFAD,MINISTERE DE L'ECONOMIE ET DES FINANCES,Money is disbursed through central Ministry of Finance or Treasury,,BF,WCA,1000000018 0010727500181052 Direct Payment/Reimbursement,C01, ,3,1,20,110
1000000018_0010623700181032_08-25-2006-00:00:00_Disbursement,1100000512,1000000018,0010623700181032,Disbursement,2006-08-25T00:00:00.000Z,266552.75,BEF,2006-08-25T00:00:00.000Z,1000000018 G-B-B-25-,IFAD,MINISTERE DE L'ECONOMIE ET DES FINANCES,Money is disbursed through central Ministry of Finance or Treasury,,BF,WCA,1000000018 0010623700181032 Direct Payment/Reimbursement,C01, ,3,1,20,110
1000000018_0010703200181036_02-01-2007-00:00:00_Disbursement,1100000512,1000000018,0010703200181036,Disbursement,2007-02-01T00:00:00.000Z,1850413.4,BEF,2007-02-01T00:00:00.000Z,1000000018 G-B-B-25-,IFAD,MINISTERE DE L'ECONOMIE ET DES FINANCES,Money is disbursed through central Ministry of Finance or Treasury,,BF,WCA,1000000018 0010703200181036 Direct Payment/Reimbursement,C01, ,3,1,20,110
1000000018_0010326800181005_09-25-2003-00:00:00_Disbursement,1100000512,1000000018,0010326800181005,Disbursement,2003-09-25T00:00:00.000Z,1561908.89,BEF,2003-09-25T00:00:00.000Z,1000000018 G-B-B-25-,IFAD,MINISTERE DE L'ECONOMIE ET DES FINANCES,Money is disbursed through central Ministry of Finance or Treasury,,BF,WCA,1000000018 0010326800181005 Direct Payment/Reimbursement,C01, ,3,1,20,110
1000000018_0010601300181021_01-13-2006-00:00:00_Disbursement,1100000512,1000000018,0010601300181021,Disbursement,2006-01-13T00:00:00.000Z,3635640.75,BEF,2006-01-13T00:00:00.000Z,1000000018 G-B-B-25-,IFAD,MINISTERE DE L'ECONOMIE ET DES FINANCES,Money is disbursed through central Ministry of Finance or Treasury,,BF,WCA,1000000018 0010601300181021 Direct Payment/Reimbursement,C01, ,3,1,20,110
1000000018_0010514500181012_05-25-2005-00:00:00_Disbursement,1100000512,1000000018,0010514500181012,Disbursement,2005-05-25T00:00:00.000Z,4944141.65,BEF,2005-05-25T00:00:00.000Z,1000000018 G-B-B-25-,IFAD,MINISTERE DE L'ECONOMIE ET DES FINANCES,Money is disbursed through central Ministry of Finance or Treasury,,BF,WCA,1000000018 0010514500181012 Direct Payment/Reimbursement,C01, ,3,1,20,110
1000000018_0010606900181024_03-10-2006-00:00:00_Disbursement,1100000512,1000000018,0010606900181024,Disbursement,2006-03-10T00:00:00.000Z,390072.71,BEF,2006-03-10T00:00:00.000Z,1000000018 G-B-B-25-,IFAD,MINISTERE DE L'ECONOMIE ET DES FINANCES,Money is disbursed through central Ministry of Finance or Treasury,,BF,WCA,1000000018 0010606900181024 Direct Payment/Reimbursement,C01, ,3,1,20,110
1000000018_0010712200181040_05-02-2007-00:00:00_Disbursement,1100000512,1000000018,0010712200181040,Disbursement,2007-05-02T00:00:00.000Z,396045.84,BEF,2007-05-02T00:00:00.000Z,1000000018 G-B-B-25-,IFAD,MINISTERE DE L'ECONOMIE ET DES FINANCES,Money is disbursed through central Ministry of Finance or Treasury,,BF,WCA,1000000018 0010712200181040 Direct Payment/Reimbursement,C01, ,3,1,20,110
1000000018_0010608900181026_03-30-2006-00:00:00_Disbursement,1100000512,1000000018,0010608900181026,Disbursement,2006-03-30T00:00:00.000Z,1397658.94,BEF,2006-03-30T00:00:00.000Z,1000000018 G-B-B-25-,IFAD,MINISTERE DE L'ECONOMIE ET DES FINANCES,Money is disbursed through central Ministry of Finance or Treasury,,BF,WCA,1000000018 0010608900181026 Direct Payment/Reimbursement,C01, ,3,1,20,110
1000000018_0010701900181038_01-19-2007-00:00:00_Disbursement,1100000512,1000000018,0010701900181038,Disbursement,2007-01-19T00:00:00.000Z,338237.96,BEF,2007-01-19T00:00:00.000Z,1000000018 G-B-B-25-,IFAD,MINISTERE DE L'ECONOMIE ET DES FINANCES,Money is disbursed through central Ministry of Finance or Treasury,,BF,WCA,1000000018 0010701900181038 Direct Payment/Reimbursement,C01, ,3,1,20,110
1000000018_0010515300181013_06-02-2005-00:00:00_Disbursement,1100000512,1000000018,0010515300181013,Disbursement,2005-06-02T00:00:00.000Z,1324848.64,BEF,2005-06-02T00:00:00.000Z,1000000018 G-B-B-25-,IFAD,MINISTERE DE L'ECONOMIE ET DES FINANCES,Money is disbursed through central Ministry of Finance or Treasury,,BF,WCA,1000000018 0010515300181013 Direct Payment/Reimbursement,C01, ,3,1,20,110
1000000018_0010618800181028_07-07-2006-00:00:00_Disbursement,1100000512,1000000018,0010618800181028,Disbursement,2006-07-07T00:00:00.000Z,2129744.62,BEF,2006-07-07T00:00:00.000Z,1000000018 G-B-B-25-,IFAD,MINISTERE DE L'ECONOMIE ET DES FINANCES,Money is disbursed through central Ministry of Finance or Treasury,,BF,WCA,1000000018 0010618800181028 Direct Payment/Reimbursement,C01, ,3,1,20,110
1000000018_0010609600181027_04-06-2006-00:00:00_Disbursement,1100000512,1000000018,0010609600181027,Disbursement,2006-04-06T00:00:00.000Z,1775435.64,BEF,2006-04-06T00:00:00.000Z,1000000018 G-B-B-25-,IFAD,MINISTERE DE L'ECONOMIE ET DES FINANCES,Money is disbursed through central Ministry of Finance or Treasury,,BF,WCA,1000000018 0010609600181027 Direct Payment/Reimbursement,C01, ,3,1,20,110
1000000018_0010702400181035_01-24-2007-00:00:00_Disbursement,1100000512,1000000018,0010702400181035,Disbursement,2007-01-24T00:00:00.000Z,3661901.62,BEF,2007-01-24T00:00:00.000Z,1000000018 G-B-B-25-,IFAD,MINISTERE DE L'ECONOMIE ET DES FINANCES,Money is disbursed through central Ministry of Finance or Treasury,,BF,WCA,1000000018 0010702400181035 Direct Payment/Reimbursement,C01, ,3,1,20,110
1000000018_0010720700181047_07-26-2007-00:00:00_Disbursement,1100000512,1000000018,0010720700181047,Disbursement,2007-07-26T00:00:00.000Z,132835.26,BEF,2007-07-26T00:00:00.000Z,1000000018 G-B-B-25-,IFAD,MINISTERE DE L'ECONOMIE ET DES FINANCES,Money is disbursed through central Ministry of Finance or Treasury,,BF,WCA,1000000018 0010720700181047 Direct Payment/Reimbursement,C01, ,3,1,20,110
1000000018_0010501300181008_01-13-2005-00:00:00_Disbursement,1100000512,1000000018,0010501300181008,Disbursement,2005-01-13T00:00:00.000Z,2720046.85,BEF,2005-01-13T00:00:00.000Z,1000000018 G-B-B-25-,IFAD,MINISTERE DE L'ECONOMIE ET DES FINANCES,Money is disbursed through central Ministry of Finance or Treasury,,BF,WCA,1000000018 0010501300181008 Direct Payment/Reimbursement,C01, ,3,1,20,110
1000000018_0010503400181010_02-03-2005-00:00:00_Disbursement,1100000512,1000000018,0010503400181010,Disbursement,2005-02-03T00:00:00.000Z,501237.78,BEF,2005-02-03T00:00:00.000Z,1000000018 G-B-B-25-,IFAD,MINISTERE DE L'ECONOMIE ET DES FINANCES,Money is disbursed through central Ministry of Finance or Treasury,,BF,WCA,1000000018 0010503400181010 Direct Payment/Reimbursement,C01, ,3,1,20,110
1000000018_0010519600181014_07-15-2005-00:00:00_Disbursement,1100000512,1000000018,0010519600181014,Disbursement,2005-07-15T00:00:00.000Z,1759563.1,BEF,2005-07-15T00:00:00.000Z,1000000018 G-B-B-25-,IFAD,MINISTERE DE L'ECONOMIE ET DES FINANCES,Money is disbursed through central Ministry of Finance or Treasury,,BF,WCA,1000000018 0010519600181014 Direct Payment/Reimbursement,C01, ,3,1,20,110
1000000018_0010501400181009_01-14-2005-00:00:00_Disbursement,1100000512,1000000018,0010501400181009,Disbursement,2005-01-14T00:00:00.000Z,2176343.66,BEF,2005-01-14T00:00:00.000Z,1000000018 G-B-B-25-,IFAD,MINISTERE DE L'ECONOMIE ET DES FINANCES,Money is disbursed through central Ministry of Finance or Treasury,,BF,WCA,1000000018 0010501400181009 Direct Payment/Reimbursement,C01, ,3,1,20,110
1000000018_0010719200181046_07-11-2007-00:00:00_Disbursement,1100000512,1000000018,0010719200181046,Disbursement,2007-07-11T00:00:00.000Z,166043.87,BEF,2007-07-11T00:00:00.000Z,1000000018 G-B-B-25-,IFAD,MINISTERE DE L'ECONOMIE ET DES FINANCES,Money is disbursed through central Ministry of Finance or Treasury,,BF,WCA,1000000018 0010719200181046 Direct Payment/Reimbursement,C01, ,3,1,20,110
1000000018_0010521300181017_08-01-2005-00:00:00_Disbursement,1100000512,1000000018,0010521300181017,Disbursement,2005-08-01T00:00:00.000Z,725412.25,BEF,2005-08-01T00:00:00.000Z,1000000018 G-B-B-25-,IFAD,MINISTERE DE L'ECONOMIE ET DES FINANCES,Money is disbursed through central Ministry of Finance or Treasury,,BF,WCA,1000000018 0010521300181017 Direct Payment/Reimbursement,C01, ,3,1,20,110
1000000018_0010523800181018_08-26-2005-00:00:00_Disbursement,1100000512,1000000018,0010523800181018,Disbursement,2005-08-26T00:00:00.000Z,256191.85,BEF,2005-08-26T00:00:00.000Z,1000000018 G-B-B-25-,IFAD,MINISTERE DE L'ECONOMIE ET DES FINANCES,Money is disbursed through central Ministry of Finance or Treasury,,BF,WCA,1000000018 0010523800181018 Direct Payment/Reimbursement,C01, ,3,1,20,110
1000000018_0010720700181048_07-26-2007-00:00:00_Disbursement,1100000512,1000000018,0010720700181048,Disbursement,2007-07-26T00:00:00.000Z,108343.29,BEF,2007-07-26T00:00:00.000Z,1000000018 G-B-B-25-,IFAD,MINISTERE DE L'ECONOMIE ET DES FINANCES,Money is disbursed through central Ministry of Finance or Treasury,,BF,WCA,1000000018 0010720700181048 Direct Payment/Reimbursement,C01, ,3,1,20,110
1000000018_0010428900181006_10-15-2004-00:00:00_Disbursement,1100000512,1000000018,0010428900181006,Disbursement,2004-10-15T00:00:00.000Z,2385549.6,BEF,2004-10-15T00:00:00.000Z,1000000018 G-B-B-25-,IFAD,MINISTERE DE L'ECONOMIE ET DES FINANCES,Money is disbursed through central Ministry of Finance or Treasury,,BF,WCA,1000000018 0010428900181006 Direct Payment/Reimbursement,C01, ,3,1,20,110
1000000018_0010535000181019_12-16-2005-00:00:00_Disbursement,1100000512,1000000018,0010535000181019,Disbursement,2005-12-16T00:00:00.000Z,1299593.85,BEF,2005-12-16T00:00:00.000Z,1000000018 G-B-B-25-,IFAD,MINISTERE DE L'ECONOMIE ET DES FINANCES,Money is disbursed through central Ministry of Finance or Treasury,,BF,WCA,1000000018 0010535000181019 Direct Payment/Reimbursement,C01, ,3,1,20,110
1000000018_0010620000181030_07-19-2006-00:00:00_Disbursement,1100000512,1000000018,0010620000181030,Disbursement,2006-07-19T00:00:00.000Z,64685.84,BEF,2006-07-19T00:00:00.000Z,1000000018 G-B-B-25-,IFAD,MINISTERE DE L'ECONOMIE ET DES FINANCES,Money is disbursed through central Ministry of Finance or Treasury,,BF,WCA,1000000018 0010620000181030 Direct Payment/Reimbursement,C01, ,3,1,20,110
1000000018_0010304100181004_02-10-2003-00:00:00_Disbursement,1100000512,1000000018,0010304100181004,Disbursement,2003-02-10T00:00:00.000Z,1733803.25,BEF,2003-02-10T00:00:00.000Z,1000000018 G-B-B-25-,IFAD,MINISTERE DE L'ECONOMIE ET DES FINANCES,Money is disbursed through central Ministry of Finance or Treasury,,BF,WCA,1000000018 0010304100181004 Direct Payment/Reimbursement,C01, ,3,1,20,110
1000000018_0010621300181031_08-01-2006-00:00:00_Disbursement,1100000512,1000000018,0010621300181031,Disbursement,2006-08-01T00:00:00.000Z,988235.58,BEF,2006-08-01T00:00:00.000Z,1000000018 G-B-B-25-,IFAD,MINISTERE DE L'ECONOMIE ET DES FINANCES,Money is disbursed through central Ministry of Finance or Treasury,,BF,WCA,1000000018 0010621300181031 Direct Payment/Reimbursement,C01, ,3,1,20,110
1000000018_0010705200181039_02-21-2007-00:00:00_Disbursement,1100000512,1000000018,0010705200181039,Disbursement,2007-02-21T00:00:00.000Z,1191457.91,BEF,2007-02-21T00:00:00.000Z,1000000018 G-B-B-25-,IFAD,MINISTERE DE L'ECONOMIE ET DES FINANCES,Money is disbursed through central Ministry of Finance or Treasury,,BF,WCA,1000000018 0010705200181039 Direct Payment/Reimbursement,C01, ,3,1,20,110
1000000018_0010720700181050_07-26-2007-00:00:00_Disbursement,1100000512,1000000018,0010720700181050,Disbursement,2007-07-26T00:00:00.000Z,109958.1,BEF,2007-07-26T00:00:00.000Z,1000000018 G-B-B-25-,IFAD,MINISTERE DE L'ECONOMIE ET DES FINANCES,Money is disbursed through central Ministry of Finance or Treasury,,BF,WCA,1000000018 0010720700181050 Direct Payment/Reimbursement,C01, ,3,1,20,110
1000000018_0010601300181022_01-13-2006-00:00:00_Disbursement,1100000512,1000000018,0010601300181022,Disbursement,2006-01-13T00:00:00.000Z,995441.49,BEF,2006-01-13T00:00:00.000Z,1000000018 G-B-B-25-,IFAD,MINISTERE DE L'ECONOMIE ET DES FINANCES,Money is disbursed through central Ministry of Finance or Treasury,,BF,WCA,1000000018 0010601300181022 Direct Payment/Reimbursement,C01, ,3,1,20,110
1000000018_0010219900181003_07-18-2002-00:00:00_Disbursement,1100000512,1000000018,0010219900181003,Disbursement,2002-07-18T00:00:00.000Z,486702.2,BEF,2002-07-18T00:00:00.000Z,1000000018 G-B-B-25-,IFAD,MINISTERE DE L'ECONOMIE ET DES FINANCES,Money is disbursed through central Ministry of Finance or Treasury,,BF,WCA,1000000018 0010219900181003 Direct Payment/Reimbursement,C01, ,3,1,20,110
1000000018_0010722000181051_08-08-2007-00:00:00_Disbursement,1100000512,1000000018,0010722000181051,Disbursement,2007-08-08T00:00:00.000Z,3623229.37,BEF,2007-08-08T00:00:00.000Z,1000000018 G-B-B-25-,IFAD,MINISTERE DE L'ECONOMIE ET DES FINANCES,Money is disbursed through central Ministry of Finance or Treasury,,BF,WCA,1000000018 0010722000181051 Direct Payment/Reimbursement,C01, ,3,1,20,110
1000000018_0010606900181023_03-10-2006-00:00:00_Disbursement,1100000512,1000000018,0010606900181023,Disbursement,2006-03-10T00:00:00.000Z,384360.99,BEF,2006-03-10T00:00:00.000Z,1000000018 G-B-B-25-,IFAD,MINISTERE DE L'ECONOMIE ET DES FINANCES,Money is disbursed through central Ministry of Finance or Treasury,,BF,WCA,1000000018 0010606900181023 Direct Payment/Reimbursement,C01, ,3,1,20,110
1000000018_0010719100181045_07-10-2007-00:00:00_Disbursement,1100000512,1000000018,0010719100181045,Disbursement,2007-07-10T00:00:00.000Z,70107.52,BEF,2007-07-10T00:00:00.000Z,1000000018 G-B-B-25-,IFAD,MINISTERE DE L'ECONOMIE ET DES FINANCES,Money is disbursed through central Ministry of Finance or Treasury,,BF,WCA,1000000018 0010719100181045 Direct Payment/Reimbursement,C01, ,3,1,20,110
1000000018_0010719100181044_07-10-2007-00:00:00_Disbursement,1100000512,1000000018,0010719100181044,Disbursement,2007-07-10T00:00:00.000Z,388666.06,BEF,2007-07-10T00:00:00.000Z,1000000018 G-B-B-25-,IFAD,MINISTERE DE L'ECONOMIE ET DES FINANCES,Money is disbursed through central Ministry of Finance or Treasury,,BF,WCA,1000000018 0010719100181044 Direct Payment/Reimbursement,C01, ,3,1,20,110
1000000018_0010519900181016_07-18-2005-00:00:00_Disbursement,1100000512,1000000018,0010519900181016,Disbursement,2005-07-18T00:00:00.000Z,2241640.64,BEF,2005-07-18T00:00:00.000Z,1000000018 G-B-B-25-,IFAD,MINISTERE DE L'ECONOMIE ET DES FINANCES,Money is disbursed through central Ministry of Finance or Treasury,,BF,WCA,1000000018 0010519900181016 Direct Payment/Reimbursement,C01, ,3,1,20,110
1000000018_0010619300181029_07-12-2006-00:00:00_Disbursement,1100000512,1000000018,0010619300181029,Disbursement,2006-07-12T00:00:00.000Z,611638.4,BEF,2006-07-12T00:00:00.000Z,1000000018 G-B-B-25-,IFAD,MINISTERE DE L'ECONOMIE ET DES FINANCES,Money is disbursed through central Ministry of Finance or Treasury,,BF,WCA,1000000018 0010619300181029 Direct Payment/Reimbursement,C01, ,3,1,20,110
1000000018_0010716300181042_06-12-2007-00:00:00_Disbursement,1100000512,1000000018,0010716300181042,Disbursement,2007-06-12T00:00:00.000Z,1918052.92,BEF,2007-06-12T00:00:00.000Z,1000000018 G-B-B-25-,IFAD,MINISTERE DE L'ECONOMIE ET DES FINANCES,Money is disbursed through central Ministry of Finance or Treasury,,BF,WCA,1000000018 0010716300181042 Direct Payment/Reimbursement,C01, ,3,1,20,110
1000000019__12-04-1996-00:00:00_Commitment,1100001006,1000000019,,Commitment,1996-12-04T00:00:00.000Z,78214508.09,BEF,1996-12-04T00:00:00.000Z,1000000019 G-B-B-26-,IFAD,"MINISTRY OF FINANCE, PERMANENT SECRETARY",Money is disbursed through central Ministry of Finance or Treasury,,TZ,ESA,1000000019 GRANTS,C01, ,2,1,20,110
1000000019_0019901500191005_01-15-1999-00:00:00_Disbursement,1100001006,1000000019,0019901500191005,Disbursement,1999-01-15T00:00:00.000Z,2204680.0,BEF,1999-01-15T00:00:00.000Z,1000000019 G-B-B-26-,IFAD,"MINISTRY OF FINANCE, PERMANENT SECRETARY",Money is disbursed through central Ministry of Finance or Treasury,,TZ,ESA,1000000019 0019901500191005 Direct Payment/Reimbursement,C01, ,3,1,20,110
1000000019_0019933300191015_11-29-1999-00:00:00_Disbursement,1100001006,1000000019,0019933300191015,Disbursement,1999-11-29T00:00:00.000Z,2628431.0,BEF,1999-11-29T00:00:00.000Z,1000000019 G-B-B-26-,IFAD,"MINISTRY OF FINANCE, PERMANENT SECRETARY",Money is disbursed through central Ministry of Finance or Treasury,,TZ,ESA,1000000019 0019933300191015 Direct Payment/Reimbursement,C01, ,3,1,20,110
1000000019_0019917300191011_06-22-1999-00:00:00_Disbursement,1100001006,1000000019,0019917300191011,Disbursement,1999-06-22T00:00:00.000Z,1231410.0,BEF,1999-06-22T00:00:00.000Z,1000000019 G-B-B-26-,IFAD,"MINISTRY OF FINANCE, PERMANENT SECRETARY",Money is disbursed through central Ministry of Finance or Treasury,,TZ,ESA,1000000019 0019917300191011 Direct Payment/Reimbursement,C01, ,3,1,20,110
1000000019_0019827100191003_09-28-1998-00:00:00_Disbursement,1100001006,1000000019,0019827100191003,Disbursement,1998-09-28T00:00:00.000Z,207666.0,BEF,1998-09-28T00:00:00.000Z,1000000019 G-B-B-26-,IFAD,"MINISTRY OF FINANCE, PERMANENT SECRETARY",Money is disbursed through central Ministry of Finance or Treasury,,TZ,ESA,1000000019 0019827100191003 Direct Payment/Reimbursement,C01, ,3,1,20,110
1000000019_0010005300191016_02-22-2000-00:00:00_Disbursement,1100001006,1000000019,0010005300191016,Disbursement,2000-02-22T00:00:00.000Z,2280415.0,BEF,2000-02-22T00:00:00.000Z,1000000019 G-B-B-26-,IFAD,"MINISTRY OF FINANCE, PERMANENT SECRETARY",Money is disbursed through central Ministry of Finance or Treasury,,TZ,ESA,1000000019 0010005300191016 Direct Payment/Reimbursement,C01, ,3,1,20,110
1000000019_0010312700191030_05-07-2003-00:00:00_Disbursement,1100001006,1000000019,0010312700191030,Disbursement,2003-05-07T00:00:00.000Z,1418185.63,BEF,2003-05-07T00:00:00.000Z,1000000019 G-B-B-26-,IFAD,"MINISTRY OF FINANCE, PERMANENT SECRETARY",Money is disbursed through central Ministry of Finance or Treasury,,TZ,ESA,1000000019 0010312700191030 Direct Payment/Reimbursement,C01, ,3,1,20,110
1000000019_0019912700191008_05-07-1999-00:00:00_Disbursement,1100001006,1000000019,0019912700191008,Disbursement,1999-05-07T00:00:00.000Z,4703857.0,BEF,1999-05-07T00:00:00.000Z,1000000019 G-B-B-26-,IFAD,"MINISTRY OF FINANCE, PERMANENT SECRETARY",Money is disbursed through central Ministry of Finance or Treasury,,TZ,ESA,1000000019 0019912700191008 Direct Payment/Reimbursement,C01, ,3,1,20,110
1000000019_0010510400191033_04-14-2005-00:00:00_Disbursement,1100001006,1000000019,0010510400191033,Disbursement,2005-04-14T00:00:00.000Z,1415986.85,BEF,2005-04-14T00:00:00.000Z,1000000019 G-B-B-26-,IFAD,"MINISTRY OF FINANCE, PERMANENT SECRETARY",Money is disbursed through central Ministry of Finance or Treasury,,TZ,ESA,1000000019 0010510400191033 Direct Payment/Reimbursement,C01, ,3,1,20,110
1000000019_0010115800191026_06-07-2001-00:00:00_Disbursement,1100001006,1000000019,0010115800191026,Disbursement,2001-06-07T00:00:00.000Z,2914319.53,BEF,2001-06-07T00:00:00.000Z,1000000019 G-B-B-26-,IFAD,"MINISTRY OF FINANCE, PERMANENT SECRETARY",Money is disbursed through central Ministry of Finance or Treasury,,TZ,ESA,1000000019 0010115800191026 Direct Payment/Reimbursement,C01, ,3,1,20,110
1000000019_0019911800191009_04-28-1999-00:00:00_Disbursement,1100001006,1000000019,0019911800191009,Disbursement,1999-04-28T00:00:00.000Z,3377318.0,BEF,1999-04-28T00:00:00.000Z,1000000019 G-B-B-26-,IFAD,"MINISTRY OF FINANCE, PERMANENT SECRETARY",Money is disbursed through central Ministry of Finance or Treasury,,TZ,ESA,1000000019 0019911800191009 Direct Payment/Reimbursement,C01, ,3,1,20,110
1000000019_0019916100191010_06-10-1999-00:00:00_Disbursement,1100001006,1000000019,0019916100191010,Disbursement,1999-06-10T00:00:00.000Z,1577429.0,BEF,1999-06-10T00:00:00.000Z,1000000019 G-B-B-26-,IFAD,"MINISTRY OF FINANCE, PERMANENT SECRETARY",Money is disbursed through central Ministry of Finance or Treasury,,TZ,ESA,1000000019 0019916100191010 Direct Payment/Reimbursement,C01, ,3,1,20,110
1000000019_0010221100191029_07-30-2002-00:00:00_Disbursement,1100001006,1000000019,0010221100191029,Disbursement,2002-07-30T00:00:00.000Z,424816.13,BEF,2002-07-30T00:00:00.000Z,1000000019 G-B-B-26-,IFAD,"MINISTRY OF FINANCE, PERMANENT SECRETARY",Money is disbursed through central Ministry of Finance or Treasury,,TZ,ESA,1000000019 0010221100191029 Direct Payment/Reimbursement,C01, ,3,1,20,110
1000000019_0010106100191024_03-02-2001-00:00:00_Disbursement,1100001006,1000000019,0010106100191024,Disbursement,2001-03-02T00:00:00.000Z,2058785.9,BEF,2001-03-02T00:00:00.000Z,1000000019 G-B-B-26-,IFAD,"MINISTRY OF FINANCE, PERMANENT SECRETARY",Money is disbursed through central Ministry of Finance or Treasury,,TZ,ESA,1000000019 0010106100191024 Direct Payment/Reimbursement,C01, ,3,1,20,110
1000000019_0010027800191021_10-04-2000-00:00:00_Disbursement,1100001006,1000000019,0010027800191021,Disbursement,2000-10-04T00:00:00.000Z,6552546.0,BEF,2000-10-04T00:00:00.000Z,1000000019 G-B-B-26-,IFAD,"MINISTRY OF FINANCE, PERMANENT SECRETARY",Money is disbursed through central Ministry of Finance or Treasury,,TZ,ESA,1000000019 0010027800191021 Direct Payment/Reimbursement,C01, ,3,1,20,110
1000000019_0019832300191004_11-19-1998-00:00:00_Disbursement,1100001006,1000000019,0019832300191004,Disbursement,1998-11-19T00:00:00.000Z,922043.0,BEF,1998-11-19T00:00:00.000Z,1000000019 G-B-B-26-,IFAD,"MINISTRY OF FINANCE, PERMANENT SECRETARY",Money is disbursed through central Ministry of Finance or Treasury,,TZ,ESA,1000000019 0019832300191004 Direct Payment/Reimbursement,C01, ,3,1,20,110
1000000019_0010027900191020_10-05-2000-00:00:00_Disbursement,1100001006,1000000019,0010027900191020,Disbursement,2000-10-05T00:00:00.000Z,3556250.0,BEF,2000-10-05T00:00:00.000Z,1000000019 G-B-B-26-,IFAD,"MINISTRY OF FINANCE, PERMANENT SECRETARY",Money is disbursed through central Ministry of Finance or Treasury,,TZ,ESA,1000000019 0010027900191020 Direct Payment/Reimbursement,C01, ,3,1,20,110
1000000019_0010409300191032_04-02-2004-00:00:00_Disbursement,1100001006,1000000019,0010409300191032,Disbursement,2004-04-02T00:00:00.000Z,858444.77,BEF,2004-04-02T00:00:00.000Z,1000000019 G-B-B-26-,IFAD,"MINISTRY OF FINANCE, PERMANENT SECRETARY",Money is disbursed through central Ministry of Finance or Treasury,,TZ,ESA,1000000019 0010409300191032 Direct Payment/Reimbursement,C01, ,3,1,20,110
1000000019_0010211900191028_04-29-2002-00:00:00_Disbursement,1100001006,1000000019,0010211900191028,Disbursement,2002-04-29T00:00:00.000Z,858953.75,BEF,2002-04-29T00:00:00.000Z,1000000019 G-B-B-26-,IFAD,"MINISTRY OF FINANCE, PERMANENT SECRETARY",Money is disbursed through central Ministry of Finance or Treasury,,TZ,ESA,1000000019 0010211900191028 Direct Payment/Reimbursement,C01, ,3,1,20,110
1000000019_0019921600191012_08-04-1999-00:00:00_Disbursement,1100001006,1000000019,0019921600191012,Disbursement,1999-08-04T00:00:00.000Z,3913885.0,BEF,1999-08-04T00:00:00.000Z,1000000019 G-B-B-26-,IFAD,"MINISTRY OF FINANCE, PERMANENT SECRETARY",Money is disbursed through central Ministry of Finance or Treasury,,TZ,ESA,1000000019 0019921600191012 Direct Payment/Reimbursement,C01, ,3,1,20,110
1000000019_0019928600191014_10-13-1999-00:00:00_Disbursement,1100001006,1000000019,0019928600191014,Disbursement,1999-10-13T00:00:00.000Z,494931.0,BEF,1999-10-13T00:00:00.000Z,1000000019 G-B-B-26-,IFAD,"MINISTRY OF FINANCE, PERMANENT SECRETARY",Money is disbursed through central Ministry of Finance or Treasury,,TZ,ESA,1000000019 0019928600191014 Direct Payment/Reimbursement,C01, ,3,1,20,110
1000000019_0010122800191027_08-16-2001-00:00:00_Disbursement,1100001006,1000000019,0010122800191027,Disbursement,2001-08-16T00:00:00.000Z,1784977.46,BEF,2001-08-16T00:00:00.000Z,1000000019 G-B-B-26-,IFAD,"MINISTRY OF FINANCE, PERMANENT SECRETARY",Money is disbursed through central Ministry of Finance or Treasury,,TZ,ESA,1000000019 0010122800191027 Direct Payment/Reimbursement,C01, ,3,1,20,110
1000000019_0019903400191006_02-03-1999-00:00:00_Disbursement,1100001006,1000000019,0019903400191006,Disbursement,1999-02-03T00:00:00.000Z,6473960.0,BEF,1999-02-03T00:00:00.000Z,1000000019 G-B-B-26-,IFAD,"MINISTRY OF FINANCE, PERMANENT SECRETARY",Money is disbursed through central Ministry of Finance or Treasury,,TZ,ESA,1000000019 0019903400191006 Direct Payment/Reimbursement,C01, ,3,1,20,110
1000000019_0019732300191001_11-19-1997-00:00:00_Disbursement,1100001006,1000000019,0019732300191001,Disbursement,1997-11-19T00:00:00.000Z,7192900.0,BEF,1997-11-19T00:00:00.000Z,1000000019 G-B-B-26-,IFAD,"MINISTRY OF FINANCE, PERMANENT SECRETARY",Money is disbursed through central Ministry of Finance or Treasury,,TZ,ESA,1000000019 0019732300191001 Direct Payment/Reimbursement,C01, ,3,1,20,110
1000000019_0010407700191031_03-17-2004-00:00:00_Disbursement,1100001006,1000000019,0010407700191031,Disbursement,2004-03-17T00:00:00.000Z,3253676.76,BEF,2004-03-17T00:00:00.000Z,1000000019 G-B-B-26-,IFAD,"MINISTRY OF FINANCE, PERMANENT SECRETARY",Money is disbursed through central Ministry of Finance or Treasury,,TZ,ESA,1000000019 0010407700191031 Direct Payment/Reimbursement,C01, ,3,1,20,110
1000000019_0019911800191007_04-28-1999-00:00:00_Disbursement,1100001006,1000000019,0019911800191007,Disbursement,1999-04-28T00:00:00.000Z,1972737.0,BEF,1999-04-28T00:00:00.000Z,1000000019 G-B-B-26-,IFAD,"MINISTRY OF FINANCE, PERMANENT SECRETARY",Money is disbursed through central Ministry of Finance or Treasury,,TZ,ESA,1000000019 0019911800191007 Direct Payment/Reimbursement,C01, ,3,1,20,110
1000000019_0010020800191019_07-26-2000-00:00:00_Disbursement,1100001006,1000000019,0010020800191019,Disbursement,2000-07-26T00:00:00.000Z,823967.0,BEF,2000-07-26T00:00:00.000Z,1000000019 G-B-B-26-,IFAD,"MINISTRY OF FINANCE, PERMANENT SECRETARY",Money is disbursed through central Ministry of Finance or Treasury,,TZ,ESA,1000000019 0010020800191019 Direct Payment/Reimbursement,C01, ,3,1,20,110
1000000019_0010015800191018_06-06-2000-00:00:00_Disbursement,1100001006,1000000019,0010015800191018,Disbursement,2000-06-06T00:00:00.000Z,4088413.0,BEF,2000-06-06T00:00:00.000Z,1000000019 G-B-B-26-,IFAD,"MINISTRY OF FINANCE, PERMANENT SECRETARY",Money is disbursed through central Ministry of Finance or Treasury,,TZ,ESA,1000000019 0010015800191018 Direct Payment/Reimbursement,C01, ,3,1,20,110
1000000019_0010011900191017_04-28-2000-00:00:00_Disbursement,1100001006,1000000019,0010011900191017,Disbursement,2000-04-28T00:00:00.000Z,3272140.0,BEF,2000-04-28T00:00:00.000Z,1000000019 G-B-B-26-,IFAD,"MINISTRY OF FINANCE, PERMANENT SECRETARY",Money is disbursed through central Ministry of Finance or Treasury,,TZ,ESA,1000000019 0010011900191017 Direct Payment/Reimbursement,C01, ,3,1,20,110
1000000019_0019924600191013_09-03-1999-00:00:00_Disbursement,1100001006,1000000019,0019924600191013,Disbursement,1999-09-03T00:00:00.000Z,1686262.0,BEF,1999-09-03T00:00:00.000Z,1000000019 G-B-B-26-,IFAD,"MINISTRY OF FINANCE, PERMANENT SECRETARY",Money is disbursed through central Ministry of Finance or Treasury,,TZ,ESA,1000000019 0019924600191013 Direct Payment/Reimbursement,C01, ,3,1,20,110
1000000019_0010108900191025_03-30-2001-00:00:00_Disbursement,1100001006,1000000019,0010108900191025,Disbursement,2001-03-30T00:00:00.000Z,1149355.26,BEF,2001-03-30T00:00:00.000Z,1000000019 G-B-B-26-,IFAD,"MINISTRY OF FINANCE, PERMANENT SECRETARY",Money is disbursed through central Ministry of Finance or Treasury,,TZ,ESA,1000000019 0010108900191025 Direct Payment/Reimbursement,C01, ,3,1,20,110
1000000019_0010101200191023_01-12-2001-00:00:00_Disbursement,1100001006,1000000019,0010101200191023,Disbursement,2001-01-12T00:00:00.000Z,1714094.13,BEF,2001-01-12T00:00:00.000Z,1000000019 G-B-B-26-,IFAD,"MINISTRY OF FINANCE, PERMANENT SECRETARY",Money is disbursed through central Ministry of Finance or Treasury,,TZ,ESA,1000000019 0010101200191023 Direct Payment/Reimbursement,C01, ,3,1,20,110
1000000019_0019823300191002_08-21-1998-00:00:00_Disbursement,1100001006,1000000019,0019823300191002,Disbursement,1998-08-21T00:00:00.000Z,430789.0,BEF,1998-08-21T00:00:00.000Z,1000000019 G-B-B-26-,IFAD,"MINISTRY OF FINANCE, PERMANENT SECRETARY",Money is disbursed through central Ministry of Finance or Treasury,,TZ,ESA,1000000019 0019823300191002 Direct Payment/Reimbursement,C01, ,3,1,20,110
1000000019_0010034200191022_12-07-2000-00:00:00_Disbursement,1100001006,1000000019,0010034200191022,Disbursement,2000-12-07T00:00:00.000Z,770882.92,BEF,2000-12-07T00:00:00.000Z,1000000019 G-B-B-26-,IFAD,"MINISTRY OF FINANCE, PERMANENT SECRETARY",Money is disbursed through central Ministry of Finance or Treasury,,TZ,ESA,1000000019 0010034200191022 Direct Payment/Reimbursement,C01, ,3,1,20,110
1000000020__04-20-1994-00:00:00_Commitment,1100000469,1000000020,,Commitment,1994-04-20T00:00:00.000Z,84499999.62,BEF,1994-04-20T00:00:00.000Z,1000000020 G-B-B-27-,IFAD,M.S. SWAMINATHAN RESEARCH FOUNDATION (MSSRF),Money is disbursed through central Ministry of Finance or Treasury,,IN,WCA,1000000020 GRANTS,C01, ,2,1,20,110
1000000020_0019917300201007_06-22-1999-00:00:00_Disbursement,1100000469,1000000020,0019917300201007,Disbursement,1999-06-22T00:00:00.000Z,3700953.0,BEF,1999-06-22T00:00:00.000Z,1000000020 G-B-B-27-,IFAD,M.S. SWAMINATHAN RESEARCH FOUNDATION (MSSRF),Money is disbursed through central Ministry of Finance or Treasury,,IN,WCA,1000000020 0019917300201007 Direct Payment/Reimbursement,C01, ,3,1,20,110
1000000020_0010022200201014_08-09-2000-00:00:00_Disbursement,1100000469,1000000020,0010022200201014,Disbursement,2000-08-09T00:00:00.000Z,768921.66,BEF,2000-08-09T00:00:00.000Z,1000000020 G-B-B-27-,IFAD,M.S. SWAMINATHAN RESEARCH FOUNDATION (MSSRF),Money is disbursed through central Ministry of Finance or Treasury,,IN,WCA,1000000020 0010022200201014 Direct Payment/Reimbursement,C01, ,3,1,20,110
1000000020_0010105400201018_02-23-2001-00:00:00_Disbursement,1100000469,1000000020,0010105400201018,Disbursement,2001-02-23T00:00:00.000Z,201868.12,BEF,2001-02-23T00:00:00.000Z,1000000020 G-B-B-27-,IFAD,M.S. SWAMINATHAN RESEARCH FOUNDATION (MSSRF),Money is disbursed through central Ministry of Finance or Treasury,,IN,WCA,1000000020 0010105400201018 Direct Payment/Reimbursement,C01, ,3,1,20,110
1000000020_0010008700201012_03-27-2000-00:00:00_Disbursement,1100000469,1000000020,0010008700201012,Disbursement,2000-03-27T00:00:00.000Z,3686555.0,BEF,2000-03-27T00:00:00.000Z,1000000020 G-B-B-27-,IFAD,M.S. SWAMINATHAN RESEARCH FOUNDATION (MSSRF),Money is disbursed through central Ministry of Finance or Treasury,,IN,WCA,1000000020 0010008700201012 Direct Payment/Reimbursement,C01, ,3,1,20,110
1000000020_0010302100201033_01-21-2003-00:00:00_Disbursement,1100000469,1000000020,0010302100201033,Disbursement,2003-01-21T00:00:00.000Z,2611526.87,BEF,2003-01-21T00:00:00.000Z,1000000020 G-B-B-27-,IFAD,M.S. SWAMINATHAN RESEARCH FOUNDATION (MSSRF),Money is disbursed through central Ministry of Finance or Treasury,,IN,WCA,1000000020 0010302100201033 Direct Payment/Reimbursement,C01, ,3,1,20,110
1000000020_0010223900201032_08-27-2002-00:00:00_Disbursement,1100000469,1000000020,0010223900201032,Disbursement,2002-08-27T00:00:00.000Z,1507551.28,BEF,2002-08-27T00:00:00.000Z,1000000020 G-B-B-27-,IFAD,M.S. SWAMINATHAN RESEARCH FOUNDATION (MSSRF),Money is disbursed through central Ministry of Finance or Treasury,,IN,WCA,1000000020 0010223900201032 Direct Payment/Reimbursement,C01, ,3,1,20,110
1000000020_0010132300201025_11-19-2001-00:00:00_Disbursement,1100000469,1000000020,0010132300201025,Disbursement,2001-11-19T00:00:00.000Z,320768.36,BEF,2001-11-19T00:00:00.000Z,1000000020 G-B-B-27-,IFAD,M.S. SWAMINATHAN RESEARCH FOUNDATION (MSSRF),Money is disbursed through central Ministry of Finance or Treasury,,IN,WCA,1000000020 0010132300201025 Direct Payment/Reimbursement,C01, ,3,1,20,110
1000000020_0010217800201030_06-27-2002-00:00:00_Disbursement,1100000469,1000000020,0010217800201030,Disbursement,2002-06-27T00:00:00.000Z,1935478.54,BEF,2002-06-27T00:00:00.000Z,1000000020 G-B-B-27-,IFAD,M.S. SWAMINATHAN RESEARCH FOUNDATION (MSSRF),Money is disbursed through central Ministry of Finance or Treasury,,IN,WCA,1000000020 0010217800201030 Direct Payment/Reimbursement,C01, ,3,1,20,110
1000000020_0019916600201005_06-15-1999-00:00:00_Disbursement,1100000469,1000000020,0019916600201005,Disbursement,1999-06-15T00:00:00.000Z,940839.42,BEF,1999-06-15T00:00:00.000Z,1000000020 G-B-B-27-,IFAD,M.S. SWAMINATHAN RESEARCH FOUNDATION (MSSRF),Money is disbursed through central Ministry of Finance or Treasury,,IN,WCA,1000000020 0019916600201005 Direct Payment/Reimbursement,C01, ,3,1,20,110
1000000020_0010212000201029_04-30-2002-00:00:00_Disbursement,1100000469,1000000020,0010212000201029,Disbursement,2002-04-30T00:00:00.000Z,6454258.95,BEF,2002-04-30T00:00:00.000Z,1000000020 G-B-B-27-,IFAD,M.S. SWAMINATHAN RESEARCH FOUNDATION (MSSRF),Money is disbursed through central Ministry of Finance or Treasury,,IN,WCA,1000000020 0010212000201029 Direct Payment/Reimbursement,C01, ,3,1,20,110
1000000020_0010129700201022_10-24-2001-00:00:00_Disbursement,1100000469,1000000020,0010129700201022,Disbursement,2001-10-24T00:00:00.000Z,2766742.7,BEF,2001-10-24T00:00:00.000Z,1000000020 G-B-B-27-,IFAD,M.S. SWAMINATHAN RESEARCH FOUNDATION (MSSRF),Money is disbursed through central Ministry of Finance or Treasury,,IN,WCA,1000000020 0010129700201022 Direct Payment/Reimbursement,C01, ,3,1,20,110
1000000020_0010017300201013_06-21-2000-00:00:00_Disbursement,1100000469,1000000020,0010017300201013,Disbursement,2000-06-21T00:00:00.000Z,1211744.44,BEF,2000-06-21T00:00:00.000Z,1000000020 G-B-B-27-,IFAD,M.S. SWAMINATHAN RESEARCH FOUNDATION (MSSRF),Money is disbursed through central Ministry of Finance or Treasury,,IN,WCA,1000000020 0010017300201013 Direct Payment/Reimbursement,C01, ,3,1,20,110
1000000020_0010002800201011_01-28-2000-00:00:00_Disbursement,1100000469,1000000020,0010002800201011,Disbursement,2000-01-28T00:00:00.000Z,1913452.56,BEF,2000-01-28T00:00:00.000Z,1000000020 G-B-B-27-,IFAD,M.S. SWAMINATHAN RESEARCH FOUNDATION (MSSRF),Money is disbursed through central Ministry of Finance or Treasury,,IN,WCA,1000000020 0010002800201011 Direct Payment/Reimbursement,C01, ,3,1,20,110
1000000020_0010029200201015_10-18-2000-00:00:00_Disbursement,1100000469,1000000020,0010029200201015,Disbursement,2000-10-18T00:00:00.000Z,3376959.0,BEF,2000-10-18T00:00:00.000Z,1000000020 G-B-B-27-,IFAD,M.S. SWAMINATHAN RESEARCH FOUNDATION (MSSRF),Money is disbursed through central Ministry of Finance or Treasury,,IN,WCA,1000000020 0010029200201015 Direct Payment/Reimbursement,C01, ,3,1,20,110
1000000020_0019916600201006_06-15-1999-00:00:00_Disbursement,1100000469,1000000020,0019916600201006,Disbursement,1999-06-15T00:00:00.000Z,6920293.71,BEF,1999-06-15T00:00:00.000Z,1000000020 G-B-B-27-,IFAD,M.S. SWAMINATHAN RESEARCH FOUNDATION (MSSRF),Money is disbursed through central Ministry of Finance or Treasury,,IN,WCA,1000000020 0019916600201006 Direct Payment/Reimbursement,C01, ,3,1,20,110
1000000020_0010129700201023_10-24-2001-00:00:00_Disbursement,1100000469,1000000020,0010129700201023,Disbursement,2001-10-24T00:00:00.000Z,1314317.51,BEF,2001-10-24T00:00:00.000Z,1000000020 G-B-B-27-,IFAD,M.S. SWAMINATHAN RESEARCH FOUNDATION (MSSRF),Money is disbursed through central Ministry of Finance or Treasury,,IN,WCA,1000000020 0010129700201023 Direct Payment/Reimbursement,C01, ,3,1,20,110
1000000020_0019804200201002_02-11-1998-00:00:00_Disbursement,1100000469,1000000020,0019804200201002,Disbursement,1998-02-11T00:00:00.000Z,671972.0,BEF,1998-02-11T00:00:00.000Z,1000000020 G-B-B-27-,IFAD,M.S. SWAMINATHAN RESEARCH FOUNDATION (MSSRF),Money is disbursed through central Ministry of Finance or Treasury,,IN,WCA,1000000020 0019804200201002 Direct Payment/Reimbursement,C01, ,3,1,20,110
1000000020_0010117200201019_06-21-2001-00:00:00_Disbursement,1100000469,1000000020,0010117200201019,Disbursement,2001-06-21T00:00:00.000Z,1211744.44,BEF,2001-06-21T00:00:00.000Z,1000000020 G-B-B-27-,IFAD,M.S. SWAMINATHAN RESEARCH FOUNDATION (MSSRF),Money is disbursed through central Ministry of Finance or Treasury,,IN,WCA,1000000020 0010117200201019 Direct Payment/Reimbursement,C01, ,3,1,20,110
1000000020_0010118000201020_06-29-2001-00:00:00_Disbursement,1100000469,1000000020,0010118000201020,Disbursement,2001-06-29T00:00:00.000Z,1435179.48,BEF,2001-06-29T00:00:00.000Z,1000000020 G-B-B-27-,IFAD,M.S. SWAMINATHAN RESEARCH FOUNDATION (MSSRF),Money is disbursed through central Ministry of Finance or Treasury,,IN,WCA,1000000020 0010118000201020 Direct Payment/Reimbursement,C01, ,3,1,20,110
1000000020_0010208000201028_03-21-2002-00:00:00_Disbursement,1100000469,1000000020,0010208000201028,Disbursement,2002-03-21T00:00:00.000Z,2952631.38,BEF,2002-03-21T00:00:00.000Z,1000000020 G-B-B-27-,IFAD,M.S. SWAMINATHAN RESEARCH FOUNDATION (MSSRF),Money is disbursed through central Ministry of Finance or Treasury,,IN,WCA,1000000020 0010208000201028 Direct Payment/Reimbursement,C01, ,3,1,20,110
1000000020_0010203700201026_02-06-2002-00:00:00_Disbursement,1100000469,1000000020,0010203700201026,Disbursement,2002-02-06T00:00:00.000Z,4723095.94,BEF,2002-02-06T00:00:00.000Z,1000000020 G-B-B-27-,IFAD,M.S. SWAMINATHAN RESEARCH FOUNDATION (MSSRF),Money is disbursed through central Ministry of Finance or Treasury,,IN,WCA,1000000020 0010203700201026 Direct Payment/Reimbursement,C01, ,3,1,20,110
1000000020_0010132300201024_11-19-2001-00:00:00_Disbursement,1100000469,1000000020,0010132300201024,Disbursement,2001-11-19T00:00:00.000Z,2825303.33,BEF,2001-11-19T00:00:00.000Z,1000000020 G-B-B-27-,IFAD,M.S. SWAMINATHAN RESEARCH FOUNDATION (MSSRF),Money is disbursed through central Ministry of Finance or Treasury,,IN,WCA,1000000020 0010132300201024 Direct Payment/Reimbursement,C01, ,3,1,20,110
1000000020_0010128800201021_10-15-2001-00:00:00_Disbursement,1100000469,1000000020,0010128800201021,Disbursement,2001-10-15T00:00:00.000Z,2403688.04,BEF,2001-10-15T00:00:00.000Z,1000000020 G-B-B-27-,IFAD,M.S. SWAMINATHAN RESEARCH FOUNDATION (MSSRF),Money is disbursed through central Ministry of Finance or Treasury,,IN,WCA,1000000020 0010128800201021 Direct Payment/Reimbursement,C01, ,3,1,20,110
1000000020_0019802800201001_01-28-1998-00:00:00_Disbursement,1100000469,1000000020,0019802800201001,Disbursement,1998-01-28T00:00:00.000Z,7411200.0,BEF,1998-01-28T00:00:00.000Z,1000000020 G-B-B-27-,IFAD,M.S. SWAMINATHAN RESEARCH FOUNDATION (MSSRF),Money is disbursed through central Ministry of Finance or Treasury,,IN,WCA,1000000020 0019802800201001 Direct Payment/Reimbursement,C01, ,3,1,20,110
1000000020_0010033300201016_11-28-2000-00:00:00_Disbursement,1100000469,1000000020,0010033300201016,Disbursement,2000-11-28T00:00:00.000Z,2328605.0,BEF,2000-11-28T00:00:00.000Z,1000000020 G-B-B-27-,IFAD,M.S. SWAMINATHAN RESEARCH FOUNDATION (MSSRF),Money is disbursed through central Ministry of Finance or Treasury,,IN,WCA,1000000020 0010033300201016 Direct Payment/Reimbursement,C01, ,3,1,20,110
1000000020_0019925800201009_09-15-1999-00:00:00_Disbursement,1100000469,1000000020,0019925800201009,Disbursement,1999-09-15T00:00:00.000Z,904017.56,BEF,1999-09-15T00:00:00.000Z,1000000020 G-B-B-27-,IFAD,M.S. SWAMINATHAN RESEARCH FOUNDATION (MSSRF),Money is disbursed through central Ministry of Finance or Treasury,,IN,WCA,1000000020 0019925800201009 Direct Payment/Reimbursement,C01, ,3,1,20,110
1000000020_0019908500201004_03-26-1999-00:00:00_Disbursement,1100000469,1000000020,0019908500201004,Disbursement,1999-03-26T00:00:00.000Z,1943089.0,BEF,1999-03-26T00:00:00.000Z,1000000020 G-B-B-27-,IFAD,M.S. SWAMINATHAN RESEARCH FOUNDATION (MSSRF),Money is disbursed through central Ministry of Finance or Treasury,,IN,WCA,1000000020 0019908500201004 Direct Payment/Reimbursement,C01, ,3,1,20,110
1000000020_0019918100201008_06-30-1999-00:00:00_Disbursement,1100000469,1000000020,0019918100201008,Disbursement,1999-06-30T00:00:00.000Z,801160.9,BEF,1999-06-30T00:00:00.000Z,1000000020 G-B-B-27-,IFAD,M.S. SWAMINATHAN RESEARCH FOUNDATION (MSSRF),Money is disbursed through central Ministry of Finance or Treasury,,IN,WCA,1000000020 0019918100201008 Direct Payment/Reimbursement,C01, ,3,1,20,110
1000000020_0010311800201034_04-28-2003-00:00:00_Disbursement,1100000469,1000000020,0010311800201034,Disbursement,2003-04-28T00:00:00.000Z,1980626.56,BEF,2003-04-28T00:00:00.000Z,1000000020 G-B-B-27-,IFAD,M.S. SWAMINATHAN RESEARCH FOUNDATION (MSSRF),Money is disbursed through central Ministry of Finance or Treasury,,IN,WCA,1000000020 0010311800201034 Direct Payment/Reimbursement,C01, ,3,1,20,110
1000000020_0019903900201003_02-08-1999-00:00:00_Disbursement,1100000469,1000000020,0019903900201003,Disbursement,1999-02-08T00:00:00.000Z,2680306.0,BEF,1999-02-08T00:00:00.000Z,1000000020 G-B-B-27-,IFAD,M.S. SWAMINATHAN RESEARCH FOUNDATION (MSSRF),Money is disbursed through central Ministry of Finance or Treasury,,IN,WCA,1000000020 0019903900201003 Direct Payment/Reimbursement,C01, ,3,1,20,110
1000000020_0019927300201010_09-30-1999-00:00:00_Disbursement,1100000469,1000000020,0019927300201010,Disbursement,1999-09-30T00:00:00.000Z,5209373.67,BEF,1999-09-30T00:00:00.000Z,1000000020 G-B-B-27-,IFAD,M.S. SWAMINATHAN RESEARCH FOUNDATION (MSSRF),Money is disbursed through central Ministry of Finance or Treasury,,IN,WCA,1000000020 0019927300201010 Direct Payment/Reimbursement,C01, ,3,1,20,110
1000000020_0010036400201017_12-29-2000-00:00:00_Disbursement,1100000469,1000000020,0010036400201017,Disbursement,2000-12-29T00:00:00.000Z,956204.89,BEF,2000-12-29T00:00:00.000Z,1000000020 G-B-B-27-,IFAD,M.S. SWAMINATHAN RESEARCH FOUNDATION (MSSRF),Money is disbursed through central Ministry of Finance or Treasury,,IN,WCA,1000000020 0010036400201017 Direct Payment/Reimbursement,C01, ,3,1,20,110
1000000020_0010217800201031_06-27-2002-00:00:00_Disbursement,1100000469,1000000020,0010217800201031,Disbursement,2002-06-27T00:00:00.000Z,1451568.76,BEF,2002-06-27T00:00:00.000Z,1000000020 G-B-B-27-,IFAD,M.S. SWAMINATHAN RESEARCH FOUNDATION (MSSRF),Money is disbursed through central Ministry of Finance or Treasury,,IN,WCA,1000000020 0010217800201031 Direct Payment/Reimbursement,C01, ,3,1,20,110
1000000020_0010203700201027_02-06-2002-00:00:00_Disbursement,1100000469,1000000020,0010203700201027,Disbursement,2002-02-06T00:00:00.000Z,2978001.55,BEF,2002-02-06T00:00:00.000Z,1000000020 G-B-B-27-,IFAD,M.S. SWAMINATHAN RESEARCH FOUNDATION (MSSRF),Money is disbursed through central Ministry of Finance or Treasury,,IN,WCA,1000000020 0010203700201027 Direct Payment/Reimbursement,C01, ,3,1,20,110
1000000022__12-02-1993-00:00:00_Commitment,1100000342,1000000022,,Commitment,1993-12-02T00:00:00.000Z,109910756.98,BEF,1993-12-02T00:00:00.000Z,1000000022 G-B-B-29-,IFAD,UNDP (Special Unit for South-South Cooperation),Money is disbursed through central Ministry of Finance or Treasury,,US,ESA,1000000022 GRANTS,C01, ,2,1,20,110
1000000022_0010506800221031_03-09-2005-00:00:00_Disbursement,1100000342,1000000022,0010506800221031,Disbursement,2005-03-09T00:00:00.000Z,946767.19,BEF,2005-03-09T00:00:00.000Z,1000000022 G-B-B-29-,IFAD,UNDP (Special Unit for South-South Cooperation),Money is disbursed through central Ministry of Finance or Treasury,,US,ESA,1000000022 0010506800221031 Direct Payment/Reimbursement,C01, ,3,1,20,110
1000000022_0010406100221023_03-01-2004-00:00:00_Disbursement,1100000342,1000000022,0010406100221023,Disbursement,2004-03-01T00:00:00.000Z,2607305.3,BEF,2004-03-01T00:00:00.000Z,1000000022 G-B-B-29-,IFAD,UNDP (Special Unit for South-South Cooperation),Money is disbursed through central Ministry of Finance or Treasury,,US,ESA,1000000022 0010406100221023 Direct Payment/Reimbursement,C01, ,3,1,20,110
1000000022_0010228100221009_10-08-2002-00:00:00_Disbursement,1100000342,1000000022,0010228100221009,Disbursement,2002-10-08T00:00:00.000Z,653720.07,BEF,2002-10-08T00:00:00.000Z,1000000022 G-B-B-29-,IFAD,UNDP (Special Unit for South-South Cooperation),Money is disbursed through central Ministry of Finance or Treasury,,US,ESA,1000000022 0010228100221009 Direct Payment/Reimbursement,C01, ,3,1,20,110
1000000022_0010236500221016_12-31-2002-00:00:00_Disbursement,1100000342,1000000022,0010236500221016,Disbursement,2002-12-31T00:00:00.000Z,2710394.2,BEF,2002-12-31T00:00:00.000Z,1000000022 G-B-B-29-,IFAD,UNDP (Special Unit for South-South Cooperation),Money is disbursed through central Ministry of Finance or Treasury,,US,ESA,1000000022 0010236500221016 Direct Payment/Reimbursement,C01, ,3,1,20,110
1000000022_0010400900221021_01-09-2004-00:00:00_Disbursement,1100000342,1000000022,0010400900221021,Disbursement,2004-01-09T00:00:00.000Z,2370475.39,BEF,2004-01-09T00:00:00.000Z,1000000022 G-B-B-29-,IFAD,UNDP (Special Unit for South-South Cooperation),Money is disbursed through central Ministry of Finance or Treasury,,US,ESA,1000000022 0010400900221021 Direct Payment/Reimbursement,C01, ,3,1,20,110
1000000022_0010329500221019_10-22-2003-00:00:00_Disbursement,1100000342,1000000022,0010329500221019,Disbursement,2003-10-22T00:00:00.000Z,969811.54,BEF,2003-10-22T00:00:00.000Z,1000000022 G-B-B-29-,IFAD,UNDP (Special Unit for South-South Cooperation),Money is disbursed through central Ministry of Finance or Treasury,,US,ESA,1000000022 0010329500221019 Direct Payment/Reimbursement,C01, ,3,1,20,110
1000000022_0010323400221018_08-22-2003-00:00:00_Disbursement,1100000342,1000000022,0010323400221018,Disbursement,2003-08-22T00:00:00.000Z,832823.88,BEF,2003-08-22T00:00:00.000Z,1000000022 G-B-B-29-,IFAD,UNDP (Special Unit for South-South Cooperation),Money is disbursed through central Ministry of Finance or Treasury,,US,ESA,1000000022 0010323400221018 Direct Payment/Reimbursement,C01, ,3,1,20,110
1000000022_0010405700221022_02-26-2004-00:00:00_Disbursement,1100000342,1000000022,0010405700221022,Disbursement,2004-02-26T00:00:00.000Z,1670110.99,BEF,2004-02-26T00:00:00.000Z,1000000022 G-B-B-29-,IFAD,UNDP (Special Unit for South-South Cooperation),Money is disbursed through central Ministry of Finance or Treasury,,US,ESA,1000000022 0010405700221022 Direct Payment/Reimbursement,C01, ,3,1,20,110
1000000022_0010400900221020_01-09-2004-00:00:00_Disbursement,1100000342,1000000022,0010400900221020,Disbursement,2004-01-09T00:00:00.000Z,856560.9,BEF,2004-01-09T00:00:00.000Z,1000000022 G-B-B-29-,IFAD,UNDP (Special Unit for South-South Cooperation),Money is disbursed through central Ministry of Finance or Treasury,,US,ESA,1000000022 0010400900221020 Direct Payment/Reimbursement,C01, ,3,1,20,110
1000000022_0010531400221039_11-10-2005-00:00:00_Disbursement,1100000342,1000000022,0010531400221039,Disbursement,2005-11-10T00:00:00.000Z,1186530.76,BEF,2005-11-10T00:00:00.000Z,1000000022 G-B-B-29-,IFAD,UNDP (Special Unit for South-South Cooperation),Money is disbursed through central Ministry of Finance or Treasury,,US,ESA,1000000022 0010531400221039 Direct Payment/Reimbursement,C01, ,3,1,20,110
1000000022_0010523500221037_08-23-2005-00:00:00_Disbursement,1100000342,1000000022,0010523500221037,Disbursement,2005-08-23T00:00:00.000Z,1121184.29,BEF,2005-08-23T00:00:00.000Z,1000000022 G-B-B-29-,IFAD,UNDP (Special Unit for South-South Cooperation),Money is disbursed through central Ministry of Finance or Treasury,,US,ESA,1000000022 0010523500221037 Direct Payment/Reimbursement,C01, ,3,1,20,110
1000000022_0010231600221014_11-12-2002-00:00:00_Disbursement,1100000342,1000000022,0010231600221014,Disbursement,2002-11-12T00:00:00.000Z,809477.35,BEF,2002-11-12T00:00:00.000Z,1000000022 G-B-B-29-,IFAD,UNDP (Special Unit for South-South Cooperation),Money is disbursed through central Ministry of Finance or Treasury,,US,ESA,1000000022 0010231600221014 Direct Payment/Reimbursement,C01, ,3,1,20,110
1000000022_0010119100221003_07-10-2001-00:00:00_Disbursement,1100000342,1000000022,0010119100221003,Disbursement,2001-07-10T00:00:00.000Z,2251092.75,BEF,2001-07-10T00:00:00.000Z,1000000022 G-B-B-29-,IFAD,UNDP (Special Unit for South-South Cooperation),Money is disbursed through central Ministry of Finance or Treasury,,US,ESA,1000000022 0010119100221003 Direct Payment/Reimbursement,C01, ,3,1,20,110
1000000022_0010229000221011_10-17-2002-00:00:00_Disbursement,1100000342,1000000022,0010229000221011,Disbursement,2002-10-17T00:00:00.000Z,238122.57,BEF,2002-10-17T00:00:00.000Z,1000000022 G-B-B-29-,IFAD,UNDP (Special Unit for South-South Cooperation),Money is disbursed through central Ministry of Finance or Treasury,,US,ESA,1000000022 0010229000221011 Direct Payment/Reimbursement,C01, ,3,1,20,110
1000000022_0010322500221017_08-13-2003-00:00:00_Disbursement,1100000342,1000000022,0010322500221017,Disbursement,2003-08-13T00:00:00.000Z,2483087.18,BEF,2003-08-13T00:00:00.000Z,1000000022 G-B-B-29-,IFAD,UNDP (Special Unit for South-South Cooperation),Money is disbursed through central Ministry of Finance or Treasury,,US,ESA,1000000022 0010322500221017 Direct Payment/Reimbursement,C01, ,3,1,20,110
1000000022_0010517500221035_06-24-2005-00:00:00_Disbursement,1100000342,1000000022,0010517500221035,Disbursement,2005-06-24T00:00:00.000Z,1655529.26,BEF,2005-06-24T00:00:00.000Z,1000000022 G-B-B-29-,IFAD,UNDP (Special Unit for South-South Cooperation),Money is disbursed through central Ministry of Finance or Treasury,,US,ESA,1000000022 0010517500221035 Direct Payment/Reimbursement,C01, ,3,1,20,110
1000000022_0010229000221010_10-17-2002-00:00:00_Disbursement,1100000342,1000000022,0010229000221010,Disbursement,2002-10-17T00:00:00.000Z,3290100.94,BEF,2002-10-17T00:00:00.000Z,1000000022 G-B-B-29-,IFAD,UNDP (Special Unit for South-South Cooperation),Money is disbursed through central Ministry of Finance or Treasury,,US,ESA,1000000022 0010229000221010 Direct Payment/Reimbursement,C01, ,3,1,20,110
1000000022_0010607900221041_03-20-2006-00:00:00_Disbursement,1100000342,1000000022,0010607900221041,Disbursement,2006-03-20T00:00:00.000Z,3463996.46,BEF,2006-03-20T00:00:00.000Z,1000000022 G-B-B-29-,IFAD,UNDP (Special Unit for South-South Cooperation),Money is disbursed through central Ministry of Finance or Treasury,,US,ESA,1000000022 0010607900221041 Direct Payment/Reimbursement,C01, ,3,1,20,110
1000000022_0010416900221025_06-17-2004-00:00:00_Disbursement,1100000342,1000000022,0010416900221025,Disbursement,2004-06-17T00:00:00.000Z,970071.32,BEF,2004-06-17T00:00:00.000Z,1000000022 G-B-B-29-,IFAD,UNDP (Special Unit for South-South Cooperation),Money is disbursed through central Ministry of Finance or Treasury,,US,ESA,1000000022 0010416900221025 Direct Payment/Reimbursement,C01, ,3,1,20,110
1000000022_0010501900221030_01-19-2005-00:00:00_Disbursement,1100000342,1000000022,0010501900221030,Disbursement,2005-01-19T00:00:00.000Z,422620.56,BEF,2005-01-19T00:00:00.000Z,1000000022 G-B-B-29-,IFAD,UNDP (Special Unit for South-South Cooperation),Money is disbursed through central Ministry of Finance or Treasury,,US,ESA,1000000022 0010501900221030 Direct Payment/Reimbursement,C01, ,3,1,20,110
1000000022_0010520700221036_07-26-2005-00:00:00_Disbursement,1100000342,1000000022,0010520700221036,Disbursement,2005-07-26T00:00:00.000Z,3941982.52,BEF,2005-07-26T00:00:00.000Z,1000000022 G-B-B-29-,IFAD,UNDP (Special Unit for South-South Cooperation),Money is disbursed through central Ministry of Finance or Treasury,,US,ESA,1000000022 0010520700221036 Direct Payment/Reimbursement,C01, ,3,1,20,110
1000000022_0010232500221015_11-21-2002-00:00:00_Disbursement,1100000342,1000000022,0010232500221015,Disbursement,2002-11-21T00:00:00.000Z,5704043.09,BEF,2002-11-21T00:00:00.000Z,1000000022 G-B-B-29-,IFAD,UNDP (Special Unit for South-South Cooperation),Money is disbursed through central Ministry of Finance or Treasury,,US,ESA,1000000022 0010232500221015 Direct Payment/Reimbursement,C01, ,3,1,20,110
1000000022_0010203600221006_02-05-2002-00:00:00_Disbursement,1100000342,1000000022,0010203600221006,Disbursement,2002-02-05T00:00:00.000Z,4020682.4,BEF,2002-02-05T00:00:00.000Z,1000000022 G-B-B-29-,IFAD,UNDP (Special Unit for South-South Cooperation),Money is disbursed through central Ministry of Finance or Treasury,,US,ESA,1000000022 0010203600221006 Direct Payment/Reimbursement,C01, ,3,1,20,110
1000000022_0010231600221013_11-12-2002-00:00:00_Disbursement,1100000342,1000000022,0010231600221013,Disbursement,2002-11-12T00:00:00.000Z,1736032.44,BEF,2002-11-12T00:00:00.000Z,1000000022 G-B-B-29-,IFAD,UNDP (Special Unit for South-South Cooperation),Money is disbursed through central Ministry of Finance or Treasury,,US,ESA,1000000022 0010231600221013 Direct Payment/Reimbursement,C01, ,3,1,20,110
1000000022_0010435900221027_12-24-2004-00:00:00_Disbursement,1100000342,1000000022,0010435900221027,Disbursement,2004-12-24T00:00:00.000Z,2252381.95,BEF,2004-12-24T00:00:00.000Z,1000000022 G-B-B-29-,IFAD,UNDP (Special Unit for South-South Cooperation),Money is disbursed through central Ministry of Finance or Treasury,,US,ESA,1000000022 0010435900221027 Direct Payment/Reimbursement,C01, ,3,1,20,110
1000000022_0010229000221012_10-17-2002-00:00:00_Disbursement,1100000342,1000000022,0010229000221012,Disbursement,2002-10-17T00:00:00.000Z,1915676.76,BEF,2002-10-17T00:00:00.000Z,1000000022 G-B-B-29-,IFAD,UNDP (Special Unit for South-South Cooperation),Money is disbursed through central Ministry of Finance or Treasury,,US,ESA,1000000022 0010229000221012 Direct Payment/Reimbursement,C01, ,3,1,20,110
1000000022_0010221300221008_08-01-2002-00:00:00_Disbursement,1100000342,1000000022,0010221300221008,Disbursement,2002-08-01T00:00:00.000Z,3859709.88,BEF,2002-08-01T00:00:00.000Z,1000000022 G-B-B-29-,IFAD,UNDP (Special Unit for South-South Cooperation),Money is disbursed through central Ministry of Finance or Treasury,,US,ESA,1000000022 0010221300221008 Direct Payment/Reimbursement,C01, ,3,1,20,110
1000000022_0010416900221024_06-17-2004-00:00:00_Disbursement,1100000342,1000000022,0010416900221024,Disbursement,2004-06-17T00:00:00.000Z,2226002.48,BEF,2004-06-17T00:00:00.000Z,1000000022 G-B-B-29-,IFAD,UNDP (Special Unit for South-South Cooperation),Money is disbursed through central Ministry of Finance or Treasury,,US,ESA,1000000022 0010416900221024 Direct Payment/Reimbursement,C01, ,3,1,20,110
1000000022_0010219000221007_07-09-2002-00:00:00_Disbursement,1100000342,1000000022,0010219000221007,Disbursement,2002-07-09T00:00:00.000Z,883045.88,BEF,2002-07-09T00:00:00.000Z,1000000022 G-B-B-29-,IFAD,UNDP (Special Unit for South-South Cooperation),Money is disbursed through central Ministry of Finance or Treasury,,US,ESA,1000000022 0010219000221007 Direct Payment/Reimbursement,C01, ,3,1,20,110
1000000022_0010503200221032_02-01-2005-00:00:00_Disbursement,1100000342,1000000022,0010503200221032,Disbursement,2005-02-01T00:00:00.000Z,3913801.3,BEF,2005-02-01T00:00:00.000Z,1000000022 G-B-B-29-,IFAD,UNDP (Special Unit for South-South Cooperation),Money is disbursed through central Ministry of Finance or Treasury,,US,ESA,1000000022 0010503200221032 Direct Payment/Reimbursement,C01, ,3,1,20,110
1000000022_0010527100221038_09-28-2005-00:00:00_Disbursement,1100000342,1000000022,0010527100221038,Disbursement,2005-09-28T00:00:00.000Z,2661129.03,BEF,2005-09-28T00:00:00.000Z,1000000022 G-B-B-29-,IFAD,UNDP (Special Unit for South-South Cooperation),Money is disbursed through central Ministry of Finance or Treasury,,US,ESA,1000000022 0010527100221038 Direct Payment/Reimbursement,C01, ,3,1,20,110
1000000022_0010034900221002_12-14-2000-00:00:00_Disbursement,1100000342,1000000022,0010034900221002,Disbursement,2000-12-14T00:00:00.000Z,9423349.71,BEF,2000-12-14T00:00:00.000Z,1000000022 G-B-B-29-,IFAD,UNDP (Special Unit for South-South Cooperation),Money is disbursed through central Ministry of Finance or Treasury,,US,ESA,1000000022 0010034900221002 Direct Payment/Reimbursement,C01, ,3,1,20,110
1000000022_0010436600221029_12-31-2004-00:00:00_Disbursement,1100000342,1000000022,0010436600221029,Disbursement,2004-12-31T00:00:00.000Z,1170264.13,BEF,2004-12-31T00:00:00.000Z,1000000022 G-B-B-29-,IFAD,UNDP (Special Unit for South-South Cooperation),Money is disbursed through central Ministry of Finance or Treasury,,US,ESA,1000000022 0010436600221029 Direct Payment/Reimbursement,C01, ,3,1,20,110
1000000022_0010129100221004_10-18-2001-00:00:00_Disbursement,1100000342,1000000022,0010129100221004,Disbursement,2001-10-18T00:00:00.000Z,10167783.29,BEF,2001-10-18T00:00:00.000Z,1000000022 G-B-B-29-,IFAD,UNDP (Special Unit for South-South Cooperation),Money is disbursed through central Ministry of Finance or Treasury,,US,ESA,1000000022 0010129100221004 Direct Payment/Reimbursement,C01, ,3,1,20,110
1000000022_0010506700221034_03-08-2005-00:00:00_Disbursement,1100000342,1000000022,0010506700221034,Disbursement,2005-03-08T00:00:00.000Z,348193.81,BEF,2005-03-08T00:00:00.000Z,1000000022 G-B-B-29-,IFAD,UNDP (Special Unit for South-South Cooperation),Money is disbursed through central Ministry of Finance or Treasury,,US,ESA,1000000022 0010506700221034 Direct Payment/Reimbursement,C01, ,3,1,20,110
1000000022_0010603800221040_02-07-2006-00:00:00_Disbursement,1100000342,1000000022,0010603800221040,Disbursement,2006-02-07T00:00:00.000Z,1314945.02,BEF,2006-02-07T00:00:00.000Z,1000000022 G-B-B-29-,IFAD,UNDP (Special Unit for South-South Cooperation),Money is disbursed through central Ministry of Finance or Treasury,,US,ESA,1000000022 0010603800221040 Direct Payment/Reimbursement,C01, ,3,1,20,110
1000000022_0019926700221001_09-24-1999-00:00:00_Disbursement,1100000342,1000000022,0019926700221001,Disbursement,1999-09-24T00:00:00.000Z,13477848.0,BEF,1999-09-24T00:00:00.000Z,1000000022 G-B-B-29-,IFAD,UNDP (Special Unit for South-South Cooperation),Money is disbursed through central Ministry of Finance or Treasury,,US,ESA,1000000022 0019926700221001 Direct Payment/Reimbursement,C01, ,3,1,20,110
1000000022_0010503400221033_02-03-2005-00:00:00_Disbursement,1100000342,1000000022,0010503400221033,Disbursement,2005-02-03T00:00:00.000Z,4391856.9,BEF,2005-02-03T00:00:00.000Z,1000000022 G-B-B-29-,IFAD,UNDP (Special Unit for South-South Cooperation),Money is disbursed through central Ministry of Finance or Treasury,,US,ESA,1000000022 0010503400221033 Direct Payment/Reimbursement,C01, ,3,1,20,110
1000000022_0010424000221026_08-27-2004-00:00:00_Disbursement,1100000342,1000000022,0010424000221026,Disbursement,2004-08-27T00:00:00.000Z,3320233.96,BEF,2004-08-27T00:00:00.000Z,1000000022 G-B-B-29-,IFAD,UNDP (Special Unit for South-South Cooperation),Money is disbursed through central Ministry of Finance or Treasury,,US,ESA,1000000022 0010424000221026 Direct Payment/Reimbursement,C01, ,3,1,20,110
1000000022_0010435200221028_12-17-2004-00:00:00_Disbursement,1100000342,1000000022,0010435200221028,Disbursement,2004-12-17T00:00:00.000Z,601080.24,BEF,2004-12-17T00:00:00.000Z,1000000022 G-B-B-29-,IFAD,UNDP (Special Unit for South-South Cooperation),Money is disbursed through central Ministry of Finance or Treasury,,US,ESA,1000000022 0010435200221028 Direct Payment/Reimbursement,C01, ,3,1,20,110
1000000022_0010133100221005_11-27-2001-00:00:00_Disbursement,1100000342,1000000022,0010133100221005,Disbursement,2001-11-27T00:00:00.000Z,1070931.29,BEF,2001-11-27T00:00:00.000Z,1000000022 G-B-B-29-,IFAD,UNDP (Special Unit for South-South Cooperation),Money is disbursed through central Ministry of Finance or Treasury,,US,ESA,1000000022 0010133100221005 Direct Payment/Reimbursement,C01, ,3,1,20,110
1000000024__09-10-1998-00:00:00_Commitment,1100001060,1000000024,,Commitment,1998-09-10T00:00:00.000Z,139194483.52,BEF,1998-09-10T00:00:00.000Z,1000000024 G-B-B-30-,IFAD,"MINISTRY OF FINANCE, PLANNING AND ECONOMIC DEVELOPMENT",Money is disbursed through central Ministry of Finance or Treasury,,UG,ESA,1000000024 GRANTS,C01, ,2,1,20,110
1000000024_0010526400241054_09-21-2005-00:00:00_Disbursement,1100001060,1000000024,0010526400241054,Disbursement,2005-09-21T00:00:00.000Z,732393.59,BEF,2005-09-21T00:00:00.000Z,1000000024 G-B-B-30-,IFAD,"MINISTRY OF FINANCE, PLANNING AND ECONOMIC DEVELOPMENT",Money is disbursed through central Ministry of Finance or Treasury,,UG,ESA,1000000024 0010526400241054 Direct Payment/Reimbursement,C01, ,3,1,20,110
1000000024_0010627000241062_09-27-2006-00:00:00_Disbursement,1100001060,1000000024,0010627000241062,Disbursement,2006-09-27T00:00:00.000Z,-2697.56,BEF,2006-09-27T00:00:00.000Z,1000000024 G-B-B-30-,IFAD,"MINISTRY OF FINANCE, PLANNING AND ECONOMIC DEVELOPMENT",Money is disbursed through central Ministry of Finance or Treasury,,UG,ESA,1000000024 0010627000241062 Direct Payment/Reimbursement,C01, ,3,1,20,110
1000000024_0010625800241058_09-15-2006-00:00:00_Disbursement,1100001060,1000000024,0010625800241058,Disbursement,2006-09-15T00:00:00.000Z,645059.89,BEF,2006-09-15T00:00:00.000Z,1000000024 G-B-B-30-,IFAD,"MINISTRY OF FINANCE, PLANNING AND ECONOMIC DEVELOPMENT",Money is disbursed through central Ministry of Finance or Treasury,,UG,ESA,1000000024 0010625800241058 Direct Payment/Reimbursement,C01, ,3,1,20,110
1000000024_0010309000241028_03-31-2003-00:00:00_Disbursement,1100001060,1000000024,0010309000241028,Disbursement,2003-03-31T00:00:00.000Z,2588262.05,BEF,2003-03-31T00:00:00.000Z,1000000024 G-B-B-30-,IFAD,"MINISTRY OF FINANCE, PLANNING AND ECONOMIC DEVELOPMENT",Money is disbursed through central Ministry of Finance or Treasury,,UG,ESA,1000000024 0010309000241028 Direct Payment/Reimbursement,C01, ,3,1,20,110
1000000024_0010429600241049_10-22-2004-00:00:00_Disbursement,1100001060,1000000024,0010429600241049,Disbursement,2004-10-22T00:00:00.000Z,716226.45,BEF,2004-10-22T00:00:00.000Z,1000000024 G-B-B-30-,IFAD,"MINISTRY OF FINANCE, PLANNING AND ECONOMIC DEVELOPMENT",Money is disbursed through central Ministry of Finance or Treasury,,UG,ESA,1000000024 0010429600241049 Direct Payment/Reimbursement,C01, ,3,1,20,110
1000000024_0010411800241042_04-27-2004-00:00:00_Disbursement,1100001060,1000000024,0010411800241042,Disbursement,2004-04-27T00:00:00.000Z,686509.26,BEF,2004-04-27T00:00:00.000Z,1000000024 G-B-B-30-,IFAD,"MINISTRY OF FINANCE, PLANNING AND ECONOMIC DEVELOPMENT",Money is disbursed through central Ministry of Finance or Treasury,,UG,ESA,1000000024 0010411800241042 Direct Payment/Reimbursement,C01, ,3,1,20,110
1000000024_0010235200241023_12-18-2002-00:00:00_Disbursement,1100001060,1000000024,0010235200241023,Disbursement,2002-12-18T00:00:00.000Z,2653480.6,BEF,2002-12-18T00:00:00.000Z,1000000024 G-B-B-30-,IFAD,"MINISTRY OF FINANCE, PLANNING AND ECONOMIC DEVELOPMENT",Money is disbursed through central Ministry of Finance or Treasury,,UG,ESA,1000000024 0010235200241023 Direct Payment/Reimbursement,C01, ,3,1,20,110
1000000024_0010501300241050_01-13-2005-00:00:00_Disbursement,1100001060,1000000024,0010501300241050,Disbursement,2005-01-13T00:00:00.000Z,276653.05,BEF,2005-01-13T00:00:00.000Z,1000000024 G-B-B-30-,IFAD,"MINISTRY OF FINANCE, PLANNING AND ECONOMIC DEVELOPMENT",Money is disbursed through central Ministry of Finance or Treasury,,UG,ESA,1000000024 0010501300241050 Direct Payment/Reimbursement,C01, ,3,1,20,110
1000000024_0010205000241009_02-19-2002-00:00:00_Disbursement,1100001060,1000000024,0010205000241009,Disbursement,2002-02-19T00:00:00.000Z,4336846.31,BEF,2002-02-19T00:00:00.000Z,1000000024 G-B-B-30-,IFAD,"MINISTRY OF FINANCE, PLANNING AND ECONOMIC DEVELOPMENT",Money is disbursed through central Ministry of Finance or Treasury,,UG,ESA,1000000024 0010205000241009 Direct Payment/Reimbursement,C01, ,3,1,20,110
1000000024_0010231200241022_11-08-2002-00:00:00_Disbursement,1100001060,1000000024,0010231200241022,Disbursement,2002-11-08T00:00:00.000Z,3438591.15,BEF,2002-11-08T00:00:00.000Z,1000000024 G-B-B-30-,IFAD,"MINISTRY OF FINANCE, PLANNING AND ECONOMIC DEVELOPMENT",Money is disbursed through central Ministry of Finance or Treasury,,UG,ESA,1000000024 0010231200241022 Direct Payment/Reimbursement,C01, ,3,1,20,110
1000000024_0010428200241048_10-08-2004-00:00:00_Disbursement,1100001060,1000000024,0010428200241048,Disbursement,2004-10-08T00:00:00.000Z,1975096.37,BEF,2004-10-08T00:00:00.000Z,1000000024 G-B-B-30-,IFAD,"MINISTRY OF FINANCE, PLANNING AND ECONOMIC DEVELOPMENT",Money is disbursed through central Ministry of Finance or Treasury,,UG,ESA,1000000024 0010428200241048 Direct Payment/Reimbursement,C01, ,3,1,20,110
1000000024_0010627000241063_09-27-2006-00:00:00_Disbursement,1100001060,1000000024,0010627000241063,Disbursement,2006-09-27T00:00:00.000Z,631247.46,BEF,2006-09-27T00:00:00.000Z,1000000024 G-B-B-30-,IFAD,"MINISTRY OF FINANCE, PLANNING AND ECONOMIC DEVELOPMENT",Money is disbursed through central Ministry of Finance or Treasury,,UG,ESA,1000000024 0010627000241063 Direct Payment/Reimbursement,C01, ,3,1,20,110
1000000024_0010214800241014_05-28-2002-00:00:00_Disbursement,1100001060,1000000024,0010214800241014,Disbursement,2002-05-28T00:00:00.000Z,5131391.26,BEF,2002-05-28T00:00:00.000Z,1000000024 G-B-B-30-,IFAD,"MINISTRY OF FINANCE, PLANNING AND ECONOMIC DEVELOPMENT",Money is disbursed through central Ministry of Finance or Treasury,,UG,ESA,1000000024 0010214800241014 Direct Payment/Reimbursement,C01, ,3,1,20,110
1000000024_0010625800241057_09-15-2006-00:00:00_Disbursement,1100001060,1000000024,0010625800241057,Disbursement,2006-09-15T00:00:00.000Z,602804.93,BEF,2006-09-15T00:00:00.000Z,1000000024 G-B-B-30-,IFAD,"MINISTRY OF FINANCE, PLANNING AND ECONOMIC DEVELOPMENT",Money is disbursed through central Ministry of Finance or Treasury,,UG,ESA,1000000024 0010625800241057 Direct Payment/Reimbursement,C01, ,3,1,20,110
1000000024_0010230400241021_10-31-2002-00:00:00_Disbursement,1100001060,1000000024,0010230400241021,Disbursement,2002-10-31T00:00:00.000Z,905070.57,BEF,2002-10-31T00:00:00.000Z,1000000024 G-B-B-30-,IFAD,"MINISTRY OF FINANCE, PLANNING AND ECONOMIC DEVELOPMENT",Money is disbursed through central Ministry of Finance or Treasury,,UG,ESA,1000000024 0010230400241021 Direct Payment/Reimbursement,C01, ,3,1,20,110
1000000024_0010308700241027_03-28-2003-00:00:00_Disbursement,1100001060,1000000024,0010308700241027,Disbursement,2003-03-28T00:00:00.000Z,4129916.52,BEF,2003-03-28T00:00:00.000Z,1000000024 G-B-B-30-,IFAD,"MINISTRY OF FINANCE, PLANNING AND ECONOMIC DEVELOPMENT",Money is disbursed through central Ministry of Finance or Treasury,,UG,ESA,1000000024 0010308700241027 Direct Payment/Reimbursement,C01, ,3,1,20,110
1000000024_0010407500241041_03-15-2004-00:00:00_Disbursement,1100001060,1000000024,0010407500241041,Disbursement,2004-03-15T00:00:00.000Z,1152336.27,BEF,2004-03-15T00:00:00.000Z,1000000024 G-B-B-30-,IFAD,"MINISTRY OF FINANCE, PLANNING AND ECONOMIC DEVELOPMENT",Money is disbursed through central Ministry of Finance or Treasury,,UG,ESA,1000000024 0010407500241041 Direct Payment/Reimbursement,C01, ,3,1,20,110
1000000024_0010230400241020_10-31-2002-00:00:00_Disbursement,1100001060,1000000024,0010230400241020,Disbursement,2002-10-31T00:00:00.000Z,1961551.64,BEF,2002-10-31T00:00:00.000Z,1000000024 G-B-B-30-,IFAD,"MINISTRY OF FINANCE, PLANNING AND ECONOMIC DEVELOPMENT",Money is disbursed through central Ministry of Finance or Treasury,,UG,ESA,1000000024 0010230400241020 Direct Payment/Reimbursement,C01, ,3,1,20,110
1000000024_0010214800241015_05-28-2002-00:00:00_Disbursement,1100001060,1000000024,0010214800241015,Disbursement,2002-05-28T00:00:00.000Z,6080706.49,BEF,2002-05-28T00:00:00.000Z,1000000024 G-B-B-30-,IFAD,"MINISTRY OF FINANCE, PLANNING AND ECONOMIC DEVELOPMENT",Money is disbursed through central Ministry of Finance or Treasury,,UG,ESA,1000000024 0010214800241015 Direct Payment/Reimbursement,C01, ,3,1,20,110
1000000024_0010625800241059_09-15-2006-00:00:00_Disbursement,1100001060,1000000024,0010625800241059,Disbursement,2006-09-15T00:00:00.000Z,382324.25,BEF,2006-09-15T00:00:00.000Z,1000000024 G-B-B-30-,IFAD,"MINISTRY OF FINANCE, PLANNING AND ECONOMIC DEVELOPMENT",Money is disbursed through central Ministry of Finance or Treasury,,UG,ESA,1000000024 0010625800241059 Direct Payment/Reimbursement,C01, ,3,1,20,110
1000000024_0010303800241026_02-07-2003-00:00:00_Disbursement,1100001060,1000000024,0010303800241026,Disbursement,2003-02-07T00:00:00.000Z,2351586.45,BEF,2003-02-07T00:00:00.000Z,1000000024 G-B-B-30-,IFAD,"MINISTRY OF FINANCE, PLANNING AND ECONOMIC DEVELOPMENT",Money is disbursed through central Ministry of Finance or Treasury,,UG,ESA,1000000024 0010303800241026 Direct Payment/Reimbursement,C01, ,3,1,20,110
1000000024_0010028700241001_10-13-2000-00:00:00_Disbursement,1100001060,1000000024,0010028700241001,Disbursement,2000-10-13T00:00:00.000Z,1684014.62,BEF,2000-10-13T00:00:00.000Z,1000000024 G-B-B-30-,IFAD,"MINISTRY OF FINANCE, PLANNING AND ECONOMIC DEVELOPMENT",Money is disbursed through central Ministry of Finance or Treasury,,UG,ESA,1000000024 0010028700241001 Direct Payment/Reimbursement,C01, ,3,1,20,110
1000000024_0010205300241011_02-22-2002-00:00:00_Disbursement,1100001060,1000000024,0010205300241011,Disbursement,2002-02-22T00:00:00.000Z,1521830.29,BEF,2002-02-22T00:00:00.000Z,1000000024 G-B-B-30-,IFAD,"MINISTRY OF FINANCE, PLANNING AND ECONOMIC DEVELOPMENT",Money is disbursed through central Ministry of Finance or Treasury,,UG,ESA,1000000024 0010205300241011 Direct Payment/Reimbursement,C01, ,3,1,20,110
1000000024_0010414200241045_05-21-2004-00:00:00_Disbursement,1100001060,1000000024,0010414200241045,Disbursement,2004-05-21T00:00:00.000Z,2738779.48,BEF,2004-05-21T00:00:00.000Z,1000000024 G-B-B-30-,IFAD,"MINISTRY OF FINANCE, PLANNING AND ECONOMIC DEVELOPMENT",Money is disbursed through central Ministry of Finance or Treasury,,UG,ESA,1000000024 0010414200241045 Direct Payment/Reimbursement,C01, ,3,1,20,110
1000000024_0010635500241070_12-21-2006-00:00:00_Disbursement,1100001060,1000000024,0010635500241070,Disbursement,2006-12-21T00:00:00.000Z,234040.87,BEF,2006-12-21T00:00:00.000Z,1000000024 G-B-B-30-,IFAD,"MINISTRY OF FINANCE, PLANNING AND ECONOMIC DEVELOPMENT",Money is disbursed through central Ministry of Finance or Treasury,,UG,ESA,1000000024 0010635500241070 Direct Payment/Reimbursement,C01, ,3,1,20,110
1000000024_0010709400241072_04-04-2007-00:00:00_Disbursement,1100001060,1000000024,0010709400241072,Disbursement,2007-04-04T00:00:00.000Z,560502.93,BEF,2007-04-04T00:00:00.000Z,1000000024 G-B-B-30-,IFAD,"MINISTRY OF FINANCE, PLANNING AND ECONOMIC DEVELOPMENT",Money is disbursed through central Ministry of Finance or Treasury,,UG,ESA,1000000024 0010709400241072 Direct Payment/Reimbursement,C01, ,3,1,20,110
1000000024_0010412600241043_05-05-2004-00:00:00_Disbursement,1100001060,1000000024,0010412600241043,Disbursement,2004-05-05T00:00:00.000Z,2342230.6,BEF,2004-05-05T00:00:00.000Z,1000000024 G-B-B-30-,IFAD,"MINISTRY OF FINANCE, PLANNING AND ECONOMIC DEVELOPMENT",Money is disbursed through central Ministry of Finance or Treasury,,UG,ESA,1000000024 0010412600241043 Direct Payment/Reimbursement,C01, ,3,1,20,110
1000000024_0010210000241013_04-10-2002-00:00:00_Disbursement,1100001060,1000000024,0010210000241013,Disbursement,2002-04-10T00:00:00.000Z,5006454.74,BEF,2002-04-10T00:00:00.000Z,1000000024 G-B-B-30-,IFAD,"MINISTRY OF FINANCE, PLANNING AND ECONOMIC DEVELOPMENT",Money is disbursed through central Ministry of Finance or Treasury,,UG,ESA,1000000024 0010210000241013 Direct Payment/Reimbursement,C01, ,3,1,20,110
1000000024_0010313600241031_05-16-2003-00:00:00_Disbursement,1100001060,1000000024,0010313600241031,Disbursement,2003-05-16T00:00:00.000Z,3898575.87,BEF,2003-05-16T00:00:00.000Z,1000000024 G-B-B-30-,IFAD,"MINISTRY OF FINANCE, PLANNING AND ECONOMIC DEVELOPMENT",Money is disbursed through central Ministry of Finance or Treasury,,UG,ESA,1000000024 0010313600241031 Direct Payment/Reimbursement,C01, ,3,1,20,110
1000000024_0010333500241037_12-01-2003-00:00:00_Disbursement,1100001060,1000000024,0010333500241037,Disbursement,2003-12-01T00:00:00.000Z,1043929.76,BEF,2003-12-01T00:00:00.000Z,1000000024 G-B-B-30-,IFAD,"MINISTRY OF FINANCE, PLANNING AND ECONOMIC DEVELOPMENT",Money is disbursed through central Ministry of Finance or Treasury,,UG,ESA,1000000024 0010333500241037 Direct Payment/Reimbursement,C01, ,3,1,20,110
1000000024_0010134000241008_12-06-2001-00:00:00_Disbursement,1100001060,1000000024,0010134000241008,Disbursement,2001-12-06T00:00:00.000Z,7721924.61,BEF,2001-12-06T00:00:00.000Z,1000000024 G-B-B-30-,IFAD,"MINISTRY OF FINANCE, PLANNING AND ECONOMIC DEVELOPMENT",Money is disbursed through central Ministry of Finance or Treasury,,UG,ESA,1000000024 0010134000241008 Direct Payment/Reimbursement,C01, ,3,1,20,110
1000000024_0010627000241066_09-27-2006-00:00:00_Disbursement,1100001060,1000000024,0010627000241066,Disbursement,2006-09-27T00:00:00.000Z,318394.4,BEF,2006-09-27T00:00:00.000Z,1000000024 G-B-B-30-,IFAD,"MINISTRY OF FINANCE, PLANNING AND ECONOMIC DEVELOPMENT",Money is disbursed through central Ministry of Finance or Treasury,,UG,ESA,1000000024 0010627000241066 Direct Payment/Reimbursement,C01, ,3,1,20,110
1000000024_0010513000241052_05-10-2005-00:00:00_Disbursement,1100001060,1000000024,0010513000241052,Disbursement,2005-05-10T00:00:00.000Z,183561.64,BEF,2005-05-10T00:00:00.000Z,1000000024 G-B-B-30-,IFAD,"MINISTRY OF FINANCE, PLANNING AND ECONOMIC DEVELOPMENT",Money is disbursed through central Ministry of Finance or Treasury,,UG,ESA,1000000024 0010513000241052 Direct Payment/Reimbursement,C01, ,3,1,20,110
1000000024_0010405700241040_02-26-2004-00:00:00_Disbursement,1100001060,1000000024,0010405700241040,Disbursement,2004-02-26T00:00:00.000Z,1466109.7,BEF,2004-02-26T00:00:00.000Z,1000000024 G-B-B-30-,IFAD,"MINISTRY OF FINANCE, PLANNING AND ECONOMIC DEVELOPMENT",Money is disbursed through central Ministry of Finance or Treasury,,UG,ESA,1000000024 0010405700241040 Direct Payment/Reimbursement,C01, ,3,1,20,110
1000000024_0010526400241053_09-21-2005-00:00:00_Disbursement,1100001060,1000000024,0010526400241053,Disbursement,2005-09-21T00:00:00.000Z,501676.76,BEF,2005-09-21T00:00:00.000Z,1000000024 G-B-B-30-,IFAD,"MINISTRY OF FINANCE, PLANNING AND ECONOMIC DEVELOPMENT",Money is disbursed through central Ministry of Finance or Treasury,,UG,ESA,1000000024 0010526400241053 Direct Payment/Reimbursement,C01, ,3,1,20,110
1000000024_0010709400241074_04-04-2007-00:00:00_Disbursement,1100001060,1000000024,0010709400241074,Disbursement,2007-04-04T00:00:00.000Z,987522.16,BEF,2007-04-04T00:00:00.000Z,1000000024 G-B-B-30-,IFAD,"MINISTRY OF FINANCE, PLANNING AND ECONOMIC DEVELOPMENT",Money is disbursed through central Ministry of Finance or Treasury,,UG,ESA,1000000024 0010709400241074 Direct Payment/Reimbursement,C01, ,3,1,20,110
1000000024_0010326100241035_09-18-2003-00:00:00_Disbursement,1100001060,1000000024,0010326100241035,Disbursement,2003-09-18T00:00:00.000Z,3266702.14,BEF,2003-09-18T00:00:00.000Z,1000000024 G-B-B-30-,IFAD,"MINISTRY OF FINANCE, PLANNING AND ECONOMIC DEVELOPMENT",Money is disbursed through central Ministry of Finance or Treasury,,UG,ESA,1000000024 0010326100241035 Direct Payment/Reimbursement,C01, ,3,1,20,110
1000000024_0010625800241060_09-15-2006-00:00:00_Disbursement,1100001060,1000000024,0010625800241060,Disbursement,2006-09-15T00:00:00.000Z,413405.86,BEF,2006-09-15T00:00:00.000Z,1000000024 G-B-B-30-,IFAD,"MINISTRY OF FINANCE, PLANNING AND ECONOMIC DEVELOPMENT",Money is disbursed through central Ministry of Finance or Treasury,,UG,ESA,1000000024 0010625800241060 Direct Payment/Reimbursement,C01, ,3,1,20,110
1000000024_0010210000241012_04-10-2002-00:00:00_Disbursement,1100001060,1000000024,0010210000241012,Disbursement,2002-04-10T00:00:00.000Z,2442955.87,BEF,2002-04-10T00:00:00.000Z,1000000024 G-B-B-30-,IFAD,"MINISTRY OF FINANCE, PLANNING AND ECONOMIC DEVELOPMENT",Money is disbursed through central Ministry of Finance or Treasury,,UG,ESA,1000000024 0010210000241012 Direct Payment/Reimbursement,C01, ,3,1,20,110
1000000024_0010218200241017_07-01-2002-00:00:00_Disbursement,1100001060,1000000024,0010218200241017,Disbursement,2002-07-01T00:00:00.000Z,3507076.57,BEF,2002-07-01T00:00:00.000Z,1000000024 G-B-B-30-,IFAD,"MINISTRY OF FINANCE, PLANNING AND ECONOMIC DEVELOPMENT",Money is disbursed through central Ministry of Finance or Treasury,,UG,ESA,1000000024 0010218200241017 Direct Payment/Reimbursement,C01, ,3,1,20,110
1000000024_0010235800241024_12-24-2002-00:00:00_Disbursement,1100001060,1000000024,0010235800241024,Disbursement,2002-12-24T00:00:00.000Z,2838533.93,BEF,2002-12-24T00:00:00.000Z,1000000024 G-B-B-30-,IFAD,"MINISTRY OF FINANCE, PLANNING AND ECONOMIC DEVELOPMENT",Money is disbursed through central Ministry of Finance or Treasury,,UG,ESA,1000000024 0010235800241024 Direct Payment/Reimbursement,C01, ,3,1,20,110
1000000024_0010126800241006_09-25-2001-00:00:00_Disbursement,1100001060,1000000024,0010126800241006,Disbursement,2001-09-25T00:00:00.000Z,1429401.6,BEF,2001-09-25T00:00:00.000Z,1000000024 G-B-B-30-,IFAD,"MINISTRY OF FINANCE, PLANNING AND ECONOMIC DEVELOPMENT",Money is disbursed through central Ministry of Finance or Treasury,,UG,ESA,1000000024 0010126800241006 Direct Payment/Reimbursement,C01, ,3,1,20,110
1000000024_0010421600241046_08-03-2004-00:00:00_Disbursement,1100001060,1000000024,0010421600241046,Disbursement,2004-08-03T00:00:00.000Z,1030481.13,BEF,2004-08-03T00:00:00.000Z,1000000024 G-B-B-30-,IFAD,"MINISTRY OF FINANCE, PLANNING AND ECONOMIC DEVELOPMENT",Money is disbursed through central Ministry of Finance or Treasury,,UG,ESA,1000000024 0010421600241046 Direct Payment/Reimbursement,C01, ,3,1,20,110
1000000024_0010028700241002_10-13-2000-00:00:00_Disbursement,1100001060,1000000024,0010028700241002,Disbursement,2000-10-13T00:00:00.000Z,6660031.63,BEF,2000-10-13T00:00:00.000Z,1000000024 G-B-B-30-,IFAD,"MINISTRY OF FINANCE, PLANNING AND ECONOMIC DEVELOPMENT",Money is disbursed through central Ministry of Finance or Treasury,,UG,ESA,1000000024 0010028700241002 Direct Payment/Reimbursement,C01, ,3,1,20,110
1000000024_0010225900241019_09-16-2002-00:00:00_Disbursement,1100001060,1000000024,0010225900241019,Disbursement,2002-09-16T00:00:00.000Z,1432236.28,BEF,2002-09-16T00:00:00.000Z,1000000024 G-B-B-30-,IFAD,"MINISTRY OF FINANCE, PLANNING AND ECONOMIC DEVELOPMENT",Money is disbursed through central Ministry of Finance or Treasury,,UG,ESA,1000000024 0010225900241019 Direct Payment/Reimbursement,C01, ,3,1,20,110
1000000024_0010827400241076_09-30-2008-00:00:00_Disbursement,1100001060,1000000024,0010827400241076,Disbursement,2008-09-30T00:00:00.000Z,57456.17,BEF,2008-09-30T00:00:00.000Z,1000000024 G-B-B-30-,IFAD,"MINISTRY OF FINANCE, PLANNING AND ECONOMIC DEVELOPMENT",Money is disbursed through central Ministry of Finance or Treasury,,UG,ESA,1000000024 0010827400241076 Direct Payment/Reimbursement,C01, ,3,1,20,110
1000000024_0010404100241039_02-10-2004-00:00:00_Disbursement,1100001060,1000000024,0010404100241039,Disbursement,2004-02-10T00:00:00.000Z,4174614.89,BEF,2004-02-10T00:00:00.000Z,1000000024 G-B-B-30-,IFAD,"MINISTRY OF FINANCE, PLANNING AND ECONOMIC DEVELOPMENT",Money is disbursed through central Ministry of Finance or Treasury,,UG,ESA,1000000024 0010404100241039 Direct Payment/Reimbursement,C01, ,3,1,20,110
1000000024_0010634000241069_12-06-2006-00:00:00_Disbursement,1100001060,1000000024,0010634000241069,Disbursement,2006-12-06T00:00:00.000Z,1623861.73,BEF,2006-12-06T00:00:00.000Z,1000000024 G-B-B-30-,IFAD,"MINISTRY OF FINANCE, PLANNING AND ECONOMIC DEVELOPMENT",Money is disbursed through central Ministry of Finance or Treasury,,UG,ESA,1000000024 0010634000241069 Direct Payment/Reimbursement,C01, ,3,1,20,110
1000000024_0010627900241068_10-06-2006-00:00:00_Disbursement,1100001060,1000000024,0010627900241068,Disbursement,2006-10-06T00:00:00.000Z,192495.59,BEF,2006-10-06T00:00:00.000Z,1000000024 G-B-B-30-,IFAD,"MINISTRY OF FINANCE, PLANNING AND ECONOMIC DEVELOPMENT",Money is disbursed through central Ministry of Finance or Treasury,,UG,ESA,1000000024 0010627900241068 Direct Payment/Reimbursement,C01, ,3,1,20,110
1000000024_0010709400241071_04-04-2007-00:00:00_Disbursement,1100001060,1000000024,0010709400241071,Disbursement,2007-04-04T00:00:00.000Z,560502.93,BEF,2007-04-04T00:00:00.000Z,1000000024 G-B-B-30-,IFAD,"MINISTRY OF FINANCE, PLANNING AND ECONOMIC DEVELOPMENT",Money is disbursed through central Ministry of Finance or Treasury,,UG,ESA,1000000024 0010709400241071 Direct Payment/Reimbursement,C01, ,3,1,20,110
1000000024_0010330400241036_10-31-2003-00:00:00_Disbursement,1100001060,1000000024,0010330400241036,Disbursement,2003-10-31T00:00:00.000Z,838934.89,BEF,2003-10-31T00:00:00.000Z,1000000024 G-B-B-30-,IFAD,"MINISTRY OF FINANCE, PLANNING AND ECONOMIC DEVELOPMENT",Money is disbursed through central Ministry of Finance or Treasury,,UG,ESA,1000000024 0010330400241036 Direct Payment/Reimbursement,C01, ,3,1,20,110
1000000024_0010123900241005_08-27-2001-00:00:00_Disbursement,1100001060,1000000024,0010123900241005,Disbursement,2001-08-27T00:00:00.000Z,1596650.31,BEF,2001-08-27T00:00:00.000Z,1000000024 G-B-B-30-,IFAD,"MINISTRY OF FINANCE, PLANNING AND ECONOMIC DEVELOPMENT",Money is disbursed through central Ministry of Finance or Treasury,,UG,ESA,1000000024 0010123900241005 Direct Payment/Reimbursement,C01, ,3,1,20,110
1000000024_0010313600241032_05-16-2003-00:00:00_Disbursement,1100001060,1000000024,0010313600241032,Disbursement,2003-05-16T00:00:00.000Z,2912599.64,BEF,2003-05-16T00:00:00.000Z,1000000024 G-B-B-30-,IFAD,"MINISTRY OF FINANCE, PLANNING AND ECONOMIC DEVELOPMENT",Money is disbursed through central Ministry of Finance or Treasury,,UG,ESA,1000000024 0010313600241032 Direct Payment/Reimbursement,C01, ,3,1,20,110
1000000024_0010107400241003_03-15-2001-00:00:00_Disbursement,1100001060,1000000024,0010107400241003,Disbursement,2001-03-15T00:00:00.000Z,358048.38,BEF,2001-03-15T00:00:00.000Z,1000000024 G-B-B-30-,IFAD,"MINISTRY OF FINANCE, PLANNING AND ECONOMIC DEVELOPMENT",Money is disbursed through central Ministry of Finance or Treasury,,UG,ESA,1000000024 0010107400241003 Direct Payment/Reimbursement,C01, ,3,1,20,110
1000000024_0010205000241010_02-19-2002-00:00:00_Disbursement,1100001060,1000000024,0010205000241010,Disbursement,2002-02-19T00:00:00.000Z,5869264.56,BEF,2002-02-19T00:00:00.000Z,1000000024 G-B-B-30-,IFAD,"MINISTRY OF FINANCE, PLANNING AND ECONOMIC DEVELOPMENT",Money is disbursed through central Ministry of Finance or Treasury,,UG,ESA,1000000024 0010205000241010 Direct Payment/Reimbursement,C01, ,3,1,20,110
1000000024_0010625800241061_09-15-2006-00:00:00_Disbursement,1100001060,1000000024,0010625800241061,Disbursement,2006-09-15T00:00:00.000Z,658004.48,BEF,2006-09-15T00:00:00.000Z,1000000024 G-B-B-30-,IFAD,"MINISTRY OF FINANCE, PLANNING AND ECONOMIC DEVELOPMENT",Money is disbursed through central Ministry of Finance or Treasury,,UG,ESA,1000000024 0010625800241061 Direct Payment/Reimbursement,C01, ,3,1,20,110
1000000024_0010314300241033_05-23-2003-00:00:00_Disbursement,1100001060,1000000024,0010314300241033,Disbursement,2003-05-23T00:00:00.000Z,2438527.29,BEF,2003-05-23T00:00:00.000Z,1000000024 G-B-B-30-,IFAD,"MINISTRY OF FINANCE, PLANNING AND ECONOMIC DEVELOPMENT",Money is disbursed through central Ministry of Finance or Treasury,,UG,ESA,1000000024 0010314300241033 Direct Payment/Reimbursement,C01, ,3,1,20,110
1000000024_0010602500241056_01-25-2006-00:00:00_Disbursement,1100001060,1000000024,0010602500241056,Disbursement,2006-01-25T00:00:00.000Z,211104.05,BEF,2006-01-25T00:00:00.000Z,1000000024 G-B-B-30-,IFAD,"MINISTRY OF FINANCE, PLANNING AND ECONOMIC DEVELOPMENT",Money is disbursed through central Ministry of Finance or Treasury,,UG,ESA,1000000024 0010602500241056 Direct Payment/Reimbursement,C01, ,3,1,20,110
1000000024_0010512600241051_05-06-2005-00:00:00_Disbursement,1100001060,1000000024,0010512600241051,Disbursement,2005-05-06T00:00:00.000Z,199923.61,BEF,2005-05-06T00:00:00.000Z,1000000024 G-B-B-30-,IFAD,"MINISTRY OF FINANCE, PLANNING AND ECONOMIC DEVELOPMENT",Money is disbursed through central Ministry of Finance or Treasury,,UG,ESA,1000000024 0010512600241051 Direct Payment/Reimbursement,C01, ,3,1,20,110
1000000024_0010311800241030_04-28-2003-00:00:00_Disbursement,1100001060,1000000024,0010311800241030,Disbursement,2003-04-28T00:00:00.000Z,1251726.35,BEF,2003-04-28T00:00:00.000Z,1000000024 G-B-B-30-,IFAD,"MINISTRY OF FINANCE, PLANNING AND ECONOMIC DEVELOPMENT",Money is disbursed through central Ministry of Finance or Treasury,,UG,ESA,1000000024 0010311800241030 Direct Payment/Reimbursement,C01, ,3,1,20,110
1000000024_0010216800241016_06-17-2002-00:00:00_Disbursement,1100001060,1000000024,0010216800241016,Disbursement,2002-06-17T00:00:00.000Z,1751913.66,BEF,2002-06-17T00:00:00.000Z,1000000024 G-B-B-30-,IFAD,"MINISTRY OF FINANCE, PLANNING AND ECONOMIC DEVELOPMENT",Money is disbursed through central Ministry of Finance or Treasury,,UG,ESA,1000000024 0010216800241016 Direct Payment/Reimbursement,C01, ,3,1,20,110
1000000024_0010627000241064_09-27-2006-00:00:00_Disbursement,1100001060,1000000024,0010627000241064,Disbursement,2006-09-27T00:00:00.000Z,585955.01,BEF,2006-09-27T00:00:00.000Z,1000000024 G-B-B-30-,IFAD,"MINISTRY OF FINANCE, PLANNING AND ECONOMIC DEVELOPMENT",Money is disbursed through central Ministry of Finance or Treasury,,UG,ESA,1000000024 0010627000241064 Direct Payment/Reimbursement,C01, ,3,1,20,110
1000000024_0010709400241073_04-04-2007-00:00:00_Disbursement,1100001060,1000000024,0010709400241073,Disbursement,2007-04-04T00:00:00.000Z,551848.8,BEF,2007-04-04T00:00:00.000Z,1000000024 G-B-B-30-,IFAD,"MINISTRY OF FINANCE, PLANNING AND ECONOMIC DEVELOPMENT",Money is disbursed through central Ministry of Finance or Treasury,,UG,ESA,1000000024 0010709400241073 Direct Payment/Reimbursement,C01, ,3,1,20,110
1000000024_0010301600241025_01-16-2003-00:00:00_Disbursement,1100001060,1000000024,0010301600241025,Disbursement,2003-01-16T00:00:00.000Z,3156659.94,BEF,2003-01-16T00:00:00.000Z,1000000024 G-B-B-30-,IFAD,"MINISTRY OF FINANCE, PLANNING AND ECONOMIC DEVELOPMENT",Money is disbursed through central Ministry of Finance or Treasury,,UG,ESA,1000000024 0010301600241025 Direct Payment/Reimbursement,C01, ,3,1,20,110
1000000024_0010627000241065_09-27-2006-00:00:00_Disbursement,1100001060,1000000024,0010627000241065,Disbursement,2006-09-27T00:00:00.000Z,564495.19,BEF,2006-09-27T00:00:00.000Z,1000000024 G-B-B-30-,IFAD,"MINISTRY OF FINANCE, PLANNING AND ECONOMIC DEVELOPMENT",Money is disbursed through central Ministry of Finance or Treasury,,UG,ESA,1000000024 0010627000241065 Direct Payment/Reimbursement,C01, ,3,1,20,110
1000000024_0010131200241007_11-08-2001-00:00:00_Disbursement,1100001060,1000000024,0010131200241007,Disbursement,2001-11-08T00:00:00.000Z,2558246.22,BEF,2001-11-08T00:00:00.000Z,1000000024 G-B-B-30-,IFAD,"MINISTRY OF FINANCE, PLANNING AND ECONOMIC DEVELOPMENT",Money is disbursed through central Ministry of Finance or Treasury,,UG,ESA,1000000024 0010131200241007 Direct Payment/Reimbursement,C01, ,3,1,20,110
1000000024_0010421900241047_08-06-2004-00:00:00_Disbursement,1100001060,1000000024,0010421900241047,Disbursement,2004-08-06T00:00:00.000Z,537724.01,BEF,2004-08-06T00:00:00.000Z,1000000024 G-B-B-30-,IFAD,"MINISTRY OF FINANCE, PLANNING AND ECONOMIC DEVELOPMENT",Money is disbursed through central Ministry of Finance or Treasury,,UG,ESA,1000000024 0010421900241047 Direct Payment/Reimbursement,C01, ,3,1,20,110
1000000024_0010221100241018_07-30-2002-00:00:00_Disbursement,1100001060,1000000024,0010221100241018,Disbursement,2002-07-30T00:00:00.000Z,4143078.42,BEF,2002-07-30T00:00:00.000Z,1000000024 G-B-B-30-,IFAD,"MINISTRY OF FINANCE, PLANNING AND ECONOMIC DEVELOPMENT",Money is disbursed through central Ministry of Finance or Treasury,,UG,ESA,1000000024 0010221100241018 Direct Payment/Reimbursement,C01, ,3,1,20,110
1000000024_0010414000241044_05-19-2004-00:00:00_Disbursement,1100001060,1000000024,0010414000241044,Disbursement,2004-05-19T00:00:00.000Z,1336460.08,BEF,2004-05-19T00:00:00.000Z,1000000024 G-B-B-30-,IFAD,"MINISTRY OF FINANCE, PLANNING AND ECONOMIC DEVELOPMENT",Money is disbursed through central Ministry of Finance or Treasury,,UG,ESA,1000000024 0010414000241044 Direct Payment/Reimbursement,C01, ,3,1,20,110
1000000024_0010531400241055_11-10-2005-00:00:00_Disbursement,1100001060,1000000024,0010531400241055,Disbursement,2005-11-10T00:00:00.000Z,704928.08,BEF,2005-11-10T00:00:00.000Z,1000000024 G-B-B-30-,IFAD,"MINISTRY OF FINANCE, PLANNING AND ECONOMIC DEVELOPMENT",Money is disbursed through central Ministry of Finance or Treasury,,UG,ESA,1000000024 0010531400241055 Direct Payment/Reimbursement,C01, ,3,1,20,110
1000000024_0010620100241075_07-20-2006-00:00:00_Disbursement,1100001060,1000000024,0010620100241075,Disbursement,2006-07-20T00:00:00.000Z,3358883.1,BEF,2006-07-20T00:00:00.000Z,1000000024 G-B-B-30-,IFAD,"MINISTRY OF FINANCE, PLANNING AND ECONOMIC DEVELOPMENT",Money is disbursed through central Ministry of Finance or Treasury,,UG,ESA,1000000024 0010620100241075 Direct Payment/Reimbursement,C01, ,3,1,20,110
1000000024_0010403000241038_01-30-2004-00:00:00_Disbursement,1100001060,1000000024,0010403000241038,Disbursement,2004-01-30T00:00:00.000Z,634603.51,BEF,2004-01-30T00:00:00.000Z,1000000024 G-B-B-30-,IFAD,"MINISTRY OF FINANCE, PLANNING AND ECONOMIC DEVELOPMENT",Money is disbursed through central Ministry of Finance or Treasury,,UG,ESA,1000000024 0010403000241038 Direct Payment/Reimbursement,C01, ,3,1,20,110
1000000024_0010318900241034_07-08-2003-00:00:00_Disbursement,1100001060,1000000024,0010318900241034,Disbursement,2003-07-08T00:00:00.000Z,741720.84,BEF,2003-07-08T00:00:00.000Z,1000000024 G-B-B-30-,IFAD,"MINISTRY OF FINANCE, PLANNING AND ECONOMIC DEVELOPMENT",Money is disbursed through central Ministry of Finance or Treasury,,UG,ESA,1000000024 0010318900241034 Direct Payment/Reimbursement,C01, ,3,1,20,110
1000000024_0010118600241004_07-05-2001-00:00:00_Disbursement,1100001060,1000000024,0010118600241004,Disbursement,2001-07-05T00:00:00.000Z,956998.57,BEF,2001-07-05T00:00:00.000Z,1000000024 G-B-B-30-,IFAD,"MINISTRY OF FINANCE, PLANNING AND ECONOMIC DEVELOPMENT",Money is disbursed through central Ministry of Finance or Treasury,,UG,ESA,1000000024 0010118600241004 Direct Payment/Reimbursement,C01, ,3,1,20,110
1000000024_0010627900241067_10-06-2006-00:00:00_Disbursement,1100001060,1000000024,0010627900241067,Disbursement,2006-10-06T00:00:00.000Z,61522.78,BEF,2006-10-06T00:00:00.000Z,1000000024 G-B-B-30-,IFAD,"MINISTRY OF FINANCE, PLANNING AND ECONOMIC DEVELOPMENT",Money is disbursed through central Ministry of Finance or Treasury,,UG,ESA,1000000024 0010627900241067 Direct Payment/Reimbursement,C01, ,3,1,20,110
1000000025__05-03-2000-00:00:00_Commitment,1100001144,1000000025,,Commitment,2000-05-03T00:00:00.000Z,98076215.02,BEF,2000-05-03T00:00:00.000Z,1000000025 G-B-B-31-,IFAD,MINISTERE DE LA PROMOTION ECONOMIQUE ET DU DEVELOPPEMENT,Money is disbursed through central Ministry of Finance or Treasury,,TD,WCA,1000000025 GRANTS,C01, ,2,1,20,110
1000000025_0010719100251015_07-10-2007-00:00:00_Disbursement,1100001144,1000000025,0010719100251015,Disbursement,2007-07-10T00:00:00.000Z,5327891.08,BEF,2007-07-10T00:00:00.000Z,1000000025 G-B-B-31-,IFAD,MINISTERE DE LA PROMOTION ECONOMIQUE ET DU DEVELOPPEMENT,Money is disbursed through central Ministry of Finance or Treasury,,TD,WCA,1000000025 0010719100251015 Direct Payment/Reimbursement,C01, ,3,1,20,110
1000000025_0010812800251023_05-07-2008-00:00:00_Disbursement,1100001144,1000000025,0010812800251023,Disbursement,2008-05-07T00:00:00.000Z,1684883.46,BEF,2008-05-07T00:00:00.000Z,1000000025 G-B-B-31-,IFAD,MINISTERE DE LA PROMOTION ECONOMIQUE ET DU DEVELOPPEMENT,Money is disbursed through central Ministry of Finance or Treasury,,TD,WCA,1000000025 0010812800251023 Direct Payment/Reimbursement,C01, ,3,1,20,110
1000000025_0010727600251018_10-03-2007-00:00:00_Disbursement,1100001144,1000000025,0010727600251018,Disbursement,2007-10-03T00:00:00.000Z,5060882.9,BEF,2007-10-03T00:00:00.000Z,1000000025 G-B-B-31-,IFAD,MINISTERE DE LA PROMOTION ECONOMIQUE ET DU DEVELOPPEMENT,Money is disbursed through central Ministry of Finance or Treasury,,TD,WCA,1000000025 0010727600251018 Direct Payment/Reimbursement,C01, ,3,1,20,110
1000000025_0010707400251012_03-15-2007-00:00:00_Disbursement,1100001144,1000000025,0010707400251012,Disbursement,2007-03-15T00:00:00.000Z,3569909.3,BEF,2007-03-15T00:00:00.000Z,1000000025 G-B-B-31-,IFAD,MINISTERE DE LA PROMOTION ECONOMIQUE ET DU DEVELOPPEMENT,Money is disbursed through central Ministry of Finance or Treasury,,TD,WCA,1000000025 0010707400251012 Direct Payment/Reimbursement,C01, ,3,1,20,110
1000000025_0010613600251005_05-16-2006-00:00:00_Disbursement,1100001144,1000000025,0010613600251005,Disbursement,2006-05-16T00:00:00.000Z,7612956.42,BEF,2006-05-16T00:00:00.000Z,1000000025 G-B-B-31-,IFAD,MINISTERE DE LA PROMOTION ECONOMIQUE ET DU DEVELOPPEMENT,Money is disbursed through central Ministry of Finance or Treasury,,TD,WCA,1000000025 0010613600251005 Direct Payment/Reimbursement,C01, ,3,1,20,110
1000000025_0010622300251008_08-11-2006-00:00:00_Disbursement,1100001144,1000000025,0010622300251008,Disbursement,2006-08-11T00:00:00.000Z,1916798.35,BEF,2006-08-11T00:00:00.000Z,1000000025 G-B-B-31-,IFAD,MINISTERE DE LA PROMOTION ECONOMIQUE ET DU DEVELOPPEMENT,Money is disbursed through central Ministry of Finance or Treasury,,TD,WCA,1000000025 0010622300251008 Direct Payment/Reimbursement,C01, ,3,1,20,110
1000000025_0010616000251006_06-09-2006-00:00:00_Disbursement,1100001144,1000000025,0010616000251006,Disbursement,2006-06-09T00:00:00.000Z,1239795.19,BEF,2006-06-09T00:00:00.000Z,1000000025 G-B-B-31-,IFAD,MINISTERE DE LA PROMOTION ECONOMIQUE ET DU DEVELOPPEMENT,Money is disbursed through central Ministry of Finance or Treasury,,TD,WCA,1000000025 0010616000251006 Direct Payment/Reimbursement,C01, ,3,1,20,110
1000000025_0010727500251020_10-02-2007-00:00:00_Disbursement,1100001144,1000000025,0010727500251020,Disbursement,2007-10-02T00:00:00.000Z,804789.07,BEF,2007-10-02T00:00:00.000Z,1000000025 G-B-B-31-,IFAD,MINISTERE DE LA PROMOTION ECONOMIQUE ET DU DEVELOPPEMENT,Money is disbursed through central Ministry of Finance or Treasury,,TD,WCA,1000000025 0010727500251020 Direct Payment/Reimbursement,C01, ,3,1,20,110
1000000025_0010804600251022_02-15-2008-00:00:00_Disbursement,1100001144,1000000025,0010804600251022,Disbursement,2008-02-15T00:00:00.000Z,871792.03,BEF,2008-02-15T00:00:00.000Z,1000000025 G-B-B-31-,IFAD,MINISTERE DE LA PROMOTION ECONOMIQUE ET DU DEVELOPPEMENT,Money is disbursed through central Ministry of Finance or Treasury,,TD,WCA,1000000025 0010804600251022 Direct Payment/Reimbursement,C01, ,3,1,20,110
1000000025_0010917500251028_06-24-2009-00:00:00_Disbursement,1100001144,1000000025,0010917500251028,Disbursement,2009-06-24T00:00:00.000Z,909333.15,BEF,2009-06-24T00:00:00.000Z,1000000025 G-B-B-31-,IFAD,MINISTERE DE LA PROMOTION ECONOMIQUE ET DU DEVELOPPEMENT,Money is disbursed through central Ministry of Finance or Treasury,,TD,WCA,1000000025 0010917500251028 Direct Payment/Reimbursement,C01, ,3,1,20,110
1000000025_0010727500251019_10-02-2007-00:00:00_Disbursement,1100001144,1000000025,0010727500251019,Disbursement,2007-10-02T00:00:00.000Z,3727605.23,BEF,2007-10-02T00:00:00.000Z,1000000025 G-B-B-31-,IFAD,MINISTERE DE LA PROMOTION ECONOMIQUE ET DU DEVELOPPEMENT,Money is disbursed through central Ministry of Finance or Treasury,,TD,WCA,1000000025 0010727500251019 Direct Payment/Reimbursement,C01, ,3,1,20,110
1000000025_0010216200251001_06-11-2002-00:00:00_Disbursement,1100001144,1000000025,0010216200251001,Disbursement,2002-06-11T00:00:00.000Z,11116391.66,BEF,2002-06-11T00:00:00.000Z,1000000025 G-B-B-31-,IFAD,MINISTERE DE LA PROMOTION ECONOMIQUE ET DU DEVELOPPEMENT,Money is disbursed through central Ministry of Finance or Treasury,,TD,WCA,1000000025 0010216200251001 Direct Payment/Reimbursement,C01, ,3,1,20,110
1000000025_0010804600251021_02-15-2008-00:00:00_Disbursement,1100001144,1000000025,0010804600251021,Disbursement,2008-02-15T00:00:00.000Z,2612605.56,BEF,2008-02-15T00:00:00.000Z,1000000025 G-B-B-31-,IFAD,MINISTERE DE LA PROMOTION ECONOMIQUE ET DU DEVELOPPEMENT,Money is disbursed through central Ministry of Finance or Treasury,,TD,WCA,1000000025 0010804600251021 Direct Payment/Reimbursement,C01, ,3,1,20,110
1000000025_0010834500251024_12-10-2008-00:00:00_Disbursement,1100001144,1000000025,0010834500251024,Disbursement,2008-12-10T00:00:00.000Z,3071754.7,BEF,2008-12-10T00:00:00.000Z,1000000025 G-B-B-31-,IFAD,MINISTERE DE LA PROMOTION ECONOMIQUE ET DU DEVELOPPEMENT,Money is disbursed through central Ministry of Finance or Treasury,,TD,WCA,1000000025 0010834500251024 Direct Payment/Reimbursement,C01, ,3,1,20,110
1000000025_0011010900251038_04-19-2010-00:00:00_Disbursement,1100001144,1000000025,0011010900251038,Disbursement,2010-04-19T00:00:00.000Z,3383466.35,BEF,2010-04-19T00:00:00.000Z,1000000025 G-B-B-31-,IFAD,MINISTERE DE LA PROMOTION ECONOMIQUE ET DU DEVELOPPEMENT,Money is disbursed through central Ministry of Finance or Treasury,,TD,WCA,1000000025 0011010900251038 Direct Payment/Reimbursement,C01, ,3,1,20,110
1000000025_0010930600251035_11-02-2009-00:00:00_Disbursement,1100001144,1000000025,0010930600251035,Disbursement,2009-11-02T00:00:00.000Z,1734586.25,BEF,2009-11-02T00:00:00.000Z,1000000025 G-B-B-31-,IFAD,MINISTERE DE LA PROMOTION ECONOMIQUE ET DU DEVELOPPEMENT,Money is disbursed through central Ministry of Finance or Treasury,,TD,WCA,1000000025 0010930600251035 Direct Payment/Reimbursement,C01, ,3,1,20,110
1000000025_0010923200251031_08-20-2009-00:00:00_Disbursement,1100001144,1000000025,0010923200251031,Disbursement,2009-08-20T00:00:00.000Z,1114155.36,BEF,2009-08-20T00:00:00.000Z,1000000025 G-B-B-31-,IFAD,MINISTERE DE LA PROMOTION ECONOMIQUE ET DU DEVELOPPEMENT,Money is disbursed through central Ministry of Finance or Treasury,,TD,WCA,1000000025 0010923200251031 Direct Payment/Reimbursement,C01, ,3,1,20,110
1000000025_0011019000251040_07-09-2010-00:00:00_Disbursement,1100001144,1000000025,0011019000251040,Disbursement,2010-07-09T00:00:00.000Z,1542989.48,BEF,2010-07-09T00:00:00.000Z,1000000025 G-B-B-31-,IFAD,MINISTERE DE LA PROMOTION ECONOMIQUE ET DU DEVELOPPEMENT,Money is disbursed through central Ministry of Finance or Treasury,,TD,WCA,1000000025 0011019000251040 Direct Payment/Reimbursement,C01, ,3,1,20,110
1000000025_0011002700251037_01-27-2010-00:00:00_Disbursement,1100001144,1000000025,0011002700251037,Disbursement,2010-01-27T00:00:00.000Z,710086.72,BEF,2010-01-27T00:00:00.000Z,1000000025 G-B-B-31-,IFAD,MINISTERE DE LA PROMOTION ECONOMIQUE ET DU DEVELOPPEMENT,Money is disbursed through central Ministry of Finance or Treasury,,TD,WCA,1000000025 0011002700251037 Direct Payment/Reimbursement,C01, ,3,1,20,110
1000000025_0010622300251007_08-11-2006-00:00:00_Disbursement,1100001144,1000000025,0010622300251007,Disbursement,2006-08-11T00:00:00.000Z,1733049.3,BEF,2006-08-11T00:00:00.000Z,1000000025 G-B-B-31-,IFAD,MINISTERE DE LA PROMOTION ECONOMIQUE ET DU DEVELOPPEMENT,Money is disbursed through central Ministry of Finance or Treasury,,TD,WCA,1000000025 0010622300251007 Direct Payment/Reimbursement,C01, ,3,1,20,110
1000000025_0010412100251003_04-30-2004-00:00:00_Disbursement,1100001144,1000000025,0010412100251003,Disbursement,2004-04-30T00:00:00.000Z,3793529.1,BEF,2004-04-30T00:00:00.000Z,1000000025 G-B-B-31-,IFAD,MINISTERE DE LA PROMOTION ECONOMIQUE ET DU DEVELOPPEMENT,Money is disbursed through central Ministry of Finance or Treasury,,TD,WCA,1000000025 0010412100251003 Direct Payment/Reimbursement,C01, ,3,1,20,110
1000000025_0010706100251011_03-02-2007-00:00:00_Disbursement,1100001144,1000000025,0010706100251011,Disbursement,2007-03-02T00:00:00.000Z,-15934.55,BEF,2007-03-02T00:00:00.000Z,1000000025 G-B-B-31-,IFAD,MINISTERE DE LA PROMOTION ECONOMIQUE ET DU DEVELOPPEMENT,Money is disbursed through central Ministry of Finance or Treasury,,TD,WCA,1000000025 0010706100251011 Direct Payment/Reimbursement,C01, ,3,1,20,110
1000000025_0010411300251002_04-22-2004-00:00:00_Disbursement,1100001144,1000000025,0010411300251002,Disbursement,2004-04-22T00:00:00.000Z,779736.38,BEF,2004-04-22T00:00:00.000Z,1000000025 G-B-B-31-,IFAD,MINISTERE DE LA PROMOTION ECONOMIQUE ET DU DEVELOPPEMENT,Money is disbursed through central Ministry of Finance or Treasury,,TD,WCA,1000000025 0010411300251002 Direct Payment/Reimbursement,C01, ,3,1,20,110
1000000025_0010910000251027_04-10-2009-00:00:00_Disbursement,1100001144,1000000025,0010910000251027,Disbursement,2009-04-10T00:00:00.000Z,2609898.34,BEF,2009-04-10T00:00:00.000Z,1000000025 G-B-B-31-,IFAD,MINISTERE DE LA PROMOTION ECONOMIQUE ET DU DEVELOPPEMENT,Money is disbursed through central Ministry of Finance or Treasury,,TD,WCA,1000000025 0010910000251027 Direct Payment/Reimbursement,C01, ,3,1,20,110
1000000025_0011010600251039_04-16-2010-00:00:00_Disbursement,1100001144,1000000025,0011010600251039,Disbursement,2010-04-16T00:00:00.000Z,620324.8,BEF,2010-04-16T00:00:00.000Z,1000000025 G-B-B-31-,IFAD,MINISTERE DE LA PROMOTION ECONOMIQUE ET DU DEVELOPPEMENT,Money is disbursed through central Ministry of Finance or Treasury,,TD,WCA,1000000025 0011010600251039 Direct Payment/Reimbursement,C01, ,3,1,20,110
1000000025_0010921200251029_07-31-2009-00:00:00_Disbursement,1100001144,1000000025,0010921200251029,Disbursement,2009-07-31T00:00:00.000Z,701074.79,BEF,2009-07-31T00:00:00.000Z,1000000025 G-B-B-31-,IFAD,MINISTERE DE LA PROMOTION ECONOMIQUE ET DU DEVELOPPEMENT,Money is disbursed through central Ministry of Finance or Treasury,,TD,WCA,1000000025 0010921200251029 Direct Payment/Reimbursement,C01, ,3,1,20,110
1000000025_0010711500251014_04-25-2007-00:00:00_Disbursement,1100001144,1000000025,0010711500251014,Disbursement,2007-04-25T00:00:00.000Z,690099.51,BEF,2007-04-25T00:00:00.000Z,1000000025 G-B-B-31-,IFAD,MINISTERE DE LA PROMOTION ECONOMIQUE ET DU DEVELOPPEMENT,Money is disbursed through central Ministry of Finance or Treasury,,TD,WCA,1000000025 0010711500251014 Direct Payment/Reimbursement,C01, ,3,1,20,110
1000000025_0011002700251036_01-27-2010-00:00:00_Disbursement,1100001144,1000000025,0011002700251036,Disbursement,2010-01-27T00:00:00.000Z,724299.68,BEF,2010-01-27T00:00:00.000Z,1000000025 G-B-B-31-,IFAD,MINISTERE DE LA PROMOTION ECONOMIQUE ET DU DEVELOPPEMENT,Money is disbursed through central Ministry of Finance or Treasury,,TD,WCA,1000000025 0011002700251036 Direct Payment/Reimbursement,C01, ,3,1,20,110
1000000025_0010910000251025_04-10-2009-00:00:00_Disbursement,1100001144,1000000025,0010910000251025,Disbursement,2009-04-10T00:00:00.000Z,1120622.25,BEF,2009-04-10T00:00:00.000Z,1000000025 G-B-B-31-,IFAD,MINISTERE DE LA PROMOTION ECONOMIQUE ET DU DEVELOPPEMENT,Money is disbursed through central Ministry of Finance or Treasury,,TD,WCA,1000000025 0010910000251025 Direct Payment/Reimbursement,C01, ,3,1,20,110
1000000025_0010911000251026_04-20-2009-00:00:00_Disbursement,1100001144,1000000025,0010911000251026,Disbursement,2009-04-20T00:00:00.000Z,3708110.57,BEF,2009-04-20T00:00:00.000Z,1000000025 G-B-B-31-,IFAD,MINISTERE DE LA PROMOTION ECONOMIQUE ET DU DEVELOPPEMENT,Money is disbursed through central Ministry of Finance or Treasury,,TD,WCA,1000000025 0010911000251026 Direct Payment/Reimbursement,C01, ,3,1,20,110
1000000025_0010507000251004_03-11-2005-00:00:00_Disbursement,1100001144,1000000025,0010507000251004,Disbursement,2005-03-11T00:00:00.000Z,3306907.27,BEF,2005-03-11T00:00:00.000Z,1000000025 G-B-B-31-,IFAD,MINISTERE DE LA PROMOTION ECONOMIQUE ET DU DEVELOPPEMENT,Money is disbursed through central Ministry of Finance or Treasury,,TD,WCA,1000000025 0010507000251004 Direct Payment/Reimbursement,C01, ,3,1,20,110
1000000025_0010706100251010_03-02-2007-00:00:00_Disbursement,1100001144,1000000025,0010706100251010,Disbursement,2007-03-02T00:00:00.000Z,1601623.52,BEF,2007-03-02T00:00:00.000Z,1000000025 G-B-B-31-,IFAD,MINISTERE DE LA PROMOTION ECONOMIQUE ET DU DEVELOPPEMENT,Money is disbursed through central Ministry of Finance or Treasury,,TD,WCA,1000000025 0010706100251010 Direct Payment/Reimbursement,C01, ,3,1,20,110
1000000025_0010703200251009_02-01-2007-00:00:00_Disbursement,1100001144,1000000025,0010703200251009,Disbursement,2007-02-01T00:00:00.000Z,4310587.79,BEF,2007-02-01T00:00:00.000Z,1000000025 G-B-B-31-,IFAD,MINISTERE DE LA PROMOTION ECONOMIQUE ET DU DEVELOPPEMENT,Money is disbursed through central Ministry of Finance or Treasury,,TD,WCA,1000000025 0010703200251009 Direct Payment/Reimbursement,C01, ,3,1,20,110
1000000025_0010930600251034_11-02-2009-00:00:00_Disbursement,1100001144,1000000025,0010930600251034,Disbursement,2009-11-02T00:00:00.000Z,709839.44,BEF,2009-11-02T00:00:00.000Z,1000000025 G-B-B-31-,IFAD,MINISTERE DE LA PROMOTION ECONOMIQUE ET DU DEVELOPPEMENT,Money is disbursed through central Ministry of Finance or Treasury,,TD,WCA,1000000025 0010930600251034 Direct Payment/Reimbursement,C01, ,3,1,20,110
1000000025_0010921900251030_08-07-2009-00:00:00_Disbursement,1100001144,1000000025,0010921900251030,Disbursement,2009-08-07T00:00:00.000Z,1460572.24,BEF,2009-08-07T00:00:00.000Z,1000000025 G-B-B-31-,IFAD,MINISTERE DE LA PROMOTION ECONOMIQUE ET DU DEVELOPPEMENT,Money is disbursed through central Ministry of Finance or Treasury,,TD,WCA,1000000025 0010921900251030 Direct Payment/Reimbursement,C01, ,3,1,20,110
1000000025_0010923200251032_08-20-2009-00:00:00_Disbursement,1100001144,1000000025,0010923200251032,Disbursement,2009-08-20T00:00:00.000Z,628110.4,BEF,2009-08-20T00:00:00.000Z,1000000025 G-B-B-31-,IFAD,MINISTERE DE LA PROMOTION ECONOMIQUE ET DU DEVELOPPEMENT,Money is disbursed through central Ministry of Finance or Treasury,,TD,WCA,1000000025 0010923200251032 Direct Payment/Reimbursement,C01, ,3,1,20,110
1000000025_0010727000251017_09-27-2007-00:00:00_Disbursement,1100001144,1000000025,0010727000251017,Disbursement,2007-09-27T00:00:00.000Z,3146463.79,BEF,2007-09-27T00:00:00.000Z,1000000025 G-B-B-31-,IFAD,MINISTERE DE LA PROMOTION ECONOMIQUE ET DU DEVELOPPEMENT,Money is disbursed through central Ministry of Finance or Treasury,,TD,WCA,1000000025 0010727000251017 Direct Payment/Reimbursement,C01, ,3,1,20,110
1000000025_0010724900251016_09-06-2007-00:00:00_Disbursement,1100001144,1000000025,0010724900251016,Disbursement,2007-09-06T00:00:00.000Z,927687.4,BEF,2007-09-06T00:00:00.000Z,1000000025 G-B-B-31-,IFAD,MINISTERE DE LA PROMOTION ECONOMIQUE ET DU DEVELOPPEMENT,Money is disbursed through central Ministry of Finance or Treasury,,TD,WCA,1000000025 0010724900251016 Direct Payment/Reimbursement,C01, ,3,1,20,110
1000000025_0010923800251033_08-26-2009-00:00:00_Disbursement,1100001144,1000000025,0010923800251033,Disbursement,2009-08-26T00:00:00.000Z,4079328.82,BEF,2009-08-26T00:00:00.000Z,1000000025 G-B-B-31-,IFAD,MINISTERE DE LA PROMOTION ECONOMIQUE ET DU DEVELOPPEMENT,Money is disbursed through central Ministry of Finance or Treasury,,TD,WCA,1000000025 0010923800251033 Direct Payment/Reimbursement,C01, ,3,1,20,110
1000000025_0010710600251013_04-16-2007-00:00:00_Disbursement,1100001144,1000000025,0010710600251013,Disbursement,2007-04-16T00:00:00.000Z,3427611.92,BEF,2007-04-16T00:00:00.000Z,1000000025 G-B-B-31-,IFAD,MINISTERE DE LA PROMOTION ECONOMIQUE ET DU DEVELOPPEMENT,Money is disbursed through central Ministry of Finance or Treasury,,TD,WCA,1000000025 0010710600251013 Direct Payment/Reimbursement,C01, ,3,1,20,110
1000000027__12-07-2000-00:00:00_Commitment,1100001114,1000000027,,Commitment,2000-12-07T00:00:00.000Z,175194361.58,BEF,2000-12-07T00:00:00.000Z,1000000027 G-B-B-33-,IFAD,MINISTRY OF FINANCE - DEBT MANAGEMENT DEPARTMENT,Money is disbursed through central Ministry of Finance or Treasury,,KE,ESA,1000000027 GRANTS,C01, ,2,1,20,110
1000000027_0010531800271033_11-14-2005-00:00:00_Disbursement,1100001114,1000000027,0010531800271033,Disbursement,2005-11-14T00:00:00.000Z,155673.31,BEF,2005-11-14T00:00:00.000Z,1000000027 G-B-B-33-,IFAD,MINISTRY OF FINANCE - DEBT MANAGEMENT DEPARTMENT,Money is disbursed through central Ministry of Finance or Treasury,,KE,ESA,1000000027 0010531800271033 Direct Payment/Reimbursement,C01, ,3,1,20,110
1000000027_0010927400271062_10-01-2009-00:00:00_Disbursement,1100001114,1000000027,0010927400271062,Disbursement,2009-10-01T00:00:00.000Z,859601.58,BEF,2009-10-01T00:00:00.000Z,1000000027 G-B-B-33-,IFAD,MINISTRY OF FINANCE - DEBT MANAGEMENT DEPARTMENT,Money is disbursed through central Ministry of Finance or Treasury,,KE,ESA,1000000027 0010927400271062 Direct Payment/Reimbursement,C01, ,3,1,20,110
1000000027_0010919500271061_07-14-2009-00:00:00_Disbursement,1100001114,1000000027,0010919500271061,Disbursement,2009-07-14T00:00:00.000Z,1154745.07,BEF,2009-07-14T00:00:00.000Z,1000000027 G-B-B-33-,IFAD,MINISTRY OF FINANCE - DEBT MANAGEMENT DEPARTMENT,Money is disbursed through central Ministry of Finance or Treasury,,KE,ESA,1000000027 0010919500271061 Direct Payment/Reimbursement,C01, ,3,1,20,110
1000000027_0010928700271063_10-14-2009-00:00:00_Disbursement,1100001114,1000000027,0010928700271063,Disbursement,2009-10-14T00:00:00.000Z,790939.58,BEF,2009-10-14T00:00:00.000Z,1000000027 G-B-B-33-,IFAD,MINISTRY OF FINANCE - DEBT MANAGEMENT DEPARTMENT,Money is disbursed through central Ministry of Finance or Treasury,,KE,ESA,1000000027 0010928700271063 Direct Payment/Reimbursement,C01, ,3,1,20,110
1000000027_0010930000271064_10-27-2009-00:00:00_Disbursement,1100001114,1000000027,0010930000271064,Disbursement,2009-10-27T00:00:00.000Z,884315.42,BEF,2009-10-27T00:00:00.000Z,1000000027 G-B-B-33-,IFAD,MINISTRY OF FINANCE - DEBT MANAGEMENT DEPARTMENT,Money is disbursed through central Ministry of Finance or Treasury,,KE,ESA,1000000027 0010930000271064 Direct Payment/Reimbursement,C01, ,3,1,20,110
1000000027_0010627900271044_10-06-2006-00:00:00_Disbursement,1100001114,1000000027,0010627900271044,Disbursement,2006-10-06T00:00:00.000Z,1085456.58,BEF,2006-10-06T00:00:00.000Z,1000000027 G-B-B-33-,IFAD,MINISTRY OF FINANCE - DEBT MANAGEMENT DEPARTMENT,Money is disbursed through central Ministry of Finance or Treasury,,KE,ESA,1000000027 0010627900271044 Direct Payment/Reimbursement,C01, ,3,1,20,110
1000000027_0010627700271041_10-04-2006-00:00:00_Disbursement,1100001114,1000000027,0010627700271041,Disbursement,2006-10-04T00:00:00.000Z,1514949.47,BEF,2006-10-04T00:00:00.000Z,1000000027 G-B-B-33-,IFAD,MINISTRY OF FINANCE - DEBT MANAGEMENT DEPARTMENT,Money is disbursed through central Ministry of Finance or Treasury,,KE,ESA,1000000027 0010627700271041 Direct Payment/Reimbursement,C01, ,3,1,20,110
1000000027_0010935500271065_12-21-2009-00:00:00_Disbursement,1100001114,1000000027,0010935500271065,Disbursement,2009-12-21T00:00:00.000Z,2330163.49,BEF,2009-12-21T00:00:00.000Z,1000000027 G-B-B-33-,IFAD,MINISTRY OF FINANCE - DEBT MANAGEMENT DEPARTMENT,Money is disbursed through central Ministry of Finance or Treasury,,KE,ESA,1000000027 0010935500271065 Direct Payment/Reimbursement,C01, ,3,1,20,110
1000000027_0010205300271002_02-22-2002-00:00:00_Disbursement,1100001114,1000000027,0010205300271002,Disbursement,2002-02-22T00:00:00.000Z,1919182.01,BEF,2002-02-22T00:00:00.000Z,1000000027 G-B-B-33-,IFAD,MINISTRY OF FINANCE - DEBT MANAGEMENT DEPARTMENT,Money is disbursed through central Ministry of Finance or Treasury,,KE,ESA,1000000027 0010205300271002 Direct Payment/Reimbursement,C01, ,3,1,20,110
1000000027_0010628400271046_10-11-2006-00:00:00_Disbursement,1100001114,1000000027,0010628400271046,Disbursement,2006-10-11T00:00:00.000Z,3840452.28,BEF,2006-10-11T00:00:00.000Z,1000000027 G-B-B-33-,IFAD,MINISTRY OF FINANCE - DEBT MANAGEMENT DEPARTMENT,Money is disbursed through central Ministry of Finance or Treasury,,KE,ESA,1000000027 0010628400271046 Direct Payment/Reimbursement,C01, ,3,1,20,110
1000000027_0010513900271024_05-19-2005-00:00:00_Disbursement,1100001114,1000000027,0010513900271024,Disbursement,2005-05-19T00:00:00.000Z,1614427.17,BEF,2005-05-19T00:00:00.000Z,1000000027 G-B-B-33-,IFAD,MINISTRY OF FINANCE - DEBT MANAGEMENT DEPARTMENT,Money is disbursed through central Ministry of Finance or Treasury,,KE,ESA,1000000027 0010513900271024 Direct Payment/Reimbursement,C01, ,3,1,20,110
1000000027_0010411800271013_04-27-2004-00:00:00_Disbursement,1100001114,1000000027,0010411800271013,Disbursement,2004-04-27T00:00:00.000Z,1263805.8,BEF,2004-04-27T00:00:00.000Z,1000000027 G-B-B-33-,IFAD,MINISTRY OF FINANCE - DEBT MANAGEMENT DEPARTMENT,Money is disbursed through central Ministry of Finance or Treasury,,KE,ESA,1000000027 0010411800271013 Direct Payment/Reimbursement,C01, ,3,1,20,110
1000000027_0010518200271025_07-01-2005-00:00:00_Disbursement,1100001114,1000000027,0010518200271025,Disbursement,2005-07-01T00:00:00.000Z,1475360.65,BEF,2005-07-01T00:00:00.000Z,1000000027 G-B-B-33-,IFAD,MINISTRY OF FINANCE - DEBT MANAGEMENT DEPARTMENT,Money is disbursed through central Ministry of Finance or Treasury,,KE,ESA,1000000027 0010518200271025 Direct Payment/Reimbursement,C01, ,3,1,20,110
1000000027_0010417500271016_06-23-2004-00:00:00_Disbursement,1100001114,1000000027,0010417500271016,Disbursement,2004-06-23T00:00:00.000Z,158401.88,BEF,2004-06-23T00:00:00.000Z,1000000027 G-B-B-33-,IFAD,MINISTRY OF FINANCE - DEBT MANAGEMENT DEPARTMENT,Money is disbursed through central Ministry of Finance or Treasury,,KE,ESA,1000000027 0010417500271016 Direct Payment/Reimbursement,C01, ,3,1,20,110
1000000027_0010627700271042_10-04-2006-00:00:00_Disbursement,1100001114,1000000027,0010627700271042,Disbursement,2006-10-04T00:00:00.000Z,1929035.47,BEF,2006-10-04T00:00:00.000Z,1000000027 G-B-B-33-,IFAD,MINISTRY OF FINANCE - DEBT MANAGEMENT DEPARTMENT,Money is disbursed through central Ministry of Finance or Treasury,,KE,ESA,1000000027 0010627700271042 Direct Payment/Reimbursement,C01, ,3,1,20,110
1000000027_0010414000271014_05-19-2004-00:00:00_Disbursement,1100001114,1000000027,0010414000271014,Disbursement,2004-05-19T00:00:00.000Z,79981.11,BEF,2004-05-19T00:00:00.000Z,1000000027 G-B-B-33-,IFAD,MINISTRY OF FINANCE - DEBT MANAGEMENT DEPARTMENT,Money is disbursed through central Ministry of Finance or Treasury,,KE,ESA,1000000027 0010414000271014 Direct Payment/Reimbursement,C01, ,3,1,20,110
1000000027_0010524900271028_09-06-2005-00:00:00_Disbursement,1100001114,1000000027,0010524900271028,Disbursement,2005-09-06T00:00:00.000Z,295927.54,BEF,2005-09-06T00:00:00.000Z,1000000027 G-B-B-33-,IFAD,MINISTRY OF FINANCE - DEBT MANAGEMENT DEPARTMENT,Money is disbursed through central Ministry of Finance or Treasury,,KE,ESA,1000000027 0010524900271028 Direct Payment/Reimbursement,C01, ,3,1,20,110
1000000027_0010627700271040_10-04-2006-00:00:00_Disbursement,1100001114,1000000027,0010627700271040,Disbursement,2006-10-04T00:00:00.000Z,629033.41,BEF,2006-10-04T00:00:00.000Z,1000000027 G-B-B-33-,IFAD,MINISTRY OF FINANCE - DEBT MANAGEMENT DEPARTMENT,Money is disbursed through central Ministry of Finance or Treasury,,KE,ESA,1000000027 0010627700271040 Direct Payment/Reimbursement,C01, ,3,1,20,110
1000000027_0010628500271048_10-12-2006-00:00:00_Disbursement,1100001114,1000000027,0010628500271048,Disbursement,2006-10-12T00:00:00.000Z,4249982.72,BEF,2006-10-12T00:00:00.000Z,1000000027 G-B-B-33-,IFAD,MINISTRY OF FINANCE - DEBT MANAGEMENT DEPARTMENT,Money is disbursed through central Ministry of Finance or Treasury,,KE,ESA,1000000027 0010628500271048 Direct Payment/Reimbursement,C01, ,3,1,20,110
1000000027_0010405000271012_02-19-2004-00:00:00_Disbursement,1100001114,1000000027,0010405000271012,Disbursement,2004-02-19T00:00:00.000Z,6173571.91,BEF,2004-02-19T00:00:00.000Z,1000000027 G-B-B-33-,IFAD,MINISTRY OF FINANCE - DEBT MANAGEMENT DEPARTMENT,Money is disbursed through central Ministry of Finance or Treasury,,KE,ESA,1000000027 0010405000271012 Direct Payment/Reimbursement,C01, ,3,1,20,110
1000000027_0010627900271045_10-06-2006-00:00:00_Disbursement,1100001114,1000000027,0010627900271045,Disbursement,2006-10-06T00:00:00.000Z,1012376.63,BEF,2006-10-06T00:00:00.000Z,1000000027 G-B-B-33-,IFAD,MINISTRY OF FINANCE - DEBT MANAGEMENT DEPARTMENT,Money is disbursed through central Ministry of Finance or Treasury,,KE,ESA,1000000027 0010627900271045 Direct Payment/Reimbursement,C01, ,3,1,20,110
1000000027_0010703600271049_02-05-2007-00:00:00_Disbursement,1100001114,1000000027,0010703600271049,Disbursement,2007-02-05T00:00:00.000Z,1427419.48,BEF,2007-02-05T00:00:00.000Z,1000000027 G-B-B-33-,IFAD,MINISTRY OF FINANCE - DEBT MANAGEMENT DEPARTMENT,Money is disbursed through central Ministry of Finance or Treasury,,KE,ESA,1000000027 0010703600271049 Direct Payment/Reimbursement,C01, ,3,1,20,110
1000000027_0010531800271035_11-14-2005-00:00:00_Disbursement,1100001114,1000000027,0010531800271035,Disbursement,2005-11-14T00:00:00.000Z,966296.58,BEF,2005-11-14T00:00:00.000Z,1000000027 G-B-B-33-,IFAD,MINISTRY OF FINANCE - DEBT MANAGEMENT DEPARTMENT,Money is disbursed through central Ministry of Finance or Treasury,,KE,ESA,1000000027 0010531800271035 Direct Payment/Reimbursement,C01, ,3,1,20,110
1000000027_0010433100271020_11-26-2004-00:00:00_Disbursement,1100001114,1000000027,0010433100271020,Disbursement,2004-11-26T00:00:00.000Z,5035440.93,BEF,2004-11-26T00:00:00.000Z,1000000027 G-B-B-33-,IFAD,MINISTRY OF FINANCE - DEBT MANAGEMENT DEPARTMENT,Money is disbursed through central Ministry of Finance or Treasury,,KE,ESA,1000000027 0010433100271020 Direct Payment/Reimbursement,C01, ,3,1,20,110
1000000027_0010605500271036_02-24-2006-00:00:00_Disbursement,1100001114,1000000027,0010605500271036,Disbursement,2006-02-24T00:00:00.000Z,1323681.39,BEF,2006-02-24T00:00:00.000Z,1000000027 G-B-B-33-,IFAD,MINISTRY OF FINANCE - DEBT MANAGEMENT DEPARTMENT,Money is disbursed through central Ministry of Finance or Treasury,,KE,ESA,1000000027 0010605500271036 Direct Payment/Reimbursement,C01, ,3,1,20,110
1000000027_0010400900271010_01-09-2004-00:00:00_Disbursement,1100001114,1000000027,0010400900271010,Disbursement,2004-01-09T00:00:00.000Z,4943801.99,BEF,2004-01-09T00:00:00.000Z,1000000027 G-B-B-33-,IFAD,MINISTRY OF FINANCE - DEBT MANAGEMENT DEPARTMENT,Money is disbursed through central Ministry of Finance or Treasury,,KE,ESA,1000000027 0010400900271010 Direct Payment/Reimbursement,C01, ,3,1,20,110
1000000027_0010914800271060_05-28-2009-00:00:00_Disbursement,1100001114,1000000027,0010914800271060,Disbursement,2009-05-28T00:00:00.000Z,884064.04,BEF,2009-05-28T00:00:00.000Z,1000000027 G-B-B-33-,IFAD,MINISTRY OF FINANCE - DEBT MANAGEMENT DEPARTMENT,Money is disbursed through central Ministry of Finance or Treasury,,KE,ESA,1000000027 0010914800271060 Direct Payment/Reimbursement,C01, ,3,1,20,110
1000000027_0010735500271056_12-21-2007-00:00:00_Disbursement,1100001114,1000000027,0010735500271056,Disbursement,2007-12-21T00:00:00.000Z,2370062.66,BEF,2007-12-21T00:00:00.000Z,1000000027 G-B-B-33-,IFAD,MINISTRY OF FINANCE - DEBT MANAGEMENT DEPARTMENT,Money is disbursed through central Ministry of Finance or Treasury,,KE,ESA,1000000027 0010735500271056 Direct Payment/Reimbursement,C01, ,3,1,20,110
1000000027_0010605900271037_02-28-2006-00:00:00_Disbursement,1100001114,1000000027,0010605900271037,Disbursement,2006-02-28T00:00:00.000Z,2749648.04,BEF,2006-02-28T00:00:00.000Z,1000000027 G-B-B-33-,IFAD,MINISTRY OF FINANCE - DEBT MANAGEMENT DEPARTMENT,Money is disbursed through central Ministry of Finance or Treasury,,KE,ESA,1000000027 0010605900271037 Direct Payment/Reimbursement,C01, ,3,1,20,110
1000000027_0010524900271029_09-06-2005-00:00:00_Disbursement,1100001114,1000000027,0010524900271029,Disbursement,2005-09-06T00:00:00.000Z,7321495.48,BEF,2005-09-06T00:00:00.000Z,1000000027 G-B-B-33-,IFAD,MINISTRY OF FINANCE - DEBT MANAGEMENT DEPARTMENT,Money is disbursed through central Ministry of Finance or Treasury,,KE,ESA,1000000027 0010524900271029 Direct Payment/Reimbursement,C01, ,3,1,20,110
1000000027_0010519300271027_07-12-2005-00:00:00_Disbursement,1100001114,1000000027,0010519300271027,Disbursement,2005-07-12T00:00:00.000Z,1406821.82,BEF,2005-07-12T00:00:00.000Z,1000000027 G-B-B-33-,IFAD,MINISTRY OF FINANCE - DEBT MANAGEMENT DEPARTMENT,Money is disbursed through central Ministry of Finance or Treasury,,KE,ESA,1000000027 0010519300271027 Direct Payment/Reimbursement,C01, ,3,1,20,110
1000000027_0011107700271067_03-18-2011-00:00:00_Disbursement,1100001114,1000000027,0011107700271067,Disbursement,2011-03-18T00:00:00.000Z,337168.59,BEF,2011-03-18T00:00:00.000Z,1000000027 G-B-B-33-,IFAD,MINISTRY OF FINANCE - DEBT MANAGEMENT DEPARTMENT,Money is disbursed through central Ministry of Finance or Treasury,,KE,ESA,1000000027 0011107700271067 Direct Payment/Reimbursement,C01, ,3,1,20,110
1000000027_0010405000271011_02-19-2004-00:00:00_Disbursement,1100001114,1000000027,0010405000271011,Disbursement,2004-02-19T00:00:00.000Z,9558652.26,BEF,2004-02-19T00:00:00.000Z,1000000027 G-B-B-33-,IFAD,MINISTRY OF FINANCE - DEBT MANAGEMENT DEPARTMENT,Money is disbursed through central Ministry of Finance or Treasury,,KE,ESA,1000000027 0010405000271011 Direct Payment/Reimbursement,C01, ,3,1,20,110
1000000027_0010708900271050_03-30-2007-00:00:00_Disbursement,1100001114,1000000027,0010708900271050,Disbursement,2007-03-30T00:00:00.000Z,1405776.19,BEF,2007-03-30T00:00:00.000Z,1000000027 G-B-B-33-,IFAD,MINISTRY OF FINANCE - DEBT MANAGEMENT DEPARTMENT,Money is disbursed through central Ministry of Finance or Treasury,,KE,ESA,1000000027 0010708900271050 Direct Payment/Reimbursement,C01, ,3,1,20,110
1000000027_0010235800271005_12-24-2002-00:00:00_Disbursement,1100001114,1000000027,0010235800271005,Disbursement,2002-12-24T00:00:00.000Z,4974368.75,BEF,2002-12-24T00:00:00.000Z,1000000027 G-B-B-33-,IFAD,MINISTRY OF FINANCE - DEBT MANAGEMENT DEPARTMENT,Money is disbursed through central Ministry of Finance or Treasury,,KE,ESA,1000000027 0010235800271005 Direct Payment/Reimbursement,C01, ,3,1,20,110
1000000027_0010414000271015_05-19-2004-00:00:00_Disbursement,1100001114,1000000027,0010414000271015,Disbursement,2004-05-19T00:00:00.000Z,97886.38,BEF,2004-05-19T00:00:00.000Z,1000000027 G-B-B-33-,IFAD,MINISTRY OF FINANCE - DEBT MANAGEMENT DEPARTMENT,Money is disbursed through central Ministry of Finance or Treasury,,KE,ESA,1000000027 0010414000271015 Direct Payment/Reimbursement,C01, ,3,1,20,110
1000000027_0010531800271034_11-14-2005-00:00:00_Disbursement,1100001114,1000000027,0010531800271034,Disbursement,2005-11-14T00:00:00.000Z,288880.86,BEF,2005-11-14T00:00:00.000Z,1000000027 G-B-B-33-,IFAD,MINISTRY OF FINANCE - DEBT MANAGEMENT DEPARTMENT,Money is disbursed through central Ministry of Finance or Treasury,,KE,ESA,1000000027 0010531800271034 Direct Payment/Reimbursement,C01, ,3,1,20,110
1000000027_0010614600271038_05-26-2006-00:00:00_Disbursement,1100001114,1000000027,0010614600271038,Disbursement,2006-05-26T00:00:00.000Z,1326413.99,BEF,2006-05-26T00:00:00.000Z,1000000027 G-B-B-33-,IFAD,MINISTRY OF FINANCE - DEBT MANAGEMENT DEPARTMENT,Money is disbursed through central Ministry of Finance or Treasury,,KE,ESA,1000000027 0010614600271038 Direct Payment/Reimbursement,C01, ,3,1,20,110
1000000027_0010531800271032_11-14-2005-00:00:00_Disbursement,1100001114,1000000027,0010531800271032,Disbursement,2005-11-14T00:00:00.000Z,6807396.55,BEF,2005-11-14T00:00:00.000Z,1000000027 G-B-B-33-,IFAD,MINISTRY OF FINANCE - DEBT MANAGEMENT DEPARTMENT,Money is disbursed through central Ministry of Finance or Treasury,,KE,ESA,1000000027 0010531800271032 Direct Payment/Reimbursement,C01, ,3,1,20,110
1000000027_0010628400271047_10-11-2006-00:00:00_Disbursement,1100001114,1000000027,0010628400271047,Disbursement,2006-10-11T00:00:00.000Z,3878644.52,BEF,2006-10-11T00:00:00.000Z,1000000027 G-B-B-33-,IFAD,MINISTRY OF FINANCE - DEBT MANAGEMENT DEPARTMENT,Money is disbursed through central Ministry of Finance or Treasury,,KE,ESA,1000000027 0010628400271047 Direct Payment/Reimbursement,C01, ,3,1,20,110
1000000027_0010715800271051_06-07-2007-00:00:00_Disbursement,1100001114,1000000027,0010715800271051,Disbursement,2007-06-07T00:00:00.000Z,1193651.48,BEF,2007-06-07T00:00:00.000Z,1000000027 G-B-B-33-,IFAD,MINISTRY OF FINANCE - DEBT MANAGEMENT DEPARTMENT,Money is disbursed through central Ministry of Finance or Treasury,,KE,ESA,1000000027 0010715800271051 Direct Payment/Reimbursement,C01, ,3,1,20,110
1000000027_0010518200271026_07-01-2005-00:00:00_Disbursement,1100001114,1000000027,0010518200271026,Disbursement,2005-07-01T00:00:00.000Z,2328946.35,BEF,2005-07-01T00:00:00.000Z,1000000027 G-B-B-33-,IFAD,MINISTRY OF FINANCE - DEBT MANAGEMENT DEPARTMENT,Money is disbursed through central Ministry of Finance or Treasury,,KE,ESA,1000000027 0010518200271026 Direct Payment/Reimbursement,C01, ,3,1,20,110
1000000027_0010217200271003_06-21-2002-00:00:00_Disbursement,1100001114,1000000027,0010217200271003,Disbursement,2002-06-21T00:00:00.000Z,1006555.97,BEF,2002-06-21T00:00:00.000Z,1000000027 G-B-B-33-,IFAD,MINISTRY OF FINANCE - DEBT MANAGEMENT DEPARTMENT,Money is disbursed through central Ministry of Finance or Treasury,,KE,ESA,1000000027 0010217200271003 Direct Payment/Reimbursement,C01, ,3,1,20,110
1000000027_0010900700271059_01-07-2009-00:00:00_Disbursement,1100001114,1000000027,0010900700271059,Disbursement,2009-01-07T00:00:00.000Z,2375517.27,BEF,2009-01-07T00:00:00.000Z,1000000027 G-B-B-33-,IFAD,MINISTRY OF FINANCE - DEBT MANAGEMENT DEPARTMENT,Money is disbursed through central Ministry of Finance or Treasury,,KE,ESA,1000000027 0010900700271059 Direct Payment/Reimbursement,C01, ,3,1,20,110
1000000027_0010311300271007_04-23-2003-00:00:00_Disbursement,1100001114,1000000027,0010311300271007,Disbursement,2003-04-23T00:00:00.000Z,1633186.57,BEF,2003-04-23T00:00:00.000Z,1000000027 G-B-B-33-,IFAD,MINISTRY OF FINANCE - DEBT MANAGEMENT DEPARTMENT,Money is disbursed through central Ministry of Finance or Treasury,,KE,ESA,1000000027 0010311300271007 Direct Payment/Reimbursement,C01, ,3,1,20,110
1000000027_0010506800271022_03-09-2005-00:00:00_Disbursement,1100001114,1000000027,0010506800271022,Disbursement,2005-03-09T00:00:00.000Z,5854828.77,BEF,2005-03-09T00:00:00.000Z,1000000027 G-B-B-33-,IFAD,MINISTRY OF FINANCE - DEBT MANAGEMENT DEPARTMENT,Money is disbursed through central Ministry of Finance or Treasury,,KE,ESA,1000000027 0010506800271022 Direct Payment/Reimbursement,C01, ,3,1,20,110
1000000027_0010531800271031_11-14-2005-00:00:00_Disbursement,1100001114,1000000027,0010531800271031,Disbursement,2005-11-14T00:00:00.000Z,4100476.37,BEF,2005-11-14T00:00:00.000Z,1000000027 G-B-B-33-,IFAD,MINISTRY OF FINANCE - DEBT MANAGEMENT DEPARTMENT,Money is disbursed through central Ministry of Finance or Treasury,,KE,ESA,1000000027 0010531800271031 Direct Payment/Reimbursement,C01, ,3,1,20,110
1000000027_0010615600271039_06-05-2006-00:00:00_Disbursement,1100001114,1000000027,0010615600271039,Disbursement,2006-06-05T00:00:00.000Z,1038941.81,BEF,2006-06-05T00:00:00.000Z,1000000027 G-B-B-33-,IFAD,MINISTRY OF FINANCE - DEBT MANAGEMENT DEPARTMENT,Money is disbursed through central Ministry of Finance or Treasury,,KE,ESA,1000000027 0010615600271039 Direct Payment/Reimbursement,C01, ,3,1,20,110
1000000027_0011110400271068_04-14-2011-00:00:00_Disbursement,1100001114,1000000027,0011110400271068,Disbursement,2011-04-14T00:00:00.000Z,440182.13,BEF,2011-04-14T00:00:00.000Z,1000000027 G-B-B-33-,IFAD,MINISTRY OF FINANCE - DEBT MANAGEMENT DEPARTMENT,Money is disbursed through central Ministry of Finance or Treasury,,KE,ESA,1000000027 0011110400271068 Direct Payment/Reimbursement,C01, ,3,1,20,110
1000000027_0010320300271009_07-22-2003-00:00:00_Disbursement,1100001114,1000000027,0010320300271009,Disbursement,2003-07-22T00:00:00.000Z,984063.54,BEF,2003-07-22T00:00:00.000Z,1000000027 G-B-B-33-,IFAD,MINISTRY OF FINANCE - DEBT MANAGEMENT DEPARTMENT,Money is disbursed through central Ministry of Finance or Treasury,,KE,ESA,1000000027 0010320300271009 Direct Payment/Reimbursement,C01, ,3,1,20,110
1000000027_0010421900271018_08-06-2004-00:00:00_Disbursement,1100001114,1000000027,0010421900271018,Disbursement,2004-08-06T00:00:00.000Z,920599.68,BEF,2004-08-06T00:00:00.000Z,1000000027 G-B-B-33-,IFAD,MINISTRY OF FINANCE - DEBT MANAGEMENT DEPARTMENT,Money is disbursed through central Ministry of Finance or Treasury,,KE,ESA,1000000027 0010421900271018 Direct Payment/Reimbursement,C01, ,3,1,20,110
1000000027_0010513000271023_05-10-2005-00:00:00_Disbursement,1100001114,1000000027,0010513000271023,Disbursement,2005-05-10T00:00:00.000Z,836570.7,BEF,2005-05-10T00:00:00.000Z,1000000027 G-B-B-33-,IFAD,MINISTRY OF FINANCE - DEBT MANAGEMENT DEPARTMENT,Money is disbursed through central Ministry of Finance or Treasury,,KE,ESA,1000000027 0010513000271023 Direct Payment/Reimbursement,C01, ,3,1,20,110
1000000027_0010825500271058_09-11-2008-00:00:00_Disbursement,1100001114,1000000027,0010825500271058,Disbursement,2008-09-11T00:00:00.000Z,2120918.66,BEF,2008-09-11T00:00:00.000Z,1000000027 G-B-B-33-,IFAD,MINISTRY OF FINANCE - DEBT MANAGEMENT DEPARTMENT,Money is disbursed through central Ministry of Finance or Treasury,,KE,ESA,1000000027 0010825500271058 Direct Payment/Reimbursement,C01, ,3,1,20,110
1000000027_0010735100271054_12-17-2007-00:00:00_Disbursement,1100001114,1000000027,0010735100271054,Disbursement,2007-12-17T00:00:00.000Z,3873820.23,BEF,2007-12-17T00:00:00.000Z,1000000027 G-B-B-33-,IFAD,MINISTRY OF FINANCE - DEBT MANAGEMENT DEPARTMENT,Money is disbursed through central Ministry of Finance or Treasury,,KE,ESA,1000000027 0010735100271054 Direct Payment/Reimbursement,C01, ,3,1,20,110
1000000027_0010506200271021_03-03-2005-00:00:00_Disbursement,1100001114,1000000027,0010506200271021,Disbursement,2005-03-03T00:00:00.000Z,2489156.79,BEF,2005-03-03T00:00:00.000Z,1000000027 G-B-B-33-,IFAD,MINISTRY OF FINANCE - DEBT MANAGEMENT DEPARTMENT,Money is disbursed through central Ministry of Finance or Treasury,,KE,ESA,1000000027 0010506200271021 Direct Payment/Reimbursement,C01, ,3,1,20,110
1000000027_0010727000271053_09-27-2007-00:00:00_Disbursement,1100001114,1000000027,0010727000271053,Disbursement,2007-09-27T00:00:00.000Z,865835.18,BEF,2007-09-27T00:00:00.000Z,1000000027 G-B-B-33-,IFAD,MINISTRY OF FINANCE - DEBT MANAGEMENT DEPARTMENT,Money is disbursed through central Ministry of Finance or Treasury,,KE,ESA,1000000027 0010727000271053 Direct Payment/Reimbursement,C01, ,3,1,20,110
1000000027_0010312900271008_05-09-2003-00:00:00_Disbursement,1100001114,1000000027,0010312900271008,Disbursement,2003-05-09T00:00:00.000Z,949719.93,BEF,2003-05-09T00:00:00.000Z,1000000027 G-B-B-33-,IFAD,MINISTRY OF FINANCE - DEBT MANAGEMENT DEPARTMENT,Money is disbursed through central Ministry of Finance or Treasury,,KE,ESA,1000000027 0010312900271008 Direct Payment/Reimbursement,C01, ,3,1,20,110
1000000027_0010719800271052_07-17-2007-00:00:00_Disbursement,1100001114,1000000027,0010719800271052,Disbursement,2007-07-17T00:00:00.000Z,2480761.31,BEF,2007-07-17T00:00:00.000Z,1000000027 G-B-B-33-,IFAD,MINISTRY OF FINANCE - DEBT MANAGEMENT DEPARTMENT,Money is disbursed through central Ministry of Finance or Treasury,,KE,ESA,1000000027 0010719800271052 Direct Payment/Reimbursement,C01, ,3,1,20,110
1000000027_0010123900271001_08-27-2001-00:00:00_Disbursement,1100001114,1000000027,0010123900271001,Disbursement,2001-08-27T00:00:00.000Z,17751407.05,BEF,2001-08-27T00:00:00.000Z,1000000027 G-B-B-33-,IFAD,MINISTRY OF FINANCE - DEBT MANAGEMENT DEPARTMENT,Money is disbursed through central Ministry of Finance or Treasury,,KE,ESA,1000000027 0010123900271001 Direct Payment/Reimbursement,C01, ,3,1,20,110
1000000027_0010531400271030_11-10-2005-00:00:00_Disbursement,1100001114,1000000027,0010531400271030,Disbursement,2005-11-10T00:00:00.000Z,483701.65,BEF,2005-11-10T00:00:00.000Z,1000000027 G-B-B-33-,IFAD,MINISTRY OF FINANCE - DEBT MANAGEMENT DEPARTMENT,Money is disbursed through central Ministry of Finance or Treasury,,KE,ESA,1000000027 0010531400271030 Direct Payment/Reimbursement,C01, ,3,1,20,110
1000000027_0010627900271043_10-06-2006-00:00:00_Disbursement,1100001114,1000000027,0010627900271043,Disbursement,2006-10-06T00:00:00.000Z,422291.8,BEF,2006-10-06T00:00:00.000Z,1000000027 G-B-B-33-,IFAD,MINISTRY OF FINANCE - DEBT MANAGEMENT DEPARTMENT,Money is disbursed through central Ministry of Finance or Treasury,,KE,ESA,1000000027 0010627900271043 Direct Payment/Reimbursement,C01, ,3,1,20,110
1000000027_0011007100271066_03-12-2010-00:00:00_Disbursement,1100001114,1000000027,0011007100271066,Disbursement,2010-03-12T00:00:00.000Z,4865794.3,BEF,2010-03-12T00:00:00.000Z,1000000027 G-B-B-33-,IFAD,MINISTRY OF FINANCE - DEBT MANAGEMENT DEPARTMENT,Money is disbursed through central Ministry of Finance or Treasury,,KE,ESA,1000000027 0011007100271066 Direct Payment/Reimbursement,C01, ,3,1,20,110
1000000027_0011118800271069_07-07-2011-00:00:00_Disbursement,1100001114,1000000027,0011118800271069,Disbursement,2011-07-07T00:00:00.000Z,1273545.17,BEF,2011-07-07T00:00:00.000Z,1000000027 G-B-B-33-,IFAD,MINISTRY OF FINANCE - DEBT MANAGEMENT DEPARTMENT,Money is disbursed through central Ministry of Finance or Treasury,,KE,ESA,1000000027 0011118800271069 Direct Payment/Reimbursement,C01, ,3,1,20,110
1000000027_0011126900271070_09-26-2011-00:00:00_Disbursement,1100001114,1000000027,0011126900271070,Disbursement,2011-09-26T00:00:00.000Z,167699.42,BEF,2011-09-26T00:00:00.000Z,1000000027 G-B-B-33-,IFAD,MINISTRY OF FINANCE - DEBT MANAGEMENT DEPARTMENT,Money is disbursed through central Ministry of Finance or Treasury,,KE,ESA,1000000027 0011126900271070 Direct Payment/Reimbursement,C01, ,3,1,20,110
1000000027_0010221100271004_07-30-2002-00:00:00_Disbursement,1100001114,1000000027,0010221100271004,Disbursement,2002-07-30T00:00:00.000Z,2307190.85,BEF,2002-07-30T00:00:00.000Z,1000000027 G-B-B-33-,IFAD,MINISTRY OF FINANCE - DEBT MANAGEMENT DEPARTMENT,Money is disbursed through central Ministry of Finance or Treasury,,KE,ESA,1000000027 0010221100271004 Direct Payment/Reimbursement,C01, ,3,1,20,110
1000000027_0010724000271055_08-28-2007-00:00:00_Disbursement,1100001114,1000000027,0010724000271055,Disbursement,2007-08-28T00:00:00.000Z,17674472.56,BEF,2007-08-28T00:00:00.000Z,1000000027 G-B-B-33-,IFAD,MINISTRY OF FINANCE - DEBT MANAGEMENT DEPARTMENT,Money is disbursed through central Ministry of Finance or Treasury,,KE,ESA,1000000027 0010724000271055 Direct Payment/Reimbursement,C01, ,3,1,20,110
1000000027_0010809200271057_04-01-2008-00:00:00_Disbursement,1100001114,1000000027,0010809200271057,Disbursement,2008-04-01T00:00:00.000Z,592936.98,BEF,2008-04-01T00:00:00.000Z,1000000027 G-B-B-33-,IFAD,MINISTRY OF FINANCE - DEBT MANAGEMENT DEPARTMENT,Money is disbursed through central Ministry of Finance or Treasury,,KE,ESA,1000000027 0010809200271057 Direct Payment/Reimbursement,C01, ,3,1,20,110
1000000027_0010430300271019_10-29-2004-00:00:00_Disbursement,1100001114,1000000027,0010430300271019,Disbursement,2004-10-29T00:00:00.000Z,471740.84,BEF,2004-10-29T00:00:00.000Z,1000000027 G-B-B-33-,IFAD,MINISTRY OF FINANCE - DEBT MANAGEMENT DEPARTMENT,Money is disbursed through central Ministry of Finance or Treasury,,KE,ESA,1000000027 0010430300271019 Direct Payment/Reimbursement,C01, ,3,1,20,110
1000000027_0010421900271017_08-06-2004-00:00:00_Disbursement,1100001114,1000000027,0010421900271017,Disbursement,2004-08-06T00:00:00.000Z,3168544.64,BEF,2004-08-06T00:00:00.000Z,1000000027 G-B-B-33-,IFAD,MINISTRY OF FINANCE - DEBT MANAGEMENT DEPARTMENT,Money is disbursed through central Ministry of Finance or Treasury,,KE,ESA,1000000027 0010421900271017 Direct Payment/Reimbursement,C01, ,3,1,20,110
1000000032___Commitment,1100000271,1000000032,,Commitment,,194528263.42,BEF,,1000000032 G-B-B-7-,IFAD,MINISTRY OF FINANCE - DEBT MANAGEMENT DEPARTMENT,Money is disbursed through central Ministry of Finance or Treasury,,KE,ESA,1000000032 GRANTS,C01, ,2,1,20,110
1000000032_0019728300321050_10-10-1997-00:00:00_Disbursement,1100000271,1000000032,0019728300321050,Disbursement,1997-10-10T00:00:00.000Z,4796315.0,BEF,1997-10-10T00:00:00.000Z,1000000032 G-B-B-7-,IFAD,MINISTRY OF FINANCE - DEBT MANAGEMENT DEPARTMENT,Money is disbursed through central Ministry of Finance or Treasury,,KE,ESA,1000000032 0019728300321050 Direct Payment/Reimbursement,C01, ,3,1,20,110
1000000032_0019503200321031_02-01-1995-00:00:00_Disbursement,1100000271,1000000032,0019503200321031,Disbursement,1995-02-01T00:00:00.000Z,4177232.0,BEF,1995-02-01T00:00:00.000Z,1000000032 G-B-B-7-,IFAD,MINISTRY OF FINANCE - DEBT MANAGEMENT DEPARTMENT,Money is disbursed through central Ministry of Finance or Treasury,,KE,ESA,1000000032 0019503200321031 Direct Payment/Reimbursement,C01, ,3,1,20,110
1000000032_0019524900321037_09-06-1995-00:00:00_Disbursement,1100000271,1000000032,0019524900321037,Disbursement,1995-09-06T00:00:00.000Z,186038.0,BEF,1995-09-06T00:00:00.000Z,1000000032 G-B-B-7-,IFAD,MINISTRY OF FINANCE - DEBT MANAGEMENT DEPARTMENT,Money is disbursed through central Ministry of Finance or Treasury,,KE,ESA,1000000032 0019524900321037 Direct Payment/Reimbursement,C01, ,3,1,20,110
1000000032_0019426500321028_09-22-1994-00:00:00_Disbursement,1100000271,1000000032,0019426500321028,Disbursement,1994-09-22T00:00:00.000Z,888790.0,BEF,1994-09-22T00:00:00.000Z,1000000032 G-B-B-7-,IFAD,MINISTRY OF FINANCE - DEBT MANAGEMENT DEPARTMENT,Money is disbursed through central Ministry of Finance or Treasury,,KE,ESA,1000000032 0019426500321028 Direct Payment/Reimbursement,C01, ,3,1,20,110
1000000032_0019520600321033_07-25-1995-00:00:00_Disbursement,1100000271,1000000032,0019520600321033,Disbursement,1995-07-25T00:00:00.000Z,1610820.0,BEF,1995-07-25T00:00:00.000Z,1000000032 G-B-B-7-,IFAD,MINISTRY OF FINANCE - DEBT MANAGEMENT DEPARTMENT,Money is disbursed through central Ministry of Finance or Treasury,,KE,ESA,1000000032 0019520600321033 Direct Payment/Reimbursement,C01, ,3,1,20,110
1000000032_0019331400321019_11-10-1993-00:00:00_Disbursement,1100000271,1000000032,0019331400321019,Disbursement,1993-11-10T00:00:00.000Z,1951795.0,BEF,1993-11-10T00:00:00.000Z,1000000032 G-B-B-7-,IFAD,MINISTRY OF FINANCE - DEBT MANAGEMENT DEPARTMENT,Money is disbursed through central Ministry of Finance or Treasury,,KE,ESA,1000000032 0019331400321019 Direct Payment/Reimbursement,C01, ,3,1,20,110
1000000032_0010008700321064_03-27-2000-00:00:00_Disbursement,1100000271,1000000032,0010008700321064,Disbursement,2000-03-27T00:00:00.000Z,3900445.0,BEF,2000-03-27T00:00:00.000Z,1000000032 G-B-B-7-,IFAD,MINISTRY OF FINANCE - DEBT MANAGEMENT DEPARTMENT,Money is disbursed through central Ministry of Finance or Treasury,,KE,ESA,1000000032 0010008700321064 Direct Payment/Reimbursement,C01, ,3,1,20,110
1000000032_0019727200321049_09-29-1997-00:00:00_Disbursement,1100000271,1000000032,0019727200321049,Disbursement,1997-09-29T00:00:00.000Z,5033726.0,BEF,1997-09-29T00:00:00.000Z,1000000032 G-B-B-7-,IFAD,MINISTRY OF FINANCE - DEBT MANAGEMENT DEPARTMENT,Money is disbursed through central Ministry of Finance or Treasury,,KE,ESA,1000000032 0019727200321049 Direct Payment/Reimbursement,C01, ,3,1,20,110
1000000032_0019317200321008_06-21-1993-00:00:00_Disbursement,1100000271,1000000032,0019317200321008,Disbursement,1993-06-21T00:00:00.000Z,2345755.0,BEF,1993-06-21T00:00:00.000Z,1000000032 G-B-B-7-,IFAD,MINISTRY OF FINANCE - DEBT MANAGEMENT DEPARTMENT,Money is disbursed through central Ministry of Finance or Treasury,,KE,ESA,1000000032 0019317200321008 Direct Payment/Reimbursement,C01, ,3,1,20,110
1000000032_0019413900321025_05-19-1994-00:00:00_Disbursement,1100000271,1000000032,0019413900321025,Disbursement,1994-05-19T00:00:00.000Z,1068223.0,BEF,1994-05-19T00:00:00.000Z,1000000032 G-B-B-7-,IFAD,MINISTRY OF FINANCE - DEBT MANAGEMENT DEPARTMENT,Money is disbursed through central Ministry of Finance or Treasury,,KE,ESA,1000000032 0019413900321025 Direct Payment/Reimbursement,C01, ,3,1,20,110
1000000032_0019619200321039_07-10-1996-00:00:00_Disbursement,1100000271,1000000032,0019619200321039,Disbursement,1996-07-10T00:00:00.000Z,1537228.0,BEF,1996-07-10T00:00:00.000Z,1000000032 G-B-B-7-,IFAD,MINISTRY OF FINANCE - DEBT MANAGEMENT DEPARTMENT,Money is disbursed through central Ministry of Finance or Treasury,,KE,ESA,1000000032 0019619200321039 Direct Payment/Reimbursement,C01, ,3,1,20,110
1000000032_0019902700321057_01-27-1999-00:00:00_Disbursement,1100000271,1000000032,0019902700321057,Disbursement,1999-01-27T00:00:00.000Z,3990320.0,BEF,1999-01-27T00:00:00.000Z,1000000032 G-B-B-7-,IFAD,MINISTRY OF FINANCE - DEBT MANAGEMENT DEPARTMENT,Money is disbursed through central Ministry of Finance or Treasury,,KE,ESA,1000000032 0019902700321057 Direct Payment/Reimbursement,C01, ,3,1,20,110
1000000032_0019619200321040_07-10-1996-00:00:00_Disbursement,1100000271,1000000032,0019619200321040,Disbursement,1996-07-10T00:00:00.000Z,54430654.0,BEF,1996-07-10T00:00:00.000Z,1000000032 G-B-B-7-,IFAD,MINISTRY OF FINANCE - DEBT MANAGEMENT DEPARTMENT,Money is disbursed through central Ministry of Finance or Treasury,,KE,ESA,1000000032 0019619200321040 Direct Payment/Reimbursement,C01, ,3,1,20,110
1000000032_0019330200321018_10-29-1993-00:00:00_Disbursement,1100000271,1000000032,0019330200321018,Disbursement,1993-10-29T00:00:00.000Z,462983.0,BEF,1993-10-29T00:00:00.000Z,1000000032 G-B-B-7-,IFAD,MINISTRY OF FINANCE - DEBT MANAGEMENT DEPARTMENT,Money is disbursed through central Ministry of Finance or Treasury,,KE,ESA,1000000032 0019330200321018 Direct Payment/Reimbursement,C01, ,3,1,20,110
1000000032_0019828600321055_10-13-1998-00:00:00_Disbursement,1100000271,1000000032,0019828600321055,Disbursement,1998-10-13T00:00:00.000Z,1532632.0,BEF,1998-10-13T00:00:00.000Z,1000000032 G-B-B-7-,IFAD,MINISTRY OF FINANCE - DEBT MANAGEMENT DEPARTMENT,Money is disbursed through central Ministry of Finance or Treasury,,KE,ESA,1000000032 0019828600321055 Direct Payment/Reimbursement,C01, ,3,1,20,110
1000000032_0019828800321056_10-15-1998-00:00:00_Disbursement,1100000271,1000000032,0019828800321056,Disbursement,1998-10-15T00:00:00.000Z,515324.0,BEF,1998-10-15T00:00:00.000Z,1000000032 G-B-B-7-,IFAD,MINISTRY OF FINANCE - DEBT MANAGEMENT DEPARTMENT,Money is disbursed through central Ministry of Finance or Treasury,,KE,ESA,1000000032 0019828800321056 Direct Payment/Reimbursement,C01, ,3,1,20,110
1000000032_0019320300321010_07-22-1993-00:00:00_Disbursement,1100000271,1000000032,0019320300321010,Disbursement,1993-07-22T00:00:00.000Z,8209636.0,BEF,1993-07-22T00:00:00.000Z,1000000032 G-B-B-7-,IFAD,MINISTRY OF FINANCE - DEBT MANAGEMENT DEPARTMENT,Money is disbursed through central Ministry of Finance or Treasury,,KE,ESA,1000000032 0019320300321010 Direct Payment/Reimbursement,C01, ,3,1,20,110
1000000032_0019630200321043_10-28-1996-00:00:00_Disbursement,1100000271,1000000032,0019630200321043,Disbursement,1996-10-28T00:00:00.000Z,1242437.0,BEF,1996-10-28T00:00:00.000Z,1000000032 G-B-B-7-,IFAD,MINISTRY OF FINANCE - DEBT MANAGEMENT DEPARTMENT,Money is disbursed through central Ministry of Finance or Treasury,,KE,ESA,1000000032 0019630200321043 Direct Payment/Reimbursement,C01, ,3,1,20,110
1000000032_0019630200321042_10-28-1996-00:00:00_Disbursement,1100000271,1000000032,0019630200321042,Disbursement,1996-10-28T00:00:00.000Z,3249651.0,BEF,1996-10-28T00:00:00.000Z,1000000032 G-B-B-7-,IFAD,MINISTRY OF FINANCE - DEBT MANAGEMENT DEPARTMENT,Money is disbursed through central Ministry of Finance or Treasury,,KE,ESA,1000000032 0019630200321042 Direct Payment/Reimbursement,C01, ,3,1,20,110
1000000032_0019431100321030_11-07-1994-00:00:00_Disbursement,1100000271,1000000032,0019431100321030,Disbursement,1994-11-07T00:00:00.000Z,2579812.0,BEF,1994-11-07T00:00:00.000Z,1000000032 G-B-B-7-,IFAD,MINISTRY OF FINANCE - DEBT MANAGEMENT DEPARTMENT,Money is disbursed through central Ministry of Finance or Treasury,,KE,ESA,1000000032 0019431100321030 Direct Payment/Reimbursement,C01, ,3,1,20,110
1000000032_0019717700321048_06-26-1997-00:00:00_Disbursement,1100000271,1000000032,0019717700321048,Disbursement,1997-06-26T00:00:00.000Z,1161814.0,BEF,1997-06-26T00:00:00.000Z,1000000032 G-B-B-7-,IFAD,MINISTRY OF FINANCE - DEBT MANAGEMENT DEPARTMENT,Money is disbursed through central Ministry of Finance or Treasury,,KE,ESA,1000000032 0019717700321048 Direct Payment/Reimbursement,C01, ,3,1,20,110
1000000032_0019310400321007_04-14-1993-00:00:00_Disbursement,1100000271,1000000032,0019310400321007,Disbursement,1993-04-14T00:00:00.000Z,2241924.0,BEF,1993-04-14T00:00:00.000Z,1000000032 G-B-B-7-,IFAD,MINISTRY OF FINANCE - DEBT MANAGEMENT DEPARTMENT,Money is disbursed through central Ministry of Finance or Treasury,,KE,ESA,1000000032 0019310400321007 Direct Payment/Reimbursement,C01, ,3,1,20,110
1000000032_0010013300321065_05-12-2000-00:00:00_Disbursement,1100000271,1000000032,0010013300321065,Disbursement,2000-05-12T00:00:00.000Z,2209231.0,BEF,2000-05-12T00:00:00.000Z,1000000032 G-B-B-7-,IFAD,MINISTRY OF FINANCE - DEBT MANAGEMENT DEPARTMENT,Money is disbursed through central Ministry of Finance or Treasury,,KE,ESA,1000000032 0010013300321065 Direct Payment/Reimbursement,C01, ,3,1,20,110
1000000032_0019706400321044_03-05-1997-00:00:00_Disbursement,1100000271,1000000032,0019706400321044,Disbursement,1997-03-05T00:00:00.000Z,850583.0,BEF,1997-03-05T00:00:00.000Z,1000000032 G-B-B-7-,IFAD,MINISTRY OF FINANCE - DEBT MANAGEMENT DEPARTMENT,Money is disbursed through central Ministry of Finance or Treasury,,KE,ESA,1000000032 0019706400321044 Direct Payment/Reimbursement,C01, ,3,1,20,110
1000000032_0019325100321014_09-08-1993-00:00:00_Disbursement,1100000271,1000000032,0019325100321014,Disbursement,1993-09-08T00:00:00.000Z,922887.0,BEF,1993-09-08T00:00:00.000Z,1000000032 G-B-B-7-,IFAD,MINISTRY OF FINANCE - DEBT MANAGEMENT DEPARTMENT,Money is disbursed through central Ministry of Finance or Treasury,,KE,ESA,1000000032 0019325100321014 Direct Payment/Reimbursement,C01, ,3,1,20,110
1000000032_0019409600321022_04-06-1994-00:00:00_Disbursement,1100000271,1000000032,0019409600321022,Disbursement,1994-04-06T00:00:00.000Z,1874777.0,BEF,1994-04-06T00:00:00.000Z,1000000032 G-B-B-7-,IFAD,MINISTRY OF FINANCE - DEBT MANAGEMENT DEPARTMENT,Money is disbursed through central Ministry of Finance or Treasury,,KE,ESA,1000000032 0019409600321022 Direct Payment/Reimbursement,C01, ,3,1,20,110
1000000032_0010014600321066_05-25-2000-00:00:00_Disbursement,1100000271,1000000032,0010014600321066,Disbursement,2000-05-25T00:00:00.000Z,1696810.0,BEF,2000-05-25T00:00:00.000Z,1000000032 G-B-B-7-,IFAD,MINISTRY OF FINANCE - DEBT MANAGEMENT DEPARTMENT,Money is disbursed through central Ministry of Finance or Treasury,,KE,ESA,1000000032 0010014600321066 Direct Payment/Reimbursement,C01, ,3,1,20,110
1000000032_0019518000321032_06-29-1995-00:00:00_Disbursement,1100000271,1000000032,0019518000321032,Disbursement,1995-06-29T00:00:00.000Z,2638594.0,BEF,1995-06-29T00:00:00.000Z,1000000032 G-B-B-7-,IFAD,MINISTRY OF FINANCE - DEBT MANAGEMENT DEPARTMENT,Money is disbursed through central Ministry of Finance or Treasury,,KE,ESA,1000000032 0019518000321032 Direct Payment/Reimbursement,C01, ,3,1,20,110
1000000032_0019707900321046_03-20-1997-00:00:00_Disbursement,1100000271,1000000032,0019707900321046,Disbursement,1997-03-20T00:00:00.000Z,3104323.0,BEF,1997-03-20T00:00:00.000Z,1000000032 G-B-B-7-,IFAD,MINISTRY OF FINANCE - DEBT MANAGEMENT DEPARTMENT,Money is disbursed through central Ministry of Finance or Treasury,,KE,ESA,1000000032 0019707900321046 Direct Payment/Reimbursement,C01, ,3,1,20,110
1000000032_0019227900321005_10-05-1992-00:00:00_Disbursement,1100000271,1000000032,0019227900321005,Disbursement,1992-10-05T00:00:00.000Z,777650.0,BEF,1992-10-05T00:00:00.000Z,1000000032 G-B-B-7-,IFAD,MINISTRY OF FINANCE - DEBT MANAGEMENT DEPARTMENT,Money is disbursed through central Ministry of Finance or Treasury,,KE,ESA,1000000032 0019227900321005 Direct Payment/Reimbursement,C01, ,3,1,20,110
1000000032_0019202100321001_01-21-1992-00:00:00_Disbursement,1100000271,1000000032,0019202100321001,Disbursement,1992-01-21T00:00:00.000Z,10039800.0,BEF,1992-01-21T00:00:00.000Z,1000000032 G-B-B-7-,IFAD,MINISTRY OF FINANCE - DEBT MANAGEMENT DEPARTMENT,Money is disbursed through central Ministry of Finance or Treasury,,KE,ESA,1000000032 0019202100321001 Direct Payment/Reimbursement,C01, ,3,1,20,110
1000000032_0019914500321059_05-25-1999-00:00:00_Disbursement,1100000271,1000000032,0019914500321059,Disbursement,1999-05-25T00:00:00.000Z,2652035.0,BEF,1999-05-25T00:00:00.000Z,1000000032 G-B-B-7-,IFAD,MINISTRY OF FINANCE - DEBT MANAGEMENT DEPARTMENT,Money is disbursed through central Ministry of Finance or Treasury,,KE,ESA,1000000032 0019914500321059 Direct Payment/Reimbursement,C01, ,3,1,20,110
1000000032_0019415900321026_06-08-1994-00:00:00_Disbursement,1100000271,1000000032,0019415900321026,Disbursement,1994-06-08T00:00:00.000Z,31086.0,BEF,1994-06-08T00:00:00.000Z,1000000032 G-B-B-7-,IFAD,MINISTRY OF FINANCE - DEBT MANAGEMENT DEPARTMENT,Money is disbursed through central Ministry of Finance or Treasury,,KE,ESA,1000000032 0019415900321026 Direct Payment/Reimbursement,C01, ,3,1,20,110
1000000032_0019733500321051_12-01-1997-00:00:00_Disbursement,1100000271,1000000032,0019733500321051,Disbursement,1997-12-01T00:00:00.000Z,484098.0,BEF,1997-12-01T00:00:00.000Z,1000000032 G-B-B-7-,IFAD,MINISTRY OF FINANCE - DEBT MANAGEMENT DEPARTMENT,Money is disbursed through central Ministry of Finance or Treasury,,KE,ESA,1000000032 0019733500321051 Direct Payment/Reimbursement,C01, ,3,1,20,110
1000000032_0019401900321021_01-19-1994-00:00:00_Disbursement,1100000271,1000000032,0019401900321021,Disbursement,1994-01-19T00:00:00.000Z,1035308.0,BEF,1994-01-19T00:00:00.000Z,1000000032 G-B-B-7-,IFAD,MINISTRY OF FINANCE - DEBT MANAGEMENT DEPARTMENT,Money is disbursed through central Ministry of Finance or Treasury,,KE,ESA,1000000032 0019401900321021 Direct Payment/Reimbursement,C01, ,3,1,20,110
1000000032_0019327400321017_10-01-1993-00:00:00_Disbursement,1100000271,1000000032,0019327400321017,Disbursement,1993-10-01T00:00:00.000Z,449730.0,BEF,1993-10-01T00:00:00.000Z,1000000032 G-B-B-7-,IFAD,MINISTRY OF FINANCE - DEBT MANAGEMENT DEPARTMENT,Money is disbursed through central Ministry of Finance or Treasury,,KE,ESA,1000000032 0019327400321017 Direct Payment/Reimbursement,C01, ,3,1,20,110
1000000032_0019411700321023_04-27-1994-00:00:00_Disbursement,1100000271,1000000032,0019411700321023,Disbursement,1994-04-27T00:00:00.000Z,1216112.0,BEF,1994-04-27T00:00:00.000Z,1000000032 G-B-B-7-,IFAD,MINISTRY OF FINANCE - DEBT MANAGEMENT DEPARTMENT,Money is disbursed through central Ministry of Finance or Treasury,,KE,ESA,1000000032 0019411700321023 Direct Payment/Reimbursement,C01, ,3,1,20,110
1000000032_0019323600321013_08-24-1993-00:00:00_Disbursement,1100000271,1000000032,0019323600321013,Disbursement,1993-08-24T00:00:00.000Z,176452.0,BEF,1993-08-24T00:00:00.000Z,1000000032 G-B-B-7-,IFAD,MINISTRY OF FINANCE - DEBT MANAGEMENT DEPARTMENT,Money is disbursed through central Ministry of Finance or Treasury,,KE,ESA,1000000032 0019323600321013 Direct Payment/Reimbursement,C01, ,3,1,20,110
1000000032_0019707900321045_03-20-1997-00:00:00_Disbursement,1100000271,1000000032,0019707900321045,Disbursement,1997-03-20T00:00:00.000Z,628183.0,BEF,1997-03-20T00:00:00.000Z,1000000032 G-B-B-7-,IFAD,MINISTRY OF FINANCE - DEBT MANAGEMENT DEPARTMENT,Money is disbursed through central Ministry of Finance or Treasury,,KE,ESA,1000000032 0019707900321045 Direct Payment/Reimbursement,C01, ,3,1,20,110
1000000032_0019522100321035_08-09-1995-00:00:00_Disbursement,1100000271,1000000032,0019522100321035,Disbursement,1995-08-09T00:00:00.000Z,408489.0,BEF,1995-08-09T00:00:00.000Z,1000000032 G-B-B-7-,IFAD,MINISTRY OF FINANCE - DEBT MANAGEMENT DEPARTMENT,Money is disbursed through central Ministry of Finance or Treasury,,KE,ESA,1000000032 0019522100321035 Direct Payment/Reimbursement,C01, ,3,1,20,110
1000000032_0019623200321041_08-19-1996-00:00:00_Disbursement,1100000271,1000000032,0019623200321041,Disbursement,1996-08-19T00:00:00.000Z,914100.0,BEF,1996-08-19T00:00:00.000Z,1000000032 G-B-B-7-,IFAD,MINISTRY OF FINANCE - DEBT MANAGEMENT DEPARTMENT,Money is disbursed through central Ministry of Finance or Treasury,,KE,ESA,1000000032 0019623200321041 Direct Payment/Reimbursement,C01, ,3,1,20,110
1000000032_0019812700321052_05-07-1998-00:00:00_Disbursement,1100000271,1000000032,0019812700321052,Disbursement,1998-05-07T00:00:00.000Z,3845048.0,BEF,1998-05-07T00:00:00.000Z,1000000032 G-B-B-7-,IFAD,MINISTRY OF FINANCE - DEBT MANAGEMENT DEPARTMENT,Money is disbursed through central Ministry of Finance or Treasury,,KE,ESA,1000000032 0019812700321052 Direct Payment/Reimbursement,C01, ,3,1,20,110
1000000032_0019524900321038_09-06-1995-00:00:00_Disbursement,1100000271,1000000032,0019524900321038,Disbursement,1995-09-06T00:00:00.000Z,38352.0,BEF,1995-09-06T00:00:00.000Z,1000000032 G-B-B-7-,IFAD,MINISTRY OF FINANCE - DEBT MANAGEMENT DEPARTMENT,Money is disbursed through central Ministry of Finance or Treasury,,KE,ESA,1000000032 0019524900321038 Direct Payment/Reimbursement,C01, ,3,1,20,110
1000000032_0019320300321011_07-22-1993-00:00:00_Disbursement,1100000271,1000000032,0019320300321011,Disbursement,1993-07-22T00:00:00.000Z,1092512.0,BEF,1993-07-22T00:00:00.000Z,1000000032 G-B-B-7-,IFAD,MINISTRY OF FINANCE - DEBT MANAGEMENT DEPARTMENT,Money is disbursed through central Ministry of Finance or Treasury,,KE,ESA,1000000032 0019320300321011 Direct Payment/Reimbursement,C01, ,3,1,20,110
1000000032_0019813100321053_05-11-1998-00:00:00_Disbursement,1100000271,1000000032,0019813100321053,Disbursement,1998-05-11T00:00:00.000Z,8730227.0,BEF,1998-05-11T00:00:00.000Z,1000000032 G-B-B-7-,IFAD,MINISTRY OF FINANCE - DEBT MANAGEMENT DEPARTMENT,Money is disbursed through central Ministry of Finance or Treasury,,KE,ESA,1000000032 0019813100321053 Direct Payment/Reimbursement,C01, ,3,1,20,110
1000000032_0019224800321003_09-04-1992-00:00:00_Disbursement,1100000271,1000000032,0019224800321003,Disbursement,1992-09-04T00:00:00.000Z,4087436.0,BEF,1992-09-04T00:00:00.000Z,1000000032 G-B-B-7-,IFAD,MINISTRY OF FINANCE - DEBT MANAGEMENT DEPARTMENT,Money is disbursed through central Ministry of Finance or Treasury,,KE,ESA,1000000032 0019224800321003 Direct Payment/Reimbursement,C01, ,3,1,20,110
1000000032_0019412500321024_05-05-1994-00:00:00_Disbursement,1100000271,1000000032,0019412500321024,Disbursement,1994-05-05T00:00:00.000Z,779152.0,BEF,1994-05-05T00:00:00.000Z,1000000032 G-B-B-7-,IFAD,MINISTRY OF FINANCE - DEBT MANAGEMENT DEPARTMENT,Money is disbursed through central Ministry of Finance or Treasury,,KE,ESA,1000000032 0019412500321024 Direct Payment/Reimbursement,C01, ,3,1,20,110
1000000032_0019825300321054_09-10-1998-00:00:00_Disbursement,1100000271,1000000032,0019825300321054,Disbursement,1998-09-10T00:00:00.000Z,1891367.0,BEF,1998-09-10T00:00:00.000Z,1000000032 G-B-B-7-,IFAD,MINISTRY OF FINANCE - DEBT MANAGEMENT DEPARTMENT,Money is disbursed through central Ministry of Finance or Treasury,,KE,ESA,1000000032 0019825300321054 Direct Payment/Reimbursement,C01, ,3,1,20,110
1000000032_0010202200321067_01-22-2002-00:00:00_Disbursement,1100000271,1000000032,0010202200321067,Disbursement,2002-01-22T00:00:00.000Z,12114372.42,BEF,2002-01-22T00:00:00.000Z,1000000032 G-B-B-7-,IFAD,MINISTRY OF FINANCE - DEBT MANAGEMENT DEPARTMENT,Money is disbursed through central Ministry of Finance or Treasury,,KE,ESA,1000000032 0010202200321067 Direct Payment/Reimbursement,C01, ,3,1,20,110
1000000032_0019325200321015_09-09-1993-00:00:00_Disbursement,1100000271,1000000032,0019325200321015,Disbursement,1993-09-09T00:00:00.000Z,567664.0,BEF,1993-09-09T00:00:00.000Z,1000000032 G-B-B-7-,IFAD,MINISTRY OF FINANCE - DEBT MANAGEMENT DEPARTMENT,Money is disbursed through central Ministry of Finance or Treasury,,KE,ESA,1000000032 0019325200321015 Direct Payment/Reimbursement,C01, ,3,1,20,110
1000000032_0019427900321029_10-06-1994-00:00:00_Disbursement,1100000271,1000000032,0019427900321029,Disbursement,1994-10-06T00:00:00.000Z,1728126.0,BEF,1994-10-06T00:00:00.000Z,1000000032 G-B-B-7-,IFAD,MINISTRY OF FINANCE - DEBT MANAGEMENT DEPARTMENT,Money is disbursed through central Ministry of Finance or Treasury,,KE,ESA,1000000032 0019427900321029 Direct Payment/Reimbursement,C01, ,3,1,20,110
1000000032_0019320300321009_07-22-1993-00:00:00_Disbursement,1100000271,1000000032,0019320300321009,Disbursement,1993-07-22T00:00:00.000Z,158036.0,BEF,1993-07-22T00:00:00.000Z,1000000032 G-B-B-7-,IFAD,MINISTRY OF FINANCE - DEBT MANAGEMENT DEPARTMENT,Money is disbursed through central Ministry of Finance or Treasury,,KE,ESA,1000000032 0019320300321009 Direct Payment/Reimbursement,C01, ,3,1,20,110
1000000032_0019712000321047_04-30-1997-00:00:00_Disbursement,1100000271,1000000032,0019712000321047,Disbursement,1997-04-30T00:00:00.000Z,628479.0,BEF,1997-04-30T00:00:00.000Z,1000000032 G-B-B-7-,IFAD,MINISTRY OF FINANCE - DEBT MANAGEMENT DEPARTMENT,Money is disbursed through central Ministry of Finance or Treasury,,KE,ESA,1000000032 0019712000321047 Direct Payment/Reimbursement,C01, ,3,1,20,110
1000000032_0019233700321006_12-02-1992-00:00:00_Disbursement,1100000271,1000000032,0019233700321006,Disbursement,1992-12-02T00:00:00.000Z,352521.0,BEF,1992-12-02T00:00:00.000Z,1000000032 G-B-B-7-,IFAD,MINISTRY OF FINANCE - DEBT MANAGEMENT DEPARTMENT,Money is disbursed through central Ministry of Finance or Treasury,,KE,ESA,1000000032 0019233700321006 Direct Payment/Reimbursement,C01, ,3,1,20,110
1000000032_0019909000321058_03-31-1999-00:00:00_Disbursement,1100000271,1000000032,0019909000321058,Disbursement,1999-03-31T00:00:00.000Z,795337.0,BEF,1999-03-31T00:00:00.000Z,1000000032 G-B-B-7-,IFAD,MINISTRY OF FINANCE - DEBT MANAGEMENT DEPARTMENT,Money is disbursed through central Ministry of Finance or Treasury,,KE,ESA,1000000032 0019909000321058 Direct Payment/Reimbursement,C01, ,3,1,20,110
1000000032_0019930000321063_10-27-1999-00:00:00_Disbursement,1100000271,1000000032,0019930000321063,Disbursement,1999-10-27T00:00:00.000Z,1322957.0,BEF,1999-10-27T00:00:00.000Z,1000000032 G-B-B-7-,IFAD,MINISTRY OF FINANCE - DEBT MANAGEMENT DEPARTMENT,Money is disbursed through central Ministry of Finance or Treasury,,KE,ESA,1000000032 0019930000321063 Direct Payment/Reimbursement,C01, ,3,1,20,110
1000000032_0019524100321036_08-29-1995-00:00:00_Disbursement,1100000271,1000000032,0019524100321036,Disbursement,1995-08-29T00:00:00.000Z,194237.0,BEF,1995-08-29T00:00:00.000Z,1000000032 G-B-B-7-,IFAD,MINISTRY OF FINANCE - DEBT MANAGEMENT DEPARTMENT,Money is disbursed through central Ministry of Finance or Treasury,,KE,ESA,1000000032 0019524100321036 Direct Payment/Reimbursement,C01, ,3,1,20,110
1000000032_0019325800321016_09-15-1993-00:00:00_Disbursement,1100000271,1000000032,0019325800321016,Disbursement,1993-09-15T00:00:00.000Z,372852.0,BEF,1993-09-15T00:00:00.000Z,1000000032 G-B-B-7-,IFAD,MINISTRY OF FINANCE - DEBT MANAGEMENT DEPARTMENT,Money is disbursed through central Ministry of Finance or Treasury,,KE,ESA,1000000032 0019325800321016 Direct Payment/Reimbursement,C01, ,3,1,20,110
1000000032_0019520600321034_07-25-1995-00:00:00_Disbursement,1100000271,1000000032,0019520600321034,Disbursement,1995-07-25T00:00:00.000Z,564976.0,BEF,1995-07-25T00:00:00.000Z,1000000032 G-B-B-7-,IFAD,MINISTRY OF FINANCE - DEBT MANAGEMENT DEPARTMENT,Money is disbursed through central Ministry of Finance or Treasury,,KE,ESA,1000000032 0019520600321034 Direct Payment/Reimbursement,C01, ,3,1,20,110
1000000032_0019925800321061_09-15-1999-00:00:00_Disbursement,1100000271,1000000032,0019925800321061,Disbursement,1999-09-15T00:00:00.000Z,10299337.0,BEF,1999-09-15T00:00:00.000Z,1000000032 G-B-B-7-,IFAD,MINISTRY OF FINANCE - DEBT MANAGEMENT DEPARTMENT,Money is disbursed through central Ministry of Finance or Treasury,,KE,ESA,1000000032 0019925800321061 Direct Payment/Reimbursement,C01, ,3,1,20,110
1000000032_0019322100321012_08-09-1993-00:00:00_Disbursement,1100000271,1000000032,0019322100321012,Disbursement,1993-08-09T00:00:00.000Z,399817.0,BEF,1993-08-09T00:00:00.000Z,1000000032 G-B-B-7-,IFAD,MINISTRY OF FINANCE - DEBT MANAGEMENT DEPARTMENT,Money is disbursed through central Ministry of Finance or Treasury,,KE,ESA,1000000032 0019322100321012 Direct Payment/Reimbursement,C01, ,3,1,20,110
1000000032_0019224800321002_09-04-1992-00:00:00_Disbursement,1100000271,1000000032,0019224800321002,Disbursement,1992-09-04T00:00:00.000Z,733003.0,BEF,1992-09-04T00:00:00.000Z,1000000032 G-B-B-7-,IFAD,MINISTRY OF FINANCE - DEBT MANAGEMENT DEPARTMENT,Money is disbursed through central Ministry of Finance or Treasury,,KE,ESA,1000000032 0019224800321002 Direct Payment/Reimbursement,C01, ,3,1,20,110
1000000032_0019335400321020_12-20-1993-00:00:00_Disbursement,1100000271,1000000032,0019335400321020,Disbursement,1993-12-20T00:00:00.000Z,315094.0,BEF,1993-12-20T00:00:00.000Z,1000000032 G-B-B-7-,IFAD,MINISTRY OF FINANCE - DEBT MANAGEMENT DEPARTMENT,Money is disbursed through central Ministry of Finance or Treasury,,KE,ESA,1000000032 0019335400321020 Direct Payment/Reimbursement,C01, ,3,1,20,110
1000000032_0019227200321004_09-28-1992-00:00:00_Disbursement,1100000271,1000000032,0019227200321004,Disbursement,1992-09-28T00:00:00.000Z,407700.0,BEF,1992-09-28T00:00:00.000Z,1000000032 G-B-B-7-,IFAD,MINISTRY OF FINANCE - DEBT MANAGEMENT DEPARTMENT,Money is disbursed through central Ministry of Finance or Treasury,,KE,ESA,1000000032 0019227200321004 Direct Payment/Reimbursement,C01, ,3,1,20,110
1000000032_0019423800321027_08-26-1994-00:00:00_Disbursement,1100000271,1000000032,0019423800321027,Disbursement,1994-08-26T00:00:00.000Z,529717.0,BEF,1994-08-26T00:00:00.000Z,1000000032 G-B-B-7-,IFAD,MINISTRY OF FINANCE - DEBT MANAGEMENT DEPARTMENT,Money is disbursed through central Ministry of Finance or Treasury,,KE,ESA,1000000032 0019423800321027 Direct Payment/Reimbursement,C01, ,3,1,20,110
1000000032_0019926500321062_09-22-1999-00:00:00_Disbursement,1100000271,1000000032,0019926500321062,Disbursement,1999-09-22T00:00:00.000Z,3356142.0,BEF,1999-09-22T00:00:00.000Z,1000000032 G-B-B-7-,IFAD,MINISTRY OF FINANCE - DEBT MANAGEMENT DEPARTMENT,Money is disbursed through central Ministry of Finance or Treasury,,KE,ESA,1000000032 0019926500321062 Direct Payment/Reimbursement,C01, ,3,1,20,110
1000000043__09-06-1994-00:00:00_Commitment,1000000043,1000000043,,Commitment,1994-09-06T00:00:00.000Z,0.0,XDR,1994-09-06T00:00:00.000Z,1000000043 G-B-B1-16-,IFAD,MINISTRY OF FINANCE,Money is disbursed through central Ministry of Finance or Treasury,,NA,ESA,1000000043 GRANTS,C01, ,2,1,20,110
1000000044___Commitment,1000000044,1000000044,,Commitment,,0.0,BEF,,1000000044 G-B-B1-16-A,IFAD,MINISTRY OF FINANCE,Money is disbursed through central Ministry of Finance or Treasury,,NA,WCA,1000000044 GRANTS,C01, ,2,1,20,110
1000000061__09-06-1994-00:00:00_Commitment,1100000362,1000000061,,Commitment,1994-09-06T00:00:00.000Z,64099201.09,BEF,1994-09-06T00:00:00.000Z,1000000061 G-B-B2-5-,IFAD,MINISTRY OF FINANCE,Money is disbursed through central Ministry of Finance or Treasury,,NA,ESA,1000000061 GRANTS,C01, ,2,1,20,110
1000000061_0010332500611044_11-21-2003-00:00:00_Disbursement,1100000362,1000000061,0010332500611044,Disbursement,2003-11-21T00:00:00.000Z,172786.65,BEF,2003-11-21T00:00:00.000Z,1000000061 G-B-B2-5-,IFAD,MINISTRY OF FINANCE,Money is disbursed through central Ministry of Finance or Treasury,,NA,ESA,1000000061 0010332500611044 Direct Payment/Reimbursement,C01, ,3,1,20,110
1000000061_0019714800611011_05-28-1997-00:00:00_Disbursement,1100000362,1000000061,0019714800611011,Disbursement,1997-05-28T00:00:00.000Z,686215.0,BEF,1997-05-28T00:00:00.000Z,1000000061 G-B-B2-5-,IFAD,MINISTRY OF FINANCE,Money is disbursed through central Ministry of Finance or Treasury,,NA,ESA,1000000061 0019714800611011 Direct Payment/Reimbursement,C01, ,3,1,20,110
1000000061_0019835600611026_12-22-1998-00:00:00_Disbursement,1100000362,1000000061,0019835600611026,Disbursement,1998-12-22T00:00:00.000Z,734004.0,BEF,1998-12-22T00:00:00.000Z,1000000061 G-B-B2-5-,IFAD,MINISTRY OF FINANCE,Money is disbursed through central Ministry of Finance or Treasury,,NA,ESA,1000000061 0019835600611026 Direct Payment/Reimbursement,C01, ,3,1,20,110
1000000061_0010324600611043_09-03-2003-00:00:00_Disbursement,1100000362,1000000061,0010324600611043,Disbursement,2003-09-03T00:00:00.000Z,235383.93,BEF,2003-09-03T00:00:00.000Z,1000000061 G-B-B2-5-,IFAD,MINISTRY OF FINANCE,Money is disbursed through central Ministry of Finance or Treasury,,NA,ESA,1000000061 0010324600611043 Direct Payment/Reimbursement,C01, ,3,1,20,110
1000000061_0019723100611013_08-19-1997-00:00:00_Disbursement,1100000362,1000000061,0019723100611013,Disbursement,1997-08-19T00:00:00.000Z,813413.0,BEF,1997-08-19T00:00:00.000Z,1000000061 G-B-B2-5-,IFAD,MINISTRY OF FINANCE,Money is disbursed through central Ministry of Finance or Treasury,,NA,ESA,1000000061 0019723100611013 Direct Payment/Reimbursement,C01, ,3,1,20,110
1000000061_0010402600611045_01-26-2004-00:00:00_Disbursement,1100000362,1000000061,0010402600611045,Disbursement,2004-01-26T00:00:00.000Z,1325807.52,BEF,2004-01-26T00:00:00.000Z,1000000061 G-B-B2-5-,IFAD,MINISTRY OF FINANCE,Money is disbursed through central Ministry of Finance or Treasury,,NA,ESA,1000000061 0010402600611045 Direct Payment/Reimbursement,C01, ,3,1,20,110
1000000061_0019701000611005_01-10-1997-00:00:00_Disbursement,1100000362,1000000061,0019701000611005,Disbursement,1997-01-10T00:00:00.000Z,1760722.03,BEF,1997-01-10T00:00:00.000Z,1000000061 G-B-B2-5-,IFAD,MINISTRY OF FINANCE,Money is disbursed through central Ministry of Finance or Treasury,,NA,ESA,1000000061 0019701000611005 Direct Payment/Reimbursement,C01, ,3,1,20,110
1000000061_0019809200611021_04-02-1998-00:00:00_Disbursement,1100000362,1000000061,0019809200611021,Disbursement,1998-04-02T00:00:00.000Z,837996.0,BEF,1998-04-02T00:00:00.000Z,1000000061 G-B-B2-5-,IFAD,MINISTRY OF FINANCE,Money is disbursed through central Ministry of Finance or Treasury,,NA,ESA,1000000061 0019809200611021 Direct Payment/Reimbursement,C01, ,3,1,20,110
1000000061_0019706900611006_03-10-1997-00:00:00_Disbursement,1100000362,1000000061,0019706900611006,Disbursement,1997-03-10T00:00:00.000Z,1285554.74,BEF,1997-03-10T00:00:00.000Z,1000000061 G-B-B2-5-,IFAD,MINISTRY OF FINANCE,Money is disbursed through central Ministry of Finance or Treasury,,NA,ESA,1000000061 0019706900611006 Direct Payment/Reimbursement,C01, ,3,1,20,110
1000000061_0010415500611046_06-03-2004-00:00:00_Disbursement,1100000362,1000000061,0010415500611046,Disbursement,2004-06-03T00:00:00.000Z,930617.69,BEF,2004-06-03T00:00:00.000Z,1000000061 G-B-B2-5-,IFAD,MINISTRY OF FINANCE,Money is disbursed through central Ministry of Finance or Treasury,,NA,ESA,1000000061 0010415500611046 Direct Payment/Reimbursement,C01, ,3,1,20,110
1000000061_0010224800611040_09-05-2002-00:00:00_Disbursement,1100000362,1000000061,0010224800611040,Disbursement,2002-09-05T00:00:00.000Z,3908454.34,BEF,2002-09-05T00:00:00.000Z,1000000061 G-B-B2-5-,IFAD,MINISTRY OF FINANCE,Money is disbursed through central Ministry of Finance or Treasury,,NA,ESA,1000000061 0010224800611040 Direct Payment/Reimbursement,C01, ,3,1,20,110
1000000061_0019732300611017_11-19-1997-00:00:00_Disbursement,1100000362,1000000061,0019732300611017,Disbursement,1997-11-19T00:00:00.000Z,657137.0,BEF,1997-11-19T00:00:00.000Z,1000000061 G-B-B2-5-,IFAD,MINISTRY OF FINANCE,Money is disbursed through central Ministry of Finance or Treasury,,NA,ESA,1000000061 0019732300611017 Direct Payment/Reimbursement,C01, ,3,1,20,110
1000000061_0019905700611028_02-26-1999-00:00:00_Disbursement,1100000362,1000000061,0019905700611028,Disbursement,1999-02-26T00:00:00.000Z,1174364.04,BEF,1999-02-26T00:00:00.000Z,1000000061 G-B-B2-5-,IFAD,MINISTRY OF FINANCE,Money is disbursed through central Ministry of Finance or Treasury,,NA,ESA,1000000061 0019905700611028 Direct Payment/Reimbursement,C01, ,3,1,20,110
1000000061_0019714800611012_05-28-1997-00:00:00_Disbursement,1100000362,1000000061,0019714800611012,Disbursement,1997-05-28T00:00:00.000Z,697354.07,BEF,1997-05-28T00:00:00.000Z,1000000061 G-B-B2-5-,IFAD,MINISTRY OF FINANCE,Money is disbursed through central Ministry of Finance or Treasury,,NA,ESA,1000000061 0019714800611012 Direct Payment/Reimbursement,C01, ,3,1,20,110
1000000061_0010415900611047_06-07-2004-00:00:00_Disbursement,1100000362,1000000061,0010415900611047,Disbursement,2004-06-07T00:00:00.000Z,1539675.96,BEF,2004-06-07T00:00:00.000Z,1000000061 G-B-B2-5-,IFAD,MINISTRY OF FINANCE,Money is disbursed through central Ministry of Finance or Treasury,,NA,ESA,1000000061 0010415900611047 Direct Payment/Reimbursement,C01, ,3,1,20,110
1000000061_0019926700611031_09-24-1999-00:00:00_Disbursement,1100000362,1000000061,0019926700611031,Disbursement,1999-09-24T00:00:00.000Z,2629009.0,BEF,1999-09-24T00:00:00.000Z,1000000061 G-B-B2-5-,IFAD,MINISTRY OF FINANCE,Money is disbursed through central Ministry of Finance or Treasury,,NA,ESA,1000000061 0019926700611031 Direct Payment/Reimbursement,C01, ,3,1,20,110
1000000061_0019734900611019_12-15-1997-00:00:00_Disbursement,1100000362,1000000061,0019734900611019,Disbursement,1997-12-15T00:00:00.000Z,590282.23,BEF,1997-12-15T00:00:00.000Z,1000000061 G-B-B2-5-,IFAD,MINISTRY OF FINANCE,Money is disbursed through central Ministry of Finance or Treasury,,NA,ESA,1000000061 0019734900611019 Direct Payment/Reimbursement,C01, ,3,1,20,110
1000000061_0019824700611025_09-04-1998-00:00:00_Disbursement,1100000362,1000000061,0019824700611025,Disbursement,1998-09-04T00:00:00.000Z,712083.0,BEF,1998-09-04T00:00:00.000Z,1000000061 G-B-B2-5-,IFAD,MINISTRY OF FINANCE,Money is disbursed through central Ministry of Finance or Treasury,,NA,ESA,1000000061 0019824700611025 Direct Payment/Reimbursement,C01, ,3,1,20,110
1000000061_0019706500611007_03-06-1997-00:00:00_Disbursement,1100000362,1000000061,0019706500611007,Disbursement,1997-03-06T00:00:00.000Z,742702.0,BEF,1997-03-06T00:00:00.000Z,1000000061 G-B-B2-5-,IFAD,MINISTRY OF FINANCE,Money is disbursed through central Ministry of Finance or Treasury,,NA,ESA,1000000061 0019706500611007 Direct Payment/Reimbursement,C01, ,3,1,20,110
1000000061_0019634800611004_12-13-1996-00:00:00_Disbursement,1100000362,1000000061,0019634800611004,Disbursement,1996-12-13T00:00:00.000Z,977673.0,BEF,1996-12-13T00:00:00.000Z,1000000061 G-B-B2-5-,IFAD,MINISTRY OF FINANCE,Money is disbursed through central Ministry of Finance or Treasury,,NA,ESA,1000000061 0019634800611004 Direct Payment/Reimbursement,C01, ,3,1,20,110
1000000061_0010016100611035_06-09-2000-00:00:00_Disbursement,1100000362,1000000061,0010016100611035,Disbursement,2000-06-09T00:00:00.000Z,737784.0,BEF,2000-06-09T00:00:00.000Z,1000000061 G-B-B2-5-,IFAD,MINISTRY OF FINANCE,Money is disbursed through central Ministry of Finance or Treasury,,NA,ESA,1000000061 0010016100611035 Direct Payment/Reimbursement,C01, ,3,1,20,110
1000000061_0010014600611034_05-25-2000-00:00:00_Disbursement,1100000362,1000000061,0010014600611034,Disbursement,2000-05-25T00:00:00.000Z,3723806.0,BEF,2000-05-25T00:00:00.000Z,1000000061 G-B-B2-5-,IFAD,MINISTRY OF FINANCE,Money is disbursed through central Ministry of Finance or Treasury,,NA,ESA,1000000061 0010014600611034 Direct Payment/Reimbursement,C01, ,3,1,20,110
1000000061_0019730300611014_10-30-1997-00:00:00_Disbursement,1100000362,1000000061,0019730300611014,Disbursement,1997-10-30T00:00:00.000Z,643141.75,BEF,1997-10-30T00:00:00.000Z,1000000061 G-B-B2-5-,IFAD,MINISTRY OF FINANCE,Money is disbursed through central Ministry of Finance or Treasury,,NA,ESA,1000000061 0019730300611014 Direct Payment/Reimbursement,C01, ,3,1,20,110
1000000061_0019729600611015_10-23-1997-00:00:00_Disbursement,1100000362,1000000061,0019729600611015,Disbursement,1997-10-23T00:00:00.000Z,398027.0,BEF,1997-10-23T00:00:00.000Z,1000000061 G-B-B2-5-,IFAD,MINISTRY OF FINANCE,Money is disbursed through central Ministry of Finance or Treasury,,NA,ESA,1000000061 0019729600611015 Direct Payment/Reimbursement,C01, ,3,1,20,110
1000000061_0010035000611037_12-15-2000-00:00:00_Disbursement,1100000362,1000000061,0010035000611037,Disbursement,2000-12-15T00:00:00.000Z,553006.96,BEF,2000-12-15T00:00:00.000Z,1000000061 G-B-B2-5-,IFAD,MINISTRY OF FINANCE,Money is disbursed through central Ministry of Finance or Treasury,,NA,ESA,1000000061 0010035000611037 Direct Payment/Reimbursement,C01, ,3,1,20,110
1000000061_0010002800611033_01-28-2000-00:00:00_Disbursement,1100000362,1000000061,0010002800611033,Disbursement,2000-01-28T00:00:00.000Z,1028630.0,BEF,2000-01-28T00:00:00.000Z,1000000061 G-B-B2-5-,IFAD,MINISTRY OF FINANCE,Money is disbursed through central Ministry of Finance or Treasury,,NA,ESA,1000000061 0010002800611033 Direct Payment/Reimbursement,C01, ,3,1,20,110
1000000061_0019815500611023_06-04-1998-00:00:00_Disbursement,1100000362,1000000061,0019815500611023,Disbursement,1998-06-04T00:00:00.000Z,2381440.24,BEF,1998-06-04T00:00:00.000Z,1000000061 G-B-B2-5-,IFAD,MINISTRY OF FINANCE,Money is disbursed through central Ministry of Finance or Treasury,,NA,ESA,1000000061 0019815500611023 Direct Payment/Reimbursement,C01, ,3,1,20,110
1000000061_0019627400611003_09-30-1996-00:00:00_Disbursement,1100000362,1000000061,0019627400611003,Disbursement,1996-09-30T00:00:00.000Z,3816034.0,BEF,1996-09-30T00:00:00.000Z,1000000061 G-B-B2-5-,IFAD,MINISTRY OF FINANCE,Money is disbursed through central Ministry of Finance or Treasury,,NA,ESA,1000000061 0019627400611003 Direct Payment/Reimbursement,C01, ,3,1,20,110
1000000061_0019732300611018_11-19-1997-00:00:00_Disbursement,1100000362,1000000061,0019732300611018,Disbursement,1997-11-19T00:00:00.000Z,800204.0,BEF,1997-11-19T00:00:00.000Z,1000000061 G-B-B2-5-,IFAD,MINISTRY OF FINANCE,Money is disbursed through central Ministry of Finance or Treasury,,NA,ESA,1000000061 0019732300611018 Direct Payment/Reimbursement,C01, ,3,1,20,110
1000000061_0019926500611030_09-22-1999-00:00:00_Disbursement,1100000362,1000000061,0019926500611030,Disbursement,1999-09-22T00:00:00.000Z,1286321.0,BEF,1999-09-22T00:00:00.000Z,1000000061 G-B-B2-5-,IFAD,MINISTRY OF FINANCE,Money is disbursed through central Ministry of Finance or Treasury,,NA,ESA,1000000061 0019926500611030 Direct Payment/Reimbursement,C01, ,3,1,20,110
1000000061_0019821900611024_08-07-1998-00:00:00_Disbursement,1100000362,1000000061,0019821900611024,Disbursement,1998-08-07T00:00:00.000Z,1087490.0,BEF,1998-08-07T00:00:00.000Z,1000000061 G-B-B2-5-,IFAD,MINISTRY OF FINANCE,Money is disbursed through central Ministry of Finance or Treasury,,NA,ESA,1000000061 0019821900611024 Direct Payment/Reimbursement,C01, ,3,1,20,110
1000000061_0019815500611022_06-04-1998-00:00:00_Disbursement,1100000362,1000000061,0019815500611022,Disbursement,1998-06-04T00:00:00.000Z,1845015.0,BEF,1998-06-04T00:00:00.000Z,1000000061 G-B-B2-5-,IFAD,MINISTRY OF FINANCE,Money is disbursed through central Ministry of Finance or Treasury,,NA,ESA,1000000061 0019815500611022 Direct Payment/Reimbursement,C01, ,3,1,20,110
1000000061_0019714700611009_05-27-1997-00:00:00_Disbursement,1100000362,1000000061,0019714700611009,Disbursement,1997-05-27T00:00:00.000Z,991323.0,BEF,1997-05-27T00:00:00.000Z,1000000061 G-B-B2-5-,IFAD,MINISTRY OF FINANCE,Money is disbursed through central Ministry of Finance or Treasury,,NA,ESA,1000000061 0019714700611009 Direct Payment/Reimbursement,C01, ,3,1,20,110
1000000061_0019836500611027_12-31-1998-00:00:00_Disbursement,1100000362,1000000061,0019836500611027,Disbursement,1998-12-31T00:00:00.000Z,970159.81,BEF,1998-12-31T00:00:00.000Z,1000000061 G-B-B2-5-,IFAD,MINISTRY OF FINANCE,Money is disbursed through central Ministry of Finance or Treasury,,NA,ESA,1000000061 0019836500611027 Direct Payment/Reimbursement,C01, ,3,1,20,110
1000000061_0019613600611002_05-15-1996-00:00:00_Disbursement,1100000362,1000000061,0019613600611002,Disbursement,1996-05-15T00:00:00.000Z,2445280.0,BEF,1996-05-15T00:00:00.000Z,1000000061 G-B-B2-5-,IFAD,MINISTRY OF FINANCE,Money is disbursed through central Ministry of Finance or Treasury,,NA,ESA,1000000061 0019613600611002 Direct Payment/Reimbursement,C01, ,3,1,20,110
1000000061_0010025100611036_09-07-2000-00:00:00_Disbursement,1100000362,1000000061,0010025100611036,Disbursement,2000-09-07T00:00:00.000Z,1159089.0,BEF,2000-09-07T00:00:00.000Z,1000000061 G-B-B2-5-,IFAD,MINISTRY OF FINANCE,Money is disbursed through central Ministry of Finance or Treasury,,NA,ESA,1000000061 0010025100611036 Direct Payment/Reimbursement,C01, ,3,1,20,110
1000000061_0010428200611048_10-08-2004-00:00:00_Disbursement,1100000362,1000000061,0010428200611048,Disbursement,2004-10-08T00:00:00.000Z,1261067.63,BEF,2004-10-08T00:00:00.000Z,1000000061 G-B-B2-5-,IFAD,MINISTRY OF FINANCE,Money is disbursed through central Ministry of Finance or Treasury,,NA,ESA,1000000061 0010428200611048 Direct Payment/Reimbursement,C01, ,3,1,20,110
1000000061_0010431400611049_11-09-2004-00:00:00_Disbursement,1100000362,1000000061,0010431400611049,Disbursement,2004-11-09T00:00:00.000Z,754678.44,BEF,2004-11-09T00:00:00.000Z,1000000061 G-B-B2-5-,IFAD,MINISTRY OF FINANCE,Money is disbursed through central Ministry of Finance or Treasury,,NA,ESA,1000000061 0010431400611049 Direct Payment/Reimbursement,C01, ,3,1,20,110
1000000061_0019518800611001_07-07-1995-00:00:00_Disbursement,1100000362,1000000061,0019518800611001,Disbursement,1995-07-07T00:00:00.000Z,3999800.0,BEF,1995-07-07T00:00:00.000Z,1000000061 G-B-B2-5-,IFAD,MINISTRY OF FINANCE,Money is disbursed through central Ministry of Finance or Treasury,,NA,ESA,1000000061 0019518800611001 Direct Payment/Reimbursement,C01, ,3,1,20,110
1000000061_0010224800611041_09-05-2002-00:00:00_Disbursement,1100000362,1000000061,0010224800611041,Disbursement,2002-09-05T00:00:00.000Z,1870961.46,BEF,2002-09-05T00:00:00.000Z,1000000061 G-B-B2-5-,IFAD,MINISTRY OF FINANCE,Money is disbursed through central Ministry of Finance or Treasury,,NA,ESA,1000000061 0010224800611041 Direct Payment/Reimbursement,C01, ,3,1,20,110
1000000061_0019729600611016_10-23-1997-00:00:00_Disbursement,1100000362,1000000061,0019729600611016,Disbursement,1997-10-23T00:00:00.000Z,1075202.0,BEF,1997-10-23T00:00:00.000Z,1000000061 G-B-B2-5-,IFAD,MINISTRY OF FINANCE,Money is disbursed through central Ministry of Finance or Treasury,,NA,ESA,1000000061 0019729600611016 Direct Payment/Reimbursement,C01, ,3,1,20,110
1000000061_0019714800611010_05-28-1997-00:00:00_Disbursement,1100000362,1000000061,0019714800611010,Disbursement,1997-05-28T00:00:00.000Z,1861427.33,BEF,1997-05-28T00:00:00.000Z,1000000061 G-B-B2-5-,IFAD,MINISTRY OF FINANCE,Money is disbursed through central Ministry of Finance or Treasury,,NA,ESA,1000000061 0019714800611010 Direct Payment/Reimbursement,C01, ,3,1,20,110
1000000061_0019905700611029_02-26-1999-00:00:00_Disbursement,1100000362,1000000061,0019905700611029,Disbursement,1999-02-26T00:00:00.000Z,773648.0,BEF,1999-02-26T00:00:00.000Z,1000000061 G-B-B2-5-,IFAD,MINISTRY OF FINANCE,Money is disbursed through central Ministry of Finance or Treasury,,NA,ESA,1000000061 0019905700611029 Direct Payment/Reimbursement,C01, ,3,1,20,110
1000000061_0019706600611008_03-07-1997-00:00:00_Disbursement,1100000362,1000000061,0019706600611008,Disbursement,1997-03-07T00:00:00.000Z,741682.0,BEF,1997-03-07T00:00:00.000Z,1000000061 G-B-B2-5-,IFAD,MINISTRY OF FINANCE,Money is disbursed through central Ministry of Finance or Treasury,,NA,ESA,1000000061 0019706600611008 Direct Payment/Reimbursement,C01, ,3,1,20,110
1000000061_0019809200611020_04-02-1998-00:00:00_Disbursement,1100000362,1000000061,0019809200611020,Disbursement,1998-04-02T00:00:00.000Z,3140133.49,BEF,1998-04-02T00:00:00.000Z,1000000061 G-B-B2-5-,IFAD,MINISTRY OF FINANCE,Money is disbursed through central Ministry of Finance or Treasury,,NA,ESA,1000000061 0019809200611020 Direct Payment/Reimbursement,C01, ,3,1,20,110
1000000061_0019930000611032_10-27-1999-00:00:00_Disbursement,1100000362,1000000061,0019930000611032,Disbursement,1999-10-27T00:00:00.000Z,388055.0,BEF,1999-10-27T00:00:00.000Z,1000000061 G-B-B2-5-,IFAD,MINISTRY OF FINANCE,Money is disbursed through central Ministry of Finance or Treasury,,NA,ESA,1000000061 0019930000611032 Direct Payment/Reimbursement,C01, ,3,1,20,110
1000000061_0010032900611038_11-24-2000-00:00:00_Disbursement,1100000362,1000000061,0010032900611038,Disbursement,2000-11-24T00:00:00.000Z,1954558.78,BEF,2000-11-24T00:00:00.000Z,1000000061 G-B-B2-5-,IFAD,MINISTRY OF FINANCE,Money is disbursed through central Ministry of Finance or Treasury,,NA,ESA,1000000061 0010032900611038 Direct Payment/Reimbursement,C01, ,3,1,20,110
1000000064__12-04-1997-00:00:00_Commitment,1000000064,1000000064,,Commitment,1997-12-04T00:00:00.000Z,0.0,BEF,1997-12-04T00:00:00.000Z,1000000064 G-B-B2-8-,IFAD,FONDS VOOR ONTWIKKELINGS SAMENWERKING,Money is disbursed through central Ministry of Finance or Treasury,,BE,ESA,1000000064 GRANTS,C01, ,2,1,20,110
1000000065__12-04-1997-00:00:00_Commitment,1100001023,1000000065,,Commitment,1997-12-04T00:00:00.000Z,1000000.0,USD,1997-12-04T00:00:00.000Z,1000000065 G-B-B2-8-A,IFAD,FONDS VOOR ONTWIKKELINGS SAMENWERKING,Money is disbursed through central Ministry of Finance or Treasury,,BE,ESA,1000000065 GRANTS,C01, ,2,1,20,110
1000000065_0019914000651001_05-20-1999-00:00:00_Disbursement,1100001023,1000000065,0019914000651001,Disbursement,1999-05-20T00:00:00.000Z,250000.0,USD,1999-05-20T00:00:00.000Z,1000000065 G-B-B2-8-A,IFAD,FONDS VOOR ONTWIKKELINGS SAMENWERKING,Money is disbursed through central Ministry of Finance or Treasury,,BE,ESA,1000000065 0019914000651001 Direct Payment/Reimbursement,C01, ,3,1,20,110
1000000065_0010108600651004_03-27-2001-00:00:00_Disbursement,1100001023,1000000065,0010108600651004,Disbursement,2001-03-27T00:00:00.000Z,143912.7,USD,2001-03-27T00:00:00.000Z,1000000065 G-B-B2-8-A,IFAD,FONDS VOOR ONTWIKKELINGS SAMENWERKING,Money is disbursed through central Ministry of Finance or Treasury,,BE,ESA,1000000065 0010108600651004 Direct Payment/Reimbursement,C01, ,3,1,20,110
1000000065_0010509700651009_04-07-2005-00:00:00_Disbursement,1100001023,1000000065,0010509700651009,Disbursement,2005-04-07T00:00:00.000Z,103480.45,USD,2005-04-07T00:00:00.000Z,1000000065 G-B-B2-8-A,IFAD,FONDS VOOR ONTWIKKELINGS SAMENWERKING,Money is disbursed through central Ministry of Finance or Treasury,,BE,ESA,1000000065 0010509700651009 Direct Payment/Reimbursement,C01, ,3,1,20,110
1000000065_0010321100651007_07-30-2003-00:00:00_Disbursement,1100001023,1000000065,0010321100651007,Disbursement,2003-07-30T00:00:00.000Z,91167.1,USD,2003-07-30T00:00:00.000Z,1000000065 G-B-B2-8-A,IFAD,FONDS VOOR ONTWIKKELINGS SAMENWERKING,Money is disbursed through central Ministry of Finance or Treasury,,BE,ESA,1000000065 0010321100651007 Direct Payment/Reimbursement,C01, ,3,1,20,110
1000000065_0010203700651005_02-06-2002-00:00:00_Disbursement,1100001023,1000000065,0010203700651005,Disbursement,2002-02-06T00:00:00.000Z,230880.0,USD,2002-02-06T00:00:00.000Z,1000000065 G-B-B2-8-A,IFAD,FONDS VOOR ONTWIKKELINGS SAMENWERKING,Money is disbursed through central Ministry of Finance or Treasury,,BE,ESA,1000000065 0010203700651005 Direct Payment/Reimbursement,C01, ,3,1,20,110
1000000065_0010416900651008_06-17-2004-00:00:00_Disbursement,1100001023,1000000065,0010416900651008,Disbursement,2004-06-17T00:00:00.000Z,28810.18,USD,2004-06-17T00:00:00.000Z,1000000065 G-B-B2-8-A,IFAD,FONDS VOOR ONTWIKKELINGS SAMENWERKING,Money is disbursed through central Ministry of Finance or Treasury,,BE,ESA,1000000065 0010416900651008 Direct Payment/Reimbursement,C01, ,3,1,20,110
1000000065_0019936200651003_12-28-1999-00:00:00_Disbursement,1100001023,1000000065,0019936200651003,Disbursement,1999-12-28T00:00:00.000Z,105525.05,USD,1999-12-28T00:00:00.000Z,1000000065 G-B-B2-8-A,IFAD,FONDS VOOR ONTWIKKELINGS SAMENWERKING,Money is disbursed through central Ministry of Finance or Treasury,,BE,ESA,1000000065 0019936200651003 Direct Payment/Reimbursement,C01, ,3,1,20,110
1000000065_0019934200651006_12-08-1999-00:00:00_Disbursement,1100001023,1000000065,0019934200651006,Disbursement,1999-12-08T00:00:00.000Z,46224.52,USD,1999-12-08T00:00:00.000Z,1000000065 G-B-B2-8-A,IFAD,FONDS VOOR ONTWIKKELINGS SAMENWERKING,Money is disbursed through central Ministry of Finance or Treasury,,BE,ESA,1000000065 0019934200651006 Direct Payment/Reimbursement,C01, ,3,1,20,110
1000000067___Commitment,1000000067,1000000067,,Commitment,,0.0,EUR,,1000000067 G-B-BE-17-,IFAD,"MINISTRY OF FINANCE, PERMANENT SECRETARY",Money is disbursed through central Ministry of Finance or Treasury,,TZ,NEN,1000000067 GRANTS,C01, ,2,1,20,110
1000000071___Commitment,1100001184,1000000071,,Commitment,,3607780.99,EUR,,1000000071 G-B-BE-36-,IFAD,MINISTRY OF FINANCE,Money is disbursed through central Ministry of Finance or Treasury,,MZ,ESA,1000000071 GRANTS,C01, ,2,1,20,110
1000000071_0010530000711006_10-27-2005-00:00:00_Disbursement,1100001184,1000000071,0010530000711006,Disbursement,2005-10-27T00:00:00.000Z,44126.49,EUR,2005-10-27T00:00:00.000Z,1000000071 G-B-BE-36-,IFAD,MINISTRY OF FINANCE,Money is disbursed through central Ministry of Finance or Treasury,,MZ,ESA,1000000071 0010530000711006 Direct Payment/Reimbursement,C01, ,3,1,20,110
1000000071_0010920300711042_07-22-2009-00:00:00_Disbursement,1100001184,1000000071,0010920300711042,Disbursement,2009-07-22T00:00:00.000Z,37729.72,EUR,2009-07-22T00:00:00.000Z,1000000071 G-B-BE-36-,IFAD,MINISTRY OF FINANCE,Money is disbursed through central Ministry of Finance or Treasury,,MZ,ESA,1000000071 0010920300711042 Direct Payment/Reimbursement,C01, ,3,1,20,110
1000000071_0010816800711032_06-16-2008-00:00:00_Disbursement,1100001184,1000000071,0010816800711032,Disbursement,2008-06-16T00:00:00.000Z,101019.02,EUR,2008-06-16T00:00:00.000Z,1000000071 G-B-BE-36-,IFAD,MINISTRY OF FINANCE,Money is disbursed through central Ministry of Finance or Treasury,,MZ,ESA,1000000071 0010816800711032 Direct Payment/Reimbursement,C01, ,3,1,20,110
1000000071_0010903600711038_02-05-2009-00:00:00_Disbursement,1100001184,1000000071,0010903600711038,Disbursement,2009-02-05T00:00:00.000Z,90510.44,EUR,2009-02-05T00:00:00.000Z,1000000071 G-B-BE-36-,IFAD,MINISTRY OF FINANCE,Money is disbursed through central Ministry of Finance or Treasury,,MZ,ESA,1000000071 0010903600711038 Direct Payment/Reimbursement,C01, ,3,1,20,110
1000000071_0010710800711018_04-18-2007-00:00:00_Disbursement,1100001184,1000000071,0010710800711018,Disbursement,2007-04-18T00:00:00.000Z,14563.07,EUR,2007-04-18T00:00:00.000Z,1000000071 G-B-BE-36-,IFAD,MINISTRY OF FINANCE,Money is disbursed through central Ministry of Finance or Treasury,,MZ,ESA,1000000071 0010710800711018 Direct Payment/Reimbursement,C01, ,3,1,20,110
1000000071_0010719100711027_07-10-2007-00:00:00_Disbursement,1100001184,1000000071,0010719100711027,Disbursement,2007-07-10T00:00:00.000Z,182935.03,EUR,2007-07-10T00:00:00.000Z,1000000071 G-B-BE-36-,IFAD,MINISTRY OF FINANCE,Money is disbursed through central Ministry of Finance or Treasury,,MZ,ESA,1000000071 0010719100711027 Direct Payment/Reimbursement,C01, ,3,1,20,110
1000000071_0010921600711043_08-04-2009-00:00:00_Disbursement,1100001184,1000000071,0010921600711043,Disbursement,2009-08-04T00:00:00.000Z,27741.56,EUR,2009-08-04T00:00:00.000Z,1000000071 G-B-BE-36-,IFAD,MINISTRY OF FINANCE,Money is disbursed through central Ministry of Finance or Treasury,,MZ,ESA,1000000071 0010921600711043 Direct Payment/Reimbursement,C01, ,3,1,20,110
1000000071_0011004000711044_02-09-2010-00:00:00_Disbursement,1100001184,1000000071,0011004000711044,Disbursement,2010-02-09T00:00:00.000Z,35492.63,EUR,2010-02-09T00:00:00.000Z,1000000071 G-B-BE-36-,IFAD,MINISTRY OF FINANCE,Money is disbursed through central Ministry of Finance or Treasury,,MZ,ESA,1000000071 0011004000711044 Direct Payment/Reimbursement,C01, ,3,1,20,110
1000000071_0010436500711002_12-30-2004-00:00:00_Disbursement,1100001184,1000000071,0010436500711002,Disbursement,2004-12-30T00:00:00.000Z,37395.56,EUR,2004-12-30T00:00:00.000Z,1000000071 G-B-BE-36-,IFAD,MINISTRY OF FINANCE,Money is disbursed through central Ministry of Finance or Treasury,,MZ,ESA,1000000071 0010436500711002 Direct Payment/Reimbursement,C01, ,3,1,20,110
1000000071_0010710800711017_04-18-2007-00:00:00_Disbursement,1100001184,1000000071,0010710800711017,Disbursement,2007-04-18T00:00:00.000Z,23425.47,EUR,2007-04-18T00:00:00.000Z,1000000071 G-B-BE-36-,IFAD,MINISTRY OF FINANCE,Money is disbursed through central Ministry of Finance or Treasury,,MZ,ESA,1000000071 0010710800711017 Direct Payment/Reimbursement,C01, ,3,1,20,110
1000000071_0010902100711037_01-21-2009-00:00:00_Disbursement,1100001184,1000000071,0010902100711037,Disbursement,2009-01-21T00:00:00.000Z,23253.81,EUR,2009-01-21T00:00:00.000Z,1000000071 G-B-BE-36-,IFAD,MINISTRY OF FINANCE,Money is disbursed through central Ministry of Finance or Treasury,,MZ,ESA,1000000071 0010902100711037 Direct Payment/Reimbursement,C01, ,3,1,20,110
1000000071_0010826000711034_09-16-2008-00:00:00_Disbursement,1100001184,1000000071,0010826000711034,Disbursement,2008-09-16T00:00:00.000Z,41870.01,EUR,2008-09-16T00:00:00.000Z,1000000071 G-B-BE-36-,IFAD,MINISTRY OF FINANCE,Money is disbursed through central Ministry of Finance or Treasury,,MZ,ESA,1000000071 0010826000711034 Direct Payment/Reimbursement,C01, ,3,1,20,110
1000000071_0010732000711029_11-16-2007-00:00:00_Disbursement,1100001184,1000000071,0010732000711029,Disbursement,2007-11-16T00:00:00.000Z,141581.13,EUR,2007-11-16T00:00:00.000Z,1000000071 G-B-BE-36-,IFAD,MINISTRY OF FINANCE,Money is disbursed through central Ministry of Finance or Treasury,,MZ,ESA,1000000071 0010732000711029 Direct Payment/Reimbursement,C01, ,3,1,20,110
1000000071_0010728300711028_10-10-2007-00:00:00_Disbursement,1100001184,1000000071,0010728300711028,Disbursement,2007-10-10T00:00:00.000Z,49816.45,EUR,2007-10-10T00:00:00.000Z,1000000071 G-B-BE-36-,IFAD,MINISTRY OF FINANCE,Money is disbursed through central Ministry of Finance or Treasury,,MZ,ESA,1000000071 0010728300711028 Direct Payment/Reimbursement,C01, ,3,1,20,110
1000000071_0010614600711009_05-26-2006-00:00:00_Disbursement,1100001184,1000000071,0010614600711009,Disbursement,2006-05-26T00:00:00.000Z,80913.8,EUR,2006-05-26T00:00:00.000Z,1000000071 G-B-BE-36-,IFAD,MINISTRY OF FINANCE,Money is disbursed through central Ministry of Finance or Treasury,,MZ,ESA,1000000071 0010614600711009 Direct Payment/Reimbursement,C01, ,3,1,20,110
1000000071_0010909000711041_03-31-2009-00:00:00_Disbursement,1100001184,1000000071,0010909000711041,Disbursement,2009-03-31T00:00:00.000Z,35555.78,EUR,2009-03-31T00:00:00.000Z,1000000071 G-B-BE-36-,IFAD,MINISTRY OF FINANCE,Money is disbursed through central Ministry of Finance or Treasury,,MZ,ESA,1000000071 0010909000711041 Direct Payment/Reimbursement,C01, ,3,1,20,110
1000000071_0010712800711022_05-08-2007-00:00:00_Disbursement,1100001184,1000000071,0010712800711022,Disbursement,2007-05-08T00:00:00.000Z,103013.23,EUR,2007-05-08T00:00:00.000Z,1000000071 G-B-BE-36-,IFAD,MINISTRY OF FINANCE,Money is disbursed through central Ministry of Finance or Treasury,,MZ,ESA,1000000071 0010712800711022 Direct Payment/Reimbursement,C01, ,3,1,20,110
1000000071_0010620600711011_07-25-2006-00:00:00_Disbursement,1100001184,1000000071,0010620600711011,Disbursement,2006-07-25T00:00:00.000Z,174038.38,EUR,2006-07-25T00:00:00.000Z,1000000071 G-B-BE-36-,IFAD,MINISTRY OF FINANCE,Money is disbursed through central Ministry of Finance or Treasury,,MZ,ESA,1000000071 0010620600711011 Direct Payment/Reimbursement,C01, ,3,1,20,110
1000000071_0010625000711012_09-07-2006-00:00:00_Disbursement,1100001184,1000000071,0010625000711012,Disbursement,2006-09-07T00:00:00.000Z,55500.35,EUR,2006-09-07T00:00:00.000Z,1000000071 G-B-BE-36-,IFAD,MINISTRY OF FINANCE,Money is disbursed through central Ministry of Finance or Treasury,,MZ,ESA,1000000071 0010625000711012 Direct Payment/Reimbursement,C01, ,3,1,20,110
1000000071_0010619900711010_07-18-2006-00:00:00_Disbursement,1100001184,1000000071,0010619900711010,Disbursement,2006-07-18T00:00:00.000Z,82219.3,EUR,2006-07-18T00:00:00.000Z,1000000071 G-B-BE-36-,IFAD,MINISTRY OF FINANCE,Money is disbursed through central Ministry of Finance or Treasury,,MZ,ESA,1000000071 0010619900711010 Direct Payment/Reimbursement,C01, ,3,1,20,110
1000000071_0010630700711014_11-03-2006-00:00:00_Disbursement,1100001184,1000000071,0010630700711014,Disbursement,2006-11-03T00:00:00.000Z,81303.17,EUR,2006-11-03T00:00:00.000Z,1000000071 G-B-BE-36-,IFAD,MINISTRY OF FINANCE,Money is disbursed through central Ministry of Finance or Treasury,,MZ,ESA,1000000071 0010630700711014 Direct Payment/Reimbursement,C01, ,3,1,20,110
1000000071_0010633900711015_12-05-2006-00:00:00_Disbursement,1100001184,1000000071,0010633900711015,Disbursement,2006-12-05T00:00:00.000Z,53966.85,EUR,2006-12-05T00:00:00.000Z,1000000071 G-B-BE-36-,IFAD,MINISTRY OF FINANCE,Money is disbursed through central Ministry of Finance or Treasury,,MZ,ESA,1000000071 0010633900711015 Direct Payment/Reimbursement,C01, ,3,1,20,110
1000000071_0010710800711020_04-18-2007-00:00:00_Disbursement,1100001184,1000000071,0010710800711020,Disbursement,2007-04-18T00:00:00.000Z,25826.49,EUR,2007-04-18T00:00:00.000Z,1000000071 G-B-BE-36-,IFAD,MINISTRY OF FINANCE,Money is disbursed through central Ministry of Finance or Treasury,,MZ,ESA,1000000071 0010710800711020 Direct Payment/Reimbursement,C01, ,3,1,20,110
1000000071_0010828400711035_10-10-2008-00:00:00_Disbursement,1100001184,1000000071,0010828400711035,Disbursement,2008-10-10T00:00:00.000Z,40884.9,EUR,2008-10-10T00:00:00.000Z,1000000071 G-B-BE-36-,IFAD,MINISTRY OF FINANCE,Money is disbursed through central Ministry of Finance or Treasury,,MZ,ESA,1000000071 0010828400711035 Direct Payment/Reimbursement,C01, ,3,1,20,110
1000000071_0010907900711040_03-20-2009-00:00:00_Disbursement,1100001184,1000000071,0010907900711040,Disbursement,2009-03-20T00:00:00.000Z,43718.59,EUR,2009-03-20T00:00:00.000Z,1000000071 G-B-BE-36-,IFAD,MINISTRY OF FINANCE,Money is disbursed through central Ministry of Finance or Treasury,,MZ,ESA,1000000071 0010907900711040 Direct Payment/Reimbursement,C01, ,3,1,20,110
1000000071_0010520900711004_07-28-2005-00:00:00_Disbursement,1100001184,1000000071,0010520900711004,Disbursement,2005-07-28T00:00:00.000Z,171411.75,EUR,2005-07-28T00:00:00.000Z,1000000071 G-B-BE-36-,IFAD,MINISTRY OF FINANCE,Money is disbursed through central Ministry of Finance or Treasury,,MZ,ESA,1000000071 0010520900711004 Direct Payment/Reimbursement,C01, ,3,1,20,110
1000000071_0010813300711031_05-12-2008-00:00:00_Disbursement,1100001184,1000000071,0010813300711031,Disbursement,2008-05-12T00:00:00.000Z,161126.16,EUR,2008-05-12T00:00:00.000Z,1000000071 G-B-BE-36-,IFAD,MINISTRY OF FINANCE,Money is disbursed through central Ministry of Finance or Treasury,,MZ,ESA,1000000071 0010813300711031 Direct Payment/Reimbursement,C01, ,3,1,20,110
1000000071_0010236500711001_12-31-2002-00:00:00_Disbursement,1100001184,1000000071,0010236500711001,Disbursement,2002-12-31T00:00:00.000Z,238391.12,EUR,2002-12-31T00:00:00.000Z,1000000071 G-B-BE-36-,IFAD,MINISTRY OF FINANCE,Money is disbursed through central Ministry of Finance or Treasury,,MZ,ESA,1000000071 0010236500711001 Direct Payment/Reimbursement,C01, ,3,1,20,110
1000000071_0010719100711026_07-10-2007-00:00:00_Disbursement,1100001184,1000000071,0010719100711026,Disbursement,2007-07-10T00:00:00.000Z,18942.12,EUR,2007-07-10T00:00:00.000Z,1000000071 G-B-BE-36-,IFAD,MINISTRY OF FINANCE,Money is disbursed through central Ministry of Finance or Treasury,,MZ,ESA,1000000071 0010719100711026 Direct Payment/Reimbursement,C01, ,3,1,20,110
1000000071_0010604500711007_02-14-2006-00:00:00_Disbursement,1100001184,1000000071,0010604500711007,Disbursement,2006-02-14T00:00:00.000Z,210119.37,EUR,2006-02-14T00:00:00.000Z,1000000071 G-B-BE-36-,IFAD,MINISTRY OF FINANCE,Money is disbursed through central Ministry of Finance or Treasury,,MZ,ESA,1000000071 0010604500711007 Direct Payment/Reimbursement,C01, ,3,1,20,110
1000000071_0010525600711005_09-13-2005-00:00:00_Disbursement,1100001184,1000000071,0010525600711005,Disbursement,2005-09-13T00:00:00.000Z,39875.18,EUR,2005-09-13T00:00:00.000Z,1000000071 G-B-BE-36-,IFAD,MINISTRY OF FINANCE,Money is disbursed through central Ministry of Finance or Treasury,,MZ,ESA,1000000071 0010525600711005 Direct Payment/Reimbursement,C01, ,3,1,20,110
1000000071_0010835900711036_12-24-2008-00:00:00_Disbursement,1100001184,1000000071,0010835900711036,Disbursement,2008-12-24T00:00:00.000Z,59448.14,EUR,2008-12-24T00:00:00.000Z,1000000071 G-B-BE-36-,IFAD,MINISTRY OF FINANCE,Money is disbursed through central Ministry of Finance or Treasury,,MZ,ESA,1000000071 0010835900711036 Direct Payment/Reimbursement,C01, ,3,1,20,110
1000000071_0010719100711025_07-10-2007-00:00:00_Disbursement,1100001184,1000000071,0010719100711025,Disbursement,2007-07-10T00:00:00.000Z,21145.97,EUR,2007-07-10T00:00:00.000Z,1000000071 G-B-BE-36-,IFAD,MINISTRY OF FINANCE,Money is disbursed through central Ministry of Finance or Treasury,,MZ,ESA,1000000071 0010719100711025 Direct Payment/Reimbursement,C01, ,3,1,20,110
1000000071_0010802300711030_01-23-2008-00:00:00_Disbursement,1100001184,1000000071,0010802300711030,Disbursement,2008-01-23T00:00:00.000Z,117840.05,EUR,2008-01-23T00:00:00.000Z,1000000071 G-B-BE-36-,IFAD,MINISTRY OF FINANCE,Money is disbursed through central Ministry of Finance or Treasury,,MZ,ESA,1000000071 0010802300711030 Direct Payment/Reimbursement,C01, ,3,1,20,110
1000000071_0010712800711021_05-08-2007-00:00:00_Disbursement,1100001184,1000000071,0010712800711021,Disbursement,2007-05-08T00:00:00.000Z,61259.39,EUR,2007-05-08T00:00:00.000Z,1000000071 G-B-BE-36-,IFAD,MINISTRY OF FINANCE,Money is disbursed through central Ministry of Finance or Treasury,,MZ,ESA,1000000071 0010712800711021 Direct Payment/Reimbursement,C01, ,3,1,20,110
1000000071_0010626500711013_09-22-2006-00:00:00_Disbursement,1100001184,1000000071,0010626500711013,Disbursement,2006-09-22T00:00:00.000Z,90186.93,EUR,2006-09-22T00:00:00.000Z,1000000071 G-B-BE-36-,IFAD,MINISTRY OF FINANCE,Money is disbursed through central Ministry of Finance or Treasury,,MZ,ESA,1000000071 0010626500711013 Direct Payment/Reimbursement,C01, ,3,1,20,110
1000000071_0010710800711019_04-18-2007-00:00:00_Disbursement,1100001184,1000000071,0010710800711019,Disbursement,2007-04-18T00:00:00.000Z,23241.85,EUR,2007-04-18T00:00:00.000Z,1000000071 G-B-BE-36-,IFAD,MINISTRY OF FINANCE,Money is disbursed through central Ministry of Finance or Treasury,,MZ,ESA,1000000071 0010710800711019 Direct Payment/Reimbursement,C01, ,3,1,20,110
1000000071_0011108400711047_03-25-2011-00:00:00_Disbursement,1100001184,1000000071,0011108400711047,Disbursement,2011-03-25T00:00:00.000Z,28165.95,EUR,2011-03-25T00:00:00.000Z,1000000071 G-B-BE-36-,IFAD,MINISTRY OF FINANCE,Money is disbursed through central Ministry of Finance or Treasury,,MZ,ESA,1000000071 0011108400711047 Direct Payment/Reimbursement,C01, ,3,1,20,110
1000000071_0010703800711016_02-07-2007-00:00:00_Disbursement,1100001184,1000000071,0010703800711016,Disbursement,2007-02-07T00:00:00.000Z,153381.14,EUR,2007-02-07T00:00:00.000Z,1000000071 G-B-BE-36-,IFAD,MINISTRY OF FINANCE,Money is disbursed through central Ministry of Finance or Treasury,,MZ,ESA,1000000071 0010703800711016 Direct Payment/Reimbursement,C01, ,3,1,20,110
1000000071_0011108700711048_03-28-2011-00:00:00_Disbursement,1100001184,1000000071,0011108700711048,Disbursement,2011-03-28T00:00:00.000Z,38433.39,EUR,2011-03-28T00:00:00.000Z,1000000071 G-B-BE-36-,IFAD,MINISTRY OF FINANCE,Money is disbursed through central Ministry of Finance or Treasury,,MZ,ESA,1000000071 0011108700711048 Direct Payment/Reimbursement,C01, ,3,1,20,110
1000000071_0011115200711049_06-01-2011-00:00:00_Disbursement,1100001184,1000000071,0011115200711049,Disbursement,2011-06-01T00:00:00.000Z,35898.77,EUR,2011-06-01T00:00:00.000Z,1000000071 G-B-BE-36-,IFAD,MINISTRY OF FINANCE,Money is disbursed through central Ministry of Finance or Treasury,,MZ,ESA,1000000071 0011115200711049 Direct Payment/Reimbursement,C01, ,3,1,20,110
1000000071_0011124400711050_09-01-2011-00:00:00_Disbursement,1100001184,1000000071,0011124400711050,Disbursement,2011-09-01T00:00:00.000Z,23388.63,EUR,2011-09-01T00:00:00.000Z,1000000071 G-B-BE-36-,IFAD,MINISTRY OF FINANCE,Money is disbursed through central Ministry of Finance or Treasury,,MZ,ESA,1000000071 0011124400711050 Direct Payment/Reimbursement,C01, ,3,1,20,110
1000000071_0011016700711045_06-16-2010-00:00:00_Disbursement,1100001184,1000000071,0011016700711045,Disbursement,2010-06-16T00:00:00.000Z,48187.64,EUR,2010-06-16T00:00:00.000Z,1000000071 G-B-BE-36-,IFAD,MINISTRY OF FINANCE,Money is disbursed through central Ministry of Finance or Treasury,,MZ,ESA,1000000071 0011016700711045 Direct Payment/Reimbursement,C01, ,3,1,20,110
1000000071_0010504100711003_02-10-2005-00:00:00_Disbursement,1100001184,1000000071,0010504100711003,Disbursement,2005-02-10T00:00:00.000Z,76306.21,EUR,2005-02-10T00:00:00.000Z,1000000071 G-B-BE-36-,IFAD,MINISTRY OF FINANCE,Money is disbursed through central Ministry of Finance or Treasury,,MZ,ESA,1000000071 0010504100711003 Direct Payment/Reimbursement,C01, ,3,1,20,110
1000000071_0010715500711024_06-04-2007-00:00:00_Disbursement,1100001184,1000000071,0010715500711024,Disbursement,2007-06-04T00:00:00.000Z,140771.61,EUR,2007-06-04T00:00:00.000Z,1000000071 G-B-BE-36-,IFAD,MINISTRY OF FINANCE,Money is disbursed through central Ministry of Finance or Treasury,,MZ,ESA,1000000071 0010715500711024 Direct Payment/Reimbursement,C01, ,3,1,20,110
1000000071_0010713700711023_05-17-2007-00:00:00_Disbursement,1100001184,1000000071,0010713700711023,Disbursement,2007-05-17T00:00:00.000Z,94356.13,EUR,2007-05-17T00:00:00.000Z,1000000071 G-B-BE-36-,IFAD,MINISTRY OF FINANCE,Money is disbursed through central Ministry of Finance or Treasury,,MZ,ESA,1000000071 0010713700711023 Direct Payment/Reimbursement,C01, ,3,1,20,110
1000000071_0010820400711033_07-22-2008-00:00:00_Disbursement,1100001184,1000000071,0010820400711033,Disbursement,2008-07-22T00:00:00.000Z,31598.82,EUR,2008-07-22T00:00:00.000Z,1000000071 G-B-BE-36-,IFAD,MINISTRY OF FINANCE,Money is disbursed through central Ministry of Finance or Treasury,,MZ,ESA,1000000071 0010820400711033 Direct Payment/Reimbursement,C01, ,3,1,20,110
1000000071_0010613700711008_05-17-2006-00:00:00_Disbursement,1100001184,1000000071,0010613700711008,Disbursement,2006-05-17T00:00:00.000Z,95903.44,EUR,2006-05-17T00:00:00.000Z,1000000071 G-B-BE-36-,IFAD,MINISTRY OF FINANCE,Money is disbursed through central Ministry of Finance or Treasury,,MZ,ESA,1000000071 0010613700711008 Direct Payment/Reimbursement,C01, ,3,1,20,110
1000000072__04-23-2002-00:00:00_Commitment,1100001097,1000000072,,Commitment,2002-04-23T00:00:00.000Z,3962000.0,EUR,2002-04-23T00:00:00.000Z,1000000072 G-B-BE-37-,IFAD,OFFICE OF MACRO-POLICY & INTERNATIONAL ECONOMIC COOPERATION,Money is disbursed through central Ministry of Finance or Treasury,,ER,ESA,1000000072 GRANTS,C01, ,2,1,20,110
1000000072_0010522300721006_08-11-2005-00:00:00_Disbursement,1100001097,1000000072,0010522300721006,Disbursement,2005-08-11T00:00:00.000Z,35317.93,EUR,2005-08-11T00:00:00.000Z,1000000072 G-B-BE-37-,IFAD,OFFICE OF MACRO-POLICY & INTERNATIONAL ECONOMIC COOPERATION,Money is disbursed through central Ministry of Finance or Treasury,,ER,ESA,1000000072 0010522300721006 Direct Payment/Reimbursement,C01, ,3,1,20,110
1000000072_0011026400721055_09-21-2010-00:00:00_Disbursement,1100001097,1000000072,0011026400721055,Disbursement,2010-09-21T00:00:00.000Z,251523.95,EUR,2010-09-21T00:00:00.000Z,1000000072 G-B-BE-37-,IFAD,OFFICE OF MACRO-POLICY & INTERNATIONAL ECONOMIC COOPERATION,Money is disbursed through central Ministry of Finance or Treasury,,ER,ESA,1000000072 0011026400721055 Direct Payment/Reimbursement,C01, ,3,1,20,110
1000000072_0011008100721042_03-22-2010-00:00:00_Disbursement,1100001097,1000000072,0011008100721042,Disbursement,2010-03-22T00:00:00.000Z,6813.27,EUR,2010-03-22T00:00:00.000Z,1000000072 G-B-BE-37-,IFAD,OFFICE OF MACRO-POLICY & INTERNATIONAL ECONOMIC COOPERATION,Money is disbursed through central Ministry of Finance or Treasury,,ER,ESA,1000000072 0011008100721042 Direct Payment/Reimbursement,C01, ,3,1,20,110
1000000072_0010902000721023_01-20-2009-00:00:00_Disbursement,1100001097,1000000072,0010902000721023,Disbursement,2009-01-20T00:00:00.000Z,57752.97,EUR,2009-01-20T00:00:00.000Z,1000000072 G-B-BE-37-,IFAD,OFFICE OF MACRO-POLICY & INTERNATIONAL ECONOMIC COOPERATION,Money is disbursed through central Ministry of Finance or Treasury,,ER,ESA,1000000072 0010902000721023 Direct Payment/Reimbursement,C01, ,3,1,20,110
1000000072_0011006000721040_03-01-2010-00:00:00_Disbursement,1100001097,1000000072,0011006000721040,Disbursement,2010-03-01T00:00:00.000Z,54736.71,EUR,2010-03-01T00:00:00.000Z,1000000072 G-B-BE-37-,IFAD,OFFICE OF MACRO-POLICY & INTERNATIONAL ECONOMIC COOPERATION,Money is disbursed through central Ministry of Finance or Treasury,,ER,ESA,1000000072 0011006000721040 Direct Payment/Reimbursement,C01, ,3,1,20,110
1000000072_0010916700721030_06-16-2009-00:00:00_Disbursement,1100001097,1000000072,0010916700721030,Disbursement,2009-06-16T00:00:00.000Z,21067.05,EUR,2009-06-16T00:00:00.000Z,1000000072 G-B-BE-37-,IFAD,OFFICE OF MACRO-POLICY & INTERNATIONAL ECONOMIC COOPERATION,Money is disbursed through central Ministry of Finance or Treasury,,ER,ESA,1000000072 0010916700721030 Direct Payment/Reimbursement,C01, ,3,1,20,110
1000000072_0010914600721029_05-26-2009-00:00:00_Disbursement,1100001097,1000000072,0010914600721029,Disbursement,2009-05-26T00:00:00.000Z,33085.02,EUR,2009-05-26T00:00:00.000Z,1000000072 G-B-BE-37-,IFAD,OFFICE OF MACRO-POLICY & INTERNATIONAL ECONOMIC COOPERATION,Money is disbursed through central Ministry of Finance or Treasury,,ER,ESA,1000000072 0010914600721029 Direct Payment/Reimbursement,C01, ,3,1,20,110
1000000072_0011013800721048_05-18-2010-00:00:00_Disbursement,1100001097,1000000072,0011013800721048,Disbursement,2010-05-18T00:00:00.000Z,124458.65,EUR,2010-05-18T00:00:00.000Z,1000000072 G-B-BE-37-,IFAD,OFFICE OF MACRO-POLICY & INTERNATIONAL ECONOMIC COOPERATION,Money is disbursed through central Ministry of Finance or Treasury,,ER,ESA,1000000072 0011013800721048 Direct Payment/Reimbursement,C01, ,3,1,20,110
1000000072_0010822600721018_08-13-2008-00:00:00_Disbursement,1100001097,1000000072,0010822600721018,Disbursement,2008-08-13T00:00:00.000Z,41545.17,EUR,2008-08-13T00:00:00.000Z,1000000072 G-B-BE-37-,IFAD,OFFICE OF MACRO-POLICY & INTERNATIONAL ECONOMIC COOPERATION,Money is disbursed through central Ministry of Finance or Treasury,,ER,ESA,1000000072 0010822600721018 Direct Payment/Reimbursement,C01, ,3,1,20,110
1000000072_0010922200721033_08-10-2009-00:00:00_Disbursement,1100001097,1000000072,0010922200721033,Disbursement,2009-08-10T00:00:00.000Z,53592.96,EUR,2009-08-10T00:00:00.000Z,1000000072 G-B-BE-37-,IFAD,OFFICE OF MACRO-POLICY & INTERNATIONAL ECONOMIC COOPERATION,Money is disbursed through central Ministry of Finance or Treasury,,ER,ESA,1000000072 0010922200721033 Direct Payment/Reimbursement,C01, ,3,1,20,110
1000000072_0010519500721005_07-14-2005-00:00:00_Disbursement,1100001097,1000000072,0010519500721005,Disbursement,2005-07-14T00:00:00.000Z,37871.41,EUR,2005-07-14T00:00:00.000Z,1000000072 G-B-BE-37-,IFAD,OFFICE OF MACRO-POLICY & INTERNATIONAL ECONOMIC COOPERATION,Money is disbursed through central Ministry of Finance or Treasury,,ER,ESA,1000000072 0010519500721005 Direct Payment/Reimbursement,C01, ,3,1,20,110
1000000072_0010701100721010_01-11-2007-00:00:00_Disbursement,1100001097,1000000072,0010701100721010,Disbursement,2007-01-11T00:00:00.000Z,62184.69,EUR,2007-01-11T00:00:00.000Z,1000000072 G-B-BE-37-,IFAD,OFFICE OF MACRO-POLICY & INTERNATIONAL ECONOMIC COOPERATION,Money is disbursed through central Ministry of Finance or Treasury,,ER,ESA,1000000072 0010701100721010 Direct Payment/Reimbursement,C01, ,3,1,20,110
1000000072_0011008800721043_03-29-2010-00:00:00_Disbursement,1100001097,1000000072,0011008800721043,Disbursement,2010-03-29T00:00:00.000Z,31986.93,EUR,2010-03-29T00:00:00.000Z,1000000072 G-B-BE-37-,IFAD,OFFICE OF MACRO-POLICY & INTERNATIONAL ECONOMIC COOPERATION,Money is disbursed through central Ministry of Finance or Treasury,,ER,ESA,1000000072 0011008800721043 Direct Payment/Reimbursement,C01, ,3,1,20,110
1000000072_0011028100721056_10-08-2010-00:00:00_Disbursement,1100001097,1000000072,0011028100721056,Disbursement,2010-10-08T00:00:00.000Z,21906.26,EUR,2010-10-08T00:00:00.000Z,1000000072 G-B-BE-37-,IFAD,OFFICE OF MACRO-POLICY & INTERNATIONAL ECONOMIC COOPERATION,Money is disbursed through central Ministry of Finance or Treasury,,ER,ESA,1000000072 0011028100721056 Direct Payment/Reimbursement,C01, ,3,1,20,110
1000000072_0010905100721025_02-20-2009-00:00:00_Disbursement,1100001097,1000000072,0010905100721025,Disbursement,2009-02-20T00:00:00.000Z,23985.7,EUR,2009-02-20T00:00:00.000Z,1000000072 G-B-BE-37-,IFAD,OFFICE OF MACRO-POLICY & INTERNATIONAL ECONOMIC COOPERATION,Money is disbursed through central Ministry of Finance or Treasury,,ER,ESA,1000000072 0010905100721025 Direct Payment/Reimbursement,C01, ,3,1,20,110
1000000072_0010904000721024_02-09-2009-00:00:00_Disbursement,1100001097,1000000072,0010904000721024,Disbursement,2009-02-09T00:00:00.000Z,43003.72,EUR,2009-02-09T00:00:00.000Z,1000000072 G-B-BE-37-,IFAD,OFFICE OF MACRO-POLICY & INTERNATIONAL ECONOMIC COOPERATION,Money is disbursed through central Ministry of Finance or Treasury,,ER,ESA,1000000072 0010904000721024 Direct Payment/Reimbursement,C01, ,3,1,20,110
1000000072_0010930100721036_10-28-2009-00:00:00_Disbursement,1100001097,1000000072,0010930100721036,Disbursement,2009-10-28T00:00:00.000Z,33622.92,EUR,2009-10-28T00:00:00.000Z,1000000072 G-B-BE-37-,IFAD,OFFICE OF MACRO-POLICY & INTERNATIONAL ECONOMIC COOPERATION,Money is disbursed through central Ministry of Finance or Treasury,,ER,ESA,1000000072 0010930100721036 Direct Payment/Reimbursement,C01, ,3,1,20,110
1000000072_0010912600721026_05-06-2009-00:00:00_Disbursement,1100001097,1000000072,0010912600721026,Disbursement,2009-05-06T00:00:00.000Z,69788.9,EUR,2009-05-06T00:00:00.000Z,1000000072 G-B-BE-37-,IFAD,OFFICE OF MACRO-POLICY & INTERNATIONAL ECONOMIC COOPERATION,Money is disbursed through central Ministry of Finance or Treasury,,ER,ESA,1000000072 0010912600721026 Direct Payment/Reimbursement,C01, ,3,1,20,110
1000000072_0010935600721037_12-22-2009-00:00:00_Disbursement,1100001097,1000000072,0010935600721037,Disbursement,2009-12-22T00:00:00.000Z,69182.31,EUR,2009-12-22T00:00:00.000Z,1000000072 G-B-BE-37-,IFAD,OFFICE OF MACRO-POLICY & INTERNATIONAL ECONOMIC COOPERATION,Money is disbursed through central Ministry of Finance or Treasury,,ER,ESA,1000000072 0010935600721037 Direct Payment/Reimbursement,C01, ,3,1,20,110
1000000072_0010420200721002_07-20-2004-00:00:00_Disbursement,1100001097,1000000072,0010420200721002,Disbursement,2004-07-20T00:00:00.000Z,89869.02,EUR,2004-07-20T00:00:00.000Z,1000000072 G-B-BE-37-,IFAD,OFFICE OF MACRO-POLICY & INTERNATIONAL ECONOMIC COOPERATION,Money is disbursed through central Ministry of Finance or Treasury,,ER,ESA,1000000072 0010420200721002 Direct Payment/Reimbursement,C01, ,3,1,20,110
1000000072_0010830800721019_11-03-2008-00:00:00_Disbursement,1100001097,1000000072,0010830800721019,Disbursement,2008-11-03T00:00:00.000Z,130770.86,EUR,2008-11-03T00:00:00.000Z,1000000072 G-B-BE-37-,IFAD,OFFICE OF MACRO-POLICY & INTERNATIONAL ECONOMIC COOPERATION,Money is disbursed through central Ministry of Finance or Treasury,,ER,ESA,1000000072 0010830800721019 Direct Payment/Reimbursement,C01, ,3,1,20,110
1000000072_0010928700721035_10-14-2009-00:00:00_Disbursement,1100001097,1000000072,0010928700721035,Disbursement,2009-10-14T00:00:00.000Z,85093.58,EUR,2009-10-14T00:00:00.000Z,1000000072 G-B-BE-37-,IFAD,OFFICE OF MACRO-POLICY & INTERNATIONAL ECONOMIC COOPERATION,Money is disbursed through central Ministry of Finance or Treasury,,ER,ESA,1000000072 0010928700721035 Direct Payment/Reimbursement,C01, ,3,1,20,110
1000000072_0010910400721027_04-14-2009-00:00:00_Disbursement,1100001097,1000000072,0010910400721027,Disbursement,2009-04-14T00:00:00.000Z,51980.98,EUR,2009-04-14T00:00:00.000Z,1000000072 G-B-BE-37-,IFAD,OFFICE OF MACRO-POLICY & INTERNATIONAL ECONOMIC COOPERATION,Money is disbursed through central Ministry of Finance or Treasury,,ER,ESA,1000000072 0010910400721027 Direct Payment/Reimbursement,C01, ,3,1,20,110
1000000072_0010803100721016_01-31-2008-00:00:00_Disbursement,1100001097,1000000072,0010803100721016,Disbursement,2008-01-31T00:00:00.000Z,81450.1,EUR,2008-01-31T00:00:00.000Z,1000000072 G-B-BE-37-,IFAD,OFFICE OF MACRO-POLICY & INTERNATIONAL ECONOMIC COOPERATION,Money is disbursed through central Ministry of Finance or Treasury,,ER,ESA,1000000072 0010803100721016 Direct Payment/Reimbursement,C01, ,3,1,20,110
1000000072_0011008100721041_03-22-2010-00:00:00_Disbursement,1100001097,1000000072,0011008100721041,Disbursement,2010-03-22T00:00:00.000Z,25554.51,EUR,2010-03-22T00:00:00.000Z,1000000072 G-B-BE-37-,IFAD,OFFICE OF MACRO-POLICY & INTERNATIONAL ECONOMIC COOPERATION,Money is disbursed through central Ministry of Finance or Treasury,,ER,ESA,1000000072 0011008100721041 Direct Payment/Reimbursement,C01, ,3,1,20,110
1000000072_0010726900721014_09-26-2007-00:00:00_Disbursement,1100001097,1000000072,0010726900721014,Disbursement,2007-09-26T00:00:00.000Z,84005.91,EUR,2007-09-26T00:00:00.000Z,1000000072 G-B-BE-37-,IFAD,OFFICE OF MACRO-POLICY & INTERNATIONAL ECONOMIC COOPERATION,Money is disbursed through central Ministry of Finance or Treasury,,ER,ESA,1000000072 0010726900721014 Direct Payment/Reimbursement,C01, ,3,1,20,110
1000000072_0010830800721020_11-03-2008-00:00:00_Disbursement,1100001097,1000000072,0010830800721020,Disbursement,2008-11-03T00:00:00.000Z,72257.4,EUR,2008-11-03T00:00:00.000Z,1000000072 G-B-BE-37-,IFAD,OFFICE OF MACRO-POLICY & INTERNATIONAL ECONOMIC COOPERATION,Money is disbursed through central Ministry of Finance or Treasury,,ER,ESA,1000000072 0010830800721020 Direct Payment/Reimbursement,C01, ,3,1,20,110
1000000072_0011010900721045_04-19-2010-00:00:00_Disbursement,1100001097,1000000072,0011010900721045,Disbursement,2010-04-19T00:00:00.000Z,16207.99,EUR,2010-04-19T00:00:00.000Z,1000000072 G-B-BE-37-,IFAD,OFFICE OF MACRO-POLICY & INTERNATIONAL ECONOMIC COOPERATION,Money is disbursed through central Ministry of Finance or Treasury,,ER,ESA,1000000072 0011010900721045 Direct Payment/Reimbursement,C01, ,3,1,20,110
1000000072_0010308700721001_03-28-2003-00:00:00_Disbursement,1100001097,1000000072,0010308700721001,Disbursement,2003-03-28T00:00:00.000Z,279591.33,EUR,2003-03-28T00:00:00.000Z,1000000072 G-B-BE-37-,IFAD,OFFICE OF MACRO-POLICY & INTERNATIONAL ECONOMIC COOPERATION,Money is disbursed through central Ministry of Finance or Treasury,,ER,ESA,1000000072 0010308700721001 Direct Payment/Reimbursement,C01, ,3,1,20,110
1000000072_0010935700721038_12-23-2009-00:00:00_Disbursement,1100001097,1000000072,0010935700721038,Disbursement,2009-12-23T00:00:00.000Z,200599.77,EUR,2009-12-23T00:00:00.000Z,1000000072 G-B-BE-37-,IFAD,OFFICE OF MACRO-POLICY & INTERNATIONAL ECONOMIC COOPERATION,Money is disbursed through central Ministry of Finance or Treasury,,ER,ESA,1000000072 0010935700721038 Direct Payment/Reimbursement,C01, ,3,1,20,110
1000000072_0010927400721034_10-01-2009-00:00:00_Disbursement,1100001097,1000000072,0010927400721034,Disbursement,2009-10-01T00:00:00.000Z,33719.06,EUR,2009-10-01T00:00:00.000Z,1000000072 G-B-BE-37-,IFAD,OFFICE OF MACRO-POLICY & INTERNATIONAL ECONOMIC COOPERATION,Money is disbursed through central Ministry of Finance or Treasury,,ER,ESA,1000000072 0010927400721034 Direct Payment/Reimbursement,C01, ,3,1,20,110
1000000072_0011022800721054_08-16-2010-00:00:00_Disbursement,1100001097,1000000072,0011022800721054,Disbursement,2010-08-16T00:00:00.000Z,130127.26,EUR,2010-08-16T00:00:00.000Z,1000000072 G-B-BE-37-,IFAD,OFFICE OF MACRO-POLICY & INTERNATIONAL ECONOMIC COOPERATION,Money is disbursed through central Ministry of Finance or Treasury,,ER,ESA,1000000072 0011022800721054 Direct Payment/Reimbursement,C01, ,3,1,20,110
1000000072_0010814800721017_05-27-2008-00:00:00_Disbursement,1100001097,1000000072,0010814800721017,Disbursement,2008-05-27T00:00:00.000Z,75980.12,EUR,2008-05-27T00:00:00.000Z,1000000072 G-B-BE-37-,IFAD,OFFICE OF MACRO-POLICY & INTERNATIONAL ECONOMIC COOPERATION,Money is disbursed through central Ministry of Finance or Treasury,,ER,ESA,1000000072 0010814800721017 Direct Payment/Reimbursement,C01, ,3,1,20,110
1000000072_0010707300721011_03-14-2007-00:00:00_Disbursement,1100001097,1000000072,0010707300721011,Disbursement,2007-03-14T00:00:00.000Z,0.01,EUR,2007-03-14T00:00:00.000Z,1000000072 G-B-BE-37-,IFAD,OFFICE OF MACRO-POLICY & INTERNATIONAL ECONOMIC COOPERATION,Money is disbursed through central Ministry of Finance or Treasury,,ER,ESA,1000000072 0010707300721011 Direct Payment/Reimbursement,C01, ,3,1,20,110
1000000072_0010610100721007_04-11-2006-00:00:00_Disbursement,1100001097,1000000072,0010610100721007,Disbursement,2006-04-11T00:00:00.000Z,81293.91,EUR,2006-04-11T00:00:00.000Z,1000000072 G-B-BE-37-,IFAD,OFFICE OF MACRO-POLICY & INTERNATIONAL ECONOMIC COOPERATION,Money is disbursed through central Ministry of Finance or Treasury,,ER,ESA,1000000072 0010610100721007 Direct Payment/Reimbursement,C01, ,3,1,20,110
1000000072_0010835900721022_12-24-2008-00:00:00_Disbursement,1100001097,1000000072,0010835900721022,Disbursement,2008-12-24T00:00:00.000Z,38279.33,EUR,2008-12-24T00:00:00.000Z,1000000072 G-B-BE-37-,IFAD,OFFICE OF MACRO-POLICY & INTERNATIONAL ECONOMIC COOPERATION,Money is disbursed through central Ministry of Finance or Treasury,,ER,ESA,1000000072 0010835900721022 Direct Payment/Reimbursement,C01, ,3,1,20,110
1000000072_0010833300721021_11-28-2008-00:00:00_Disbursement,1100001097,1000000072,0010833300721021,Disbursement,2008-11-28T00:00:00.000Z,39092.2,EUR,2008-11-28T00:00:00.000Z,1000000072 G-B-BE-37-,IFAD,OFFICE OF MACRO-POLICY & INTERNATIONAL ECONOMIC COOPERATION,Money is disbursed through central Ministry of Finance or Treasury,,ER,ESA,1000000072 0010833300721021 Direct Payment/Reimbursement,C01, ,3,1,20,110
1000000072_0010622300721008_08-11-2006-00:00:00_Disbursement,1100001097,1000000072,0010622300721008,Disbursement,2006-08-11T00:00:00.000Z,38821.77,EUR,2006-08-11T00:00:00.000Z,1000000072 G-B-BE-37-,IFAD,OFFICE OF MACRO-POLICY & INTERNATIONAL ECONOMIC COOPERATION,Money is disbursed through central Ministry of Finance or Treasury,,ER,ESA,1000000072 0010622300721008 Direct Payment/Reimbursement,C01, ,3,1,20,110
1000000072_0010713000721013_05-10-2007-00:00:00_Disbursement,1100001097,1000000072,0010713000721013,Disbursement,2007-05-10T00:00:00.000Z,42726.84,EUR,2007-05-10T00:00:00.000Z,1000000072 G-B-BE-37-,IFAD,OFFICE OF MACRO-POLICY & INTERNATIONAL ECONOMIC COOPERATION,Money is disbursed through central Ministry of Finance or Treasury,,ER,ESA,1000000072 0010713000721013 Direct Payment/Reimbursement,C01, ,3,1,20,110
1000000072_0010502800721003_01-28-2005-00:00:00_Disbursement,1100001097,1000000072,0010502800721003,Disbursement,2005-01-28T00:00:00.000Z,103571.62,EUR,2005-01-28T00:00:00.000Z,1000000072 G-B-BE-37-,IFAD,OFFICE OF MACRO-POLICY & INTERNATIONAL ECONOMIC COOPERATION,Money is disbursed through central Ministry of Finance or Treasury,,ER,ESA,1000000072 0010502800721003 Direct Payment/Reimbursement,C01, ,3,1,20,110
1000000072_0010626200721009_09-19-2006-00:00:00_Disbursement,1100001097,1000000072,0010626200721009,Disbursement,2006-09-19T00:00:00.000Z,68142.99,EUR,2006-09-19T00:00:00.000Z,1000000072 G-B-BE-37-,IFAD,OFFICE OF MACRO-POLICY & INTERNATIONAL ECONOMIC COOPERATION,Money is disbursed through central Ministry of Finance or Treasury,,ER,ESA,1000000072 0010626200721009 Direct Payment/Reimbursement,C01, ,3,1,20,110
1000000072_0010919000721032_07-09-2009-00:00:00_Disbursement,1100001097,1000000072,0010919000721032,Disbursement,2009-07-09T00:00:00.000Z,91302.02,EUR,2009-07-09T00:00:00.000Z,1000000072 G-B-BE-37-,IFAD,OFFICE OF MACRO-POLICY & INTERNATIONAL ECONOMIC COOPERATION,Money is disbursed through central Ministry of Finance or Treasury,,ER,ESA,1000000072 0010919000721032 Direct Payment/Reimbursement,C01, ,3,1,20,110
1000000072_0010916800721031_06-17-2009-00:00:00_Disbursement,1100001097,1000000072,0010916800721031,Disbursement,2009-06-17T00:00:00.000Z,110384.8,EUR,2009-06-17T00:00:00.000Z,1000000072 G-B-BE-37-,IFAD,OFFICE OF MACRO-POLICY & INTERNATIONAL ECONOMIC COOPERATION,Money is disbursed through central Ministry of Finance or Treasury,,ER,ESA,1000000072 0010916800721031 Direct Payment/Reimbursement,C01, ,3,1,20,110
1000000072_0011014600721050_05-26-2010-00:00:00_Disbursement,1100001097,1000000072,0011014600721050,Disbursement,2010-05-26T00:00:00.000Z,166622.86,EUR,2010-05-26T00:00:00.000Z,1000000072 G-B-BE-37-,IFAD,OFFICE OF MACRO-POLICY & INTERNATIONAL ECONOMIC COOPERATION,Money is disbursed through central Ministry of Finance or Treasury,,ER,ESA,1000000072 0011014600721050 Direct Payment/Reimbursement,C01, ,3,1,20,110
1000000072_0011016600721051_06-15-2010-00:00:00_Disbursement,1100001097,1000000072,0011016600721051,Disbursement,2010-06-15T00:00:00.000Z,167314.76,EUR,2010-06-15T00:00:00.000Z,1000000072 G-B-BE-37-,IFAD,OFFICE OF MACRO-POLICY & INTERNATIONAL ECONOMIC COOPERATION,Money is disbursed through central Ministry of Finance or Treasury,,ER,ESA,1000000072 0011016600721051 Direct Payment/Reimbursement,C01, ,3,1,20,110
1000000072_0010727500721015_10-02-2007-00:00:00_Disbursement,1100001097,1000000072,0010727500721015,Disbursement,2007-10-02T00:00:00.000Z,64383.52,EUR,2007-10-02T00:00:00.000Z,1000000072 G-B-BE-37-,IFAD,OFFICE OF MACRO-POLICY & INTERNATIONAL ECONOMIC COOPERATION,Money is disbursed through central Ministry of Finance or Treasury,,ER,ESA,1000000072 0010727500721015 Direct Payment/Reimbursement,C01, ,3,1,20,110
1000000072_0011002200721039_01-22-2010-00:00:00_Disbursement,1100001097,1000000072,0011002200721039,Disbursement,2010-01-22T00:00:00.000Z,59342.62,EUR,2010-01-22T00:00:00.000Z,1000000072 G-B-BE-37-,IFAD,OFFICE OF MACRO-POLICY & INTERNATIONAL ECONOMIC COOPERATION,Money is disbursed through central Ministry of Finance or Treasury,,ER,ESA,1000000072 0011002200721039 Direct Payment/Reimbursement,C01, ,3,1,20,110
1000000072_0011009800721044_04-08-2010-00:00:00_Disbursement,1100001097,1000000072,0011009800721044,Disbursement,2010-04-08T00:00:00.000Z,129200.3,EUR,2010-04-08T00:00:00.000Z,1000000072 G-B-BE-37-,IFAD,OFFICE OF MACRO-POLICY & INTERNATIONAL ECONOMIC COOPERATION,Money is disbursed through central Ministry of Finance or Treasury,,ER,ESA,1000000072 0011009800721044 Direct Payment/Reimbursement,C01, ,3,1,20,110
1000000072_0010710100721012_04-11-2007-00:00:00_Disbursement,1100001097,1000000072,0010710100721012,Disbursement,2007-04-11T00:00:00.000Z,106875.3,EUR,2007-04-11T00:00:00.000Z,1000000072 G-B-BE-37-,IFAD,OFFICE OF MACRO-POLICY & INTERNATIONAL ECONOMIC COOPERATION,Money is disbursed through central Ministry of Finance or Treasury,,ER,ESA,1000000072 0010710100721012 Direct Payment/Reimbursement,C01, ,3,1,20,110
1000000072_0011016600721052_06-15-2010-00:00:00_Disbursement,1100001097,1000000072,0011016600721052,Disbursement,2010-06-15T00:00:00.000Z,173653.64,EUR,2010-06-15T00:00:00.000Z,1000000072 G-B-BE-37-,IFAD,OFFICE OF MACRO-POLICY & INTERNATIONAL ECONOMIC COOPERATION,Money is disbursed through central Ministry of Finance or Treasury,,ER,ESA,1000000072 0011016600721052 Direct Payment/Reimbursement,C01, ,3,1,20,110
1000000072_0011022200721053_08-10-2010-00:00:00_Disbursement,1100001097,1000000072,0011022200721053,Disbursement,2010-08-10T00:00:00.000Z,18274.72,EUR,2010-08-10T00:00:00.000Z,1000000072 G-B-BE-37-,IFAD,OFFICE OF MACRO-POLICY & INTERNATIONAL ECONOMIC COOPERATION,Money is disbursed through central Ministry of Finance or Treasury,,ER,ESA,1000000072 0011022200721053 Direct Payment/Reimbursement,C01, ,3,1,20,110
1000000072_0010910400721028_04-14-2009-00:00:00_Disbursement,1100001097,1000000072,0010910400721028,Disbursement,2009-04-14T00:00:00.000Z,32082.38,EUR,2009-04-14T00:00:00.000Z,1000000072 G-B-BE-37-,IFAD,OFFICE OF MACRO-POLICY & INTERNATIONAL ECONOMIC COOPERATION,Money is disbursed through central Ministry of Finance or Treasury,,ER,ESA,1000000072 0010910400721028 Direct Payment/Reimbursement,C01, ,3,1,20,110
1000000073__12-11-2002-00:00:00_Commitment,1100001221,1000000073,,Commitment,2002-12-11T00:00:00.000Z,3769467.63,EUR,2002-12-11T00:00:00.000Z,1000000073 G-B-BE-38-,IFAD,MINISTERE DE L'ECONOMIE ET DES FINANCES,Money is disbursed through central Ministry of Finance or Treasury,,NE,WCA,1000000073 GRANTS,C01, ,2,1,20,110
1000000073_0011119500731063_07-14-2011-00:00:00_Disbursement,1100001221,1000000073,0011119500731063,Disbursement,2011-07-14T00:00:00.000Z,17400.78,EUR,2011-07-14T00:00:00.000Z,1000000073 G-B-BE-38-,IFAD,MINISTERE DE L'ECONOMIE ET DES FINANCES,Money is disbursed through central Ministry of Finance or Treasury,,NE,WCA,1000000073 0011119500731063 Direct Payment/Reimbursement,C01, ,3,1,20,110
1000000073_0011018700731046_07-06-2010-00:00:00_Disbursement,1100001221,1000000073,0011018700731046,Disbursement,2010-07-06T00:00:00.000Z,32010.29,EUR,2010-07-06T00:00:00.000Z,1000000073 G-B-BE-38-,IFAD,MINISTERE DE L'ECONOMIE ET DES FINANCES,Money is disbursed through central Ministry of Finance or Treasury,,NE,WCA,1000000073 0011018700731046 Direct Payment/Reimbursement,C01, ,3,1,20,110
1000000073_0010801700731009_01-17-2008-00:00:00_Disbursement,1100001221,1000000073,0010801700731009,Disbursement,2008-01-17T00:00:00.000Z,86837.1,EUR,2008-01-17T00:00:00.000Z,1000000073 G-B-BE-38-,IFAD,MINISTERE DE L'ECONOMIE ET DES FINANCES,Money is disbursed through central Ministry of Finance or Treasury,,NE,WCA,1000000073 0010801700731009 Direct Payment/Reimbursement,C01, ,3,1,20,110
1000000073_0011236600731084_12-31-2012-00:00:00_Disbursement,1100001221,1000000073,0011236600731084,Disbursement,2012-12-31T00:00:00.000Z,67758.67,EUR,2012-12-31T00:00:00.000Z,1000000073 G-B-BE-38-,IFAD,MINISTERE DE L'ECONOMIE ET DES FINANCES,Money is disbursed through central Ministry of Finance or Treasury,,NE,WCA,1000000073 0011236600731084 Direct Payment/Reimbursement,C01, ,3,1,20,110
1000000073_0011003500731036_02-04-2010-00:00:00_Disbursement,1100001221,1000000073,0011003500731036,Disbursement,2010-02-04T00:00:00.000Z,17059.05,EUR,2010-02-04T00:00:00.000Z,1000000073 G-B-BE-38-,IFAD,MINISTERE DE L'ECONOMIE ET DES FINANCES,Money is disbursed through central Ministry of Finance or Treasury,,NE,WCA,1000000073 0011003500731036 Direct Payment/Reimbursement,C01, ,3,1,20,110
1000000073_0011019400731049_07-13-2010-00:00:00_Disbursement,1100001221,1000000073,0011019400731049,Disbursement,2010-07-13T00:00:00.000Z,27137.24,EUR,2010-07-13T00:00:00.000Z,1000000073 G-B-BE-38-,IFAD,MINISTERE DE L'ECONOMIE ET DES FINANCES,Money is disbursed through central Ministry of Finance or Treasury,,NE,WCA,1000000073 0011019400731049 Direct Payment/Reimbursement,C01, ,3,1,20,110
1000000073_0011320400731094_07-23-2013-00:00:00_Disbursement,1100001221,1000000073,0011320400731094,Disbursement,2013-07-23T00:00:00.000Z,50689.3,EUR,2013-07-23T00:00:00.000Z,1000000073 G-B-BE-38-,IFAD,MINISTERE DE L'ECONOMIE ET DES FINANCES,Money is disbursed through central Ministry of Finance or Treasury,,NE,WCA,1000000073 0011320400731094 Direct Payment/Reimbursement,C01, ,3,1,20,110
1000000073_0011128000731068_10-07-2011-00:00:00_Disbursement,1100001221,1000000073,0011128000731068,Disbursement,2011-10-07T00:00:00.000Z,22367.15,EUR,2011-10-07T00:00:00.000Z,1000000073 G-B-BE-38-,IFAD,MINISTERE DE L'ECONOMIE ET DES FINANCES,Money is disbursed through central Ministry of Finance or Treasury,,NE,WCA,1000000073 0011128000731068 Direct Payment/Reimbursement,C01, ,3,1,20,110
1000000073_001RFDB133056001_12-11-2013-00:00:00_Disbursement,1100001221,1000000073,001RFDB133056001,Disbursement,2013-12-11T00:00:00.000Z,-2312.88,EUR,2013-12-11T00:00:00.000Z,1000000073 G-B-BE-38-,IFAD,MINISTERE DE L'ECONOMIE ET DES FINANCES,Money is disbursed through central Ministry of Finance or Treasury,,NE,WCA,1000000073 001RFDB133056001 Designated Special,C01, ,3,1,20,110
1000000073_0011236600731085_12-31-2012-00:00:00_Disbursement,1100001221,1000000073,0011236600731085,Disbursement,2012-12-31T00:00:00.000Z,38652.79,EUR,2012-12-31T00:00:00.000Z,1000000073 G-B-BE-38-,IFAD,MINISTERE DE L'ECONOMIE ET DES FINANCES,Money is disbursed through central Ministry of Finance or Treasury,,NE,WCA,1000000073 0011236600731085 Direct Payment/Reimbursement,C01, ,3,1,20,110
1000000073_0011003500731037_02-04-2010-00:00:00_Disbursement,1100001221,1000000073,0011003500731037,Disbursement,2010-02-04T00:00:00.000Z,17323.39,EUR,2010-02-04T00:00:00.000Z,1000000073 G-B-BE-38-,IFAD,MINISTERE DE L'ECONOMIE ET DES FINANCES,Money is disbursed through central Ministry of Finance or Treasury,,NE,WCA,1000000073 0011003500731037 Direct Payment/Reimbursement,C01, ,3,1,20,110
1000000073_0011310900731086_04-19-2013-00:00:00_Disbursement,1100001221,1000000073,0011310900731086,Disbursement,2013-04-19T00:00:00.000Z,85781.15,EUR,2013-04-19T00:00:00.000Z,1000000073 G-B-BE-38-,IFAD,MINISTERE DE L'ECONOMIE ET DES FINANCES,Money is disbursed through central Ministry of Finance or Treasury,,NE,WCA,1000000073 0011310900731086 Direct Payment/Reimbursement,C01, ,3,1,20,110
1000000073_0011112600731057_05-06-2011-00:00:00_Disbursement,1100001221,1000000073,0011112600731057,Disbursement,2011-05-06T00:00:00.000Z,13861.51,EUR,2011-05-06T00:00:00.000Z,1000000073 G-B-BE-38-,IFAD,MINISTERE DE L'ECONOMIE ET DES FINANCES,Money is disbursed through central Ministry of Finance or Treasury,,NE,WCA,1000000073 0011112600731057 Direct Payment/Reimbursement,C01, ,3,1,20,110
1000000073_0011319200731088_07-11-2013-00:00:00_Disbursement,1100001221,1000000073,0011319200731088,Disbursement,2013-07-11T00:00:00.000Z,59533.11,EUR,2013-07-11T00:00:00.000Z,1000000073 G-B-BE-38-,IFAD,MINISTERE DE L'ECONOMIE ET DES FINANCES,Money is disbursed through central Ministry of Finance or Treasury,,NE,WCA,1000000073 0011319200731088 Direct Payment/Reimbursement,C01, ,3,1,20,110
1000000073_0010923300731033_08-21-2009-00:00:00_Disbursement,1100001221,1000000073,0010923300731033,Disbursement,2009-08-21T00:00:00.000Z,44584.99,EUR,2009-08-21T00:00:00.000Z,1000000073 G-B-BE-38-,IFAD,MINISTERE DE L'ECONOMIE ET DES FINANCES,Money is disbursed through central Ministry of Finance or Treasury,,NE,WCA,1000000073 0010923300731033 Direct Payment/Reimbursement,C01, ,3,1,20,110
1000000073_0011134800731072_12-14-2011-00:00:00_Disbursement,1100001221,1000000073,0011134800731072,Disbursement,2011-12-14T00:00:00.000Z,33947.09,EUR,2011-12-14T00:00:00.000Z,1000000073 G-B-BE-38-,IFAD,MINISTERE DE L'ECONOMIE ET DES FINANCES,Money is disbursed through central Ministry of Finance or Treasury,,NE,WCA,1000000073 0011134800731072 Direct Payment/Reimbursement,C01, ,3,1,20,110
1000000073_0011105300731054_02-22-2011-00:00:00_Disbursement,1100001221,1000000073,0011105300731054,Disbursement,2011-02-22T00:00:00.000Z,16942.04,EUR,2011-02-22T00:00:00.000Z,1000000073 G-B-BE-38-,IFAD,MINISTERE DE L'ECONOMIE ET DES FINANCES,Money is disbursed through central Ministry of Finance or Treasury,,NE,WCA,1000000073 0011105300731054 Direct Payment/Reimbursement,C01, ,3,1,20,110
1000000073_0011119500731058_07-14-2011-00:00:00_Disbursement,1100001221,1000000073,0011119500731058,Disbursement,2011-07-14T00:00:00.000Z,8644.58,EUR,2011-07-14T00:00:00.000Z,1000000073 G-B-BE-38-,IFAD,MINISTERE DE L'ECONOMIE ET DES FINANCES,Money is disbursed through central Ministry of Finance or Treasury,,NE,WCA,1000000073 0011119500731058 Direct Payment/Reimbursement,C01, ,3,1,20,110
1000000073_0010720100731003_07-20-2007-00:00:00_Disbursement,1100001221,1000000073,0010720100731003,Disbursement,2007-07-20T00:00:00.000Z,47858.39,EUR,2007-07-20T00:00:00.000Z,1000000073 G-B-BE-38-,IFAD,MINISTERE DE L'ECONOMIE ET DES FINANCES,Money is disbursed through central Ministry of Finance or Treasury,,NE,WCA,1000000073 0010720100731003 Direct Payment/Reimbursement,C01, ,3,1,20,110
1000000073_0010706100731002_03-02-2007-00:00:00_Disbursement,1100001221,1000000073,0010706100731002,Disbursement,2007-03-02T00:00:00.000Z,97555.53,EUR,2007-03-02T00:00:00.000Z,1000000073 G-B-BE-38-,IFAD,MINISTERE DE L'ECONOMIE ET DES FINANCES,Money is disbursed through central Ministry of Finance or Treasury,,NE,WCA,1000000073 0010706100731002 Direct Payment/Reimbursement,C01, ,3,1,20,110
1000000073_0010903000731016_01-30-2009-00:00:00_Disbursement,1100001221,1000000073,0010903000731016,Disbursement,2009-01-30T00:00:00.000Z,39157.65,EUR,2009-01-30T00:00:00.000Z,1000000073 G-B-BE-38-,IFAD,MINISTERE DE L'ECONOMIE ET DES FINANCES,Money is disbursed through central Ministry of Finance or Treasury,,NE,WCA,1000000073 0010903000731016 Direct Payment/Reimbursement,C01, ,3,1,20,110
1000000073_0010903500731024_02-04-2009-00:00:00_Disbursement,1100001221,1000000073,0010903500731024,Disbursement,2009-02-04T00:00:00.000Z,17775.56,EUR,2009-02-04T00:00:00.000Z,1000000073 G-B-BE-38-,IFAD,MINISTERE DE L'ECONOMIE ET DES FINANCES,Money is disbursed through central Ministry of Finance or Treasury,,NE,WCA,1000000073 0010903500731024 Direct Payment/Reimbursement,C01, ,3,1,20,110
1000000073_0010903500731022_02-04-2009-00:00:00_Disbursement,1100001221,1000000073,0010903500731022,Disbursement,2009-02-04T00:00:00.000Z,15090.93,EUR,2009-02-04T00:00:00.000Z,1000000073 G-B-BE-38-,IFAD,MINISTERE DE L'ECONOMIE ET DES FINANCES,Money is disbursed through central Ministry of Finance or Treasury,,NE,WCA,1000000073 0010903500731022 Direct Payment/Reimbursement,C01, ,3,1,20,110
1000000073_0011016600731045_06-15-2010-00:00:00_Disbursement,1100001221,1000000073,0011016600731045,Disbursement,2010-06-15T00:00:00.000Z,56811.14,EUR,2010-06-15T00:00:00.000Z,1000000073 G-B-BE-38-,IFAD,MINISTERE DE L'ECONOMIE ET DES FINANCES,Money is disbursed through central Ministry of Finance or Treasury,,NE,WCA,1000000073 0011016600731045 Direct Payment/Reimbursement,C01, ,3,1,20,110
1000000073_0011221300731079_07-31-2012-00:00:00_Disbursement,1100001221,1000000073,0011221300731079,Disbursement,2012-07-31T00:00:00.000Z,147874.76,EUR,2012-07-31T00:00:00.000Z,1000000073 G-B-BE-38-,IFAD,MINISTERE DE L'ECONOMIE ET DES FINANCES,Money is disbursed through central Ministry of Finance or Treasury,,NE,WCA,1000000073 0011221300731079 Direct Payment/Reimbursement,C01, ,3,1,20,110
1000000073_0011120600731065_07-25-2011-00:00:00_Disbursement,1100001221,1000000073,0011120600731065,Disbursement,2011-07-25T00:00:00.000Z,55415.25,EUR,2011-07-25T00:00:00.000Z,1000000073 G-B-BE-38-,IFAD,MINISTERE DE L'ECONOMIE ET DES FINANCES,Money is disbursed through central Ministry of Finance or Treasury,,NE,WCA,1000000073 0011120600731065 Direct Payment/Reimbursement,C01, ,3,1,20,110
1000000073_0011209700731074_04-06-2012-00:00:00_Disbursement,1100001221,1000000073,0011209700731074,Disbursement,2012-04-06T00:00:00.000Z,37761.2,EUR,2012-04-06T00:00:00.000Z,1000000073 G-B-BE-38-,IFAD,MINISTERE DE L'ECONOMIE ET DES FINANCES,Money is disbursed through central Ministry of Finance or Treasury,,NE,WCA,1000000073 0011209700731074 Direct Payment/Reimbursement,C01, ,3,1,20,110
1000000073_0011226900731080_09-25-2012-00:00:00_Disbursement,1100001221,1000000073,0011226900731080,Disbursement,2012-09-25T00:00:00.000Z,19236.66,EUR,2012-09-25T00:00:00.000Z,1000000073 G-B-BE-38-,IFAD,MINISTERE DE L'ECONOMIE ET DES FINANCES,Money is disbursed through central Ministry of Finance or Treasury,,NE,WCA,1000000073 0011226900731080 Direct Payment/Reimbursement,C01, ,3,1,20,110
1000000073_0010727500731006_10-02-2007-00:00:00_Disbursement,1100001221,1000000073,0010727500731006,Disbursement,2007-10-02T00:00:00.000Z,16543.77,EUR,2007-10-02T00:00:00.000Z,1000000073 G-B-BE-38-,IFAD,MINISTERE DE L'ECONOMIE ET DES FINANCES,Money is disbursed through central Ministry of Finance or Treasury,,NE,WCA,1000000073 0010727500731006 Direct Payment/Reimbursement,C01, ,3,1,20,110
1000000073_0010903000731018_01-30-2009-00:00:00_Disbursement,1100001221,1000000073,0010903000731018,Disbursement,2009-01-30T00:00:00.000Z,17015.6,EUR,2009-01-30T00:00:00.000Z,1000000073 G-B-BE-38-,IFAD,MINISTERE DE L'ECONOMIE ET DES FINANCES,Money is disbursed through central Ministry of Finance or Treasury,,NE,WCA,1000000073 0010903000731018 Direct Payment/Reimbursement,C01, ,3,1,20,110
1000000073_0011235900731082_12-24-2012-00:00:00_Disbursement,1100001221,1000000073,0011235900731082,Disbursement,2012-12-24T00:00:00.000Z,77899.4,EUR,2012-12-24T00:00:00.000Z,1000000073 G-B-BE-38-,IFAD,MINISTERE DE L'ECONOMIE ET DES FINANCES,Money is disbursed through central Ministry of Finance or Treasury,,NE,WCA,1000000073 0011235900731082 Direct Payment/Reimbursement,C01, ,3,1,20,110
1000000073_0011322000731095_08-08-2013-00:00:00_Disbursement,1100001221,1000000073,0011322000731095,Disbursement,2013-08-08T00:00:00.000Z,25611.43,EUR,2013-08-08T00:00:00.000Z,1000000073 G-B-BE-38-,IFAD,MINISTERE DE L'ECONOMIE ET DES FINANCES,Money is disbursed through central Ministry of Finance or Treasury,,NE,WCA,1000000073 0011322000731095 Direct Payment/Reimbursement,C01, ,3,1,20,110
1000000073_0011016200731042_06-11-2010-00:00:00_Disbursement,1100001221,1000000073,0011016200731042,Disbursement,2010-06-11T00:00:00.000Z,46675.29,EUR,2010-06-11T00:00:00.000Z,1000000073 G-B-BE-38-,IFAD,MINISTERE DE L'ECONOMIE ET DES FINANCES,Money is disbursed through central Ministry of Finance or Treasury,,NE,WCA,1000000073 0011016200731042 Direct Payment/Reimbursement,C01, ,3,1,20,110
1000000073_0011034900731053_12-15-2010-00:00:00_Disbursement,1100001221,1000000073,0011034900731053,Disbursement,2010-12-15T00:00:00.000Z,96335.89,EUR,2010-12-15T00:00:00.000Z,1000000073 G-B-BE-38-,IFAD,MINISTERE DE L'ECONOMIE ET DES FINANCES,Money is disbursed through central Ministry of Finance or Treasury,,NE,WCA,1000000073 0011034900731053 Direct Payment/Reimbursement,C01, ,3,1,20,110
1000000073_0011016600731044_06-15-2010-00:00:00_Disbursement,1100001221,1000000073,0011016600731044,Disbursement,2010-06-15T00:00:00.000Z,24998.08,EUR,2010-06-15T00:00:00.000Z,1000000073 G-B-BE-38-,IFAD,MINISTERE DE L'ECONOMIE ET DES FINANCES,Money is disbursed through central Ministry of Finance or Treasury,,NE,WCA,1000000073 0011016600731044 Direct Payment/Reimbursement,C01, ,3,1,20,110
1000000073_0011003500731035_02-04-2010-00:00:00_Disbursement,1100001221,1000000073,0011003500731035,Disbursement,2010-02-04T00:00:00.000Z,21939.43,EUR,2010-02-04T00:00:00.000Z,1000000073 G-B-BE-38-,IFAD,MINISTERE DE L'ECONOMIE ET DES FINANCES,Money is disbursed through central Ministry of Finance or Treasury,,NE,WCA,1000000073 0011003500731035 Direct Payment/Reimbursement,C01, ,3,1,20,110
1000000073_0010918200731030_07-01-2009-00:00:00_Disbursement,1100001221,1000000073,0010918200731030,Disbursement,2009-07-01T00:00:00.000Z,144332.4,EUR,2009-07-01T00:00:00.000Z,1000000073 G-B-BE-38-,IFAD,MINISTERE DE L'ECONOMIE ET DES FINANCES,Money is disbursed through central Ministry of Finance or Treasury,,NE,WCA,1000000073 0010918200731030 Direct Payment/Reimbursement,C01, ,3,1,20,110
1000000073_0010818500731011_07-03-2008-00:00:00_Disbursement,1100001221,1000000073,0010818500731011,Disbursement,2008-07-03T00:00:00.000Z,58591.63,EUR,2008-07-03T00:00:00.000Z,1000000073 G-B-BE-38-,IFAD,MINISTERE DE L'ECONOMIE ET DES FINANCES,Money is disbursed through central Ministry of Finance or Treasury,,NE,WCA,1000000073 0010818500731011 Direct Payment/Reimbursement,C01, ,3,1,20,110
1000000073_0011119500731060_07-14-2011-00:00:00_Disbursement,1100001221,1000000073,0011119500731060,Disbursement,2011-07-14T00:00:00.000Z,72317.43,EUR,2011-07-14T00:00:00.000Z,1000000073 G-B-BE-38-,IFAD,MINISTERE DE L'ECONOMIE ET DES FINANCES,Money is disbursed through central Ministry of Finance or Treasury,,NE,WCA,1000000073 0011119500731060 Direct Payment/Reimbursement,C01, ,3,1,20,110
1000000073_0010903000731017_01-30-2009-00:00:00_Disbursement,1100001221,1000000073,0010903000731017,Disbursement,2009-01-30T00:00:00.000Z,14710.48,EUR,2009-01-30T00:00:00.000Z,1000000073 G-B-BE-38-,IFAD,MINISTERE DE L'ECONOMIE ET DES FINANCES,Money is disbursed through central Ministry of Finance or Treasury,,NE,WCA,1000000073 0010903000731017 Direct Payment/Reimbursement,C01, ,3,1,20,110
1000000073_0011019000731047_07-09-2010-00:00:00_Disbursement,1100001221,1000000073,0011019000731047,Disbursement,2010-07-09T00:00:00.000Z,18030.58,EUR,2010-07-09T00:00:00.000Z,1000000073 G-B-BE-38-,IFAD,MINISTERE DE L'ECONOMIE ET DES FINANCES,Money is disbursed through central Ministry of Finance or Treasury,,NE,WCA,1000000073 0011019000731047 Direct Payment/Reimbursement,C01, ,3,1,20,110
1000000073_0010727500731004_10-02-2007-00:00:00_Disbursement,1100001221,1000000073,0010727500731004,Disbursement,2007-10-02T00:00:00.000Z,13759.76,EUR,2007-10-02T00:00:00.000Z,1000000073 G-B-BE-38-,IFAD,MINISTERE DE L'ECONOMIE ET DES FINANCES,Money is disbursed through central Ministry of Finance or Treasury,,NE,WCA,1000000073 0010727500731004 Direct Payment/Reimbursement,C01, ,3,1,20,110
1000000073_0011024900731051_09-06-2010-00:00:00_Disbursement,1100001221,1000000073,0011024900731051,Disbursement,2010-09-06T00:00:00.000Z,18238.74,EUR,2010-09-06T00:00:00.000Z,1000000073 G-B-BE-38-,IFAD,MINISTERE DE L'ECONOMIE ET DES FINANCES,Money is disbursed through central Ministry of Finance or Treasury,,NE,WCA,1000000073 0011024900731051 Direct Payment/Reimbursement,C01, ,3,1,20,110
1000000073_0011215200731077_05-31-2012-00:00:00_Disbursement,1100001221,1000000073,0011215200731077,Disbursement,2012-05-31T00:00:00.000Z,14642.35,EUR,2012-05-31T00:00:00.000Z,1000000073 G-B-BE-38-,IFAD,MINISTERE DE L'ECONOMIE ET DES FINANCES,Money is disbursed through central Ministry of Finance or Treasury,,NE,WCA,1000000073 0011215200731077 Direct Payment/Reimbursement,C01, ,3,1,20,110
1000000073_0011320400731093_07-23-2013-00:00:00_Disbursement,1100001221,1000000073,0011320400731093,Disbursement,2013-07-23T00:00:00.000Z,27135.93,EUR,2013-07-23T00:00:00.000Z,1000000073 G-B-BE-38-,IFAD,MINISTERE DE L'ECONOMIE ET DES FINANCES,Money is disbursed through central Ministry of Finance or Treasury,,NE,WCA,1000000073 0011320400731093 Direct Payment/Reimbursement,C01, ,3,1,20,110
1000000073_0011119500731062_07-14-2011-00:00:00_Disbursement,1100001221,1000000073,0011119500731062,Disbursement,2011-07-14T00:00:00.000Z,12192.87,EUR,2011-07-14T00:00:00.000Z,1000000073 G-B-BE-38-,IFAD,MINISTERE DE L'ECONOMIE ET DES FINANCES,Money is disbursed through central Ministry of Finance or Treasury,,NE,WCA,1000000073 0011119500731062 Direct Payment/Reimbursement,C01, ,3,1,20,110
1000000073_0011219900731078_07-17-2012-00:00:00_Disbursement,1100001221,1000000073,0011219900731078,Disbursement,2012-07-17T00:00:00.000Z,25651.87,EUR,2012-07-17T00:00:00.000Z,1000000073 G-B-BE-38-,IFAD,MINISTERE DE L'ECONOMIE ET DES FINANCES,Money is disbursed through central Ministry of Finance or Treasury,,NE,WCA,1000000073 0011219900731078 Direct Payment/Reimbursement,C01, ,3,1,20,110
1000000073_0010914000731028_05-20-2009-00:00:00_Disbursement,1100001221,1000000073,0010914000731028,Disbursement,2009-05-20T00:00:00.000Z,17493.49,EUR,2009-05-20T00:00:00.000Z,1000000073 G-B-BE-38-,IFAD,MINISTERE DE L'ECONOMIE ET DES FINANCES,Money is disbursed through central Ministry of Finance or Treasury,,NE,WCA,1000000073 0010914000731028 Direct Payment/Reimbursement,C01, ,3,1,20,110
1000000073_0010903500731021_02-04-2009-00:00:00_Disbursement,1100001221,1000000073,0010903500731021,Disbursement,2009-02-04T00:00:00.000Z,15813.47,EUR,2009-02-04T00:00:00.000Z,1000000073 G-B-BE-38-,IFAD,MINISTERE DE L'ECONOMIE ET DES FINANCES,Money is disbursed through central Ministry of Finance or Treasury,,NE,WCA,1000000073 0010903500731021 Direct Payment/Reimbursement,C01, ,3,1,20,110
1000000073_0010904100731025_02-10-2009-00:00:00_Disbursement,1100001221,1000000073,0010904100731025,Disbursement,2009-02-10T00:00:00.000Z,29912.66,EUR,2009-02-10T00:00:00.000Z,1000000073 G-B-BE-38-,IFAD,MINISTERE DE L'ECONOMIE ET DES FINANCES,Money is disbursed through central Ministry of Finance or Treasury,,NE,WCA,1000000073 0010904100731025 Direct Payment/Reimbursement,C01, ,3,1,20,110
1000000073_0010905400731026_02-23-2009-00:00:00_Disbursement,1100001221,1000000073,0010905400731026,Disbursement,2009-02-23T00:00:00.000Z,25636.66,EUR,2009-02-23T00:00:00.000Z,1000000073 G-B-BE-38-,IFAD,MINISTERE DE L'ECONOMIE ET DES FINANCES,Money is disbursed through central Ministry of Finance or Treasury,,NE,WCA,1000000073 0010905400731026 Direct Payment/Reimbursement,C01, ,3,1,20,110
1000000073_0010914000731027_05-20-2009-00:00:00_Disbursement,1100001221,1000000073,0010914000731027,Disbursement,2009-05-20T00:00:00.000Z,18608.02,EUR,2009-05-20T00:00:00.000Z,1000000073 G-B-BE-38-,IFAD,MINISTERE DE L'ECONOMIE ET DES FINANCES,Money is disbursed through central Ministry of Finance or Treasury,,NE,WCA,1000000073 0010914000731027 Direct Payment/Reimbursement,C01, ,3,1,20,110
1000000073_0010932100731034_11-17-2009-00:00:00_Disbursement,1100001221,1000000073,0010932100731034,Disbursement,2009-11-17T00:00:00.000Z,20345.66,EUR,2009-11-17T00:00:00.000Z,1000000073 G-B-BE-38-,IFAD,MINISTERE DE L'ECONOMIE ET DES FINANCES,Money is disbursed through central Ministry of Finance or Treasury,,NE,WCA,1000000073 0010932100731034 Direct Payment/Reimbursement,C01, ,3,1,20,110
1000000073_0011134300731071_12-09-2011-00:00:00_Disbursement,1100001221,1000000073,0011134300731071,Disbursement,2011-12-09T00:00:00.000Z,64347.87,EUR,2011-12-09T00:00:00.000Z,1000000073 G-B-BE-38-,IFAD,MINISTERE DE L'ECONOMIE ET DES FINANCES,Money is disbursed through central Ministry of Finance or Treasury,,NE,WCA,1000000073 0011134300731071 Direct Payment/Reimbursement,C01, ,3,1,20,110
1000000073_0011006800731040_03-09-2010-00:00:00_Disbursement,1100001221,1000000073,0011006800731040,Disbursement,2010-03-09T00:00:00.000Z,142582.0,EUR,2010-03-09T00:00:00.000Z,1000000073 G-B-BE-38-,IFAD,MINISTERE DE L'ECONOMIE ET DES FINANCES,Money is disbursed through central Ministry of Finance or Treasury,,NE,WCA,1000000073 0011006800731040 Direct Payment/Reimbursement,C01, ,3,1,20,110
1000000073_0010903500731023_02-04-2009-00:00:00_Disbursement,1100001221,1000000073,0010903500731023,Disbursement,2009-02-04T00:00:00.000Z,16521.66,EUR,2009-02-04T00:00:00.000Z,1000000073 G-B-BE-38-,IFAD,MINISTERE DE L'ECONOMIE ET DES FINANCES,Money is disbursed through central Ministry of Finance or Treasury,,NE,WCA,1000000073 0010903500731023 Direct Payment/Reimbursement,C01, ,3,1,20,110
1000000073_0011317600731087_06-25-2013-00:00:00_Disbursement,1100001221,1000000073,0011317600731087,Disbursement,2013-06-25T00:00:00.000Z,43296.55,EUR,2013-06-25T00:00:00.000Z,1000000073 G-B-BE-38-,IFAD,MINISTERE DE L'ECONOMIE ET DES FINANCES,Money is disbursed through central Ministry of Finance or Treasury,,NE,WCA,1000000073 0011317600731087 Direct Payment/Reimbursement,C01, ,3,1,20,110
1000000073_0010727500731005_10-02-2007-00:00:00_Disbursement,1100001221,1000000073,0010727500731005,Disbursement,2007-10-02T00:00:00.000Z,26937.74,EUR,2007-10-02T00:00:00.000Z,1000000073 G-B-BE-38-,IFAD,MINISTERE DE L'ECONOMIE ET DES FINANCES,Money is disbursed through central Ministry of Finance or Treasury,,NE,WCA,1000000073 0010727500731005 Direct Payment/Reimbursement,C01, ,3,1,20,110
1000000073_0010914900731029_05-29-2009-00:00:00_Disbursement,1100001221,1000000073,0010914900731029,Disbursement,2009-05-29T00:00:00.000Z,21367.41,EUR,2009-05-29T00:00:00.000Z,1000000073 G-B-BE-38-,IFAD,MINISTERE DE L'ECONOMIE ET DES FINANCES,Money is disbursed through central Ministry of Finance or Treasury,,NE,WCA,1000000073 0010914900731029 Direct Payment/Reimbursement,C01, ,3,1,20,110
1000000073_0010729200731007_10-19-2007-00:00:00_Disbursement,1100001221,1000000073,0010729200731007,Disbursement,2007-10-19T00:00:00.000Z,58847.32,EUR,2007-10-19T00:00:00.000Z,1000000073 G-B-BE-38-,IFAD,MINISTERE DE L'ECONOMIE ET DES FINANCES,Money is disbursed through central Ministry of Finance or Treasury,,NE,WCA,1000000073 0010729200731007 Direct Payment/Reimbursement,C01, ,3,1,20,110
1000000073_MG2RFDB133056001_08-29-2006-00:00:00_Disbursement,1100001221,1000000073,MG2RFDB133056001,Disbursement,2006-08-29T00:00:00.000Z,250000.0,EUR,2006-08-29T00:00:00.000Z,1000000073 G-B-BE-38-,IFAD,MINISTERE DE L'ECONOMIE ET DES FINANCES,Money is disbursed through central Ministry of Finance or Treasury,,NE,WCA,1000000073 MG2RFDB133056001 Designated Special,C01, ,3,1,20,110
1000000073_0011128500731070_10-12-2011-00:00:00_Disbursement,1100001221,1000000073,0011128500731070,Disbursement,2011-10-12T00:00:00.000Z,29122.81,EUR,2011-10-12T00:00:00.000Z,1000000073 G-B-BE-38-,IFAD,MINISTERE DE L'ECONOMIE ET DES FINANCES,Money is disbursed through central Ministry of Finance or Treasury,,NE,WCA,1000000073 0011128500731070 Direct Payment/Reimbursement,C01, ,3,1,20,110
1000000073_0011006700731039_03-08-2010-00:00:00_Disbursement,1100001221,1000000073,0011006700731039,Disbursement,2010-03-08T00:00:00.000Z,15281.34,EUR,2010-03-08T00:00:00.000Z,1000000073 G-B-BE-38-,IFAD,MINISTERE DE L'ECONOMIE ET DES FINANCES,Money is disbursed through central Ministry of Finance or Treasury,,NE,WCA,1000000073 0011006700731039 Direct Payment/Reimbursement,C01, ,3,1,20,110
1000000073_0011119500731061_07-14-2011-00:00:00_Disbursement,1100001221,1000000073,0011119500731061,Disbursement,2011-07-14T00:00:00.000Z,34541.14,EUR,2011-07-14T00:00:00.000Z,1000000073 G-B-BE-38-,IFAD,MINISTERE DE L'ECONOMIE ET DES FINANCES,Money is disbursed through central Ministry of Finance or Treasury,,NE,WCA,1000000073 0011119500731061 Direct Payment/Reimbursement,C01, ,3,1,20,110
1000000073_0010904100731019_02-10-2009-00:00:00_Disbursement,1100001221,1000000073,0010904100731019,Disbursement,2009-02-10T00:00:00.000Z,127289.87,EUR,2009-02-10T00:00:00.000Z,1000000073 G-B-BE-38-,IFAD,MINISTERE DE L'ECONOMIE ET DES FINANCES,Money is disbursed through central Ministry of Finance or Treasury,,NE,WCA,1000000073 0010904100731019 Direct Payment/Reimbursement,C01, ,3,1,20,110
1000000073_0010923200731032_08-20-2009-00:00:00_Disbursement,1100001221,1000000073,0010923200731032,Disbursement,2009-08-20T00:00:00.000Z,17049.61,EUR,2009-08-20T00:00:00.000Z,1000000073 G-B-BE-38-,IFAD,MINISTERE DE L'ECONOMIE ET DES FINANCES,Money is disbursed through central Ministry of Finance or Treasury,,NE,WCA,1000000073 0010923200731032 Direct Payment/Reimbursement,C01, ,3,1,20,110
1000000073_0011122900731067_08-17-2011-00:00:00_Disbursement,1100001221,1000000073,0011122900731067,Disbursement,2011-08-17T00:00:00.000Z,22623.51,EUR,2011-08-17T00:00:00.000Z,1000000073 G-B-BE-38-,IFAD,MINISTERE DE L'ECONOMIE ET DES FINANCES,Money is disbursed through central Ministry of Finance or Treasury,,NE,WCA,1000000073 0011122900731067 Direct Payment/Reimbursement,C01, ,3,1,20,110
1000000073_0011121000731066_07-29-2011-00:00:00_Disbursement,1100001221,1000000073,0011121000731066,Disbursement,2011-07-29T00:00:00.000Z,61663.69,EUR,2011-07-29T00:00:00.000Z,1000000073 G-B-BE-38-,IFAD,MINISTERE DE L'ECONOMIE ET DES FINANCES,Money is disbursed through central Ministry of Finance or Treasury,,NE,WCA,1000000073 0011121000731066 Direct Payment/Reimbursement,C01, ,3,1,20,110
1000000073_0011320300731092_07-22-2013-00:00:00_Disbursement,1100001221,1000000073,0011320300731092,Disbursement,2013-07-22T00:00:00.000Z,44591.34,EUR,2013-07-22T00:00:00.000Z,1000000073 G-B-BE-38-,IFAD,MINISTERE DE L'ECONOMIE ET DES FINANCES,Money is disbursed through central Ministry of Finance or Treasury,,NE,WCA,1000000073 0011320300731092 Direct Payment/Reimbursement,C01, ,3,1,20,110
1000000073_0010734400731008_12-10-2007-00:00:00_Disbursement,1100001221,1000000073,0010734400731008,Disbursement,2007-12-10T00:00:00.000Z,63438.24,EUR,2007-12-10T00:00:00.000Z,1000000073 G-B-BE-38-,IFAD,MINISTERE DE L'ECONOMIE ET DES FINANCES,Money is disbursed through central Ministry of Finance or Treasury,,NE,WCA,1000000073 0010734400731008 Direct Payment/Reimbursement,C01, ,3,1,20,110
1000000073_0010815700731010_06-05-2008-00:00:00_Disbursement,1100001221,1000000073,0010815700731010,Disbursement,2008-06-05T00:00:00.000Z,25742.78,EUR,2008-06-05T00:00:00.000Z,1000000073 G-B-BE-38-,IFAD,MINISTERE DE L'ECONOMIE ET DES FINANCES,Money is disbursed through central Ministry of Finance or Treasury,,NE,WCA,1000000073 0010815700731010 Direct Payment/Reimbursement,C01, ,3,1,20,110
1000000073_0010902900731020_01-29-2009-00:00:00_Disbursement,1100001221,1000000073,0010902900731020,Disbursement,2009-01-29T00:00:00.000Z,15244.9,EUR,2009-01-29T00:00:00.000Z,1000000073 G-B-BE-38-,IFAD,MINISTERE DE L'ECONOMIE ET DES FINANCES,Money is disbursed through central Ministry of Finance or Treasury,,NE,WCA,1000000073 0010902900731020 Direct Payment/Reimbursement,C01, ,3,1,20,110
1000000073_0011007000731041_03-11-2010-00:00:00_Disbursement,1100001221,1000000073,0011007000731041,Disbursement,2010-03-11T00:00:00.000Z,17373.92,EUR,2010-03-11T00:00:00.000Z,1000000073 G-B-BE-38-,IFAD,MINISTERE DE L'ECONOMIE ET DES FINANCES,Money is disbursed through central Ministry of Finance or Treasury,,NE,WCA,1000000073 0011007000731041 Direct Payment/Reimbursement,C01, ,3,1,20,110
1000000073_0010923200731031_08-20-2009-00:00:00_Disbursement,1100001221,1000000073,0010923200731031,Disbursement,2009-08-20T00:00:00.000Z,24434.4,EUR,2009-08-20T00:00:00.000Z,1000000073 G-B-BE-38-,IFAD,MINISTERE DE L'ECONOMIE ET DES FINANCES,Money is disbursed through central Ministry of Finance or Treasury,,NE,WCA,1000000073 0010923200731031 Direct Payment/Reimbursement,C01, ,3,1,20,110
1000000073_0010822600731013_08-13-2008-00:00:00_Disbursement,1100001221,1000000073,0010822600731013,Disbursement,2008-08-13T00:00:00.000Z,16071.51,EUR,2008-08-13T00:00:00.000Z,1000000073 G-B-BE-38-,IFAD,MINISTERE DE L'ECONOMIE ET DES FINANCES,Money is disbursed through central Ministry of Finance or Treasury,,NE,WCA,1000000073 0010822600731013 Direct Payment/Reimbursement,C01, ,3,1,20,110
1000000073_0011019400731050_07-13-2010-00:00:00_Disbursement,1100001221,1000000073,0011019400731050,Disbursement,2010-07-13T00:00:00.000Z,67019.98,EUR,2010-07-13T00:00:00.000Z,1000000073 G-B-BE-38-,IFAD,MINISTERE DE L'ECONOMIE ET DES FINANCES,Money is disbursed through central Ministry of Finance or Treasury,,NE,WCA,1000000073 0011019400731050 Direct Payment/Reimbursement,C01, ,3,1,20,110
1000000073_0011320300731090_07-22-2013-00:00:00_Disbursement,1100001221,1000000073,0011320300731090,Disbursement,2013-07-22T00:00:00.000Z,26297.46,EUR,2013-07-22T00:00:00.000Z,1000000073 G-B-BE-38-,IFAD,MINISTERE DE L'ECONOMIE ET DES FINANCES,Money is disbursed through central Ministry of Finance or Treasury,,NE,WCA,1000000073 0011320300731090 Direct Payment/Reimbursement,C01, ,3,1,20,110
1000000073_0011110300731056_04-13-2011-00:00:00_Disbursement,1100001221,1000000073,0011110300731056,Disbursement,2011-04-13T00:00:00.000Z,86912.92,EUR,2011-04-13T00:00:00.000Z,1000000073 G-B-BE-38-,IFAD,MINISTERE DE L'ECONOMIE ET DES FINANCES,Money is disbursed through central Ministry of Finance or Treasury,,NE,WCA,1000000073 0011110300731056 Direct Payment/Reimbursement,C01, ,3,1,20,110
1000000073_0011204600731073_02-15-2012-00:00:00_Disbursement,1100001221,1000000073,0011204600731073,Disbursement,2012-02-15T00:00:00.000Z,109398.77,EUR,2012-02-15T00:00:00.000Z,1000000073 G-B-BE-38-,IFAD,MINISTERE DE L'ECONOMIE ET DES FINANCES,Money is disbursed through central Ministry of Finance or Treasury,,NE,WCA,1000000073 0011204600731073 Direct Payment/Reimbursement,C01, ,3,1,20,110
1000000073_0011128000731069_10-07-2011-00:00:00_Disbursement,1100001221,1000000073,0011128000731069,Disbursement,2011-10-07T00:00:00.000Z,33427.6,EUR,2011-10-07T00:00:00.000Z,1000000073 G-B-BE-38-,IFAD,MINISTERE DE L'ECONOMIE ET DES FINANCES,Money is disbursed through central Ministry of Finance or Treasury,,NE,WCA,1000000073 0011128000731069 Direct Payment/Reimbursement,C01, ,3,1,20,110
1000000073_001RFDB140220004_01-23-2014-00:00:00_Disbursement,1100001221,1000000073,001RFDB140220004,Disbursement,2014-01-23T00:00:00.000Z,6194.77,EUR,2014-01-23T00:00:00.000Z,1000000073 G-B-BE-38-,IFAD,MINISTERE DE L'ECONOMIE ET DES FINANCES,Money is disbursed through central Ministry of Finance or Treasury,,NE,WCA,1000000073 001RFDB140220004 Direct Payment/Reimbursement,C01, ,3,1,20,110
1000000073_001RFDB133300009_11-28-2013-00:00:00_Disbursement,1100001221,1000000073,001RFDB133300009,Disbursement,2013-11-28T00:00:00.000Z,27231.14,EUR,2013-11-28T00:00:00.000Z,1000000073 G-B-BE-38-,IFAD,MINISTERE DE L'ECONOMIE ET DES FINANCES,Money is disbursed through central Ministry of Finance or Treasury,,NE,WCA,1000000073 001RFDB133300009 Direct Payment/Reimbursement,C01, ,3,1,20,110
1000000073_0011209700731075_04-06-2012-00:00:00_Disbursement,1100001221,1000000073,0011209700731075,Disbursement,2012-04-06T00:00:00.000Z,29096.04,EUR,2012-04-06T00:00:00.000Z,1000000073 G-B-BE-38-,IFAD,MINISTERE DE L'ECONOMIE ET DES FINANCES,Money is disbursed through central Ministry of Finance or Treasury,,NE,WCA,1000000073 0011209700731075 Direct Payment/Reimbursement,C01, ,3,1,20,110
1000000073_0010823500731014_08-22-2008-00:00:00_Disbursement,1100001221,1000000073,0010823500731014,Disbursement,2008-08-22T00:00:00.000Z,128832.79,EUR,2008-08-22T00:00:00.000Z,1000000073 G-B-BE-38-,IFAD,MINISTERE DE L'ECONOMIE ET DES FINANCES,Money is disbursed through central Ministry of Finance or Treasury,,NE,WCA,1000000073 0010823500731014 Direct Payment/Reimbursement,C01, ,3,1,20,110
1000000073_0010822600731012_08-13-2008-00:00:00_Disbursement,1100001221,1000000073,0010822600731012,Disbursement,2008-08-13T00:00:00.000Z,20139.67,EUR,2008-08-13T00:00:00.000Z,1000000073 G-B-BE-38-,IFAD,MINISTERE DE L'ECONOMIE ET DES FINANCES,Money is disbursed through central Ministry of Finance or Treasury,,NE,WCA,1000000073 0010822600731012 Direct Payment/Reimbursement,C01, ,3,1,20,110
1000000073_0011214900731076_05-28-2012-00:00:00_Disbursement,1100001221,1000000073,0011214900731076,Disbursement,2012-05-28T00:00:00.000Z,49359.57,EUR,2012-05-28T00:00:00.000Z,1000000073 G-B-BE-38-,IFAD,MINISTERE DE L'ECONOMIE ET DES FINANCES,Money is disbursed through central Ministry of Finance or Treasury,,NE,WCA,1000000073 0011214900731076 Direct Payment/Reimbursement,C01, ,3,1,20,110
1000000074__04-21-2004-00:00:00_Commitment,1100001244,1000000074,,Commitment,2004-04-21T00:00:00.000Z,3135138.63,EUR,2004-04-21T00:00:00.000Z,1000000074 G-B-BE-39-,IFAD,MINISTERE DES FINANCES,Money is disbursed through central Ministry of Finance or Treasury,,CD,WCA,1000000074 GRANTS,C01, ,2,1,20,110
1000000074_0011107400741022_03-15-2011-00:00:00_Disbursement,1100001244,1000000074,0011107400741022,Disbursement,2011-03-15T00:00:00.000Z,25323.78,EUR,2011-03-15T00:00:00.000Z,1000000074 G-B-BE-39-,IFAD,MINISTERE DES FINANCES,Money is disbursed through central Ministry of Finance or Treasury,,CD,WCA,1000000074 0011107400741022 Direct Payment/Reimbursement,C01, ,3,1,20,110
1000000074_0011125800741030_09-15-2011-00:00:00_Disbursement,1100001244,1000000074,0011125800741030,Disbursement,2011-09-15T00:00:00.000Z,105726.85,EUR,2011-09-15T00:00:00.000Z,1000000074 G-B-BE-39-,IFAD,MINISTERE DES FINANCES,Money is disbursed through central Ministry of Finance or Treasury,,CD,WCA,1000000074 0011125800741030 Direct Payment/Reimbursement,C01, ,3,1,20,110
1000000074_0011003200741012_02-01-2010-00:00:00_Disbursement,1100001244,1000000074,0011003200741012,Disbursement,2010-02-01T00:00:00.000Z,95721.62,EUR,2010-02-01T00:00:00.000Z,1000000074 G-B-BE-39-,IFAD,MINISTERE DES FINANCES,Money is disbursed through central Ministry of Finance or Treasury,,CD,WCA,1000000074 0011003200741012 Direct Payment/Reimbursement,C01, ,3,1,20,110
1000000074_0011103200741017_02-01-2011-00:00:00_Disbursement,1100001244,1000000074,0011103200741017,Disbursement,2011-02-01T00:00:00.000Z,66340.06,EUR,2011-02-01T00:00:00.000Z,1000000074 G-B-BE-39-,IFAD,MINISTERE DES FINANCES,Money is disbursed through central Ministry of Finance or Treasury,,CD,WCA,1000000074 0011103200741017 Direct Payment/Reimbursement,C01, ,3,1,20,110
1000000074_0011134800741033_12-14-2011-00:00:00_Disbursement,1100001244,1000000074,0011134800741033,Disbursement,2011-12-14T00:00:00.000Z,129809.08,EUR,2011-12-14T00:00:00.000Z,1000000074 G-B-BE-39-,IFAD,MINISTERE DES FINANCES,Money is disbursed through central Ministry of Finance or Treasury,,CD,WCA,1000000074 0011134800741033 Direct Payment/Reimbursement,C01, ,3,1,20,110
1000000074_0011111100741021_04-21-2011-00:00:00_Disbursement,1100001244,1000000074,0011111100741021,Disbursement,2011-04-21T00:00:00.000Z,83117.4,EUR,2011-04-21T00:00:00.000Z,1000000074 G-B-BE-39-,IFAD,MINISTERE DES FINANCES,Money is disbursed through central Ministry of Finance or Treasury,,CD,WCA,1000000074 0011111100741021 Direct Payment/Reimbursement,C01, ,3,1,20,110
1000000074_001RFDB133056002_11-13-2013-00:00:00_Disbursement,1100001244,1000000074,001RFDB133056002,Disbursement,2013-11-13T00:00:00.000Z,-92046.74,EUR,2013-11-13T00:00:00.000Z,1000000074 G-B-BE-39-,IFAD,MINISTERE DES FINANCES,Money is disbursed through central Ministry of Finance or Treasury,,CD,WCA,1000000074 001RFDB133056002 Designated Special,C01, ,3,1,20,110
1000000074_0011220600741039_07-24-2012-00:00:00_Disbursement,1100001244,1000000074,0011220600741039,Disbursement,2012-07-24T00:00:00.000Z,38335.36,EUR,2012-07-24T00:00:00.000Z,1000000074 G-B-BE-39-,IFAD,MINISTERE DES FINANCES,Money is disbursed through central Ministry of Finance or Treasury,,CD,WCA,1000000074 0011220600741039 Direct Payment/Reimbursement,C01, ,3,1,20,110
1000000074_0011028700741015_10-14-2010-00:00:00_Disbursement,1100001244,1000000074,0011028700741015,Disbursement,2010-10-14T00:00:00.000Z,73552.38,EUR,2010-10-14T00:00:00.000Z,1000000074 G-B-BE-39-,IFAD,MINISTERE DES FINANCES,Money is disbursed through central Ministry of Finance or Treasury,,CD,WCA,1000000074 0011028700741015 Direct Payment/Reimbursement,C01, ,3,1,20,110
1000000074_0011300200741043_01-02-2013-00:00:00_Disbursement,1100001244,1000000074,0011300200741043,Disbursement,2013-01-02T00:00:00.000Z,212358.53,EUR,2013-01-02T00:00:00.000Z,1000000074 G-B-BE-39-,IFAD,MINISTERE DES FINANCES,Money is disbursed through central Ministry of Finance or Treasury,,CD,WCA,1000000074 0011300200741043 Direct Payment/Reimbursement,C01, ,3,1,20,110
1000000074_0010724200741004_08-30-2007-00:00:00_Disbursement,1100001244,1000000074,0010724200741004,Disbursement,2007-08-30T00:00:00.000Z,33945.62,EUR,2007-08-30T00:00:00.000Z,1000000074 G-B-BE-39-,IFAD,MINISTERE DES FINANCES,Money is disbursed through central Ministry of Finance or Treasury,,CD,WCA,1000000074 0010724200741004 Direct Payment/Reimbursement,C01, ,3,1,20,110
1000000074_0011125100741028_09-08-2011-00:00:00_Disbursement,1100001244,1000000074,0011125100741028,Disbursement,2011-09-08T00:00:00.000Z,99038.93,EUR,2011-09-08T00:00:00.000Z,1000000074 G-B-BE-39-,IFAD,MINISTERE DES FINANCES,Money is disbursed through central Ministry of Finance or Treasury,,CD,WCA,1000000074 0011125100741028 Direct Payment/Reimbursement,C01, ,3,1,20,110
1000000074_0011025000741014_09-07-2010-00:00:00_Disbursement,1100001244,1000000074,0011025000741014,Disbursement,2010-09-07T00:00:00.000Z,13176.33,EUR,2010-09-07T00:00:00.000Z,1000000074 G-B-BE-39-,IFAD,MINISTERE DES FINANCES,Money is disbursed through central Ministry of Finance or Treasury,,CD,WCA,1000000074 0011025000741014 Direct Payment/Reimbursement,C01, ,3,1,20,110
1000000074_0011310700741047_04-17-2013-00:00:00_Disbursement,1100001244,1000000074,0011310700741047,Disbursement,2013-04-17T00:00:00.000Z,44807.41,EUR,2013-04-17T00:00:00.000Z,1000000074 G-B-BE-39-,IFAD,MINISTERE DES FINANCES,Money is disbursed through central Ministry of Finance or Treasury,,CD,WCA,1000000074 0011310700741047 Direct Payment/Reimbursement,C01, ,3,1,20,110
1000000074_0011309900741046_04-09-2013-00:00:00_Disbursement,1100001244,1000000074,0011309900741046,Disbursement,2013-04-09T00:00:00.000Z,102041.44,EUR,2013-04-09T00:00:00.000Z,1000000074 G-B-BE-39-,IFAD,MINISTERE DES FINANCES,Money is disbursed through central Ministry of Finance or Treasury,,CD,WCA,1000000074 0011309900741046 Direct Payment/Reimbursement,C01, ,3,1,20,110
1000000074_0011215200741038_05-31-2012-00:00:00_Disbursement,1100001244,1000000074,0011215200741038,Disbursement,2012-05-31T00:00:00.000Z,147276.4,EUR,2012-05-31T00:00:00.000Z,1000000074 G-B-BE-39-,IFAD,MINISTERE DES FINANCES,Money is disbursed through central Ministry of Finance or Treasury,,CD,WCA,1000000074 0011215200741038 Direct Payment/Reimbursement,C01, ,3,1,20,110
1000000074_0011215800741035_06-06-2012-00:00:00_Disbursement,1100001244,1000000074,0011215800741035,Disbursement,2012-06-06T00:00:00.000Z,36482.35,EUR,2012-06-06T00:00:00.000Z,1000000074 G-B-BE-39-,IFAD,MINISTERE DES FINANCES,Money is disbursed through central Ministry of Finance or Treasury,,CD,WCA,1000000074 0011215800741035 Direct Payment/Reimbursement,C01, ,3,1,20,110
1000000074_001RFDB133170008_11-17-2013-00:00:00_Disbursement,1100001244,1000000074,001RFDB133170008,Disbursement,2013-11-17T00:00:00.000Z,5224.23,EUR,2013-11-17T00:00:00.000Z,1000000074 G-B-BE-39-,IFAD,MINISTERE DES FINANCES,Money is disbursed through central Ministry of Finance or Treasury,,CD,WCA,1000000074 001RFDB133170008 Designated Special,C01, ,3,1,20,110
1000000074_0011215200741034_05-31-2012-00:00:00_Disbursement,1100001244,1000000074,0011215200741034,Disbursement,2012-05-31T00:00:00.000Z,85137.44,EUR,2012-05-31T00:00:00.000Z,1000000074 G-B-BE-39-,IFAD,MINISTERE DES FINANCES,Money is disbursed through central Ministry of Finance or Treasury,,CD,WCA,1000000074 0011215200741034 Direct Payment/Reimbursement,C01, ,3,1,20,110
1000000074_0010815700741006_06-05-2008-00:00:00_Disbursement,1100001244,1000000074,0010815700741006,Disbursement,2008-06-05T00:00:00.000Z,22614.63,EUR,2008-06-05T00:00:00.000Z,1000000074 G-B-BE-39-,IFAD,MINISTERE DES FINANCES,Money is disbursed through central Ministry of Finance or Treasury,,CD,WCA,1000000074 0010815700741006 Direct Payment/Reimbursement,C01, ,3,1,20,110
1000000074_0011113700741024_05-17-2011-00:00:00_Disbursement,1100001244,1000000074,0011113700741024,Disbursement,2011-05-17T00:00:00.000Z,55082.92,EUR,2011-05-17T00:00:00.000Z,1000000074 G-B-BE-39-,IFAD,MINISTERE DES FINANCES,Money is disbursed through central Ministry of Finance or Treasury,,CD,WCA,1000000074 0011113700741024 Direct Payment/Reimbursement,C01, ,3,1,20,110
1000000074_0011112300741023_05-03-2011-00:00:00_Disbursement,1100001244,1000000074,0011112300741023,Disbursement,2011-05-03T00:00:00.000Z,123959.45,EUR,2011-05-03T00:00:00.000Z,1000000074 G-B-BE-39-,IFAD,MINISTERE DES FINANCES,Money is disbursed through central Ministry of Finance or Treasury,,CD,WCA,1000000074 0011112300741023 Direct Payment/Reimbursement,C01, ,3,1,20,110
1000000074_0011125800741031_09-15-2011-00:00:00_Disbursement,1100001244,1000000074,0011125800741031,Disbursement,2011-09-15T00:00:00.000Z,132376.32,EUR,2011-09-15T00:00:00.000Z,1000000074 G-B-BE-39-,IFAD,MINISTERE DES FINANCES,Money is disbursed through central Ministry of Finance or Treasury,,CD,WCA,1000000074 0011125800741031 Direct Payment/Reimbursement,C01, ,3,1,20,110
1000000074_0011233100741042_11-26-2012-00:00:00_Disbursement,1100001244,1000000074,0011233100741042,Disbursement,2012-11-26T00:00:00.000Z,102556.28,EUR,2012-11-26T00:00:00.000Z,1000000074 G-B-BE-39-,IFAD,MINISTERE DES FINANCES,Money is disbursed through central Ministry of Finance or Treasury,,CD,WCA,1000000074 0011233100741042 Direct Payment/Reimbursement,C01, ,3,1,20,110
1000000074_0010909900741009_04-09-2009-00:00:00_Disbursement,1100001244,1000000074,0010909900741009,Disbursement,2009-04-09T00:00:00.000Z,364.81,EUR,2009-04-09T00:00:00.000Z,1000000074 G-B-BE-39-,IFAD,MINISTERE DES FINANCES,Money is disbursed through central Ministry of Finance or Treasury,,CD,WCA,1000000074 0010909900741009 Direct Payment/Reimbursement,C01, ,3,1,20,110
1000000074_0010916100741011_06-10-2009-00:00:00_Disbursement,1100001244,1000000074,0010916100741011,Disbursement,2009-06-10T00:00:00.000Z,72124.05,EUR,2009-06-10T00:00:00.000Z,1000000074 G-B-BE-39-,IFAD,MINISTERE DES FINANCES,Money is disbursed through central Ministry of Finance or Treasury,,CD,WCA,1000000074 0010916100741011 Direct Payment/Reimbursement,C01, ,3,1,20,110
1000000074_001RFDB140910006_04-02-2014-00:00:00_Disbursement,1100001244,1000000074,001RFDB140910006,Disbursement,2014-04-02T00:00:00.000Z,4961.82,EUR,2014-04-02T00:00:00.000Z,1000000074 G-B-BE-39-,IFAD,MINISTERE DES FINANCES,Money is disbursed through central Ministry of Finance or Treasury,,CD,WCA,1000000074 001RFDB140910006 Direct Payment/Reimbursement,C01, ,3,1,20,110
1000000074_0011103400741020_02-03-2011-00:00:00_Disbursement,1100001244,1000000074,0011103400741020,Disbursement,2011-02-03T00:00:00.000Z,207.2,EUR,2011-02-03T00:00:00.000Z,1000000074 G-B-BE-39-,IFAD,MINISTERE DES FINANCES,Money is disbursed through central Ministry of Finance or Treasury,,CD,WCA,1000000074 0011103400741020 Direct Payment/Reimbursement,C01, ,3,1,20,110
1000000074_MG2RFDB133056002_08-11-2006-00:00:00_Disbursement,1100001244,1000000074,MG2RFDB133056002,Disbursement,2006-08-11T00:00:00.000Z,391388.5,EUR,2006-08-11T00:00:00.000Z,1000000074 G-B-BE-39-,IFAD,MINISTERE DES FINANCES,Money is disbursed through central Ministry of Finance or Treasury,,CD,WCA,1000000074 MG2RFDB133056002 Designated Special,C01, ,3,1,20,110
1000000074_0011134300741032_12-09-2011-00:00:00_Disbursement,1100001244,1000000074,0011134300741032,Disbursement,2011-12-09T00:00:00.000Z,22710.54,EUR,2011-12-09T00:00:00.000Z,1000000074 G-B-BE-39-,IFAD,MINISTERE DES FINANCES,Money is disbursed through central Ministry of Finance or Treasury,,CD,WCA,1000000074 0011134300741032 Direct Payment/Reimbursement,C01, ,3,1,20,110
1000000074_0011103200741016_02-01-2011-00:00:00_Disbursement,1100001244,1000000074,0011103200741016,Disbursement,2011-02-01T00:00:00.000Z,82.67,EUR,2011-02-01T00:00:00.000Z,1000000074 G-B-BE-39-,IFAD,MINISTERE DES FINANCES,Money is disbursed through central Ministry of Finance or Treasury,,CD,WCA,1000000074 0011103200741016 Direct Payment/Reimbursement,C01, ,3,1,20,110
1000000074_0011321200741048_07-31-2013-00:00:00_Disbursement,1100001244,1000000074,0011321200741048,Disbursement,2013-07-31T00:00:00.000Z,34651.27,EUR,2013-07-31T00:00:00.000Z,1000000074 G-B-BE-39-,IFAD,MINISTERE DES FINANCES,Money is disbursed through central Ministry of Finance or Treasury,,CD,WCA,1000000074 0011321200741048 Direct Payment/Reimbursement,C01, ,3,1,20,110
1000000074_0010909900741008_04-09-2009-00:00:00_Disbursement,1100001244,1000000074,0010909900741008,Disbursement,2009-04-09T00:00:00.000Z,30282.38,EUR,2009-04-09T00:00:00.000Z,1000000074 G-B-BE-39-,IFAD,MINISTERE DES FINANCES,Money is disbursed through central Ministry of Finance or Treasury,,CD,WCA,1000000074 0010909900741008 Direct Payment/Reimbursement,C01, ,3,1,20,110
1000000074_0011225800741040_09-14-2012-00:00:00_Disbursement,1100001244,1000000074,0011225800741040,Disbursement,2012-09-14T00:00:00.000Z,119720.28,EUR,2012-09-14T00:00:00.000Z,1000000074 G-B-BE-39-,IFAD,MINISTERE DES FINANCES,Money is disbursed through central Ministry of Finance or Treasury,,CD,WCA,1000000074 0011225800741040 Direct Payment/Reimbursement,C01, ,3,1,20,110
1000000074_0011103400741019_02-03-2011-00:00:00_Disbursement,1100001244,1000000074,0011103400741019,Disbursement,2011-02-03T00:00:00.000Z,71141.92,EUR,2011-02-03T00:00:00.000Z,1000000074 G-B-BE-39-,IFAD,MINISTERE DES FINANCES,Money is disbursed through central Ministry of Finance or Treasury,,CD,WCA,1000000074 0011103400741019 Direct Payment/Reimbursement,C01, ,3,1,20,110
1000000074_0011125000741026_09-07-2011-00:00:00_Disbursement,1100001244,1000000074,0011125000741026,Disbursement,2011-09-07T00:00:00.000Z,40947.21,EUR,2011-09-07T00:00:00.000Z,1000000074 G-B-BE-39-,IFAD,MINISTERE DES FINANCES,Money is disbursed through central Ministry of Finance or Treasury,,CD,WCA,1000000074 0011125000741026 Direct Payment/Reimbursement,C01, ,3,1,20,110
1000000074_0010806600741005_03-06-2008-00:00:00_Disbursement,1100001244,1000000074,0010806600741005,Disbursement,2008-03-06T00:00:00.000Z,8613.33,EUR,2008-03-06T00:00:00.000Z,1000000074 G-B-BE-39-,IFAD,MINISTERE DES FINANCES,Money is disbursed through central Ministry of Finance or Treasury,,CD,WCA,1000000074 0010806600741005 Direct Payment/Reimbursement,C01, ,3,1,20,110
1000000074_0011114600741025_05-26-2011-00:00:00_Disbursement,1100001244,1000000074,0011114600741025,Disbursement,2011-05-26T00:00:00.000Z,13975.72,EUR,2011-05-26T00:00:00.000Z,1000000074 G-B-BE-39-,IFAD,MINISTERE DES FINANCES,Money is disbursed through central Ministry of Finance or Treasury,,CD,WCA,1000000074 0011114600741025 Direct Payment/Reimbursement,C01, ,3,1,20,110
1000000074_0011215200741036_05-31-2012-00:00:00_Disbursement,1100001244,1000000074,0011215200741036,Disbursement,2012-05-31T00:00:00.000Z,94920.66,EUR,2012-05-31T00:00:00.000Z,1000000074 G-B-BE-39-,IFAD,MINISTERE DES FINANCES,Money is disbursed through central Ministry of Finance or Treasury,,CD,WCA,1000000074 0011215200741036 Direct Payment/Reimbursement,C01, ,3,1,20,110
1000000074_0010908600741007_03-27-2009-00:00:00_Disbursement,1100001244,1000000074,0010908600741007,Disbursement,2009-03-27T00:00:00.000Z,15250.48,EUR,2009-03-27T00:00:00.000Z,1000000074 G-B-BE-39-,IFAD,MINISTERE DES FINANCES,Money is disbursed through central Ministry of Finance or Treasury,,CD,WCA,1000000074 0010908600741007 Direct Payment/Reimbursement,C01, ,3,1,20,110
1000000074_0011215200741037_05-31-2012-00:00:00_Disbursement,1100001244,1000000074,0011215200741037,Disbursement,2012-05-31T00:00:00.000Z,69523.61,EUR,2012-05-31T00:00:00.000Z,1000000074 G-B-BE-39-,IFAD,MINISTERE DES FINANCES,Money is disbursed through central Ministry of Finance or Treasury,,CD,WCA,1000000074 0011215200741037 Direct Payment/Reimbursement,C01, ,3,1,20,110
1000000074_0010724000741002_08-28-2007-00:00:00_Disbursement,1100001244,1000000074,0010724000741002,Disbursement,2007-08-28T00:00:00.000Z,106286.9,EUR,2007-08-28T00:00:00.000Z,1000000074 G-B-BE-39-,IFAD,MINISTERE DES FINANCES,Money is disbursed through central Ministry of Finance or Treasury,,CD,WCA,1000000074 0010724000741002 Direct Payment/Reimbursement,C01, ,3,1,20,110
1000000074_0011103400741018_02-03-2011-00:00:00_Disbursement,1100001244,1000000074,0011103400741018,Disbursement,2011-02-03T00:00:00.000Z,70093.55,EUR,2011-02-03T00:00:00.000Z,1000000074 G-B-BE-39-,IFAD,MINISTERE DES FINANCES,Money is disbursed through central Ministry of Finance or Treasury,,CD,WCA,1000000074 0011103400741018 Direct Payment/Reimbursement,C01, ,3,1,20,110
1000000074_0010729200741003_10-19-2007-00:00:00_Disbursement,1100001244,1000000074,0010729200741003,Disbursement,2007-10-19T00:00:00.000Z,137710.16,EUR,2007-10-19T00:00:00.000Z,1000000074 G-B-BE-39-,IFAD,MINISTERE DES FINANCES,Money is disbursed through central Ministry of Finance or Treasury,,CD,WCA,1000000074 0010729200741003 Direct Payment/Reimbursement,C01, ,3,1,20,110
1000000074_0011002700741013_01-27-2010-00:00:00_Disbursement,1100001244,1000000074,0011002700741013,Disbursement,2010-01-27T00:00:00.000Z,15057.39,EUR,2010-01-27T00:00:00.000Z,1000000074 G-B-BE-39-,IFAD,MINISTERE DES FINANCES,Money is disbursed through central Ministry of Finance or Treasury,,CD,WCA,1000000074 0011002700741013 Direct Payment/Reimbursement,C01, ,3,1,20,110
1000000074_001RFDB133050002_12-17-2013-00:00:00_Disbursement,1100001244,1000000074,001RFDB133050002,Disbursement,2013-12-17T00:00:00.000Z,-89091.83,EUR,2013-12-17T00:00:00.000Z,1000000074 G-B-BE-39-,IFAD,MINISTERE DES FINANCES,Money is disbursed through central Ministry of Finance or Treasury,,CD,WCA,1000000074 001RFDB133050002 Direct Payment/Reimbursement,C01, ,3,1,20,110
1000000074_0010911400741010_04-24-2009-00:00:00_Disbursement,1100001244,1000000074,0010911400741010,Disbursement,2009-04-24T00:00:00.000Z,81190.53,EUR,2009-04-24T00:00:00.000Z,1000000074 G-B-BE-39-,IFAD,MINISTERE DES FINANCES,Money is disbursed through central Ministry of Finance or Treasury,,CD,WCA,1000000074 0010911400741010 Direct Payment/Reimbursement,C01, ,3,1,20,110
1000000074_0011305200741045_02-21-2013-00:00:00_Disbursement,1100001244,1000000074,0011305200741045,Disbursement,2013-02-21T00:00:00.000Z,81067.41,EUR,2013-02-21T00:00:00.000Z,1000000074 G-B-BE-39-,IFAD,MINISTERE DES FINANCES,Money is disbursed through central Ministry of Finance or Treasury,,CD,WCA,1000000074 0011305200741045 Direct Payment/Reimbursement,C01, ,3,1,20,110
1000000075___Commitment,1100001131,1000000075,,Commitment,,4447715.52,EUR,,1000000075 G-B-BE-40-,IFAD,MINISTERE DES FINANCES,Money is disbursed through central Ministry of Finance or Treasury,,ML,WCA,1000000075 GRANTS,C01, ,2,1,20,110
1000000075_0011127900751015_10-06-2011-00:00:00_Disbursement,1100001131,1000000075,0011127900751015,Disbursement,2011-10-06T00:00:00.000Z,141210.5,EUR,2011-10-06T00:00:00.000Z,1000000075 G-B-BE-40-,IFAD,MINISTERE DES FINANCES,Money is disbursed through central Ministry of Finance or Treasury,,ML,WCA,1000000075 0011127900751015 Direct Payment/Reimbursement,C01, ,3,1,20,110
1000000075_0010817800751006_06-26-2008-00:00:00_Disbursement,1100001131,1000000075,0010817800751006,Disbursement,2008-06-26T00:00:00.000Z,25773.71,EUR,2008-06-26T00:00:00.000Z,1000000075 G-B-BE-40-,IFAD,MINISTERE DES FINANCES,Money is disbursed through central Ministry of Finance or Treasury,,ML,WCA,1000000075 0010817800751006 Direct Payment/Reimbursement,C01, ,3,1,20,110
1000000075_001RFDB142690004_10-01-2014-00:00:00_Disbursement,1100001131,1000000075,001RFDB142690004,Disbursement,2014-10-01T00:00:00.000Z,21386.2,EUR,2014-10-01T00:00:00.000Z,1000000075 G-B-BE-40-,IFAD,MINISTERE DES FINANCES,Money is disbursed through central Ministry of Finance or Treasury,,ML,WCA,1000000075 001RFDB142690004 Replenishment,C01, ,3,1,20,110
1000000075_0010729800751002_10-25-2007-00:00:00_Disbursement,1100001131,1000000075,0010729800751002,Disbursement,2007-10-25T00:00:00.000Z,38988.63,EUR,2007-10-25T00:00:00.000Z,1000000075 G-B-BE-40-,IFAD,MINISTERE DES FINANCES,Money is disbursed through central Ministry of Finance or Treasury,,ML,WCA,1000000075 0010729800751002 Direct Payment/Reimbursement,C01, ,3,1,20,110
1000000075_0011317600751020_06-25-2013-00:00:00_Disbursement,1100001131,1000000075,0011317600751020,Disbursement,2013-06-25T00:00:00.000Z,71347.6,EUR,2013-06-25T00:00:00.000Z,1000000075 G-B-BE-40-,IFAD,MINISTERE DES FINANCES,Money is disbursed through central Ministry of Finance or Treasury,,ML,WCA,1000000075 0011317600751020 Direct Payment/Reimbursement,C01, ,3,1,20,110
1000000075_0010811900751004_04-28-2008-00:00:00_Disbursement,1100001131,1000000075,0010811900751004,Disbursement,2008-04-28T00:00:00.000Z,248393.43,EUR,2008-04-28T00:00:00.000Z,1000000075 G-B-BE-40-,IFAD,MINISTERE DES FINANCES,Money is disbursed through central Ministry of Finance or Treasury,,ML,WCA,1000000075 0010811900751004 Direct Payment/Reimbursement,C01, ,3,1,20,110
1000000075_0011003500751011_02-04-2010-00:00:00_Disbursement,1100001131,1000000075,0011003500751011,Disbursement,2010-02-04T00:00:00.000Z,93365.71,EUR,2010-02-04T00:00:00.000Z,1000000075 G-B-BE-40-,IFAD,MINISTERE DES FINANCES,Money is disbursed through central Ministry of Finance or Treasury,,ML,WCA,1000000075 0011003500751011 Direct Payment/Reimbursement,C01, ,3,1,20,110
1000000075_0010814400751005_05-23-2008-00:00:00_Disbursement,1100001131,1000000075,0010814400751005,Disbursement,2008-05-23T00:00:00.000Z,76732.51,EUR,2008-05-23T00:00:00.000Z,1000000075 G-B-BE-40-,IFAD,MINISTERE DES FINANCES,Money is disbursed through central Ministry of Finance or Treasury,,ML,WCA,1000000075 0010814400751005 Direct Payment/Reimbursement,C01, ,3,1,20,110
1000000075_001RFDB140700003_03-12-2014-00:00:00_Disbursement,1100001131,1000000075,001RFDB140700003,Disbursement,2014-03-12T00:00:00.000Z,35063.27,EUR,2014-03-12T00:00:00.000Z,1000000075 G-B-BE-40-,IFAD,MINISTERE DES FINANCES,Money is disbursed through central Ministry of Finance or Treasury,,ML,WCA,1000000075 001RFDB140700003 Replenishment,C01, ,3,1,20,110
1000000075_001RFDB143210004_11-20-2014-00:00:00_Disbursement,1100001131,1000000075,001RFDB143210004,Disbursement,2014-11-20T00:00:00.000Z,27920.03,EUR,2014-11-20T00:00:00.000Z,1000000075 G-B-BE-40-,IFAD,MINISTERE DES FINANCES,Money is disbursed through central Ministry of Finance or Treasury,,ML,WCA,1000000075 001RFDB143210004 Direct Payment/Reimbursement,C01, ,3,1,20,110
1000000075_0010907100751009_03-12-2009-00:00:00_Disbursement,1100001131,1000000075,0010907100751009,Disbursement,2009-03-12T00:00:00.000Z,52291.96,EUR,2009-03-12T00:00:00.000Z,1000000075 G-B-BE-40-,IFAD,MINISTERE DES FINANCES,Money is disbursed through central Ministry of Finance or Treasury,,ML,WCA,1000000075 0010907100751009 Direct Payment/Reimbursement,C01, ,3,1,20,110
1000000075_MG2RFDB133056003_10-18-2006-00:00:00_Disbursement,1100001131,1000000075,MG2RFDB133056003,Disbursement,2006-10-18T00:00:00.000Z,304898.03,EUR,2006-10-18T00:00:00.000Z,1000000075 G-B-BE-40-,IFAD,MINISTERE DES FINANCES,Money is disbursed through central Ministry of Finance or Treasury,,ML,WCA,1000000075 MG2RFDB133056003 Designated Special,C01, ,3,1,20,110
1000000075_0011321300751021_08-01-2013-00:00:00_Disbursement,1100001131,1000000075,0011321300751021,Disbursement,2013-08-01T00:00:00.000Z,86704.31,EUR,2013-08-01T00:00:00.000Z,1000000075 G-B-BE-40-,IFAD,MINISTERE DES FINANCES,Money is disbursed through central Ministry of Finance or Treasury,,ML,WCA,1000000075 0011321300751021 Direct Payment/Reimbursement,C01, ,3,1,20,110
1000000075_0011301800751018_01-18-2013-00:00:00_Disbursement,1100001131,1000000075,0011301800751018,Disbursement,2013-01-18T00:00:00.000Z,46033.51,EUR,2013-01-18T00:00:00.000Z,1000000075 G-B-BE-40-,IFAD,MINISTERE DES FINANCES,Money is disbursed through central Ministry of Finance or Treasury,,ML,WCA,1000000075 0011301800751018 Direct Payment/Reimbursement,C01, ,3,1,20,110
1000000075_001RFDB142940015_10-24-2014-00:00:00_Disbursement,1100001131,1000000075,001RFDB142940015,Disbursement,2014-10-24T00:00:00.000Z,48783.69,EUR,2014-10-24T00:00:00.000Z,1000000075 G-B-BE-40-,IFAD,MINISTERE DES FINANCES,Money is disbursed through central Ministry of Finance or Treasury,,ML,WCA,1000000075 001RFDB142940015 Direct Payment/Reimbursement,C01, ,3,1,20,110
1000000075_MG2RFDB133056004_08-10-2012-00:00:00_Disbursement,1100001131,1000000075,MG2RFDB133056004,Disbursement,2012-08-10T00:00:00.000Z,264130.57,EUR,2012-08-10T00:00:00.000Z,1000000075 G-B-BE-40-,IFAD,MINISTERE DES FINANCES,Money is disbursed through central Ministry of Finance or Treasury,,ML,WCA,1000000075 MG2RFDB133056004 Designated Special,C01, ,3,1,20,110
1000000075_001RFDB143280004_11-27-2014-00:00:00_Disbursement,1100001131,1000000075,001RFDB143280004,Disbursement,2014-11-27T00:00:00.000Z,33538.78,EUR,2014-11-27T00:00:00.000Z,1000000075 G-B-BE-40-,IFAD,MINISTERE DES FINANCES,Money is disbursed through central Ministry of Finance or Treasury,,ML,WCA,1000000075 001RFDB143280004 Direct Payment/Reimbursement,C01, ,3,1,20,110
1000000075_0010918700751010_07-06-2009-00:00:00_Disbursement,1100001131,1000000075,0010918700751010,Disbursement,2009-07-06T00:00:00.000Z,273266.84,EUR,2009-07-06T00:00:00.000Z,1000000075 G-B-BE-40-,IFAD,MINISTERE DES FINANCES,Money is disbursed through central Ministry of Finance or Treasury,,ML,WCA,1000000075 0010918700751010 Direct Payment/Reimbursement,C01, ,3,1,20,110
1000000075_0010802200751003_01-22-2008-00:00:00_Disbursement,1100001131,1000000075,0010802200751003,Disbursement,2008-01-22T00:00:00.000Z,242988.1,EUR,2008-01-22T00:00:00.000Z,1000000075 G-B-BE-40-,IFAD,MINISTERE DES FINANCES,Money is disbursed through central Ministry of Finance or Treasury,,ML,WCA,1000000075 0010802200751003 Direct Payment/Reimbursement,C01, ,3,1,20,110
1000000075_0010901900751008_01-19-2009-00:00:00_Disbursement,1100001131,1000000075,0010901900751008,Disbursement,2009-01-19T00:00:00.000Z,213926.87,EUR,2009-01-19T00:00:00.000Z,1000000075 G-B-BE-40-,IFAD,MINISTERE DES FINANCES,Money is disbursed through central Ministry of Finance or Treasury,,ML,WCA,1000000075 0010901900751008 Direct Payment/Reimbursement,C01, ,3,1,20,110
1000000075_0011230700751017_11-02-2012-00:00:00_Disbursement,1100001131,1000000075,0011230700751017,Disbursement,2012-11-02T00:00:00.000Z,152449.02,EUR,2012-11-02T00:00:00.000Z,1000000075 G-B-BE-40-,IFAD,MINISTERE DES FINANCES,Money is disbursed through central Ministry of Finance or Treasury,,ML,WCA,1000000075 0011230700751017 Direct Payment/Reimbursement,C01, ,3,1,20,110
1000000075_001RFDB142940016_10-24-2014-00:00:00_Disbursement,1100001131,1000000075,001RFDB142940016,Disbursement,2014-10-24T00:00:00.000Z,91459.42,EUR,2014-10-24T00:00:00.000Z,1000000075 G-B-BE-40-,IFAD,MINISTERE DES FINANCES,Money is disbursed through central Ministry of Finance or Treasury,,ML,WCA,1000000075 001RFDB142940016 Direct Payment/Reimbursement,C01, ,3,1,20,110
1000000075_001RFDB142900002_10-23-2014-00:00:00_Disbursement,1100001131,1000000075,001RFDB142900002,Disbursement,2014-10-23T00:00:00.000Z,26806.92,EUR,2014-10-23T00:00:00.000Z,1000000075 G-B-BE-40-,IFAD,MINISTERE DES FINANCES,Money is disbursed through central Ministry of Finance or Treasury,,ML,WCA,1000000075 001RFDB142900002 Replenishment,C01, ,3,1,20,110
1000000075_0011106300751014_03-04-2011-00:00:00_Disbursement,1100001131,1000000075,0011106300751014,Disbursement,2011-03-04T00:00:00.000Z,119001.69,EUR,2011-03-04T00:00:00.000Z,1000000075 G-B-BE-40-,IFAD,MINISTERE DES FINANCES,Money is disbursed through central Ministry of Finance or Treasury,,ML,WCA,1000000075 0011106300751014 Direct Payment/Reimbursement,C01, ,3,1,20,110
1000000075_001RFDB142890005_10-23-2014-00:00:00_Disbursement,1100001131,1000000075,001RFDB142890005,Disbursement,2014-10-23T00:00:00.000Z,76356.91,EUR,2014-10-23T00:00:00.000Z,1000000075 G-B-BE-40-,IFAD,MINISTERE DES FINANCES,Money is disbursed through central Ministry of Finance or Treasury,,ML,WCA,1000000075 001RFDB142890005 Direct Payment/Reimbursement,C01, ,3,1,20,110
1000000075_0011010200751012_04-12-2010-00:00:00_Disbursement,1100001131,1000000075,0011010200751012,Disbursement,2010-04-12T00:00:00.000Z,103026.71,EUR,2010-04-12T00:00:00.000Z,1000000075 G-B-BE-40-,IFAD,MINISTERE DES FINANCES,Money is disbursed through central Ministry of Finance or Treasury,,ML,WCA,1000000075 0011010200751012 Direct Payment/Reimbursement,C01, ,3,1,20,110
1000000075_0011028600751013_10-13-2010-00:00:00_Disbursement,1100001131,1000000075,0011028600751013,Disbursement,2010-10-13T00:00:00.000Z,295633.94,EUR,2010-10-13T00:00:00.000Z,1000000075 G-B-BE-40-,IFAD,MINISTERE DES FINANCES,Money is disbursed through central Ministry of Finance or Treasury,,ML,WCA,1000000075 0011028600751013 Direct Payment/Reimbursement,C01, ,3,1,20,110
1000000075_0011314200751019_05-22-2013-00:00:00_Disbursement,1100001131,1000000075,0011314200751019,Disbursement,2013-05-22T00:00:00.000Z,983965.49,EUR,2013-05-22T00:00:00.000Z,1000000075 G-B-BE-40-,IFAD,MINISTERE DES FINANCES,Money is disbursed through central Ministry of Finance or Treasury,,ML,WCA,1000000075 0011314200751019 Direct Payment/Reimbursement,C01, ,3,1,20,110
1000000075_0010827300751007_09-29-2008-00:00:00_Disbursement,1100001131,1000000075,0010827300751007,Disbursement,2008-09-29T00:00:00.000Z,252271.17,EUR,2008-09-29T00:00:00.000Z,1000000075 G-B-BE-40-,IFAD,MINISTERE DES FINANCES,Money is disbursed through central Ministry of Finance or Treasury,,ML,WCA,1000000075 0010827300751007 Direct Payment/Reimbursement,C01, ,3,1,20,110
1000000076__12-13-2005-00:00:00_Commitment,1100001311,1000000076,,Commitment,2005-12-13T00:00:00.000Z,1224098.23,EUR,2005-12-13T00:00:00.000Z,1000000076 G-B-BE-41-,IFAD,MINISTERE DES FINANCES,Money is disbursed through central Ministry of Finance or Treasury,,CD,WCA,1000000076 GRANTS,C01, ,2,1,20,110
1000000076_MG2RFDB133056005_01-31-2008-00:00:00_Disbursement,1100001311,1000000076,MG2RFDB133056005,Disbursement,2008-01-31T00:00:00.000Z,243897.81,EUR,2008-01-31T00:00:00.000Z,1000000076 G-B-BE-41-,IFAD,MINISTERE DES FINANCES,Money is disbursed through central Ministry of Finance or Treasury,,CD,WCA,1000000076 MG2RFDB133056005 Designated Special,C01, ,3,1,20,110
1000000076_0011206900761026_03-09-2012-00:00:00_Disbursement,1100001311,1000000076,0011206900761026,Disbursement,2012-03-09T00:00:00.000Z,17235.16,EUR,2012-03-09T00:00:00.000Z,1000000076 G-B-BE-41-,IFAD,MINISTERE DES FINANCES,Money is disbursed through central Ministry of Finance or Treasury,,CD,WCA,1000000076 0011206900761026 Direct Payment/Reimbursement,C01, ,3,1,20,110
1000000076_0011112200761017_05-02-2011-00:00:00_Disbursement,1100001311,1000000076,0011112200761017,Disbursement,2011-05-02T00:00:00.000Z,21567.73,EUR,2011-05-02T00:00:00.000Z,1000000076 G-B-BE-41-,IFAD,MINISTERE DES FINANCES,Money is disbursed through central Ministry of Finance or Treasury,,CD,WCA,1000000076 0011112200761017 Direct Payment/Reimbursement,C01, ,3,1,20,110
1000000076_0011033400761006_11-30-2010-00:00:00_Disbursement,1100001311,1000000076,0011033400761006,Disbursement,2010-11-30T00:00:00.000Z,60264.69,EUR,2010-11-30T00:00:00.000Z,1000000076 G-B-BE-41-,IFAD,MINISTERE DES FINANCES,Money is disbursed through central Ministry of Finance or Treasury,,CD,WCA,1000000076 0011033400761006 Direct Payment/Reimbursement,C01, ,3,1,20,110
1000000076_0011134800761024_12-14-2011-00:00:00_Disbursement,1100001311,1000000076,0011134800761024,Disbursement,2011-12-14T00:00:00.000Z,23284.69,EUR,2011-12-14T00:00:00.000Z,1000000076 G-B-BE-41-,IFAD,MINISTERE DES FINANCES,Money is disbursed through central Ministry of Finance or Treasury,,CD,WCA,1000000076 0011134800761024 Direct Payment/Reimbursement,C01, ,3,1,20,110
1000000076_0011035100761009_12-17-2010-00:00:00_Disbursement,1100001311,1000000076,0011035100761009,Disbursement,2010-12-17T00:00:00.000Z,19014.3,EUR,2010-12-17T00:00:00.000Z,1000000076 G-B-BE-41-,IFAD,MINISTERE DES FINANCES,Money is disbursed through central Ministry of Finance or Treasury,,CD,WCA,1000000076 0011035100761009 Direct Payment/Reimbursement,C01, ,3,1,20,110
1000000076_0011120000761018_07-19-2011-00:00:00_Disbursement,1100001311,1000000076,0011120000761018,Disbursement,2011-07-19T00:00:00.000Z,17869.91,EUR,2011-07-19T00:00:00.000Z,1000000076 G-B-BE-41-,IFAD,MINISTERE DES FINANCES,Money is disbursed through central Ministry of Finance or Treasury,,CD,WCA,1000000076 0011120000761018 Direct Payment/Reimbursement,C01, ,3,1,20,110
1000000076_0011024600761004_09-03-2010-00:00:00_Disbursement,1100001311,1000000076,0011024600761004,Disbursement,2010-09-03T00:00:00.000Z,79016.78,EUR,2010-09-03T00:00:00.000Z,1000000076 G-B-BE-41-,IFAD,MINISTERE DES FINANCES,Money is disbursed through central Ministry of Finance or Treasury,,CD,WCA,1000000076 0011024600761004 Direct Payment/Reimbursement,C01, ,3,1,20,110
1000000076_0011035100761007_12-17-2010-00:00:00_Disbursement,1100001311,1000000076,0011035100761007,Disbursement,2010-12-17T00:00:00.000Z,21300.87,EUR,2010-12-17T00:00:00.000Z,1000000076 G-B-BE-41-,IFAD,MINISTERE DES FINANCES,Money is disbursed through central Ministry of Finance or Treasury,,CD,WCA,1000000076 0011035100761007 Direct Payment/Reimbursement,C01, ,3,1,20,110
1000000076_0011129100761023_10-18-2011-00:00:00_Disbursement,1100001311,1000000076,0011129100761023,Disbursement,2011-10-18T00:00:00.000Z,25671.93,EUR,2011-10-18T00:00:00.000Z,1000000076 G-B-BE-41-,IFAD,MINISTERE DES FINANCES,Money is disbursed through central Ministry of Finance or Treasury,,CD,WCA,1000000076 0011129100761023 Direct Payment/Reimbursement,C01, ,3,1,20,110
1000000076_0011035100761008_12-17-2010-00:00:00_Disbursement,1100001311,1000000076,0011035100761008,Disbursement,2010-12-17T00:00:00.000Z,26628.12,EUR,2010-12-17T00:00:00.000Z,1000000076 G-B-BE-41-,IFAD,MINISTERE DES FINANCES,Money is disbursed through central Ministry of Finance or Treasury,,CD,WCA,1000000076 0011035100761008 Direct Payment/Reimbursement,C01, ,3,1,20,110
1000000076_0011103100761012_01-31-2011-00:00:00_Disbursement,1100001311,1000000076,0011103100761012,Disbursement,2011-01-31T00:00:00.000Z,17315.74,EUR,2011-01-31T00:00:00.000Z,1000000076 G-B-BE-41-,IFAD,MINISTERE DES FINANCES,Money is disbursed through central Ministry of Finance or Treasury,,CD,WCA,1000000076 0011103100761012 Direct Payment/Reimbursement,C01, ,3,1,20,110
1000000076_0011035100761011_12-17-2010-00:00:00_Disbursement,1100001311,1000000076,0011035100761011,Disbursement,2010-12-17T00:00:00.000Z,26613.95,EUR,2010-12-17T00:00:00.000Z,1000000076 G-B-BE-41-,IFAD,MINISTERE DES FINANCES,Money is disbursed through central Ministry of Finance or Treasury,,CD,WCA,1000000076 0011035100761011 Direct Payment/Reimbursement,C01, ,3,1,20,110
1000000076_0011129100761022_10-18-2011-00:00:00_Disbursement,1100001311,1000000076,0011129100761022,Disbursement,2011-10-18T00:00:00.000Z,17174.37,EUR,2011-10-18T00:00:00.000Z,1000000076 G-B-BE-41-,IFAD,MINISTERE DES FINANCES,Money is disbursed through central Ministry of Finance or Treasury,,CD,WCA,1000000076 0011129100761022 Direct Payment/Reimbursement,C01, ,3,1,20,110
1000000076_0011206900761027_03-09-2012-00:00:00_Disbursement,1100001311,1000000076,0011206900761027,Disbursement,2012-03-09T00:00:00.000Z,16489.35,EUR,2012-03-09T00:00:00.000Z,1000000076 G-B-BE-41-,IFAD,MINISTERE DES FINANCES,Money is disbursed through central Ministry of Finance or Treasury,,CD,WCA,1000000076 0011206900761027 Direct Payment/Reimbursement,C01, ,3,1,20,110
1000000076_0011120000761020_07-19-2011-00:00:00_Disbursement,1100001311,1000000076,0011120000761020,Disbursement,2011-07-19T00:00:00.000Z,17869.91,EUR,2011-07-19T00:00:00.000Z,1000000076 G-B-BE-41-,IFAD,MINISTERE DES FINANCES,Money is disbursed through central Ministry of Finance or Treasury,,CD,WCA,1000000076 0011120000761020 Direct Payment/Reimbursement,C01, ,3,1,20,110
1000000076_0011106600761013_03-07-2011-00:00:00_Disbursement,1100001311,1000000076,0011106600761013,Disbursement,2011-03-07T00:00:00.000Z,20148.23,EUR,2011-03-07T00:00:00.000Z,1000000076 G-B-BE-41-,IFAD,MINISTERE DES FINANCES,Money is disbursed through central Ministry of Finance or Treasury,,CD,WCA,1000000076 0011106600761013 Direct Payment/Reimbursement,C01, ,3,1,20,110
1000000076_0011208600761029_03-26-2012-00:00:00_Disbursement,1100001311,1000000076,0011208600761029,Disbursement,2012-03-26T00:00:00.000Z,18836.01,EUR,2012-03-26T00:00:00.000Z,1000000076 G-B-BE-41-,IFAD,MINISTERE DES FINANCES,Money is disbursed through central Ministry of Finance or Treasury,,CD,WCA,1000000076 0011208600761029 Direct Payment/Reimbursement,C01, ,3,1,20,110
1000000076_0011028600761005_10-13-2010-00:00:00_Disbursement,1100001311,1000000076,0011028600761005,Disbursement,2010-10-13T00:00:00.000Z,84388.32,EUR,2010-10-13T00:00:00.000Z,1000000076 G-B-BE-41-,IFAD,MINISTERE DES FINANCES,Money is disbursed through central Ministry of Finance or Treasury,,CD,WCA,1000000076 0011028600761005 Direct Payment/Reimbursement,C01, ,3,1,20,110
1000000076_0011112200761016_05-02-2011-00:00:00_Disbursement,1100001311,1000000076,0011112200761016,Disbursement,2011-05-02T00:00:00.000Z,20219.75,EUR,2011-05-02T00:00:00.000Z,1000000076 G-B-BE-41-,IFAD,MINISTERE DES FINANCES,Money is disbursed through central Ministry of Finance or Treasury,,CD,WCA,1000000076 0011112200761016 Direct Payment/Reimbursement,C01, ,3,1,20,110
1000000076_0011134800761025_12-14-2011-00:00:00_Disbursement,1100001311,1000000076,0011134800761025,Disbursement,2011-12-14T00:00:00.000Z,19403.91,EUR,2011-12-14T00:00:00.000Z,1000000076 G-B-BE-41-,IFAD,MINISTERE DES FINANCES,Money is disbursed through central Ministry of Finance or Treasury,,CD,WCA,1000000076 0011134800761025 Direct Payment/Reimbursement,C01, ,3,1,20,110
1000000076_0011218000761030_06-28-2012-00:00:00_Disbursement,1100001311,1000000076,0011218000761030,Disbursement,2012-06-28T00:00:00.000Z,23662.94,EUR,2012-06-28T00:00:00.000Z,1000000076 G-B-BE-41-,IFAD,MINISTERE DES FINANCES,Money is disbursed through central Ministry of Finance or Treasury,,CD,WCA,1000000076 0011218000761030 Direct Payment/Reimbursement,C01, ,3,1,20,110
1000000076_0011024500761003_09-02-2010-00:00:00_Disbursement,1100001311,1000000076,0011024500761003,Disbursement,2010-09-02T00:00:00.000Z,303356.86,EUR,2010-09-02T00:00:00.000Z,1000000076 G-B-BE-41-,IFAD,MINISTERE DES FINANCES,Money is disbursed through central Ministry of Finance or Treasury,,CD,WCA,1000000076 0011024500761003 Direct Payment/Reimbursement,C01, ,3,1,20,110
1000000076_0011120000761019_07-19-2011-00:00:00_Disbursement,1100001311,1000000076,0011120000761019,Disbursement,2011-07-19T00:00:00.000Z,17869.91,EUR,2011-07-19T00:00:00.000Z,1000000076 G-B-BE-41-,IFAD,MINISTERE DES FINANCES,Money is disbursed through central Ministry of Finance or Treasury,,CD,WCA,1000000076 0011120000761019 Direct Payment/Reimbursement,C01, ,3,1,20,110
1000000076_0011035100761010_12-17-2010-00:00:00_Disbursement,1100001311,1000000076,0011035100761010,Disbursement,2010-12-17T00:00:00.000Z,28899.54,EUR,2010-12-17T00:00:00.000Z,1000000076 G-B-BE-41-,IFAD,MINISTERE DES FINANCES,Money is disbursed through central Ministry of Finance or Treasury,,CD,WCA,1000000076 0011035100761010 Direct Payment/Reimbursement,C01, ,3,1,20,110
1000000076_0011106600761014_03-07-2011-00:00:00_Disbursement,1100001311,1000000076,0011106600761014,Disbursement,2011-03-07T00:00:00.000Z,17998.56,EUR,2011-03-07T00:00:00.000Z,1000000076 G-B-BE-41-,IFAD,MINISTERE DES FINANCES,Money is disbursed through central Ministry of Finance or Treasury,,CD,WCA,1000000076 0011106600761014 Direct Payment/Reimbursement,C01, ,3,1,20,110
1000000076_0011107400761015_03-15-2011-00:00:00_Disbursement,1100001311,1000000076,0011107400761015,Disbursement,2011-03-15T00:00:00.000Z,18098.89,EUR,2011-03-15T00:00:00.000Z,1000000076 G-B-BE-41-,IFAD,MINISTERE DES FINANCES,Money is disbursed through central Ministry of Finance or Treasury,,CD,WCA,1000000076 0011107400761015 Direct Payment/Reimbursement,C01, ,3,1,20,110
1000000077__09-08-2005-00:00:00_Commitment,1100001306,1000000077,,Commitment,2005-09-08T00:00:00.000Z,3893946.28,EUR,2005-09-08T00:00:00.000Z,1000000077 G-B-BE-42-,IFAD,"MINISTRY OF FINANCE, PERMANENT SECRETARY",Money is disbursed through central Ministry of Finance or Treasury,,TZ,ESA,1000000077 GRANTS,C01, ,2,1,20,110
1000000077_0011032000771007_11-16-2010-00:00:00_Disbursement,1100001306,1000000077,0011032000771007,Disbursement,2010-11-16T00:00:00.000Z,137802.22,EUR,2010-11-16T00:00:00.000Z,1000000077 G-B-BE-42-,IFAD,"MINISTRY OF FINANCE, PERMANENT SECRETARY",Money is disbursed through central Ministry of Finance or Treasury,,TZ,ESA,1000000077 0011032000771007 Direct Payment/Reimbursement,C01, ,3,1,20,110
1000000077_001RFDB133180008_11-18-2013-00:00:00_Disbursement,1100001306,1000000077,001RFDB133180008,Disbursement,2013-11-18T00:00:00.000Z,233985.38,EUR,2013-11-18T00:00:00.000Z,1000000077 G-B-BE-42-,IFAD,"MINISTRY OF FINANCE, PERMANENT SECRETARY",Money is disbursed through central Ministry of Finance or Treasury,,TZ,ESA,1000000077 001RFDB133180008 Replenishment,C01, ,3,1,20,110
1000000077_001RFDB152850004_10-14-2015-00:00:00_Disbursement,1100001306,1000000077,001RFDB152850004,Disbursement,2015-10-14T00:00:00.000Z,49727.24,EUR,2015-10-14T00:00:00.000Z,1000000077 G-B-BE-42-,IFAD,"MINISTRY OF FINANCE, PERMANENT SECRETARY",Money is disbursed through central Ministry of Finance or Treasury,,TZ,ESA,1000000077 001RFDB152850004 Direct Payment/Reimbursement,C01, ,3,1,20,110
1000000077_001RFDB150900012_04-02-2015-00:00:00_Disbursement,1100001306,1000000077,001RFDB150900012,Disbursement,2015-04-02T00:00:00.000Z,103919.62,EUR,2015-04-02T00:00:00.000Z,1000000077 G-B-BE-42-,IFAD,"MINISTRY OF FINANCE, PERMANENT SECRETARY",Money is disbursed through central Ministry of Finance or Treasury,,TZ,ESA,1000000077 001RFDB150900012 Replenishment,C01, ,3,1,20,110
1000000077_0011135700771011_12-23-2011-00:00:00_Disbursement,1100001306,1000000077,0011135700771011,Disbursement,2011-12-23T00:00:00.000Z,303964.56,EUR,2011-12-23T00:00:00.000Z,1000000077 G-B-BE-42-,IFAD,"MINISTRY OF FINANCE, PERMANENT SECRETARY",Money is disbursed through central Ministry of Finance or Treasury,,TZ,ESA,1000000077 0011135700771011 Direct Payment/Reimbursement,C01, ,3,1,20,110
1000000077_0011135700771013_12-23-2011-00:00:00_Disbursement,1100001306,1000000077,0011135700771013,Disbursement,2011-12-23T00:00:00.000Z,33780.61,EUR,2011-12-23T00:00:00.000Z,1000000077 G-B-BE-42-,IFAD,"MINISTRY OF FINANCE, PERMANENT SECRETARY",Money is disbursed through central Ministry of Finance or Treasury,,TZ,ESA,1000000077 0011135700771013 Direct Payment/Reimbursement,C01, ,3,1,20,110
1000000077_001RFDB141460008_06-03-2014-00:00:00_Disbursement,1100001306,1000000077,001RFDB141460008,Disbursement,2014-06-03T00:00:00.000Z,49863.95,EUR,2014-06-03T00:00:00.000Z,1000000077 G-B-BE-42-,IFAD,"MINISTRY OF FINANCE, PERMANENT SECRETARY",Money is disbursed through central Ministry of Finance or Treasury,,TZ,ESA,1000000077 001RFDB141460008 Direct Payment/Reimbursement,C01, ,3,1,20,110
1000000077_0011022500771006_08-13-2010-00:00:00_Disbursement,1100001306,1000000077,0011022500771006,Disbursement,2010-08-13T00:00:00.000Z,35120.36,EUR,2010-08-13T00:00:00.000Z,1000000077 G-B-BE-42-,IFAD,"MINISTRY OF FINANCE, PERMANENT SECRETARY",Money is disbursed through central Ministry of Finance or Treasury,,TZ,ESA,1000000077 0011022500771006 Direct Payment/Reimbursement,C01, ,3,1,20,110
1000000077_0011325500771027_09-12-2013-00:00:00_Disbursement,1100001306,1000000077,0011325500771027,Disbursement,2013-09-12T00:00:00.000Z,19659.85,EUR,2013-09-12T00:00:00.000Z,1000000077 G-B-BE-42-,IFAD,"MINISTRY OF FINANCE, PERMANENT SECRETARY",Money is disbursed through central Ministry of Finance or Treasury,,TZ,ESA,1000000077 0011325500771027 Direct Payment/Reimbursement,C01, ,3,1,20,110
1000000077_0011322800771025_08-16-2013-00:00:00_Disbursement,1100001306,1000000077,0011322800771025,Disbursement,2013-08-16T00:00:00.000Z,94644.78,EUR,2013-08-16T00:00:00.000Z,1000000077 G-B-BE-42-,IFAD,"MINISTRY OF FINANCE, PERMANENT SECRETARY",Money is disbursed through central Ministry of Finance or Treasury,,TZ,ESA,1000000077 0011322800771025 Direct Payment/Reimbursement,C01, ,3,1,20,110
1000000077_MG2RFDB133056006_09-26-2007-00:00:00_Disbursement,1100001306,1000000077,MG2RFDB133056006,Disbursement,2007-09-26T00:00:00.000Z,460112.31,EUR,2007-09-26T00:00:00.000Z,1000000077 G-B-BE-42-,IFAD,"MINISTRY OF FINANCE, PERMANENT SECRETARY",Money is disbursed through central Ministry of Finance or Treasury,,TZ,ESA,1000000077 MG2RFDB133056006 Designated Special,C01, ,3,1,20,110
1000000077_0011017300771005_06-22-2010-00:00:00_Disbursement,1100001306,1000000077,0011017300771005,Disbursement,2010-06-22T00:00:00.000Z,128982.4,EUR,2010-06-22T00:00:00.000Z,1000000077 G-B-BE-42-,IFAD,"MINISTRY OF FINANCE, PERMANENT SECRETARY",Money is disbursed through central Ministry of Finance or Treasury,,TZ,ESA,1000000077 0011017300771005 Direct Payment/Reimbursement,C01, ,3,1,20,110
1000000077_001RFDB133056006_08-08-2016-00:00:00_Disbursement,1100001306,1000000077,001RFDB133056006,Disbursement,2016-08-08T00:00:00.000Z,-15827.73,EUR,2016-08-08T00:00:00.000Z,1000000077 G-B-BE-42-,IFAD,"MINISTRY OF FINANCE, PERMANENT SECRETARY",Money is disbursed through central Ministry of Finance or Treasury,,TZ,ESA,1000000077 001RFDB133056006 Designated Special,C01, ,3,1,20,110
1000000077_0011034100771008_12-07-2010-00:00:00_Disbursement,1100001306,1000000077,0011034100771008,Disbursement,2010-12-07T00:00:00.000Z,262000.29,EUR,2010-12-07T00:00:00.000Z,1000000077 G-B-BE-42-,IFAD,"MINISTRY OF FINANCE, PERMANENT SECRETARY",Money is disbursed through central Ministry of Finance or Treasury,,TZ,ESA,1000000077 0011034100771008 Direct Payment/Reimbursement,C01, ,3,1,20,110
1000000077_0011322800771024_08-16-2013-00:00:00_Disbursement,1100001306,1000000077,0011322800771024,Disbursement,2013-08-16T00:00:00.000Z,14253.54,EUR,2013-08-16T00:00:00.000Z,1000000077 G-B-BE-42-,IFAD,"MINISTRY OF FINANCE, PERMANENT SECRETARY",Money is disbursed through central Ministry of Finance or Treasury,,TZ,ESA,1000000077 0011322800771024 Direct Payment/Reimbursement,C01, ,3,1,20,110
1000000077_0011208000771016_03-20-2012-00:00:00_Disbursement,1100001306,1000000077,0011208000771016,Disbursement,2012-03-20T00:00:00.000Z,67044.26,EUR,2012-03-20T00:00:00.000Z,1000000077 G-B-BE-42-,IFAD,"MINISTRY OF FINANCE, PERMANENT SECRETARY",Money is disbursed through central Ministry of Finance or Treasury,,TZ,ESA,1000000077 0011208000771016 Direct Payment/Reimbursement,C01, ,3,1,20,110
1000000077_0011235900771023_12-24-2012-00:00:00_Disbursement,1100001306,1000000077,0011235900771023,Disbursement,2012-12-24T00:00:00.000Z,184351.53,EUR,2012-12-24T00:00:00.000Z,1000000077 G-B-BE-42-,IFAD,"MINISTRY OF FINANCE, PERMANENT SECRETARY",Money is disbursed through central Ministry of Finance or Treasury,,TZ,ESA,1000000077 0011235900771023 Direct Payment/Reimbursement,C01, ,3,1,20,110
1000000077_0011227700771020_10-03-2012-00:00:00_Disbursement,1100001306,1000000077,0011227700771020,Disbursement,2012-10-03T00:00:00.000Z,35479.08,EUR,2012-10-03T00:00:00.000Z,1000000077 G-B-BE-42-,IFAD,"MINISTRY OF FINANCE, PERMANENT SECRETARY",Money is disbursed through central Ministry of Finance or Treasury,,TZ,ESA,1000000077 0011227700771020 Direct Payment/Reimbursement,C01, ,3,1,20,110
1000000077_0011226800771019_09-24-2012-00:00:00_Disbursement,1100001306,1000000077,0011226800771019,Disbursement,2012-09-24T00:00:00.000Z,210705.37,EUR,2012-09-24T00:00:00.000Z,1000000077 G-B-BE-42-,IFAD,"MINISTRY OF FINANCE, PERMANENT SECRETARY",Money is disbursed through central Ministry of Finance or Treasury,,TZ,ESA,1000000077 0011226800771019 Direct Payment/Reimbursement,C01, ,3,1,20,110
1000000077_0011035500771009_12-21-2010-00:00:00_Disbursement,1100001306,1000000077,0011035500771009,Disbursement,2010-12-21T00:00:00.000Z,47607.91,EUR,2010-12-21T00:00:00.000Z,1000000077 G-B-BE-42-,IFAD,"MINISTRY OF FINANCE, PERMANENT SECRETARY",Money is disbursed through central Ministry of Finance or Treasury,,TZ,ESA,1000000077 0011035500771009 Direct Payment/Reimbursement,C01, ,3,1,20,110
1000000077_001RFDB142170003_08-14-2014-00:00:00_Disbursement,1100001306,1000000077,001RFDB142170003,Disbursement,2014-08-14T00:00:00.000Z,23952.71,EUR,2014-08-14T00:00:00.000Z,1000000077 G-B-BE-42-,IFAD,"MINISTRY OF FINANCE, PERMANENT SECRETARY",Money is disbursed through central Ministry of Finance or Treasury,,TZ,ESA,1000000077 001RFDB142170003 Direct Payment/Reimbursement,C01, ,3,1,20,110
1000000077_0011207600771017_03-16-2012-00:00:00_Disbursement,1100001306,1000000077,0011207600771017,Disbursement,2012-03-16T00:00:00.000Z,157472.35,EUR,2012-03-16T00:00:00.000Z,1000000077 G-B-BE-42-,IFAD,"MINISTRY OF FINANCE, PERMANENT SECRETARY",Money is disbursed through central Ministry of Finance or Treasury,,TZ,ESA,1000000077 0011207600771017 Direct Payment/Reimbursement,C01, ,3,1,20,110
1000000077_001RFDB142310008_08-28-2014-00:00:00_Disbursement,1100001306,1000000077,001RFDB142310008,Disbursement,2014-08-28T00:00:00.000Z,121252.87,EUR,2014-08-28T00:00:00.000Z,1000000077 G-B-BE-42-,IFAD,"MINISTRY OF FINANCE, PERMANENT SECRETARY",Money is disbursed through central Ministry of Finance or Treasury,,TZ,ESA,1000000077 001RFDB142310008 Replenishment,C01, ,3,1,20,110
1000000077_0011217800771018_06-26-2012-00:00:00_Disbursement,1100001306,1000000077,0011217800771018,Disbursement,2012-06-26T00:00:00.000Z,61532.49,EUR,2012-06-26T00:00:00.000Z,1000000077 G-B-BE-42-,IFAD,"MINISTRY OF FINANCE, PERMANENT SECRETARY",Money is disbursed through central Ministry of Finance or Treasury,,TZ,ESA,1000000077 0011217800771018 Direct Payment/Reimbursement,C01, ,3,1,20,110
1000000077_0011236300771021_12-28-2012-00:00:00_Disbursement,1100001306,1000000077,0011236300771021,Disbursement,2012-12-28T00:00:00.000Z,14703.71,EUR,2012-12-28T00:00:00.000Z,1000000077 G-B-BE-42-,IFAD,"MINISTRY OF FINANCE, PERMANENT SECRETARY",Money is disbursed through central Ministry of Finance or Treasury,,TZ,ESA,1000000077 0011236300771021 Direct Payment/Reimbursement,C01, ,3,1,20,110
1000000077_0011135700771012_12-23-2011-00:00:00_Disbursement,1100001306,1000000077,0011135700771012,Disbursement,2011-12-23T00:00:00.000Z,56403.24,EUR,2011-12-23T00:00:00.000Z,1000000077 G-B-BE-42-,IFAD,"MINISTRY OF FINANCE, PERMANENT SECRETARY",Money is disbursed through central Ministry of Finance or Treasury,,TZ,ESA,1000000077 0011135700771012 Direct Payment/Reimbursement,C01, ,3,1,20,110
1000000077_0011322800771026_08-16-2013-00:00:00_Disbursement,1100001306,1000000077,0011322800771026,Disbursement,2013-08-16T00:00:00.000Z,12491.95,EUR,2013-08-16T00:00:00.000Z,1000000077 G-B-BE-42-,IFAD,"MINISTRY OF FINANCE, PERMANENT SECRETARY",Money is disbursed through central Ministry of Finance or Treasury,,TZ,ESA,1000000077 0011322800771026 Direct Payment/Reimbursement,C01, ,3,1,20,110
1000000077_001RFDB141980008_07-22-2014-00:00:00_Disbursement,1100001306,1000000077,001RFDB141980008,Disbursement,2014-07-22T00:00:00.000Z,108177.39,EUR,2014-07-22T00:00:00.000Z,1000000077 G-B-BE-42-,IFAD,"MINISTRY OF FINANCE, PERMANENT SECRETARY",Money is disbursed through central Ministry of Finance or Treasury,,TZ,ESA,1000000077 001RFDB141980008 Direct Payment/Reimbursement,C01, ,3,1,20,110
1000000077_001RFDB133056006_07-21-2016-00:00:00_Disbursement,1100001306,1000000077,001RFDB133056006,Disbursement,2016-07-21T00:00:00.000Z,-2225.31,EUR,2016-07-21T00:00:00.000Z,1000000077 G-B-BE-42-,IFAD,"MINISTRY OF FINANCE, PERMANENT SECRETARY",Money is disbursed through central Ministry of Finance or Treasury,,TZ,ESA,1000000077 001RFDB133056006 Designated Special,C01, ,3,1,20,110
1000000077_0011205200771015_02-21-2012-00:00:00_Disbursement,1100001306,1000000077,0011205200771015,Disbursement,2012-02-21T00:00:00.000Z,46733.02,EUR,2012-02-21T00:00:00.000Z,1000000077 G-B-BE-42-,IFAD,"MINISTRY OF FINANCE, PERMANENT SECRETARY",Money is disbursed through central Ministry of Finance or Treasury,,TZ,ESA,1000000077 0011205200771015 Direct Payment/Reimbursement,C01, ,3,1,20,110
1000000077_001RFDB152820003_10-13-2015-00:00:00_Disbursement,1100001306,1000000077,001RFDB152820003,Disbursement,2015-10-13T00:00:00.000Z,51889.46,EUR,2015-10-13T00:00:00.000Z,1000000077 G-B-BE-42-,IFAD,"MINISTRY OF FINANCE, PERMANENT SECRETARY",Money is disbursed through central Ministry of Finance or Treasury,,TZ,ESA,1000000077 001RFDB152820003 Direct Payment/Reimbursement,C01, ,3,1,20,110
1000000077_0010904900771002_02-18-2009-00:00:00_Disbursement,1100001306,1000000077,0010904900771002,Disbursement,2009-02-18T00:00:00.000Z,355983.62,EUR,2009-02-18T00:00:00.000Z,1000000077 G-B-BE-42-,IFAD,"MINISTRY OF FINANCE, PERMANENT SECRETARY",Money is disbursed through central Ministry of Finance or Treasury,,TZ,ESA,1000000077 0010904900771002 Direct Payment/Reimbursement,C01, ,3,1,20,110
1000000077_0011129100771010_10-18-2011-00:00:00_Disbursement,1100001306,1000000077,0011129100771010,Disbursement,2011-10-18T00:00:00.000Z,103139.08,EUR,2011-10-18T00:00:00.000Z,1000000077 G-B-BE-42-,IFAD,"MINISTRY OF FINANCE, PERMANENT SECRETARY",Money is disbursed through central Ministry of Finance or Treasury,,TZ,ESA,1000000077 0011129100771010 Direct Payment/Reimbursement,C01, ,3,1,20,110
1000000077_0011004200771003_02-11-2010-00:00:00_Disbursement,1100001306,1000000077,0011004200771003,Disbursement,2010-02-11T00:00:00.000Z,149400.07,EUR,2010-02-11T00:00:00.000Z,1000000077 G-B-BE-42-,IFAD,"MINISTRY OF FINANCE, PERMANENT SECRETARY",Money is disbursed through central Ministry of Finance or Treasury,,TZ,ESA,1000000077 0011004200771003 Direct Payment/Reimbursement,C01, ,3,1,20,110
1000000077_0011236300771022_12-28-2012-00:00:00_Disbursement,1100001306,1000000077,0011236300771022,Disbursement,2012-12-28T00:00:00.000Z,34656.6,EUR,2012-12-28T00:00:00.000Z,1000000077 G-B-BE-42-,IFAD,"MINISTRY OF FINANCE, PERMANENT SECRETARY",Money is disbursed through central Ministry of Finance or Treasury,,TZ,ESA,1000000077 0011236300771022 Direct Payment/Reimbursement,C01, ,3,1,20,110
1000000077_0011006000771004_03-01-2010-00:00:00_Disbursement,1100001306,1000000077,0011006000771004,Disbursement,2010-03-01T00:00:00.000Z,28224.08,EUR,2010-03-01T00:00:00.000Z,1000000077 G-B-BE-42-,IFAD,"MINISTRY OF FINANCE, PERMANENT SECRETARY",Money is disbursed through central Ministry of Finance or Treasury,,TZ,ESA,1000000077 0011006000771004 Direct Payment/Reimbursement,C01, ,3,1,20,110
1000000077_0011325500771028_09-12-2013-00:00:00_Disbursement,1100001306,1000000077,0011325500771028,Disbursement,2013-09-12T00:00:00.000Z,17316.62,EUR,2013-09-12T00:00:00.000Z,1000000077 G-B-BE-42-,IFAD,"MINISTRY OF FINANCE, PERMANENT SECRETARY",Money is disbursed through central Ministry of Finance or Treasury,,TZ,ESA,1000000077 0011325500771028 Direct Payment/Reimbursement,C01, ,3,1,20,110
1000000077_001RFDB143500008_12-18-2014-00:00:00_Disbursement,1100001306,1000000077,001RFDB143500008,Disbursement,2014-12-18T00:00:00.000Z,95664.8,EUR,2014-12-18T00:00:00.000Z,1000000077 G-B-BE-42-,IFAD,"MINISTRY OF FINANCE, PERMANENT SECRETARY",Money is disbursed through central Ministry of Finance or Treasury,,TZ,ESA,1000000077 001RFDB143500008 Direct Payment/Reimbursement,C01, ,3,1,20,110
1000000087___Commitment,1000000087,1000000087,,Commitment,,0.0,USD,,1000000087 G-C-.DE-543-,IFAD,MINISTRY OF FINANCE,Money is disbursed through central Ministry of Finance or Treasury,,GE,NEN,1000000087 GRANTS,C01, ,2,1,20,110
1000000088___Commitment,1000000088,1000000088,,Commitment,,0.0,EUR,,1000000088 G-C-.DE-543-A,IFAD,MINISTRY OF FINANCE,Money is disbursed through central Ministry of Finance or Treasury,,GE,NEN,1000000088 GRANTS,C01, ,2,1,20,110
1000000090___Commitment,1100001184,1000000090,,Commitment,,219400.0,EUR,,1000000090 G-C-.DE-566-,IFAD,MINISTRY OF FINANCE,Money is disbursed through central Ministry of Finance or Treasury,,MZ,ESA,1000000090 GRANTS,C01, ,2,1,20,110
1000000090_0010433100901001_11-26-2004-00:00:00_Disbursement,1100001184,1000000090,0010433100901001,Disbursement,2004-11-26T00:00:00.000Z,164550.0,EUR,2004-11-26T00:00:00.000Z,1000000090 G-C-.DE-566-,IFAD,MINISTRY OF FINANCE,Money is disbursed through central Ministry of Finance or Treasury,,MZ,ESA,1000000090 0010433100901001 Direct Payment/Reimbursement,C01, ,3,1,20,110
1000000090_0010618800901002_07-07-2006-00:00:00_Disbursement,1100001184,1000000090,0010618800901002,Disbursement,2006-07-07T00:00:00.000Z,54850.0,EUR,2006-07-07T00:00:00.000Z,1000000090 G-C-.DE-566-,IFAD,MINISTRY OF FINANCE,Money is disbursed through central Ministry of Finance or Treasury,,MZ,ESA,1000000090 0010618800901002 Direct Payment/Reimbursement,C01, ,3,1,20,110
1000000094___Commitment,1100001013,1000000094,,Commitment,,984452.99,USD,,1000000094 G-C-AD-265-,IFAD,AMERICAN NEAR EAST REFUGEE AID,Money is disbursed through central Ministry of Finance or Treasury,,PS,NEN,1000000094 GRANTS,C01, ,2,1,20,110
1000000094_0010511600941013_04-26-2005-00:00:00_Disbursement,1100001013,1000000094,0010511600941013,Disbursement,2005-04-26T00:00:00.000Z,40374.83,USD,2005-04-26T00:00:00.000Z,1000000094 G-C-AD-265-,IFAD,AMERICAN NEAR EAST REFUGEE AID,Money is disbursed through central Ministry of Finance or Treasury,,PS,NEN,1000000094 0010511600941013 Direct Payment/Reimbursement,C01, ,3,1,20,110
1000000094_0010108200941003_03-23-2001-00:00:00_Disbursement,1100001013,1000000094,0010108200941003,Disbursement,2001-03-23T00:00:00.000Z,150000.0,USD,2001-03-23T00:00:00.000Z,1000000094 G-C-AD-265-,IFAD,AMERICAN NEAR EAST REFUGEE AID,Money is disbursed through central Ministry of Finance or Treasury,,PS,NEN,1000000094 0010108200941003 Direct Payment/Reimbursement,C01, ,3,1,20,110
1000000094_0010433100941007_11-26-2004-00:00:00_Disbursement,1100001013,1000000094,0010433100941007,Disbursement,2004-11-26T00:00:00.000Z,37170.13,USD,2004-11-26T00:00:00.000Z,1000000094 G-C-AD-265-,IFAD,AMERICAN NEAR EAST REFUGEE AID,Money is disbursed through central Ministry of Finance or Treasury,,PS,NEN,1000000094 0010433100941007 Direct Payment/Reimbursement,C01, ,3,1,20,110
1000000094_0010432400941006_11-19-2004-00:00:00_Disbursement,1100001013,1000000094,0010432400941006,Disbursement,2004-11-19T00:00:00.000Z,67611.39,USD,2004-11-19T00:00:00.000Z,1000000094 G-C-AD-265-,IFAD,AMERICAN NEAR EAST REFUGEE AID,Money is disbursed through central Ministry of Finance or Treasury,,PS,NEN,1000000094 0010432400941006 Direct Payment/Reimbursement,C01, ,3,1,20,110
1000000094_0010535000941015_12-16-2005-00:00:00_Disbursement,1100001013,1000000094,0010535000941015,Disbursement,2005-12-16T00:00:00.000Z,101000.0,USD,2005-12-16T00:00:00.000Z,1000000094 G-C-AD-265-,IFAD,AMERICAN NEAR EAST REFUGEE AID,Money is disbursed through central Ministry of Finance or Treasury,,PS,NEN,1000000094 0010535000941015 Direct Payment/Reimbursement,C01, ,3,1,20,110
1000000094_0010421900941005_08-06-2004-00:00:00_Disbursement,1100001013,1000000094,0010421900941005,Disbursement,2004-08-06T00:00:00.000Z,66850.54,USD,2004-08-06T00:00:00.000Z,1000000094 G-C-AD-265-,IFAD,AMERICAN NEAR EAST REFUGEE AID,Money is disbursed through central Ministry of Finance or Treasury,,PS,NEN,1000000094 0010421900941005 Direct Payment/Reimbursement,C01, ,3,1,20,110
1000000094_0010505600941011_02-25-2005-00:00:00_Disbursement,1100001013,1000000094,0010505600941011,Disbursement,2005-02-25T00:00:00.000Z,19950.0,USD,2005-02-25T00:00:00.000Z,1000000094 G-C-AD-265-,IFAD,AMERICAN NEAR EAST REFUGEE AID,Money is disbursed through central Ministry of Finance or Treasury,,PS,NEN,1000000094 0010505600941011 Direct Payment/Reimbursement,C01, ,3,1,20,110
1000000094_0010020800941002_07-26-2000-00:00:00_Disbursement,1100001013,1000000094,0010020800941002,Disbursement,2000-07-26T00:00:00.000Z,39525.0,USD,2000-07-26T00:00:00.000Z,1000000094 G-C-AD-265-,IFAD,AMERICAN NEAR EAST REFUGEE AID,Money is disbursed through central Ministry of Finance or Treasury,,PS,NEN,1000000094 0010020800941002 Direct Payment/Reimbursement,C01, ,3,1,20,110
1000000094_0010504500941009_02-14-2005-00:00:00_Disbursement,1100001013,1000000094,0010504500941009,Disbursement,2005-02-14T00:00:00.000Z,45109.05,USD,2005-02-14T00:00:00.000Z,1000000094 G-C-AD-265-,IFAD,AMERICAN NEAR EAST REFUGEE AID,Money is disbursed through central Ministry of Finance or Treasury,,PS,NEN,1000000094 0010504500941009 Direct Payment/Reimbursement,C01, ,3,1,20,110
1000000094_0019918700941001_07-06-1999-00:00:00_Disbursement,1100001013,1000000094,0019918700941001,Disbursement,1999-07-06T00:00:00.000Z,110000.0,USD,1999-07-06T00:00:00.000Z,1000000094 G-C-AD-265-,IFAD,AMERICAN NEAR EAST REFUGEE AID,Money is disbursed through central Ministry of Finance or Treasury,,PS,NEN,1000000094 0019918700941001 Direct Payment/Reimbursement,C01, ,3,1,20,110
1000000094_0010436500941008_12-30-2004-00:00:00_Disbursement,1100001013,1000000094,0010436500941008,Disbursement,2004-12-30T00:00:00.000Z,61736.66,USD,2004-12-30T00:00:00.000Z,1000000094 G-C-AD-265-,IFAD,AMERICAN NEAR EAST REFUGEE AID,Money is disbursed through central Ministry of Finance or Treasury,,PS,NEN,1000000094 0010436500941008 Direct Payment/Reimbursement,C01, ,3,1,20,110
1000000094_0010505600941010_02-25-2005-00:00:00_Disbursement,1100001013,1000000094,0010505600941010,Disbursement,2005-02-25T00:00:00.000Z,48126.09,USD,2005-02-25T00:00:00.000Z,1000000094 G-C-AD-265-,IFAD,AMERICAN NEAR EAST REFUGEE AID,Money is disbursed through central Ministry of Finance or Treasury,,PS,NEN,1000000094 0010505600941010 Direct Payment/Reimbursement,C01, ,3,1,20,110
1000000094_0010427800941004_10-04-2004-00:00:00_Disbursement,1100001013,1000000094,0010427800941004,Disbursement,2004-10-04T00:00:00.000Z,142362.0,USD,2004-10-04T00:00:00.000Z,1000000094 G-C-AD-265-,IFAD,AMERICAN NEAR EAST REFUGEE AID,Money is disbursed through central Ministry of Finance or Treasury,,PS,NEN,1000000094 0010427800941004 Direct Payment/Reimbursement,C01, ,3,1,20,110
1000000094_0010508300941012_03-24-2005-00:00:00_Disbursement,1100001013,1000000094,0010508300941012,Disbursement,2005-03-24T00:00:00.000Z,54637.3,USD,2005-03-24T00:00:00.000Z,1000000094 G-C-AD-265-,IFAD,AMERICAN NEAR EAST REFUGEE AID,Money is disbursed through central Ministry of Finance or Treasury,,PS,NEN,1000000094 0010508300941012 Direct Payment/Reimbursement,C01, ,3,1,20,110
1000000095__04-29-1987-00:00:00_Commitment,1100000202,1000000095,,Commitment,1987-04-29T00:00:00.000Z,298505.29,USD,1987-04-29T00:00:00.000Z,1000000095 G-C-AG-202-,IFAD,MINISTRY OF PLANNING AND INTERNATIONAL COOPERATION (MOPIC),Money is disbursed through central Ministry of Finance or Treasury,,YE,NEN,1000000095 GRANTS,C01, ,2,1,20,110
1000000095_0019702300951017_01-23-1997-00:00:00_Disbursement,1100000202,1000000095,0019702300951017,Disbursement,1997-01-23T00:00:00.000Z,9435.0,USD,1997-01-23T00:00:00.000Z,1000000095 G-C-AG-202-,IFAD,MINISTRY OF PLANNING AND INTERNATIONAL COOPERATION (MOPIC),Money is disbursed through central Ministry of Finance or Treasury,,YE,NEN,1000000095 0019702300951017 Direct Payment/Reimbursement,C01, ,3,1,20,110
1000000095_0019702700951019_01-27-1997-00:00:00_Disbursement,1100000202,1000000095,0019702700951019,Disbursement,1997-01-27T00:00:00.000Z,1248.22,USD,1997-01-27T00:00:00.000Z,1000000095 G-C-AG-202-,IFAD,MINISTRY OF PLANNING AND INTERNATIONAL COOPERATION (MOPIC),Money is disbursed through central Ministry of Finance or Treasury,,YE,NEN,1000000095 0019702700951019 Direct Payment/Reimbursement,C01, ,3,1,20,110
1000000095_0019628900951007_10-15-1996-00:00:00_Disbursement,1100000202,1000000095,0019628900951007,Disbursement,1996-10-15T00:00:00.000Z,681.2,USD,1996-10-15T00:00:00.000Z,1000000095 G-C-AG-202-,IFAD,MINISTRY OF PLANNING AND INTERNATIONAL COOPERATION (MOPIC),Money is disbursed through central Ministry of Finance or Treasury,,YE,NEN,1000000095 0019628900951007 Direct Payment/Reimbursement,C01, ,3,1,20,110
1000000095_0019622000951001_08-07-1996-00:00:00_Disbursement,1100000202,1000000095,0019622000951001,Disbursement,1996-08-07T00:00:00.000Z,6240.0,USD,1996-08-07T00:00:00.000Z,1000000095 G-C-AG-202-,IFAD,MINISTRY OF PLANNING AND INTERNATIONAL COOPERATION (MOPIC),Money is disbursed through central Ministry of Finance or Treasury,,YE,NEN,1000000095 0019622000951001 Direct Payment/Reimbursement,C01, ,3,1,20,110
1000000095_0019635400951012_12-19-1996-00:00:00_Disbursement,1100000202,1000000095,0019635400951012,Disbursement,1996-12-19T00:00:00.000Z,5100.0,USD,1996-12-19T00:00:00.000Z,1000000095 G-C-AG-202-,IFAD,MINISTRY OF PLANNING AND INTERNATIONAL COOPERATION (MOPIC),Money is disbursed through central Ministry of Finance or Treasury,,YE,NEN,1000000095 0019635400951012 Direct Payment/Reimbursement,C01, ,3,1,20,110
1000000095_0019702300951015_01-23-1997-00:00:00_Disbursement,1100000202,1000000095,0019702300951015,Disbursement,1997-01-23T00:00:00.000Z,4200.0,USD,1997-01-23T00:00:00.000Z,1000000095 G-C-AG-202-,IFAD,MINISTRY OF PLANNING AND INTERNATIONAL COOPERATION (MOPIC),Money is disbursed through central Ministry of Finance or Treasury,,YE,NEN,1000000095 0019702300951015 Direct Payment/Reimbursement,C01, ,3,1,20,110
1000000095_0019635800951013_12-23-1996-00:00:00_Disbursement,1100000202,1000000095,0019635800951013,Disbursement,1996-12-23T00:00:00.000Z,10140.35,USD,1996-12-23T00:00:00.000Z,1000000095 G-C-AG-202-,IFAD,MINISTRY OF PLANNING AND INTERNATIONAL COOPERATION (MOPIC),Money is disbursed through central Ministry of Finance or Treasury,,YE,NEN,1000000095 0019635800951013 Direct Payment/Reimbursement,C01, ,3,1,20,110
1000000095_0019629900951008_10-25-1996-00:00:00_Disbursement,1100000202,1000000095,0019629900951008,Disbursement,1996-10-25T00:00:00.000Z,4500.0,USD,1996-10-25T00:00:00.000Z,1000000095 G-C-AG-202-,IFAD,MINISTRY OF PLANNING AND INTERNATIONAL COOPERATION (MOPIC),Money is disbursed through central Ministry of Finance or Treasury,,YE,NEN,1000000095 0019629900951008 Direct Payment/Reimbursement,C01, ,3,1,20,110
1000000095_0019626300951005_09-19-1996-00:00:00_Disbursement,1100000202,1000000095,0019626300951005,Disbursement,1996-09-19T00:00:00.000Z,11290.5,USD,1996-09-19T00:00:00.000Z,1000000095 G-C-AG-202-,IFAD,MINISTRY OF PLANNING AND INTERNATIONAL COOPERATION (MOPIC),Money is disbursed through central Ministry of Finance or Treasury,,YE,NEN,1000000095 0019626300951005 Direct Payment/Reimbursement,C01, ,3,1,20,110
1000000095_0019635100951010_12-16-1996-00:00:00_Disbursement,1100000202,1000000095,0019635100951010,Disbursement,1996-12-16T00:00:00.000Z,9554.39,USD,1996-12-16T00:00:00.000Z,1000000095 G-C-AG-202-,IFAD,MINISTRY OF PLANNING AND INTERNATIONAL COOPERATION (MOPIC),Money is disbursed through central Ministry of Finance or Treasury,,YE,NEN,1000000095 0019635100951010 Direct Payment/Reimbursement,C01, ,3,1,20,110
1000000095_0019625500951003_09-11-1996-00:00:00_Disbursement,1100000202,1000000095,0019625500951003,Disbursement,1996-09-11T00:00:00.000Z,6588.58,USD,1996-09-11T00:00:00.000Z,1000000095 G-C-AG-202-,IFAD,MINISTRY OF PLANNING AND INTERNATIONAL COOPERATION (MOPIC),Money is disbursed through central Ministry of Finance or Treasury,,YE,NEN,1000000095 0019625500951003 Direct Payment/Reimbursement,C01, ,3,1,20,110
1000000095_0019626300951004_09-19-1996-00:00:00_Disbursement,1100000202,1000000095,0019626300951004,Disbursement,1996-09-19T00:00:00.000Z,21600.0,USD,1996-09-19T00:00:00.000Z,1000000095 G-C-AG-202-,IFAD,MINISTRY OF PLANNING AND INTERNATIONAL COOPERATION (MOPIC),Money is disbursed through central Ministry of Finance or Treasury,,YE,NEN,1000000095 0019626300951004 Direct Payment/Reimbursement,C01, ,3,1,20,110
1000000095_0019701700951014_01-17-1997-00:00:00_Disbursement,1100000202,1000000095,0019701700951014,Disbursement,1997-01-17T00:00:00.000Z,47137.0,USD,1997-01-17T00:00:00.000Z,1000000095 G-C-AG-202-,IFAD,MINISTRY OF PLANNING AND INTERNATIONAL COOPERATION (MOPIC),Money is disbursed through central Ministry of Finance or Treasury,,YE,NEN,1000000095 0019701700951014 Direct Payment/Reimbursement,C01, ,3,1,20,110
1000000095_0019628500951006_10-11-1996-00:00:00_Disbursement,1100000202,1000000095,0019628500951006,Disbursement,1996-10-11T00:00:00.000Z,10095.0,USD,1996-10-11T00:00:00.000Z,1000000095 G-C-AG-202-,IFAD,MINISTRY OF PLANNING AND INTERNATIONAL COOPERATION (MOPIC),Money is disbursed through central Ministry of Finance or Treasury,,YE,NEN,1000000095 0019628500951006 Direct Payment/Reimbursement,C01, ,3,1,20,110
1000000095_0019624200951002_08-29-1996-00:00:00_Disbursement,1100000202,1000000095,0019624200951002,Disbursement,1996-08-29T00:00:00.000Z,99940.0,USD,1996-08-29T00:00:00.000Z,1000000095 G-C-AG-202-,IFAD,MINISTRY OF PLANNING AND INTERNATIONAL COOPERATION (MOPIC),Money is disbursed through central Ministry of Finance or Treasury,,YE,NEN,1000000095 0019624200951002 Direct Payment/Reimbursement,C01, ,3,1,20,110
1000000095_0019635400951011_12-19-1996-00:00:00_Disbursement,1100000202,1000000095,0019635400951011,Disbursement,1996-12-19T00:00:00.000Z,6015.96,USD,1996-12-19T00:00:00.000Z,1000000095 G-C-AG-202-,IFAD,MINISTRY OF PLANNING AND INTERNATIONAL COOPERATION (MOPIC),Money is disbursed through central Ministry of Finance or Treasury,,YE,NEN,1000000095 0019635400951011 Direct Payment/Reimbursement,C01, ,3,1,20,110
1000000095_0019703700951020_02-06-1997-00:00:00_Disbursement,1100000202,1000000095,0019703700951020,Disbursement,1997-02-06T00:00:00.000Z,2690.09,USD,1997-02-06T00:00:00.000Z,1000000095 G-C-AG-202-,IFAD,MINISTRY OF PLANNING AND INTERNATIONAL COOPERATION (MOPIC),Money is disbursed through central Ministry of Finance or Treasury,,YE,NEN,1000000095 0019703700951020 Direct Payment/Reimbursement,C01, ,3,1,20,110
1000000095_0019702300951016_01-23-1997-00:00:00_Disbursement,1100000202,1000000095,0019702300951016,Disbursement,1997-01-23T00:00:00.000Z,8440.0,USD,1997-01-23T00:00:00.000Z,1000000095 G-C-AG-202-,IFAD,MINISTRY OF PLANNING AND INTERNATIONAL COOPERATION (MOPIC),Money is disbursed through central Ministry of Finance or Treasury,,YE,NEN,1000000095 0019702300951016 Direct Payment/Reimbursement,C01, ,3,1,20,110
1000000095_0019702300951018_01-23-1997-00:00:00_Disbursement,1100000202,1000000095,0019702300951018,Disbursement,1997-01-23T00:00:00.000Z,17080.0,USD,1997-01-23T00:00:00.000Z,1000000095 G-C-AG-202-,IFAD,MINISTRY OF PLANNING AND INTERNATIONAL COOPERATION (MOPIC),Money is disbursed through central Ministry of Finance or Treasury,,YE,NEN,1000000095 0019702300951018 Direct Payment/Reimbursement,C01, ,3,1,20,110
1000000095_0019634700951009_12-12-1996-00:00:00_Disbursement,1100000202,1000000095,0019634700951009,Disbursement,1996-12-12T00:00:00.000Z,16529.0,USD,1996-12-12T00:00:00.000Z,1000000095 G-C-AG-202-,IFAD,MINISTRY OF PLANNING AND INTERNATIONAL COOPERATION (MOPIC),Money is disbursed through central Ministry of Finance or Treasury,,YE,NEN,1000000095 0019634700951009 Direct Payment/Reimbursement,C01, ,3,1,20,110
1000000111__09-18-1986-00:00:00_Commitment,1100000192,1000000111,,Commitment,1986-09-18T00:00:00.000Z,2720951.7,USD,1986-09-18T00:00:00.000Z,1000000111 G-C-AU-192-,IFAD,DEPARTMENT OF FINANCE AND TREASURY,Money is disbursed through central Ministry of Finance or Treasury,,PG,APR,1000000111 GRANTS,C01, ,2,1,20,110
1000000111_0019518401111009_07-03-1995-00:00:00_Disbursement,1100000192,1000000111,0019518401111009,Disbursement,1995-07-03T00:00:00.000Z,1292773.86,USD,1995-07-03T00:00:00.000Z,1000000111 G-C-AU-192-,IFAD,DEPARTMENT OF FINANCE AND TREASURY,Money is disbursed through central Ministry of Finance or Treasury,,PG,APR,1000000111 0019518401111009 Direct Payment/Reimbursement,C01, ,3,1,20,110
1000000111_0019316201111006_06-11-1993-00:00:00_Disbursement,1100000192,1000000111,0019316201111006,Disbursement,1993-06-11T00:00:00.000Z,44480.41,USD,1993-06-11T00:00:00.000Z,1000000111 G-C-AU-192-,IFAD,DEPARTMENT OF FINANCE AND TREASURY,Money is disbursed through central Ministry of Finance or Treasury,,PG,APR,1000000111 0019316201111006 Direct Payment/Reimbursement,C01, ,3,1,20,110
1000000111_0019231101111005_11-06-1992-00:00:00_Disbursement,1100000192,1000000111,0019231101111005,Disbursement,1992-11-06T00:00:00.000Z,96999.83,USD,1992-11-06T00:00:00.000Z,1000000111 G-C-AU-192-,IFAD,DEPARTMENT OF FINANCE AND TREASURY,Money is disbursed through central Ministry of Finance or Treasury,,PG,APR,1000000111 0019231101111005 Direct Payment/Reimbursement,C01, ,3,1,20,110
1000000111_0019435601111008_12-22-1994-00:00:00_Disbursement,1100000192,1000000111,0019435601111008,Disbursement,1994-12-22T00:00:00.000Z,28547.95,USD,1994-12-22T00:00:00.000Z,1000000111 G-C-AU-192-,IFAD,DEPARTMENT OF FINANCE AND TREASURY,Money is disbursed through central Ministry of Finance or Treasury,,PG,APR,1000000111 0019435601111008 Direct Payment/Reimbursement,C01, ,3,1,20,110
1000000111_0019435301111007_12-19-1994-00:00:00_Disbursement,1100000192,1000000111,0019435301111007,Disbursement,1994-12-19T00:00:00.000Z,39882.16,USD,1994-12-19T00:00:00.000Z,1000000111 G-C-AU-192-,IFAD,DEPARTMENT OF FINANCE AND TREASURY,Money is disbursed through central Ministry of Finance or Treasury,,PG,APR,1000000111 0019435301111007 Direct Payment/Reimbursement,C01, ,3,1,20,110
1000000111_0019026201111002_09-19-1990-00:00:00_Disbursement,1100000192,1000000111,0019026201111002,Disbursement,1990-09-19T00:00:00.000Z,462722.0,USD,1990-09-19T00:00:00.000Z,1000000111 G-C-AU-192-,IFAD,DEPARTMENT OF FINANCE AND TREASURY,Money is disbursed through central Ministry of Finance or Treasury,,PG,APR,1000000111 0019026201111002 Direct Payment/Reimbursement,C01, ,3,1,20,110
1000000111_0019011701111001_04-27-1990-00:00:00_Disbursement,1100000192,1000000111,0019011701111001,Disbursement,1990-04-27T00:00:00.000Z,656677.7,USD,1990-04-27T00:00:00.000Z,1000000111 G-C-AU-192-,IFAD,DEPARTMENT OF FINANCE AND TREASURY,Money is disbursed through central Ministry of Finance or Treasury,,PG,APR,1000000111 0019011701111001 Direct Payment/Reimbursement,C01, ,3,1,20,110
1000000111_0019108701111003_03-28-1991-00:00:00_Disbursement,1100000192,1000000111,0019108701111003,Disbursement,1991-03-28T00:00:00.000Z,75376.61,USD,1991-03-28T00:00:00.000Z,1000000111 G-C-AU-192-,IFAD,DEPARTMENT OF FINANCE AND TREASURY,Money is disbursed through central Ministry of Finance or Treasury,,PG,APR,1000000111 0019108701111003 Direct Payment/Reimbursement,C01, ,3,1,20,110
1000000111_0019205701111004_02-26-1992-00:00:00_Disbursement,1100000192,1000000111,0019205701111004,Disbursement,1992-02-26T00:00:00.000Z,23491.18,USD,1992-02-26T00:00:00.000Z,1000000111 G-C-AU-192-,IFAD,DEPARTMENT OF FINANCE AND TREASURY,Money is disbursed through central Ministry of Finance or Treasury,,PG,APR,1000000111 0019205701111004 Direct Payment/Reimbursement,C01, ,3,1,20,110
1000000112___Commitment,1100001013,1000000112,,Commitment,,4058890.99,USD,,1000000112 G-C-BG-265-,IFAD,AMERICAN NEAR EAST REFUGEE AID,Money is disbursed through central Ministry of Finance or Treasury,,PS,NEN,1000000112 GRANTS,C01, ,2,1,20,110
1000000112_0010130401121016_10-31-2001-00:00:00_Disbursement,1100001013,1000000112,0010130401121016,Disbursement,2001-10-31T00:00:00.000Z,532019.36,USD,2001-10-31T00:00:00.000Z,1000000112 G-C-BG-265-,IFAD,AMERICAN NEAR EAST REFUGEE AID,Money is disbursed through central Ministry of Finance or Treasury,,PS,NEN,1000000112 0010130401121016 Direct Payment/Reimbursement,C01, ,3,1,20,110
1000000112_0019812701121004_05-07-1998-00:00:00_Disbursement,1100001013,1000000112,0019812701121004,Disbursement,1998-05-07T00:00:00.000Z,2100.0,USD,1998-05-07T00:00:00.000Z,1000000112 G-C-BG-265-,IFAD,AMERICAN NEAR EAST REFUGEE AID,Money is disbursed through central Ministry of Finance or Treasury,,PS,NEN,1000000112 0019812701121004 Direct Payment/Reimbursement,C01, ,3,1,20,110
1000000112_0010136501121018_12-31-2001-00:00:00_Disbursement,1100001013,1000000112,0010136501121018,Disbursement,2001-12-31T00:00:00.000Z,172570.2,USD,2001-12-31T00:00:00.000Z,1000000112 G-C-BG-265-,IFAD,AMERICAN NEAR EAST REFUGEE AID,Money is disbursed through central Ministry of Finance or Treasury,,PS,NEN,1000000112 0010136501121018 Direct Payment/Reimbursement,C01, ,3,1,20,110
1000000112_0010501301121022_01-13-2005-00:00:00_Disbursement,1100001013,1000000112,0010501301121022,Disbursement,2005-01-13T00:00:00.000Z,49050.0,USD,2005-01-13T00:00:00.000Z,1000000112 G-C-BG-265-,IFAD,AMERICAN NEAR EAST REFUGEE AID,Money is disbursed through central Ministry of Finance or Treasury,,PS,NEN,1000000112 0010501301121022 Direct Payment/Reimbursement,C01, ,3,1,20,110
1000000112_0010421901121019_08-06-2004-00:00:00_Disbursement,1100001013,1000000112,0010421901121019,Disbursement,2004-08-06T00:00:00.000Z,25600.0,USD,2004-08-06T00:00:00.000Z,1000000112 G-C-BG-265-,IFAD,AMERICAN NEAR EAST REFUGEE AID,Money is disbursed through central Ministry of Finance or Treasury,,PS,NEN,1000000112 0010421901121019 Direct Payment/Reimbursement,C01, ,3,1,20,110
1000000112_0010107301121012_03-14-2001-00:00:00_Disbursement,1100001013,1000000112,0010107301121012,Disbursement,2001-03-14T00:00:00.000Z,98200.0,USD,2001-03-14T00:00:00.000Z,1000000112 G-C-BG-265-,IFAD,AMERICAN NEAR EAST REFUGEE AID,Money is disbursed through central Ministry of Finance or Treasury,,PS,NEN,1000000112 0010107301121012 Direct Payment/Reimbursement,C01, ,3,1,20,110
1000000112_0010112801121014_05-08-2001-00:00:00_Disbursement,1100001013,1000000112,0010112801121014,Disbursement,2001-05-08T00:00:00.000Z,460464.76,USD,2001-05-08T00:00:00.000Z,1000000112 G-C-BG-265-,IFAD,AMERICAN NEAR EAST REFUGEE AID,Money is disbursed through central Ministry of Finance or Treasury,,PS,NEN,1000000112 0010112801121014 Direct Payment/Reimbursement,C01, ,3,1,20,110
1000000112_0019827101121006_09-28-1998-00:00:00_Disbursement,1100001013,1000000112,0019827101121006,Disbursement,1998-09-28T00:00:00.000Z,123457.0,USD,1998-09-28T00:00:00.000Z,1000000112 G-C-BG-265-,IFAD,AMERICAN NEAR EAST REFUGEE AID,Money is disbursed through central Ministry of Finance or Treasury,,PS,NEN,1000000112 0019827101121006 Direct Payment/Reimbursement,C01, ,3,1,20,110
1000000112_0010428801121020_10-14-2004-00:00:00_Disbursement,1100001013,1000000112,0010428801121020,Disbursement,2004-10-14T00:00:00.000Z,38400.0,USD,2004-10-14T00:00:00.000Z,1000000112 G-C-BG-265-,IFAD,AMERICAN NEAR EAST REFUGEE AID,Money is disbursed through central Ministry of Finance or Treasury,,PS,NEN,1000000112 0010428801121020 Direct Payment/Reimbursement,C01, ,3,1,20,110
1000000112_0019936501121011_12-31-1999-00:00:00_Disbursement,1100001013,1000000112,0019936501121011,Disbursement,1999-12-31T00:00:00.000Z,10047.12,USD,1999-12-31T00:00:00.000Z,1000000112 G-C-BG-265-,IFAD,AMERICAN NEAR EAST REFUGEE AID,Money is disbursed through central Ministry of Finance or Treasury,,PS,NEN,1000000112 0019936501121011 Direct Payment/Reimbursement,C01, ,3,1,20,110
1000000112_0019820901121005_07-28-1998-00:00:00_Disbursement,1100001013,1000000112,0019820901121005,Disbursement,1998-07-28T00:00:00.000Z,4464.13,USD,1998-07-28T00:00:00.000Z,1000000112 G-C-BG-265-,IFAD,AMERICAN NEAR EAST REFUGEE AID,Money is disbursed through central Ministry of Finance or Treasury,,PS,NEN,1000000112 0019820901121005 Direct Payment/Reimbursement,C01, ,3,1,20,110
1000000112_0010107301121013_03-14-2001-00:00:00_Disbursement,1100001013,1000000112,0010107301121013,Disbursement,2001-03-14T00:00:00.000Z,83423.55,USD,2001-03-14T00:00:00.000Z,1000000112 G-C-BG-265-,IFAD,AMERICAN NEAR EAST REFUGEE AID,Money is disbursed through central Ministry of Finance or Treasury,,PS,NEN,1000000112 0010107301121013 Direct Payment/Reimbursement,C01, ,3,1,20,110
1000000112_0019636501121001_12-30-1996-00:00:00_Disbursement,1100001013,1000000112,0019636501121001,Disbursement,1996-12-30T00:00:00.000Z,646000.0,USD,1996-12-30T00:00:00.000Z,1000000112 G-C-BG-265-,IFAD,AMERICAN NEAR EAST REFUGEE AID,Money is disbursed through central Ministry of Finance or Treasury,,PS,NEN,1000000112 0019636501121001 Direct Payment/Reimbursement,C01, ,3,1,20,110
1000000112_0019827301121007_09-30-1998-00:00:00_Disbursement,1100001013,1000000112,0019827301121007,Disbursement,1998-09-30T00:00:00.000Z,471.2,USD,1998-09-30T00:00:00.000Z,1000000112 G-C-BG-265-,IFAD,AMERICAN NEAR EAST REFUGEE AID,Money is disbursed through central Ministry of Finance or Treasury,,PS,NEN,1000000112 0019827301121007 Direct Payment/Reimbursement,C01, ,3,1,20,110
1000000112_0019805801121003_02-27-1998-00:00:00_Disbursement,1100001013,1000000112,0019805801121003,Disbursement,1998-02-27T00:00:00.000Z,330000.0,USD,1998-02-27T00:00:00.000Z,1000000112 G-C-BG-265-,IFAD,AMERICAN NEAR EAST REFUGEE AID,Money is disbursed through central Ministry of Finance or Treasury,,PS,NEN,1000000112 0019805801121003 Direct Payment/Reimbursement,C01, ,3,1,20,110
1000000112_0010020801121009_07-26-2000-00:00:00_Disbursement,1100001013,1000000112,0010020801121009,Disbursement,2000-07-26T00:00:00.000Z,146639.0,USD,2000-07-26T00:00:00.000Z,1000000112 G-C-BG-265-,IFAD,AMERICAN NEAR EAST REFUGEE AID,Money is disbursed through central Ministry of Finance or Treasury,,PS,NEN,1000000112 0010020801121009 Direct Payment/Reimbursement,C01, ,3,1,20,110
1000000112_0010036601121015_12-31-2000-00:00:00_Disbursement,1100001013,1000000112,0010036601121015,Disbursement,2000-12-31T00:00:00.000Z,14663.9,USD,2000-12-31T00:00:00.000Z,1000000112 G-C-BG-265-,IFAD,AMERICAN NEAR EAST REFUGEE AID,Money is disbursed through central Ministry of Finance or Treasury,,PS,NEN,1000000112 0010036601121015 Direct Payment/Reimbursement,C01, ,3,1,20,110
1000000112_0010535001121024_12-16-2005-00:00:00_Disbursement,1100001013,1000000112,0010535001121024,Disbursement,2005-12-16T00:00:00.000Z,16206.0,USD,2005-12-16T00:00:00.000Z,1000000112 G-C-BG-265-,IFAD,AMERICAN NEAR EAST REFUGEE AID,Money is disbursed through central Ministry of Finance or Treasury,,PS,NEN,1000000112 0010535001121024 Direct Payment/Reimbursement,C01, ,3,1,20,110
1000000112_0010133401121017_11-30-2001-00:00:00_Disbursement,1100001013,1000000112,0010133401121017,Disbursement,2001-11-30T00:00:00.000Z,552065.54,USD,2001-11-30T00:00:00.000Z,1000000112 G-C-BG-265-,IFAD,AMERICAN NEAR EAST REFUGEE AID,Money is disbursed through central Ministry of Finance or Treasury,,PS,NEN,1000000112 0010133401121017 Direct Payment/Reimbursement,C01, ,3,1,20,110
1000000112_0019918701121008_07-06-1999-00:00:00_Disbursement,1100001013,1000000112,0019918701121008,Disbursement,1999-07-06T00:00:00.000Z,100000.0,USD,1999-07-06T00:00:00.000Z,1000000112 G-C-BG-265-,IFAD,AMERICAN NEAR EAST REFUGEE AID,Money is disbursed through central Ministry of Finance or Treasury,,PS,NEN,1000000112 0019918701121008 Direct Payment/Reimbursement,C01, ,3,1,20,110
1000000112_0019836501121010_12-31-1998-00:00:00_Disbursement,1100001013,1000000112,0019836501121010,Disbursement,1998-12-31T00:00:00.000Z,46049.23,USD,1998-12-31T00:00:00.000Z,1000000112 G-C-BG-265-,IFAD,AMERICAN NEAR EAST REFUGEE AID,Money is disbursed through central Ministry of Finance or Treasury,,PS,NEN,1000000112 0019836501121010 Direct Payment/Reimbursement,C01, ,3,1,20,110
1000000112_0019718101121002_06-30-1997-00:00:00_Disbursement,1100001013,1000000112,0019718101121002,Disbursement,1997-06-30T00:00:00.000Z,607000.0,USD,1997-06-30T00:00:00.000Z,1000000112 G-C-BG-265-,IFAD,AMERICAN NEAR EAST REFUGEE AID,Money is disbursed through central Ministry of Finance or Treasury,,PS,NEN,1000000112 0019718101121002 Direct Payment/Reimbursement,C01, ,3,1,20,110
1000000154__09-11-1997-00:00:00_Commitment,1100001059,1000000154,,Commitment,1997-09-11T00:00:00.000Z,171670.66,USD,1997-09-11T00:00:00.000Z,1000000154 G-C-CH-377-,IFAD,MINISTERE DES FINANCES ET DE LA PLANIFICATION ECONOMIQUE,Money is disbursed through central Ministry of Finance or Treasury,,RW,ESA,1000000154 GRANTS,C01, ,2,1,20,110
1000000154_0010014601541001_05-25-2000-00:00:00_Disbursement,1100001059,1000000154,0010014601541001,Disbursement,2000-05-25T00:00:00.000Z,100000.0,USD,2000-05-25T00:00:00.000Z,1000000154 G-C-CH-377-,IFAD,MINISTERE DES FINANCES ET DE LA PLANIFICATION ECONOMIQUE,Money is disbursed through central Ministry of Finance or Treasury,,RW,ESA,1000000154 0010014601541001 Direct Payment/Reimbursement,C01, ,3,1,20,110
1000000154_0010107501541002_03-16-2001-00:00:00_Disbursement,1100001059,1000000154,0010107501541002,Disbursement,2001-03-16T00:00:00.000Z,71670.66,USD,2001-03-16T00:00:00.000Z,1000000154 G-C-CH-377-,IFAD,MINISTERE DES FINANCES ET DE LA PLANIFICATION ECONOMIQUE,Money is disbursed through central Ministry of Finance or Treasury,,RW,ESA,1000000154 0010107501541002 Direct Payment/Reimbursement,C01, ,3,1,20,110
1000000160__12-07-2000-00:00:00_Commitment,1100001151,1000000160,,Commitment,2000-12-07T00:00:00.000Z,2170000.0,USD,2000-12-07T00:00:00.000Z,1000000160 G-C-CH-550-,IFAD,"MINISTRY OF FINANCE, PERMANENT SECRETARY",Money is disbursed through central Ministry of Finance or Treasury,,TZ,ESA,1000000160 GRANTS,C01, ,2,1,20,110
1000000160_0010429501601015_10-21-2004-00:00:00_Disbursement,1100001151,1000000160,0010429501601015,Disbursement,2004-10-21T00:00:00.000Z,88746.76,USD,2004-10-21T00:00:00.000Z,1000000160 G-C-CH-550-,IFAD,"MINISTRY OF FINANCE, PERMANENT SECRETARY",Money is disbursed through central Ministry of Finance or Treasury,,TZ,ESA,1000000160 0010429501601015 Direct Payment/Reimbursement,C01, ,3,1,20,110
1000000160_0010526501601024_09-22-2005-00:00:00_Disbursement,1100001151,1000000160,0010526501601024,Disbursement,2005-09-22T00:00:00.000Z,52345.17,USD,2005-09-22T00:00:00.000Z,1000000160 G-C-CH-550-,IFAD,"MINISTRY OF FINANCE, PERMANENT SECRETARY",Money is disbursed through central Ministry of Finance or Treasury,,TZ,ESA,1000000160 0010526501601024 Direct Payment/Reimbursement,C01, ,3,1,20,110
1000000160_0010426001601014_09-16-2004-00:00:00_Disbursement,1100001151,1000000160,0010426001601014,Disbursement,2004-09-16T00:00:00.000Z,41510.38,USD,2004-09-16T00:00:00.000Z,1000000160 G-C-CH-550-,IFAD,"MINISTRY OF FINANCE, PERMANENT SECRETARY",Money is disbursed through central Ministry of Finance or Treasury,,TZ,ESA,1000000160 0010426001601014 Direct Payment/Reimbursement,C01, ,3,1,20,110
1000000160_0010435201601018_12-17-2004-00:00:00_Disbursement,1100001151,1000000160,0010435201601018,Disbursement,2004-12-17T00:00:00.000Z,22699.67,USD,2004-12-17T00:00:00.000Z,1000000160 G-C-CH-550-,IFAD,"MINISTRY OF FINANCE, PERMANENT SECRETARY",Money is disbursed through central Ministry of Finance or Treasury,,TZ,ESA,1000000160 0010435201601018 Direct Payment/Reimbursement,C01, ,3,1,20,110
1000000160_0010324801601004_09-05-2003-00:00:00_Disbursement,1100001151,1000000160,0010324801601004,Disbursement,2003-09-05T00:00:00.000Z,23015.69,USD,2003-09-05T00:00:00.000Z,1000000160 G-C-CH-550-,IFAD,"MINISTRY OF FINANCE, PERMANENT SECRETARY",Money is disbursed through central Ministry of Finance or Treasury,,TZ,ESA,1000000160 0010324801601004 Direct Payment/Reimbursement,C01, ,3,1,20,110
1000000160_0010424701601013_09-03-2004-00:00:00_Disbursement,1100001151,1000000160,0010424701601013,Disbursement,2004-09-03T00:00:00.000Z,53857.35,USD,2004-09-03T00:00:00.000Z,1000000160 G-C-CH-550-,IFAD,"MINISTRY OF FINANCE, PERMANENT SECRETARY",Money is disbursed through central Ministry of Finance or Treasury,,TZ,ESA,1000000160 0010424701601013 Direct Payment/Reimbursement,C01, ,3,1,20,110
1000000160_0010710801601036_04-18-2007-00:00:00_Disbursement,1100001151,1000000160,0010710801601036,Disbursement,2007-04-18T00:00:00.000Z,50152.37,USD,2007-04-18T00:00:00.000Z,1000000160 G-C-CH-550-,IFAD,"MINISTRY OF FINANCE, PERMANENT SECRETARY",Money is disbursed through central Ministry of Finance or Treasury,,TZ,ESA,1000000160 0010710801601036 Direct Payment/Reimbursement,C01, ,3,1,20,110
1000000160_0010605301601028_02-22-2006-00:00:00_Disbursement,1100001151,1000000160,0010605301601028,Disbursement,2006-02-22T00:00:00.000Z,38472.85,USD,2006-02-22T00:00:00.000Z,1000000160 G-C-CH-550-,IFAD,"MINISTRY OF FINANCE, PERMANENT SECRETARY",Money is disbursed through central Ministry of Finance or Treasury,,TZ,ESA,1000000160 0010605301601028 Direct Payment/Reimbursement,C01, ,3,1,20,110
1000000160_0010532901601026_11-25-2005-00:00:00_Disbursement,1100001151,1000000160,0010532901601026,Disbursement,2005-11-25T00:00:00.000Z,29592.12,USD,2005-11-25T00:00:00.000Z,1000000160 G-C-CH-550-,IFAD,"MINISTRY OF FINANCE, PERMANENT SECRETARY",Money is disbursed through central Ministry of Finance or Treasury,,TZ,ESA,1000000160 0010532901601026 Direct Payment/Reimbursement,C01, ,3,1,20,110
1000000160_0010517501601021_06-24-2005-00:00:00_Disbursement,1100001151,1000000160,0010517501601021,Disbursement,2005-06-24T00:00:00.000Z,27008.81,USD,2005-06-24T00:00:00.000Z,1000000160 G-C-CH-550-,IFAD,"MINISTRY OF FINANCE, PERMANENT SECRETARY",Money is disbursed through central Ministry of Finance or Treasury,,TZ,ESA,1000000160 0010517501601021 Direct Payment/Reimbursement,C01, ,3,1,20,110
1000000160_0010415301601010_06-01-2004-00:00:00_Disbursement,1100001151,1000000160,0010415301601010,Disbursement,2004-06-01T00:00:00.000Z,23899.69,USD,2004-06-01T00:00:00.000Z,1000000160 G-C-CH-550-,IFAD,"MINISTRY OF FINANCE, PERMANENT SECRETARY",Money is disbursed through central Ministry of Finance or Treasury,,TZ,ESA,1000000160 0010415301601010 Direct Payment/Reimbursement,C01, ,3,1,20,110
1000000160_0010717801601038_06-27-2007-00:00:00_Disbursement,1100001151,1000000160,0010717801601038,Disbursement,2007-06-27T00:00:00.000Z,28998.25,USD,2007-06-27T00:00:00.000Z,1000000160 G-C-CH-550-,IFAD,"MINISTRY OF FINANCE, PERMANENT SECRETARY",Money is disbursed through central Ministry of Finance or Treasury,,TZ,ESA,1000000160 0010717801601038 Direct Payment/Reimbursement,C01, ,3,1,20,110
1000000160_0010521501601022_08-03-2005-00:00:00_Disbursement,1100001151,1000000160,0010521501601022,Disbursement,2005-08-03T00:00:00.000Z,75860.92,USD,2005-08-03T00:00:00.000Z,1000000160 G-C-CH-550-,IFAD,"MINISTRY OF FINANCE, PERMANENT SECRETARY",Money is disbursed through central Ministry of Finance or Treasury,,TZ,ESA,1000000160 0010521501601022 Direct Payment/Reimbursement,C01, ,3,1,20,110
1000000160_0010405701601009_02-26-2004-00:00:00_Disbursement,1100001151,1000000160,0010405701601009,Disbursement,2004-02-26T00:00:00.000Z,50425.08,USD,2004-02-26T00:00:00.000Z,1000000160 G-C-CH-550-,IFAD,"MINISTRY OF FINANCE, PERMANENT SECRETARY",Money is disbursed through central Ministry of Finance or Treasury,,TZ,ESA,1000000160 0010405701601009 Direct Payment/Reimbursement,C01, ,3,1,20,110
1000000160_0010535001601027_12-16-2005-00:00:00_Disbursement,1100001151,1000000160,0010535001601027,Disbursement,2005-12-16T00:00:00.000Z,26783.99,USD,2005-12-16T00:00:00.000Z,1000000160 G-C-CH-550-,IFAD,"MINISTRY OF FINANCE, PERMANENT SECRETARY",Money is disbursed through central Ministry of Finance or Treasury,,TZ,ESA,1000000160 0010535001601027 Direct Payment/Reimbursement,C01, ,3,1,20,110
1000000160_0010623701601032_08-25-2006-00:00:00_Disbursement,1100001151,1000000160,0010623701601032,Disbursement,2006-08-25T00:00:00.000Z,67072.39,USD,2006-08-25T00:00:00.000Z,1000000160 G-C-CH-550-,IFAD,"MINISTRY OF FINANCE, PERMANENT SECRETARY",Money is disbursed through central Ministry of Finance or Treasury,,TZ,ESA,1000000160 0010623701601032 Direct Payment/Reimbursement,C01, ,3,1,20,110
1000000160_0010800701601041_01-07-2008-00:00:00_Disbursement,1100001151,1000000160,0010800701601041,Disbursement,2008-01-07T00:00:00.000Z,23828.45,USD,2008-01-07T00:00:00.000Z,1000000160 G-C-CH-550-,IFAD,"MINISTRY OF FINANCE, PERMANENT SECRETARY",Money is disbursed through central Ministry of Finance or Treasury,,TZ,ESA,1000000160 0010800701601041 Direct Payment/Reimbursement,C01, ,3,1,20,110
1000000160_0010419401601011_07-12-2004-00:00:00_Disbursement,1100001151,1000000160,0010419401601011,Disbursement,2004-07-12T00:00:00.000Z,397737.11,USD,2004-07-12T00:00:00.000Z,1000000160 G-C-CH-550-,IFAD,"MINISTRY OF FINANCE, PERMANENT SECRETARY",Money is disbursed through central Ministry of Finance or Treasury,,TZ,ESA,1000000160 0010419401601011 Direct Payment/Reimbursement,C01, ,3,1,20,110
1000000160_0010510501601020_04-15-2005-00:00:00_Disbursement,1100001151,1000000160,0010510501601020,Disbursement,2005-04-15T00:00:00.000Z,25854.36,USD,2005-04-15T00:00:00.000Z,1000000160 G-C-CH-550-,IFAD,"MINISTRY OF FINANCE, PERMANENT SECRETARY",Money is disbursed through central Ministry of Finance or Treasury,,TZ,ESA,1000000160 0010510501601020 Direct Payment/Reimbursement,C01, ,3,1,20,110
1000000160_0010505601601019_02-25-2005-00:00:00_Disbursement,1100001151,1000000160,0010505601601019,Disbursement,2005-02-25T00:00:00.000Z,63151.99,USD,2005-02-25T00:00:00.000Z,1000000160 G-C-CH-550-,IFAD,"MINISTRY OF FINANCE, PERMANENT SECRETARY",Money is disbursed through central Ministry of Finance or Treasury,,TZ,ESA,1000000160 0010505601601019 Direct Payment/Reimbursement,C01, ,3,1,20,110
1000000160_0010606201601029_03-03-2006-00:00:00_Disbursement,1100001151,1000000160,0010606201601029,Disbursement,2006-03-03T00:00:00.000Z,43720.62,USD,2006-03-03T00:00:00.000Z,1000000160 G-C-CH-550-,IFAD,"MINISTRY OF FINANCE, PERMANENT SECRETARY",Money is disbursed through central Ministry of Finance or Treasury,,TZ,ESA,1000000160 0010606201601029 Direct Payment/Reimbursement,C01, ,3,1,20,110
1000000160_0010434801601017_12-13-2004-00:00:00_Disbursement,1100001151,1000000160,0010434801601017,Disbursement,2004-12-13T00:00:00.000Z,21885.94,USD,2004-12-13T00:00:00.000Z,1000000160 G-C-CH-550-,IFAD,"MINISTRY OF FINANCE, PERMANENT SECRETARY",Money is disbursed through central Ministry of Finance or Treasury,,TZ,ESA,1000000160 0010434801601017 Direct Payment/Reimbursement,C01, ,3,1,20,110
1000000160_0010715801601037_06-07-2007-00:00:00_Disbursement,1100001151,1000000160,0010715801601037,Disbursement,2007-06-07T00:00:00.000Z,43751.81,USD,2007-06-07T00:00:00.000Z,1000000160 G-C-CH-550-,IFAD,"MINISTRY OF FINANCE, PERMANENT SECRETARY",Money is disbursed through central Ministry of Finance or Treasury,,TZ,ESA,1000000160 0010715801601037 Direct Payment/Reimbursement,C01, ,3,1,20,110
1000000160_0010611801601030_04-28-2006-00:00:00_Disbursement,1100001151,1000000160,0010611801601030,Disbursement,2006-04-28T00:00:00.000Z,22536.56,USD,2006-04-28T00:00:00.000Z,1000000160 G-C-CH-550-,IFAD,"MINISTRY OF FINANCE, PERMANENT SECRETARY",Money is disbursed through central Ministry of Finance or Treasury,,TZ,ESA,1000000160 0010611801601030 Direct Payment/Reimbursement,C01, ,3,1,20,110
1000000160_0010701601601034_01-16-2007-00:00:00_Disbursement,1100001151,1000000160,0010701601601034,Disbursement,2007-01-16T00:00:00.000Z,24308.6,USD,2007-01-16T00:00:00.000Z,1000000160 G-C-CH-550-,IFAD,"MINISTRY OF FINANCE, PERMANENT SECRETARY",Money is disbursed through central Ministry of Finance or Treasury,,TZ,ESA,1000000160 0010701601601034 Direct Payment/Reimbursement,C01, ,3,1,20,110
1000000160_0010326901601005_09-26-2003-00:00:00_Disbursement,1100001151,1000000160,0010326901601005,Disbursement,2003-09-26T00:00:00.000Z,55660.64,USD,2003-09-26T00:00:00.000Z,1000000160 G-C-CH-550-,IFAD,"MINISTRY OF FINANCE, PERMANENT SECRETARY",Money is disbursed through central Ministry of Finance or Treasury,,TZ,ESA,1000000160 0010326901601005 Direct Payment/Reimbursement,C01, ,3,1,20,110
1000000160_0010710801601035_04-18-2007-00:00:00_Disbursement,1100001151,1000000160,0010710801601035,Disbursement,2007-04-18T00:00:00.000Z,37870.1,USD,2007-04-18T00:00:00.000Z,1000000160 G-C-CH-550-,IFAD,"MINISTRY OF FINANCE, PERMANENT SECRETARY",Money is disbursed through central Ministry of Finance or Treasury,,TZ,ESA,1000000160 0010710801601035 Direct Payment/Reimbursement,C01, ,3,1,20,110
1000000160_0010320301601002_07-22-2003-00:00:00_Disbursement,1100001151,1000000160,0010320301601002,Disbursement,2003-07-22T00:00:00.000Z,18194.54,USD,2003-07-22T00:00:00.000Z,1000000160 G-C-CH-550-,IFAD,"MINISTRY OF FINANCE, PERMANENT SECRETARY",Money is disbursed through central Ministry of Finance or Treasury,,TZ,ESA,1000000160 0010320301601002 Direct Payment/Reimbursement,C01, ,3,1,20,110
1000000160_0010524401601023_09-01-2005-00:00:00_Disbursement,1100001151,1000000160,0010524401601023,Disbursement,2005-09-01T00:00:00.000Z,71729.02,USD,2005-09-01T00:00:00.000Z,1000000160 G-C-CH-550-,IFAD,"MINISTRY OF FINANCE, PERMANENT SECRETARY",Money is disbursed through central Ministry of Finance or Treasury,,TZ,ESA,1000000160 0010524401601023 Direct Payment/Reimbursement,C01, ,3,1,20,110
1000000160_0010634201601033_12-08-2006-00:00:00_Disbursement,1100001151,1000000160,0010634201601033,Disbursement,2006-12-08T00:00:00.000Z,29074.62,USD,2006-12-08T00:00:00.000Z,1000000160 G-C-CH-550-,IFAD,"MINISTRY OF FINANCE, PERMANENT SECRETARY",Money is disbursed through central Ministry of Finance or Treasury,,TZ,ESA,1000000160 0010634201601033 Direct Payment/Reimbursement,C01, ,3,1,20,110
1000000160_0010323401601003_08-22-2003-00:00:00_Disbursement,1100001151,1000000160,0010323401601003,Disbursement,2003-08-22T00:00:00.000Z,70406.64,USD,2003-08-22T00:00:00.000Z,1000000160 G-C-CH-550-,IFAD,"MINISTRY OF FINANCE, PERMANENT SECRETARY",Money is disbursed through central Ministry of Finance or Treasury,,TZ,ESA,1000000160 0010323401601003 Direct Payment/Reimbursement,C01, ,3,1,20,110
1000000160_0010335801601007_12-24-2003-00:00:00_Disbursement,1100001151,1000000160,0010335801601007,Disbursement,2003-12-24T00:00:00.000Z,49466.86,USD,2003-12-24T00:00:00.000Z,1000000160 G-C-CH-550-,IFAD,"MINISTRY OF FINANCE, PERMANENT SECRETARY",Money is disbursed through central Ministry of Finance or Treasury,,TZ,ESA,1000000160 0010335801601007 Direct Payment/Reimbursement,C01, ,3,1,20,110
1000000160_0010305801601001_02-27-2003-00:00:00_Disbursement,1100001151,1000000160,0010305801601001,Disbursement,2003-02-27T00:00:00.000Z,200000.0,USD,2003-02-27T00:00:00.000Z,1000000160 G-C-CH-550-,IFAD,"MINISTRY OF FINANCE, PERMANENT SECRETARY",Money is disbursed through central Ministry of Finance or Treasury,,TZ,ESA,1000000160 0010305801601001 Direct Payment/Reimbursement,C01, ,3,1,20,110
1000000160_0010328301601006_10-10-2003-00:00:00_Disbursement,1100001151,1000000160,0010328301601006,Disbursement,2003-10-10T00:00:00.000Z,29490.57,USD,2003-10-10T00:00:00.000Z,1000000160 G-C-CH-550-,IFAD,"MINISTRY OF FINANCE, PERMANENT SECRETARY",Money is disbursed through central Ministry of Finance or Treasury,,TZ,ESA,1000000160 0010328301601006 Direct Payment/Reimbursement,C01, ,3,1,20,110
1000000160_0010530001601025_10-27-2005-00:00:00_Disbursement,1100001151,1000000160,0010530001601025,Disbursement,2005-10-27T00:00:00.000Z,66864.63,USD,2005-10-27T00:00:00.000Z,1000000160 G-C-CH-550-,IFAD,"MINISTRY OF FINANCE, PERMANENT SECRETARY",Money is disbursed through central Ministry of Finance or Treasury,,TZ,ESA,1000000160 0010530001601025 Direct Payment/Reimbursement,C01, ,3,1,20,110
1000000160_0010617001601031_06-19-2006-00:00:00_Disbursement,1100001151,1000000160,0010617001601031,Disbursement,2006-06-19T00:00:00.000Z,16775.72,USD,2006-06-19T00:00:00.000Z,1000000160 G-C-CH-550-,IFAD,"MINISTRY OF FINANCE, PERMANENT SECRETARY",Money is disbursed through central Ministry of Finance or Treasury,,TZ,ESA,1000000160 0010617001601031 Direct Payment/Reimbursement,C01, ,3,1,20,110
1000000160_0010719801601039_07-17-2007-00:00:00_Disbursement,1100001151,1000000160,0010719801601039,Disbursement,2007-07-17T00:00:00.000Z,31802.52,USD,2007-07-17T00:00:00.000Z,1000000160 G-C-CH-550-,IFAD,"MINISTRY OF FINANCE, PERMANENT SECRETARY",Money is disbursed through central Ministry of Finance or Treasury,,TZ,ESA,1000000160 0010719801601039 Direct Payment/Reimbursement,C01, ,3,1,20,110
1000000160_0010403001601008_01-30-2004-00:00:00_Disbursement,1100001151,1000000160,0010403001601008,Disbursement,2004-01-30T00:00:00.000Z,39554.06,USD,2004-01-30T00:00:00.000Z,1000000160 G-C-CH-550-,IFAD,"MINISTRY OF FINANCE, PERMANENT SECRETARY",Money is disbursed through central Ministry of Finance or Treasury,,TZ,ESA,1000000160 0010403001601008 Direct Payment/Reimbursement,C01, ,3,1,20,110
1000000160_0010433101601016_11-26-2004-00:00:00_Disbursement,1100001151,1000000160,0010433101601016,Disbursement,2004-11-26T00:00:00.000Z,39630.5,USD,2004-11-26T00:00:00.000Z,1000000160 G-C-CH-550-,IFAD,"MINISTRY OF FINANCE, PERMANENT SECRETARY",Money is disbursed through central Ministry of Finance or Treasury,,TZ,ESA,1000000160 0010433101601016 Direct Payment/Reimbursement,C01, ,3,1,20,110
1000000160_0010419401601012_07-12-2004-00:00:00_Disbursement,1100001151,1000000160,0010419401601012,Disbursement,2004-07-12T00:00:00.000Z,37623.34,USD,2004-07-12T00:00:00.000Z,1000000160 G-C-CH-550-,IFAD,"MINISTRY OF FINANCE, PERMANENT SECRETARY",Money is disbursed through central Ministry of Finance or Treasury,,TZ,ESA,1000000160 0010419401601012 Direct Payment/Reimbursement,C01, ,3,1,20,110
1000000160_0010726301601040_09-20-2007-00:00:00_Disbursement,1100001151,1000000160,0010726301601040,Disbursement,2007-09-20T00:00:00.000Z,8639.31,USD,2007-09-20T00:00:00.000Z,1000000160 G-C-CH-550-,IFAD,"MINISTRY OF FINANCE, PERMANENT SECRETARY",Money is disbursed through central Ministry of Finance or Treasury,,TZ,ESA,1000000160 0010726301601040 Direct Payment/Reimbursement,C01, ,3,1,20,110
1000000161__09-04-1991-00:00:00_Commitment,1100000287,1000000161,,Commitment,1991-09-04T00:00:00.000Z,4385934.31,DKK,1991-09-04T00:00:00.000Z,1000000161 G-C-DE-287-B,IFAD,"MINISTRY OF FINANCE, ECONOMIC RELATIONS DIVISION",Money is disbursed through central Ministry of Finance or Treasury,,BD,APR,1000000161 GRANTS,C01, ,2,1,20,110
1000000161_0019504701611001_02-16-1995-00:00:00_Disbursement,1100000287,1000000161,0019504701611001,Disbursement,1995-02-16T00:00:00.000Z,4385934.31,DKK,1995-02-16T00:00:00.000Z,1000000161 G-C-DE-287-B,IFAD,"MINISTRY OF FINANCE, ECONOMIC RELATIONS DIVISION",Money is disbursed through central Ministry of Finance or Treasury,,BD,APR,1000000161 0019504701611001 Direct Payment/Reimbursement,C01, ,3,1,20,110
1000000164__09-04-1991-00:00:00_Commitment,1100000287,1000000164,,Commitment,1991-09-04T00:00:00.000Z,813689.09,USD,1991-09-04T00:00:00.000Z,1000000164 G-C-EU-287-A,IFAD,"MINISTRY OF FINANCE, ECONOMIC RELATIONS DIVISION",Money is disbursed through central Ministry of Finance or Treasury,,BD,APR,1000000164 GRANTS,C01, ,2,1,20,110
1000000164_0019410201641003_04-12-1994-00:00:00_Disbursement,1100000287,1000000164,0019410201641003,Disbursement,1994-04-12T00:00:00.000Z,54681.09,USD,1994-04-12T00:00:00.000Z,1000000164 G-C-EU-287-A,IFAD,"MINISTRY OF FINANCE, ECONOMIC RELATIONS DIVISION",Money is disbursed through central Ministry of Finance or Treasury,,BD,APR,1000000164 0019410201641003 Direct Payment/Reimbursement,C01, ,3,1,20,110
1000000164_0019410201641002_04-12-1994-00:00:00_Disbursement,1100000287,1000000164,0019410201641002,Disbursement,1994-04-12T00:00:00.000Z,65078.94,USD,1994-04-12T00:00:00.000Z,1000000164 G-C-EU-287-A,IFAD,"MINISTRY OF FINANCE, ECONOMIC RELATIONS DIVISION",Money is disbursed through central Ministry of Finance or Treasury,,BD,APR,1000000164 0019410201641002 Direct Payment/Reimbursement,C01, ,3,1,20,110
1000000164_0019410201641004_04-12-1994-00:00:00_Disbursement,1100000287,1000000164,0019410201641004,Disbursement,1994-04-12T00:00:00.000Z,64346.02,USD,1994-04-12T00:00:00.000Z,1000000164 G-C-EU-287-A,IFAD,"MINISTRY OF FINANCE, ECONOMIC RELATIONS DIVISION",Money is disbursed through central Ministry of Finance or Treasury,,BD,APR,1000000164 0019410201641004 Direct Payment/Reimbursement,C01, ,3,1,20,110
1000000164_0019410201641006_04-12-1994-00:00:00_Disbursement,1100000287,1000000164,0019410201641006,Disbursement,1994-04-12T00:00:00.000Z,110919.56,USD,1994-04-12T00:00:00.000Z,1000000164 G-C-EU-287-A,IFAD,"MINISTRY OF FINANCE, ECONOMIC RELATIONS DIVISION",Money is disbursed through central Ministry of Finance or Treasury,,BD,APR,1000000164 0019410201641006 Direct Payment/Reimbursement,C01, ,3,1,20,110
1000000164_0019505401641008_02-23-1995-00:00:00_Disbursement,1100000287,1000000164,0019505401641008,Disbursement,1995-02-23T00:00:00.000Z,35875.62,USD,1995-02-23T00:00:00.000Z,1000000164 G-C-EU-287-A,IFAD,"MINISTRY OF FINANCE, ECONOMIC RELATIONS DIVISION",Money is disbursed through central Ministry of Finance or Treasury,,BD,APR,1000000164 0019505401641008 Direct Payment/Reimbursement,C01, ,3,1,20,110
1000000164_0019503801641007_02-07-1995-00:00:00_Disbursement,1100000287,1000000164,0019503801641007,Disbursement,1995-02-07T00:00:00.000Z,412895.65,USD,1995-02-07T00:00:00.000Z,1000000164 G-C-EU-287-A,IFAD,"MINISTRY OF FINANCE, ECONOMIC RELATIONS DIVISION",Money is disbursed through central Ministry of Finance or Treasury,,BD,APR,1000000164 0019503801641007 Direct Payment/Reimbursement,C01, ,3,1,20,110
1000000164_0019410201641005_04-12-1994-00:00:00_Disbursement,1100000287,1000000164,0019410201641005,Disbursement,1994-04-12T00:00:00.000Z,30755.74,USD,1994-04-12T00:00:00.000Z,1000000164 G-C-EU-287-A,IFAD,"MINISTRY OF FINANCE, ECONOMIC RELATIONS DIVISION",Money is disbursed through central Ministry of Finance or Treasury,,BD,APR,1000000164 0019410201641005 Direct Payment/Reimbursement,C01, ,3,1,20,110
1000000164_0019410201641001_04-12-1994-00:00:00_Disbursement,1100000287,1000000164,0019410201641001,Disbursement,1994-04-12T00:00:00.000Z,39136.47,USD,1994-04-12T00:00:00.000Z,1000000164 G-C-EU-287-A,IFAD,"MINISTRY OF FINANCE, ECONOMIC RELATIONS DIVISION",Money is disbursed through central Ministry of Finance or Treasury,,BD,APR,1000000164 0019410201641001 Direct Payment/Reimbursement,C01, ,3,1,20,110
1000000165__11-30-1988-00:00:00_Commitment,1100000448,1000000165,,Commitment,1988-11-30T00:00:00.000Z,10951433.88,FIM,1988-11-30T00:00:00.000Z,1000000165 G-C-FN-16-,IFAD,MINISTRY OF FINANCE AND NATIONAL ECONOMY,Money is disbursed through central Ministry of Finance or Treasury,,SD,NEN,1000000165 GRANTS,C01, ,2,1,20,110
1000000165_0019302101651016_01-21-1993-00:00:00_Disbursement,1100000448,1000000165,0019302101651016,Disbursement,1993-01-21T00:00:00.000Z,521226.82,FIM,1993-01-21T00:00:00.000Z,1000000165 G-C-FN-16-,IFAD,MINISTRY OF FINANCE AND NATIONAL ECONOMY,Money is disbursed through central Ministry of Finance or Treasury,,SD,NEN,1000000165 0019302101651016 Direct Payment/Reimbursement,C01, ,3,1,20,110
1000000165_0019213501651010_05-14-1992-00:00:00_Disbursement,1100000448,1000000165,0019213501651010,Disbursement,1992-05-14T00:00:00.000Z,93645.41,FIM,1992-05-14T00:00:00.000Z,1000000165 G-C-FN-16-,IFAD,MINISTRY OF FINANCE AND NATIONAL ECONOMY,Money is disbursed through central Ministry of Finance or Treasury,,SD,NEN,1000000165 0019213501651010 Direct Payment/Reimbursement,C01, ,3,1,20,110
1000000165_0019026401651004_09-21-1990-00:00:00_Disbursement,1100000448,1000000165,0019026401651004,Disbursement,1990-09-21T00:00:00.000Z,42437.6,FIM,1990-09-21T00:00:00.000Z,1000000165 G-C-FN-16-,IFAD,MINISTRY OF FINANCE AND NATIONAL ECONOMY,Money is disbursed through central Ministry of Finance or Treasury,,SD,NEN,1000000165 0019026401651004 Direct Payment/Reimbursement,C01, ,3,1,20,110
1000000165_0019423801651036_08-26-1994-00:00:00_Disbursement,1100000448,1000000165,0019423801651036,Disbursement,1994-08-26T00:00:00.000Z,165165.51,FIM,1994-08-26T00:00:00.000Z,1000000165 G-C-FN-16-,IFAD,MINISTRY OF FINANCE AND NATIONAL ECONOMY,Money is disbursed through central Ministry of Finance or Treasury,,SD,NEN,1000000165 0019423801651036 Direct Payment/Reimbursement,C01, ,3,1,20,110
1000000165_0019017201651002_06-21-1990-00:00:00_Disbursement,1100000448,1000000165,0019017201651002,Disbursement,1990-06-21T00:00:00.000Z,16553.95,FIM,1990-06-21T00:00:00.000Z,1000000165 G-C-FN-16-,IFAD,MINISTRY OF FINANCE AND NATIONAL ECONOMY,Money is disbursed through central Ministry of Finance or Treasury,,SD,NEN,1000000165 0019017201651002 Direct Payment/Reimbursement,C01, ,3,1,20,110
1000000165_0019610801651049_04-17-1996-00:00:00_Disbursement,1100000448,1000000165,0019610801651049,Disbursement,1996-04-17T00:00:00.000Z,166587.85,FIM,1996-04-17T00:00:00.000Z,1000000165 G-C-FN-16-,IFAD,MINISTRY OF FINANCE AND NATIONAL ECONOMY,Money is disbursed through central Ministry of Finance or Treasury,,SD,NEN,1000000165 0019610801651049 Direct Payment/Reimbursement,C01, ,3,1,20,110
1000000165_0019634501651060_12-10-1996-00:00:00_Disbursement,1100000448,1000000165,0019634501651060,Disbursement,1996-12-10T00:00:00.000Z,223245.37,FIM,1996-12-10T00:00:00.000Z,1000000165 G-C-FN-16-,IFAD,MINISTRY OF FINANCE AND NATIONAL ECONOMY,Money is disbursed through central Ministry of Finance or Treasury,,SD,NEN,1000000165 0019634501651060 Direct Payment/Reimbursement,C01, ,3,1,20,110
1000000165_0019526901651044_09-26-1995-00:00:00_Disbursement,1100000448,1000000165,0019526901651044,Disbursement,1995-09-26T00:00:00.000Z,77807.68,FIM,1995-09-26T00:00:00.000Z,1000000165 G-C-FN-16-,IFAD,MINISTRY OF FINANCE AND NATIONAL ECONOMY,Money is disbursed through central Ministry of Finance or Treasury,,SD,NEN,1000000165 0019526901651044 Direct Payment/Reimbursement,C01, ,3,1,20,110
1000000165_0019301301651015_01-13-1993-00:00:00_Disbursement,1100000448,1000000165,0019301301651015,Disbursement,1993-01-13T00:00:00.000Z,150960.96,FIM,1993-01-13T00:00:00.000Z,1000000165 G-C-FN-16-,IFAD,MINISTRY OF FINANCE AND NATIONAL ECONOMY,Money is disbursed through central Ministry of Finance or Treasury,,SD,NEN,1000000165 0019301301651015 Direct Payment/Reimbursement,C01, ,3,1,20,110
1000000165_0019416101651034_06-10-1994-00:00:00_Disbursement,1100000448,1000000165,0019416101651034,Disbursement,1994-06-10T00:00:00.000Z,187022.69,FIM,1994-06-10T00:00:00.000Z,1000000165 G-C-FN-16-,IFAD,MINISTRY OF FINANCE AND NATIONAL ECONOMY,Money is disbursed through central Ministry of Finance or Treasury,,SD,NEN,1000000165 0019416101651034 Direct Payment/Reimbursement,C01, ,3,1,20,110
1000000165_0019311201651021_04-22-1993-00:00:00_Disbursement,1100000448,1000000165,0019311201651021,Disbursement,1993-04-22T00:00:00.000Z,13015.18,FIM,1993-04-22T00:00:00.000Z,1000000165 G-C-FN-16-,IFAD,MINISTRY OF FINANCE AND NATIONAL ECONOMY,Money is disbursed through central Ministry of Finance or Treasury,,SD,NEN,1000000165 0019311201651021 Direct Payment/Reimbursement,C01, ,3,1,20,110
1000000165_0019416101651033_06-10-1994-00:00:00_Disbursement,1100000448,1000000165,0019416101651033,Disbursement,1994-06-10T00:00:00.000Z,23792.73,FIM,1994-06-10T00:00:00.000Z,1000000165 G-C-FN-16-,IFAD,MINISTRY OF FINANCE AND NATIONAL ECONOMY,Money is disbursed through central Ministry of Finance or Treasury,,SD,NEN,1000000165 0019416101651033 Direct Payment/Reimbursement,C01, ,3,1,20,110
1000000165_0019601101651047_01-11-1996-00:00:00_Disbursement,1100000448,1000000165,0019601101651047,Disbursement,1996-01-11T00:00:00.000Z,15568.07,FIM,1996-01-11T00:00:00.000Z,1000000165 G-C-FN-16-,IFAD,MINISTRY OF FINANCE AND NATIONAL ECONOMY,Money is disbursed through central Ministry of Finance or Treasury,,SD,NEN,1000000165 0019601101651047 Direct Payment/Reimbursement,C01, ,3,1,20,110
1000000165_0019719801651066_07-17-1997-00:00:00_Disbursement,1100000448,1000000165,0019719801651066,Disbursement,1997-07-17T00:00:00.000Z,50550.08,FIM,1997-07-17T00:00:00.000Z,1000000165 G-C-FN-16-,IFAD,MINISTRY OF FINANCE AND NATIONAL ECONOMY,Money is disbursed through central Ministry of Finance or Treasury,,SD,NEN,1000000165 0019719801651066 Direct Payment/Reimbursement,C01, ,3,1,20,110
1000000165_0019505401651041_02-23-1995-00:00:00_Disbursement,1100000448,1000000165,0019505401651041,Disbursement,1995-02-23T00:00:00.000Z,74492.25,FIM,1995-02-23T00:00:00.000Z,1000000165 G-C-FN-16-,IFAD,MINISTRY OF FINANCE AND NATIONAL ECONOMY,Money is disbursed through central Ministry of Finance or Treasury,,SD,NEN,1000000165 0019505401651041 Direct Payment/Reimbursement,C01, ,3,1,20,110
1000000165_0019427801651038_10-05-1994-00:00:00_Disbursement,1100000448,1000000165,0019427801651038,Disbursement,1994-10-05T00:00:00.000Z,78919.72,FIM,1994-10-05T00:00:00.000Z,1000000165 G-C-FN-16-,IFAD,MINISTRY OF FINANCE AND NATIONAL ECONOMY,Money is disbursed through central Ministry of Finance or Treasury,,SD,NEN,1000000165 0019427801651038 Direct Payment/Reimbursement,C01, ,3,1,20,110
1000000165_0019026101651003_09-18-1990-00:00:00_Disbursement,1100000448,1000000165,0019026101651003,Disbursement,1990-09-18T00:00:00.000Z,552003.0,FIM,1990-09-18T00:00:00.000Z,1000000165 G-C-FN-16-,IFAD,MINISTRY OF FINANCE AND NATIONAL ECONOMY,Money is disbursed through central Ministry of Finance or Treasury,,SD,NEN,1000000165 0019026101651003 Direct Payment/Reimbursement,C01, ,3,1,20,110
1000000165_0019729401651068_10-21-1997-00:00:00_Disbursement,1100000448,1000000165,0019729401651068,Disbursement,1997-10-21T00:00:00.000Z,18920.48,FIM,1997-10-21T00:00:00.000Z,1000000165 G-C-FN-16-,IFAD,MINISTRY OF FINANCE AND NATIONAL ECONOMY,Money is disbursed through central Ministry of Finance or Treasury,,SD,NEN,1000000165 0019729401651068 Direct Payment/Reimbursement,C01, ,3,1,20,110
1000000165_0019231801651013_11-13-1992-00:00:00_Disbursement,1100000448,1000000165,0019231801651013,Disbursement,1992-11-13T00:00:00.000Z,121374.5,FIM,1992-11-13T00:00:00.000Z,1000000165 G-C-FN-16-,IFAD,MINISTRY OF FINANCE AND NATIONAL ECONOMY,Money is disbursed through central Ministry of Finance or Treasury,,SD,NEN,1000000165 0019231801651013 Direct Payment/Reimbursement,C01, ,3,1,20,110
1000000165_0019432101651039_11-17-1994-00:00:00_Disbursement,1100000448,1000000165,0019432101651039,Disbursement,1994-11-17T00:00:00.000Z,63336.39,FIM,1994-11-17T00:00:00.000Z,1000000165 G-C-FN-16-,IFAD,MINISTRY OF FINANCE AND NATIONAL ECONOMY,Money is disbursed through central Ministry of Finance or Treasury,,SD,NEN,1000000165 0019432101651039 Direct Payment/Reimbursement,C01, ,3,1,20,110
1000000165_0019734601651070_12-12-1997-00:00:00_Disbursement,1100000448,1000000165,0019734601651070,Disbursement,1997-12-12T00:00:00.000Z,244000.51,FIM,1997-12-12T00:00:00.000Z,1000000165 G-C-FN-16-,IFAD,MINISTRY OF FINANCE AND NATIONAL ECONOMY,Money is disbursed through central Ministry of Finance or Treasury,,SD,NEN,1000000165 0019734601651070 Direct Payment/Reimbursement,C01, ,3,1,20,110
1000000165_0019705001651062_02-19-1997-00:00:00_Disbursement,1100000448,1000000165,0019705001651062,Disbursement,1997-02-19T00:00:00.000Z,11063.48,FIM,1997-02-19T00:00:00.000Z,1000000165 G-C-FN-16-,IFAD,MINISTRY OF FINANCE AND NATIONAL ECONOMY,Money is disbursed through central Ministry of Finance or Treasury,,SD,NEN,1000000165 0019705001651062 Direct Payment/Reimbursement,C01, ,3,1,20,110
1000000165_0019027801651005_10-05-1990-00:00:00_Disbursement,1100000448,1000000165,0019027801651005,Disbursement,1990-10-05T00:00:00.000Z,112878.18,FIM,1990-10-05T00:00:00.000Z,1000000165 G-C-FN-16-,IFAD,MINISTRY OF FINANCE AND NATIONAL ECONOMY,Money is disbursed through central Ministry of Finance or Treasury,,SD,NEN,1000000165 0019027801651005 Direct Payment/Reimbursement,C01, ,3,1,20,110
1000000165_0019528501651045_10-12-1995-00:00:00_Disbursement,1100000448,1000000165,0019528501651045,Disbursement,1995-10-12T00:00:00.000Z,52261.05,FIM,1995-10-12T00:00:00.000Z,1000000165 G-C-FN-16-,IFAD,MINISTRY OF FINANCE AND NATIONAL ECONOMY,Money is disbursed through central Ministry of Finance or Treasury,,SD,NEN,1000000165 0019528501651045 Direct Payment/Reimbursement,C01, ,3,1,20,110
1000000165_0019014501651001_05-25-1990-00:00:00_Disbursement,1100000448,1000000165,0019014501651001,Disbursement,1990-05-25T00:00:00.000Z,230044.37,FIM,1990-05-25T00:00:00.000Z,1000000165 G-C-FN-16-,IFAD,MINISTRY OF FINANCE AND NATIONAL ECONOMY,Money is disbursed through central Ministry of Finance or Treasury,,SD,NEN,1000000165 0019014501651001 Direct Payment/Reimbursement,C01, ,3,1,20,110
1000000165_0019401201651029_01-12-1994-00:00:00_Disbursement,1100000448,1000000165,0019401201651029,Disbursement,1994-01-12T00:00:00.000Z,1612173.91,FIM,1994-01-12T00:00:00.000Z,1000000165 G-C-FN-16-,IFAD,MINISTRY OF FINANCE AND NATIONAL ECONOMY,Money is disbursed through central Ministry of Finance or Treasury,,SD,NEN,1000000165 0019401201651029 Direct Payment/Reimbursement,C01, ,3,1,20,110
1000000165_0019035501651006_12-21-1990-00:00:00_Disbursement,1100000448,1000000165,0019035501651006,Disbursement,1990-12-21T00:00:00.000Z,72454.65,FIM,1990-12-21T00:00:00.000Z,1000000165 G-C-FN-16-,IFAD,MINISTRY OF FINANCE AND NATIONAL ECONOMY,Money is disbursed through central Ministry of Finance or Treasury,,SD,NEN,1000000165 0019035501651006 Direct Payment/Reimbursement,C01, ,3,1,20,110
1000000165_0019329301651027_10-20-1993-00:00:00_Disbursement,1100000448,1000000165,0019329301651027,Disbursement,1993-10-20T00:00:00.000Z,173566.16,FIM,1993-10-20T00:00:00.000Z,1000000165 G-C-FN-16-,IFAD,MINISTRY OF FINANCE AND NATIONAL ECONOMY,Money is disbursed through central Ministry of Finance or Treasury,,SD,NEN,1000000165 0019329301651027 Direct Payment/Reimbursement,C01, ,3,1,20,110
1000000165_0019628201651059_10-08-1996-00:00:00_Disbursement,1100000448,1000000165,0019628201651059,Disbursement,1996-10-08T00:00:00.000Z,25646.14,FIM,1996-10-08T00:00:00.000Z,1000000165 G-C-FN-16-,IFAD,MINISTRY OF FINANCE AND NATIONAL ECONOMY,Money is disbursed through central Ministry of Finance or Treasury,,SD,NEN,1000000165 0019628201651059 Direct Payment/Reimbursement,C01, ,3,1,20,110
1000000165_0019423801651035_08-26-1994-00:00:00_Disbursement,1100000448,1000000165,0019423801651035,Disbursement,1994-08-26T00:00:00.000Z,12200.73,FIM,1994-08-26T00:00:00.000Z,1000000165 G-C-FN-16-,IFAD,MINISTRY OF FINANCE AND NATIONAL ECONOMY,Money is disbursed through central Ministry of Finance or Treasury,,SD,NEN,1000000165 0019423801651035 Direct Payment/Reimbursement,C01, ,3,1,20,110
1000000165_0019624001651055_08-27-1996-00:00:00_Disbursement,1100000448,1000000165,0019624001651055,Disbursement,1996-08-27T00:00:00.000Z,12857.98,FIM,1996-08-27T00:00:00.000Z,1000000165 G-C-FN-16-,IFAD,MINISTRY OF FINANCE AND NATIONAL ECONOMY,Money is disbursed through central Ministry of Finance or Treasury,,SD,NEN,1000000165 0019624001651055 Direct Payment/Reimbursement,C01, ,3,1,20,110
1000000165_0019536101651046_12-27-1995-00:00:00_Disbursement,1100000448,1000000165,0019536101651046,Disbursement,1995-12-27T00:00:00.000Z,28969.65,FIM,1995-12-27T00:00:00.000Z,1000000165 G-C-FN-16-,IFAD,MINISTRY OF FINANCE AND NATIONAL ECONOMY,Money is disbursed through central Ministry of Finance or Treasury,,SD,NEN,1000000165 0019536101651046 Direct Payment/Reimbursement,C01, ,3,1,20,110
1000000165_0019329201651028_10-19-1993-00:00:00_Disbursement,1100000448,1000000165,0019329201651028,Disbursement,1993-10-19T00:00:00.000Z,21458.26,FIM,1993-10-19T00:00:00.000Z,1000000165 G-C-FN-16-,IFAD,MINISTRY OF FINANCE AND NATIONAL ECONOMY,Money is disbursed through central Ministry of Finance or Treasury,,SD,NEN,1000000165 0019329201651028 Direct Payment/Reimbursement,C01, ,3,1,20,110
1000000165_0019627601651058_10-02-1996-00:00:00_Disbursement,1100000448,1000000165,0019627601651058,Disbursement,1996-10-02T00:00:00.000Z,27371.44,FIM,1996-10-02T00:00:00.000Z,1000000165 G-C-FN-16-,IFAD,MINISTRY OF FINANCE AND NATIONAL ECONOMY,Money is disbursed through central Ministry of Finance or Treasury,,SD,NEN,1000000165 0019627601651058 Direct Payment/Reimbursement,C01, ,3,1,20,110
1000000165_0019308101651022_03-22-1993-00:00:00_Disbursement,1100000448,1000000165,0019308101651022,Disbursement,1993-03-22T00:00:00.000Z,2589.28,FIM,1993-03-22T00:00:00.000Z,1000000165 G-C-FN-16-,IFAD,MINISTRY OF FINANCE AND NATIONAL ECONOMY,Money is disbursed through central Ministry of Finance or Treasury,,SD,NEN,1000000165 0019308101651022 Direct Payment/Reimbursement,C01, ,3,1,20,110
1000000165_0019520601651042_07-25-1995-00:00:00_Disbursement,1100000448,1000000165,0019520601651042,Disbursement,1995-07-25T00:00:00.000Z,43873.51,FIM,1995-07-25T00:00:00.000Z,1000000165 G-C-FN-16-,IFAD,MINISTRY OF FINANCE AND NATIONAL ECONOMY,Money is disbursed through central Ministry of Finance or Treasury,,SD,NEN,1000000165 0019520601651042 Direct Payment/Reimbursement,C01, ,3,1,20,110
1000000165_0019619001651053_07-08-1996-00:00:00_Disbursement,1100000448,1000000165,0019619001651053,Disbursement,1996-07-08T00:00:00.000Z,134513.63,FIM,1996-07-08T00:00:00.000Z,1000000165 G-C-FN-16-,IFAD,MINISTRY OF FINANCE AND NATIONAL ECONOMY,Money is disbursed through central Ministry of Finance or Treasury,,SD,NEN,1000000165 0019619001651053 Direct Payment/Reimbursement,C01, ,3,1,20,110
1000000165_0019219901651012_07-17-1992-00:00:00_Disbursement,1100000448,1000000165,0019219901651012,Disbursement,1992-07-17T00:00:00.000Z,2075.12,FIM,1992-07-17T00:00:00.000Z,1000000165 G-C-FN-16-,IFAD,MINISTRY OF FINANCE AND NATIONAL ECONOMY,Money is disbursed through central Ministry of Finance or Treasury,,SD,NEN,1000000165 0019219901651012 Direct Payment/Reimbursement,C01, ,3,1,20,110
1000000165_0019303601651017_02-05-1993-00:00:00_Disbursement,1100000448,1000000165,0019303601651017,Disbursement,1993-02-05T00:00:00.000Z,809201.43,FIM,1993-02-05T00:00:00.000Z,1000000165 G-C-FN-16-,IFAD,MINISTRY OF FINANCE AND NATIONAL ECONOMY,Money is disbursed through central Ministry of Finance or Treasury,,SD,NEN,1000000165 0019303601651017 Direct Payment/Reimbursement,C01, ,3,1,20,110
1000000165_0019503401651040_02-03-1995-00:00:00_Disbursement,1100000448,1000000165,0019503401651040,Disbursement,1995-02-03T00:00:00.000Z,76036.89,FIM,1995-02-03T00:00:00.000Z,1000000165 G-C-FN-16-,IFAD,MINISTRY OF FINANCE AND NATIONAL ECONOMY,Money is disbursed through central Ministry of Finance or Treasury,,SD,NEN,1000000165 0019503401651040 Direct Payment/Reimbursement,C01, ,3,1,20,110
1000000165_0019622701651054_08-14-1996-00:00:00_Disbursement,1100000448,1000000165,0019622701651054,Disbursement,1996-08-14T00:00:00.000Z,118450.1,FIM,1996-08-14T00:00:00.000Z,1000000165 G-C-FN-16-,IFAD,MINISTRY OF FINANCE AND NATIONAL ECONOMY,Money is disbursed through central Ministry of Finance or Treasury,,SD,NEN,1000000165 0019622701651054 Direct Payment/Reimbursement,C01, ,3,1,20,110
1000000165_0019135201651009_12-18-1991-00:00:00_Disbursement,1100000448,1000000165,0019135201651009,Disbursement,1991-12-18T00:00:00.000Z,8917.8,FIM,1991-12-18T00:00:00.000Z,1000000165 G-C-FN-16-,IFAD,MINISTRY OF FINANCE AND NATIONAL ECONOMY,Money is disbursed through central Ministry of Finance or Treasury,,SD,NEN,1000000165 0019135201651009 Direct Payment/Reimbursement,C01, ,3,1,20,110
1000000165_0019413101651032_05-11-1994-00:00:00_Disbursement,1100000448,1000000165,0019413101651032,Disbursement,1994-05-11T00:00:00.000Z,767248.81,FIM,1994-05-11T00:00:00.000Z,1000000165 G-C-FN-16-,IFAD,MINISTRY OF FINANCE AND NATIONAL ECONOMY,Money is disbursed through central Ministry of Finance or Treasury,,SD,NEN,1000000165 0019413101651032 Direct Payment/Reimbursement,C01, ,3,1,20,110
1000000165_0019320801651024_07-27-1993-00:00:00_Disbursement,1100000448,1000000165,0019320801651024,Disbursement,1993-07-27T00:00:00.000Z,187848.02,FIM,1993-07-27T00:00:00.000Z,1000000165 G-C-FN-16-,IFAD,MINISTRY OF FINANCE AND NATIONAL ECONOMY,Money is disbursed through central Ministry of Finance or Treasury,,SD,NEN,1000000165 0019320801651024 Direct Payment/Reimbursement,C01, ,3,1,20,110
1000000165_0019425201651037_09-09-1994-00:00:00_Disbursement,1100000448,1000000165,0019425201651037,Disbursement,1994-09-09T00:00:00.000Z,185515.89,FIM,1994-09-09T00:00:00.000Z,1000000165 G-C-FN-16-,IFAD,MINISTRY OF FINANCE AND NATIONAL ECONOMY,Money is disbursed through central Ministry of Finance or Treasury,,SD,NEN,1000000165 0019425201651037 Direct Payment/Reimbursement,C01, ,3,1,20,110
1000000165_0019218201651011_06-30-1992-00:00:00_Disbursement,1100000448,1000000165,0019218201651011,Disbursement,1992-06-30T00:00:00.000Z,39417.36,FIM,1992-06-30T00:00:00.000Z,1000000165 G-C-FN-16-,IFAD,MINISTRY OF FINANCE AND NATIONAL ECONOMY,Money is disbursed through central Ministry of Finance or Treasury,,SD,NEN,1000000165 0019218201651011 Direct Payment/Reimbursement,C01, ,3,1,20,110
1000000165_0019318801651023_07-07-1993-00:00:00_Disbursement,1100000448,1000000165,0019318801651023,Disbursement,1993-07-07T00:00:00.000Z,145726.87,FIM,1993-07-07T00:00:00.000Z,1000000165 G-C-FN-16-,IFAD,MINISTRY OF FINANCE AND NATIONAL ECONOMY,Money is disbursed through central Ministry of Finance or Treasury,,SD,NEN,1000000165 0019318801651023 Direct Payment/Reimbursement,C01, ,3,1,20,110
1000000165_0019310301651020_04-13-1993-00:00:00_Disbursement,1100000448,1000000165,0019310301651020,Disbursement,1993-04-13T00:00:00.000Z,90938.6,FIM,1993-04-13T00:00:00.000Z,1000000165 G-C-FN-16-,IFAD,MINISTRY OF FINANCE AND NATIONAL ECONOMY,Money is disbursed through central Ministry of Finance or Treasury,,SD,NEN,1000000165 0019310301651020 Direct Payment/Reimbursement,C01, ,3,1,20,110
1000000165_0019707801651064_03-19-1997-00:00:00_Disbursement,1100000448,1000000165,0019707801651064,Disbursement,1997-03-19T00:00:00.000Z,13568.21,FIM,1997-03-19T00:00:00.000Z,1000000165 G-C-FN-16-,IFAD,MINISTRY OF FINANCE AND NATIONAL ECONOMY,Money is disbursed through central Ministry of Finance or Treasury,,SD,NEN,1000000165 0019707801651064 Direct Payment/Reimbursement,C01, ,3,1,20,110
1000000165_0019818101651071_06-30-1998-00:00:00_Disbursement,1100000448,1000000165,0019818101651071,Disbursement,1998-06-30T00:00:00.000Z,191925.0,FIM,1998-06-30T00:00:00.000Z,1000000165 G-C-FN-16-,IFAD,MINISTRY OF FINANCE AND NATIONAL ECONOMY,Money is disbursed through central Ministry of Finance or Treasury,,SD,NEN,1000000165 0019818101651071 Direct Payment/Reimbursement,C01, ,3,1,20,110
1000000165_0019604701651048_02-16-1996-00:00:00_Disbursement,1100000448,1000000165,0019604701651048,Disbursement,1996-02-16T00:00:00.000Z,531875.15,FIM,1996-02-16T00:00:00.000Z,1000000165 G-C-FN-16-,IFAD,MINISTRY OF FINANCE AND NATIONAL ECONOMY,Money is disbursed through central Ministry of Finance or Treasury,,SD,NEN,1000000165 0019604701651048 Direct Payment/Reimbursement,C01, ,3,1,20,110
1000000165_0019613601651050_05-15-1996-00:00:00_Disbursement,1100000448,1000000165,0019613601651050,Disbursement,1996-05-15T00:00:00.000Z,125205.25,FIM,1996-05-15T00:00:00.000Z,1000000165 G-C-FN-16-,IFAD,MINISTRY OF FINANCE AND NATIONAL ECONOMY,Money is disbursed through central Ministry of Finance or Treasury,,SD,NEN,1000000165 0019613601651050 Direct Payment/Reimbursement,C01, ,3,1,20,110
1000000165_0019615601651052_06-04-1996-00:00:00_Disbursement,1100000448,1000000165,0019615601651052,Disbursement,1996-06-04T00:00:00.000Z,59050.71,FIM,1996-06-04T00:00:00.000Z,1000000165 G-C-FN-16-,IFAD,MINISTRY OF FINANCE AND NATIONAL ECONOMY,Money is disbursed through central Ministry of Finance or Treasury,,SD,NEN,1000000165 0019615601651052 Direct Payment/Reimbursement,C01, ,3,1,20,110
1000000165_0019521301651043_08-01-1995-00:00:00_Disbursement,1100000448,1000000165,0019521301651043,Disbursement,1995-08-01T00:00:00.000Z,146609.99,FIM,1995-08-01T00:00:00.000Z,1000000165 G-C-FN-16-,IFAD,MINISTRY OF FINANCE AND NATIONAL ECONOMY,Money is disbursed through central Ministry of Finance or Treasury,,SD,NEN,1000000165 0019521301651043 Direct Payment/Reimbursement,C01, ,3,1,20,110
1000000165_0019625701651056_09-13-1996-00:00:00_Disbursement,1100000448,1000000165,0019625701651056,Disbursement,1996-09-13T00:00:00.000Z,99598.28,FIM,1996-09-13T00:00:00.000Z,1000000165 G-C-FN-16-,IFAD,MINISTRY OF FINANCE AND NATIONAL ECONOMY,Money is disbursed through central Ministry of Finance or Treasury,,SD,NEN,1000000165 0019625701651056 Direct Payment/Reimbursement,C01, ,3,1,20,110
1000000165_0019402001651030_01-20-1994-00:00:00_Disbursement,1100000448,1000000165,0019402001651030,Disbursement,1994-01-20T00:00:00.000Z,259224.15,FIM,1994-01-20T00:00:00.000Z,1000000165 G-C-FN-16-,IFAD,MINISTRY OF FINANCE AND NATIONAL ECONOMY,Money is disbursed through central Ministry of Finance or Treasury,,SD,NEN,1000000165 0019402001651030 Direct Payment/Reimbursement,C01, ,3,1,20,110
1000000165_0019235301651014_12-18-1992-00:00:00_Disbursement,1100000448,1000000165,0019235301651014,Disbursement,1992-12-18T00:00:00.000Z,97366.67,FIM,1992-12-18T00:00:00.000Z,1000000165 G-C-FN-16-,IFAD,MINISTRY OF FINANCE AND NATIONAL ECONOMY,Money is disbursed through central Ministry of Finance or Treasury,,SD,NEN,1000000165 0019235301651014 Direct Payment/Reimbursement,C01, ,3,1,20,110
1000000165_0019614101651051_05-20-1996-00:00:00_Disbursement,1100000448,1000000165,0019614101651051,Disbursement,1996-05-20T00:00:00.000Z,170000.0,FIM,1996-05-20T00:00:00.000Z,1000000165 G-C-FN-16-,IFAD,MINISTRY OF FINANCE AND NATIONAL ECONOMY,Money is disbursed through central Ministry of Finance or Treasury,,SD,NEN,1000000165 0019614101651051 Direct Payment/Reimbursement,C01, ,3,1,20,110
1000000165_0019625701651057_09-13-1996-00:00:00_Disbursement,1100000448,1000000165,0019625701651057,Disbursement,1996-09-13T00:00:00.000Z,32140.83,FIM,1996-09-13T00:00:00.000Z,1000000165 G-C-FN-16-,IFAD,MINISTRY OF FINANCE AND NATIONAL ECONOMY,Money is disbursed through central Ministry of Finance or Treasury,,SD,NEN,1000000165 0019625701651057 Direct Payment/Reimbursement,C01, ,3,1,20,110
1000000165_0019726501651067_09-22-1997-00:00:00_Disbursement,1100000448,1000000165,0019726501651067,Disbursement,1997-09-22T00:00:00.000Z,224086.77,FIM,1997-09-22T00:00:00.000Z,1000000165 G-C-FN-16-,IFAD,MINISTRY OF FINANCE AND NATIONAL ECONOMY,Money is disbursed through central Ministry of Finance or Treasury,,SD,NEN,1000000165 0019726501651067 Direct Payment/Reimbursement,C01, ,3,1,20,110
1000000165_0019306901651018_03-10-1993-00:00:00_Disbursement,1100000448,1000000165,0019306901651018,Disbursement,1993-03-10T00:00:00.000Z,61434.06,FIM,1993-03-10T00:00:00.000Z,1000000165 G-C-FN-16-,IFAD,MINISTRY OF FINANCE AND NATIONAL ECONOMY,Money is disbursed through central Ministry of Finance or Treasury,,SD,NEN,1000000165 0019306901651018 Direct Payment/Reimbursement,C01, ,3,1,20,110
1000000165_0019324601651026_09-03-1993-00:00:00_Disbursement,1100000448,1000000165,0019324601651026,Disbursement,1993-09-03T00:00:00.000Z,16680.28,FIM,1993-09-03T00:00:00.000Z,1000000165 G-C-FN-16-,IFAD,MINISTRY OF FINANCE AND NATIONAL ECONOMY,Money is disbursed through central Ministry of Finance or Treasury,,SD,NEN,1000000165 0019324601651026 Direct Payment/Reimbursement,C01, ,3,1,20,110
1000000165_0019708501651063_03-26-1997-00:00:00_Disbursement,1100000448,1000000165,0019708501651063,Disbursement,1997-03-26T00:00:00.000Z,192718.77,FIM,1997-03-26T00:00:00.000Z,1000000165 G-C-FN-16-,IFAD,MINISTRY OF FINANCE AND NATIONAL ECONOMY,Money is disbursed through central Ministry of Finance or Treasury,,SD,NEN,1000000165 0019708501651063 Direct Payment/Reimbursement,C01, ,3,1,20,110
1000000165_0019713501651065_05-15-1997-00:00:00_Disbursement,1100000448,1000000165,0019713501651065,Disbursement,1997-05-15T00:00:00.000Z,66599.5,FIM,1997-05-15T00:00:00.000Z,1000000165 G-C-FN-16-,IFAD,MINISTRY OF FINANCE AND NATIONAL ECONOMY,Money is disbursed through central Ministry of Finance or Treasury,,SD,NEN,1000000165 0019713501651065 Direct Payment/Reimbursement,C01, ,3,1,20,110
1000000165_0019323201651025_08-20-1993-00:00:00_Disbursement,1100000448,1000000165,0019323201651025,Disbursement,1993-08-20T00:00:00.000Z,162378.9,FIM,1993-08-20T00:00:00.000Z,1000000165 G-C-FN-16-,IFAD,MINISTRY OF FINANCE AND NATIONAL ECONOMY,Money is disbursed through central Ministry of Finance or Treasury,,SD,NEN,1000000165 0019323201651025 Direct Payment/Reimbursement,C01, ,3,1,20,110
1000000165_0019411001651031_04-20-1994-00:00:00_Disbursement,1100000448,1000000165,0019411001651031,Disbursement,1994-04-20T00:00:00.000Z,51000.0,FIM,1994-04-20T00:00:00.000Z,1000000165 G-C-FN-16-,IFAD,MINISTRY OF FINANCE AND NATIONAL ECONOMY,Money is disbursed through central Ministry of Finance or Treasury,,SD,NEN,1000000165 0019411001651031 Direct Payment/Reimbursement,C01, ,3,1,20,110
1000000165_0019120601651008_07-25-1991-00:00:00_Disbursement,1100000448,1000000165,0019120601651008,Disbursement,1991-07-25T00:00:00.000Z,114066.83,FIM,1991-07-25T00:00:00.000Z,1000000165 G-C-FN-16-,IFAD,MINISTRY OF FINANCE AND NATIONAL ECONOMY,Money is disbursed through central Ministry of Finance or Treasury,,SD,NEN,1000000165 0019120601651008 Direct Payment/Reimbursement,C01, ,3,1,20,110
1000000165_0019636201651061_12-27-1996-00:00:00_Disbursement,1100000448,1000000165,0019636201651061,Disbursement,1996-12-27T00:00:00.000Z,57136.52,FIM,1996-12-27T00:00:00.000Z,1000000165 G-C-FN-16-,IFAD,MINISTRY OF FINANCE AND NATIONAL ECONOMY,Money is disbursed through central Ministry of Finance or Treasury,,SD,NEN,1000000165 0019636201651061 Direct Payment/Reimbursement,C01, ,3,1,20,110
1000000165_0019113501651007_05-15-1991-00:00:00_Disbursement,1100000448,1000000165,0019113501651007,Disbursement,1991-05-15T00:00:00.000Z,65522.84,FIM,1991-05-15T00:00:00.000Z,1000000165 G-C-FN-16-,IFAD,MINISTRY OF FINANCE AND NATIONAL ECONOMY,Money is disbursed through central Ministry of Finance or Treasury,,SD,NEN,1000000165 0019113501651007 Direct Payment/Reimbursement,C01, ,3,1,20,110
1000000165_0019309201651019_04-02-1993-00:00:00_Disbursement,1100000448,1000000165,0019309201651019,Disbursement,1993-04-02T00:00:00.000Z,307319.11,FIM,1993-04-02T00:00:00.000Z,1000000165 G-C-FN-16-,IFAD,MINISTRY OF FINANCE AND NATIONAL ECONOMY,Money is disbursed through central Ministry of Finance or Treasury,,SD,NEN,1000000165 0019309201651019 Direct Payment/Reimbursement,C01, ,3,1,20,110
1000000166__09-10-1987-00:00:00_Commitment,1100000208,1000000166,,Commitment,1987-09-10T00:00:00.000Z,1115055.72,FIM,1987-09-10T00:00:00.000Z,1000000166 G-C-FN-208-,IFAD,MINISTRY OF FINANCE,Money is disbursed through central Ministry of Finance or Treasury,,NP,APR,1000000166 GRANTS,C01, ,2,1,20,110
1000000166_0019122501661011_08-13-1991-00:00:00_Disbursement,1100000208,1000000166,0019122501661011,Disbursement,1991-08-13T00:00:00.000Z,1340.73,FIM,1991-08-13T00:00:00.000Z,1000000166 G-C-FN-208-,IFAD,MINISTRY OF FINANCE,Money is disbursed through central Ministry of Finance or Treasury,,NP,APR,1000000166 0019122501661011 Direct Payment/Reimbursement,C01, ,3,1,20,110
1000000166_0019030401661003_10-31-1990-00:00:00_Disbursement,1100000208,1000000166,0019030401661003,Disbursement,1990-10-31T00:00:00.000Z,14490.76,FIM,1990-10-31T00:00:00.000Z,1000000166 G-C-FN-208-,IFAD,MINISTRY OF FINANCE,Money is disbursed through central Ministry of Finance or Treasury,,NP,APR,1000000166 0019030401661003 Direct Payment/Reimbursement,C01, ,3,1,20,110
1000000166_0019020101661002_07-20-1990-00:00:00_Disbursement,1100000208,1000000166,0019020101661002,Disbursement,1990-07-20T00:00:00.000Z,80813.88,FIM,1990-07-20T00:00:00.000Z,1000000166 G-C-FN-208-,IFAD,MINISTRY OF FINANCE,Money is disbursed through central Ministry of Finance or Treasury,,NP,APR,1000000166 0019020101661002 Direct Payment/Reimbursement,C01, ,3,1,20,110
1000000166_0019103801661004_02-07-1991-00:00:00_Disbursement,1100000208,1000000166,0019103801661004,Disbursement,1991-02-07T00:00:00.000Z,5915.74,FIM,1991-02-07T00:00:00.000Z,1000000166 G-C-FN-208-,IFAD,MINISTRY OF FINANCE,Money is disbursed through central Ministry of Finance or Treasury,,NP,APR,1000000166 0019103801661004 Direct Payment/Reimbursement,C01, ,3,1,20,110
1000000166_0019211301661008_04-22-1992-00:00:00_Disbursement,1100000208,1000000166,0019211301661008,Disbursement,1992-04-22T00:00:00.000Z,33666.52,FIM,1992-04-22T00:00:00.000Z,1000000166 G-C-FN-208-,IFAD,MINISTRY OF FINANCE,Money is disbursed through central Ministry of Finance or Treasury,,NP,APR,1000000166 0019211301661008 Direct Payment/Reimbursement,C01, ,3,1,20,110
1000000166_0019402601661010_01-26-1994-00:00:00_Disbursement,1100000208,1000000166,0019402601661010,Disbursement,1994-01-26T00:00:00.000Z,72456.93,FIM,1994-01-26T00:00:00.000Z,1000000166 G-C-FN-208-,IFAD,MINISTRY OF FINANCE,Money is disbursed through central Ministry of Finance or Treasury,,NP,APR,1000000166 0019402601661010 Direct Payment/Reimbursement,C01, ,3,1,20,110
1000000166_0019123801661006_08-26-1991-00:00:00_Disbursement,1100000208,1000000166,0019123801661006,Disbursement,1991-08-26T00:00:00.000Z,5099.62,FIM,1991-08-26T00:00:00.000Z,1000000166 G-C-FN-208-,IFAD,MINISTRY OF FINANCE,Money is disbursed through central Ministry of Finance or Treasury,,NP,APR,1000000166 0019123801661006 Direct Payment/Reimbursement,C01, ,3,1,20,110
1000000166_0019011001661001_04-20-1990-00:00:00_Disbursement,1100000208,1000000166,0019011001661001,Disbursement,1990-04-20T00:00:00.000Z,47624.52,FIM,1990-04-20T00:00:00.000Z,1000000166 G-C-FN-208-,IFAD,MINISTRY OF FINANCE,Money is disbursed through central Ministry of Finance or Treasury,,NP,APR,1000000166 0019011001661001 Direct Payment/Reimbursement,C01, ,3,1,20,110
1000000166_0019135401661005_12-20-1991-00:00:00_Disbursement,1100000208,1000000166,0019135401661005,Disbursement,1991-12-20T00:00:00.000Z,47046.39,FIM,1991-12-20T00:00:00.000Z,1000000166 G-C-FN-208-,IFAD,MINISTRY OF FINANCE,Money is disbursed through central Ministry of Finance or Treasury,,NP,APR,1000000166 0019135401661005 Direct Payment/Reimbursement,C01, ,3,1,20,110
1000000166_0019130801661007_11-04-1991-00:00:00_Disbursement,1100000208,1000000166,0019130801661007,Disbursement,1991-11-04T00:00:00.000Z,235150.78,FIM,1991-11-04T00:00:00.000Z,1000000166 G-C-FN-208-,IFAD,MINISTRY OF FINANCE,Money is disbursed through central Ministry of Finance or Treasury,,NP,APR,1000000166 0019130801661007 Direct Payment/Reimbursement,C01, ,3,1,20,110
1000000166_0019306401661009_03-05-1993-00:00:00_Disbursement,1100000208,1000000166,0019306401661009,Disbursement,1993-03-05T00:00:00.000Z,571449.85,FIM,1993-03-05T00:00:00.000Z,1000000166 G-C-FN-208-,IFAD,MINISTRY OF FINANCE,Money is disbursed through central Ministry of Finance or Treasury,,NP,APR,1000000166 0019306401661009 Direct Payment/Reimbursement,C01, ,3,1,20,110
1000000167__04-29-1999-00:00:00_Commitment,1100001063,1000000167,,Commitment,1999-04-29T00:00:00.000Z,0.0,GBP,1999-04-29T00:00:00.000Z,1000000167 G-C-GB-506-,IFAD,MINISTRY OF FINANCE,Money is disbursed through central Ministry of Finance or Treasury,,IN,APR,1000000167 GRANTS,C01, ,2,1,20,110
1000000169__04-23-2002-00:00:00_Commitment,1100001155,1000000169,,Commitment,2002-04-23T00:00:00.000Z,7540000.0,GBP,2002-04-23T00:00:00.000Z,1000000169 G-C-GB-585-,IFAD,MINISTRY OF FINANCE,Money is disbursed through central Ministry of Finance or Treasury,,IN,APR,1000000169 GRANTS,C01, ,2,1,20,110
1000000169_0010808001691004_03-20-2008-00:00:00_Disbursement,1100001155,1000000169,0010808001691004,Disbursement,2008-03-20T00:00:00.000Z,660636.98,GBP,2008-03-20T00:00:00.000Z,1000000169 G-C-GB-585-,IFAD,MINISTRY OF FINANCE,Money is disbursed through central Ministry of Finance or Treasury,,IN,APR,1000000169 0010808001691004 Direct Payment/Reimbursement,C01, ,3,1,20,110
1000000169_0010720701691002_07-26-2007-00:00:00_Disbursement,1100001155,1000000169,0010720701691002,Disbursement,2007-07-26T00:00:00.000Z,2425531.38,GBP,2007-07-26T00:00:00.000Z,1000000169 G-C-GB-585-,IFAD,MINISTRY OF FINANCE,Money is disbursed through central Ministry of Finance or Treasury,,IN,APR,1000000169 0010720701691002 Direct Payment/Reimbursement,C01, ,3,1,20,110
1000000169_0011325401691008_09-11-2013-00:00:00_Disbursement,1100001155,1000000169,0011325401691008,Disbursement,2013-09-11T00:00:00.000Z,344700.55,GBP,2013-09-11T00:00:00.000Z,1000000169 G-C-GB-585-,IFAD,MINISTRY OF FINANCE,Money is disbursed through central Ministry of Finance or Treasury,,IN,APR,1000000169 0011325401691008 Direct Payment/Reimbursement,C01, ,3,1,20,110
1000000169_0011116401691007_06-13-2011-00:00:00_Disbursement,1100001155,1000000169,0011116401691007,Disbursement,2011-06-13T00:00:00.000Z,436165.49,GBP,2011-06-13T00:00:00.000Z,1000000169 G-C-GB-585-,IFAD,MINISTRY OF FINANCE,Money is disbursed through central Ministry of Finance or Treasury,,IN,APR,1000000169 0011116401691007 Direct Payment/Reimbursement,C01, ,3,1,20,110
1000000169_0010914201691006_05-22-2009-00:00:00_Disbursement,1100001155,1000000169,0010914201691006,Disbursement,2009-05-22T00:00:00.000Z,1886902.46,GBP,2009-05-22T00:00:00.000Z,1000000169 G-C-GB-585-,IFAD,MINISTRY OF FINANCE,Money is disbursed through central Ministry of Finance or Treasury,,IN,APR,1000000169 0010914201691006 Direct Payment/Reimbursement,C01, ,3,1,20,110
1000000169_0010829101691005_10-17-2008-00:00:00_Disbursement,1100001155,1000000169,0010829101691005,Disbursement,2008-10-17T00:00:00.000Z,549554.05,GBP,2008-10-17T00:00:00.000Z,1000000169 G-C-GB-585-,IFAD,MINISTRY OF FINANCE,Money is disbursed through central Ministry of Finance or Treasury,,IN,APR,1000000169 0010829101691005 Direct Payment/Reimbursement,C01, ,3,1,20,110
1000000169_0010720501691001_07-24-2007-00:00:00_Disbursement,1100001155,1000000169,0010720501691001,Disbursement,2007-07-24T00:00:00.000Z,485296.25,GBP,2007-07-24T00:00:00.000Z,1000000169 G-C-GB-585-,IFAD,MINISTRY OF FINANCE,Money is disbursed through central Ministry of Finance or Treasury,,IN,APR,1000000169 0010720501691001 Direct Payment/Reimbursement,C01, ,3,1,20,110
1000000169_0010807701691003_03-17-2008-00:00:00_Disbursement,1100001155,1000000169,0010807701691003,Disbursement,2008-03-17T00:00:00.000Z,751212.84,GBP,2008-03-17T00:00:00.000Z,1000000169 G-C-GB-585-,IFAD,MINISTRY OF FINANCE,Money is disbursed through central Ministry of Finance or Treasury,,IN,APR,1000000169 0010807701691003 Direct Payment/Reimbursement,C01, ,3,1,20,110
1000000325__12-11-1991-00:00:00_Commitment,1100000293,1000000325,,Commitment,1991-12-11T00:00:00.000Z,0.0,USD,1991-12-11T00:00:00.000Z,1000000325 G-C-IE-293-,IFAD,MINISTRY OF FINANCE AND NATIONAL PLANNING,Money is disbursed through central Ministry of Finance or Treasury,,ZM,ESA,1000000325 GRANTS,C01, ,2,1,20,110
1000000326__12-05-1996-00:00:00_Commitment,1100001011,1000000326,,Commitment,1996-12-05T00:00:00.000Z,774726.04,USD,1996-12-05T00:00:00.000Z,1000000326 G-C-IE-438-,IFAD,MINISTRY OF FINANCE AND ECONOMIC DEVELOPMENT,Money is disbursed through central Ministry of Finance or Treasury,,ET,ESA,1000000326 GRANTS,C01, ,2,1,20,110
1000000326_0010312803261003_05-08-2003-00:00:00_Disbursement,1100001011,1000000326,0010312803261003,Disbursement,2003-05-08T00:00:00.000Z,17060.21,USD,2003-05-08T00:00:00.000Z,1000000326 G-C-IE-438-,IFAD,MINISTRY OF FINANCE AND ECONOMIC DEVELOPMENT,Money is disbursed through central Ministry of Finance or Treasury,,ET,ESA,1000000326 0010312803261003 Direct Payment/Reimbursement,C01, ,3,1,20,110
1000000326_0010436603261005_12-31-2004-00:00:00_Disbursement,1100001011,1000000326,0010436603261005,Disbursement,2004-12-31T00:00:00.000Z,23213.59,USD,2004-12-31T00:00:00.000Z,1000000326 G-C-IE-438-,IFAD,MINISTRY OF FINANCE AND ECONOMIC DEVELOPMENT,Money is disbursed through central Ministry of Finance or Treasury,,ET,ESA,1000000326 0010436603261005 Direct Payment/Reimbursement,C01, ,3,1,20,110
1000000326_0010717903261009_06-28-2007-00:00:00_Disbursement,1100001011,1000000326,0010717903261009,Disbursement,2007-06-28T00:00:00.000Z,53499.37,USD,2007-06-28T00:00:00.000Z,1000000326 G-C-IE-438-,IFAD,MINISTRY OF FINANCE AND ECONOMIC DEVELOPMENT,Money is disbursed through central Ministry of Finance or Treasury,,ET,ESA,1000000326 0010717903261009 Direct Payment/Reimbursement,C01, ,3,1,20,110
1000000326_0019929303261001_10-20-1999-00:00:00_Disbursement,1100001011,1000000326,0019929303261001,Disbursement,1999-10-20T00:00:00.000Z,150000.0,USD,1999-10-20T00:00:00.000Z,1000000326 G-C-IE-438-,IFAD,MINISTRY OF FINANCE AND ECONOMIC DEVELOPMENT,Money is disbursed through central Ministry of Finance or Treasury,,ET,ESA,1000000326 0019929303261001 Direct Payment/Reimbursement,C01, ,3,1,20,110
1000000326_0010705903261008_02-28-2007-00:00:00_Disbursement,1100001011,1000000326,0010705903261008,Disbursement,2007-02-28T00:00:00.000Z,220749.46,USD,2007-02-28T00:00:00.000Z,1000000326 G-C-IE-438-,IFAD,MINISTRY OF FINANCE AND ECONOMIC DEVELOPMENT,Money is disbursed through central Ministry of Finance or Treasury,,ET,ESA,1000000326 0010705903261008 Direct Payment/Reimbursement,C01, ,3,1,20,110
1000000326_0010317603261004_06-25-2003-00:00:00_Disbursement,1100001011,1000000326,0010317603261004,Disbursement,2003-06-25T00:00:00.000Z,10670.46,USD,2003-06-25T00:00:00.000Z,1000000326 G-C-IE-438-,IFAD,MINISTRY OF FINANCE AND ECONOMIC DEVELOPMENT,Money is disbursed through central Ministry of Finance or Treasury,,ET,ESA,1000000326 0010317603261004 Direct Payment/Reimbursement,C01, ,3,1,20,110
1000000326_0010726903261010_09-26-2007-00:00:00_Disbursement,1100001011,1000000326,0010726903261010,Disbursement,2007-09-26T00:00:00.000Z,3521.8,USD,2007-09-26T00:00:00.000Z,1000000326 G-C-IE-438-,IFAD,MINISTRY OF FINANCE AND ECONOMIC DEVELOPMENT,Money is disbursed through central Ministry of Finance or Treasury,,ET,ESA,1000000326 0010726903261010 Direct Payment/Reimbursement,C01, ,3,1,20,110
1000000326_0010619903261006_07-18-2006-00:00:00_Disbursement,1100001011,1000000326,0010619903261006,Disbursement,2006-07-18T00:00:00.000Z,40978.15,USD,2006-07-18T00:00:00.000Z,1000000326 G-C-IE-438-,IFAD,MINISTRY OF FINANCE AND ECONOMIC DEVELOPMENT,Money is disbursed through central Ministry of Finance or Treasury,,ET,ESA,1000000326 0010619903261006 Direct Payment/Reimbursement,C01, ,3,1,20,110
1000000326_0010232603261002_11-22-2002-00:00:00_Disbursement,1100001011,1000000326,0010232603261002,Disbursement,2002-11-22T00:00:00.000Z,48061.64,USD,2002-11-22T00:00:00.000Z,1000000326 G-C-IE-438-,IFAD,MINISTRY OF FINANCE AND ECONOMIC DEVELOPMENT,Money is disbursed through central Ministry of Finance or Treasury,,ET,ESA,1000000326 0010232603261002 Direct Payment/Reimbursement,C01, ,3,1,20,110
